s_no,date,created_at,id_str,screen_name,user_location,geo-tagged_place,tweet_text,tweet_tokenized,tweet_cleaned,tweet_filtered,tweet_lemmatized,tweet_mentioned_organizations,tweet_tags_classified,tweet_orgs_classified,retweet_count,fav_count,hashtags,urls,mentions,vader_polarity
152,2021-01-30,Sat Jan 30 14:31:06 +0000 2021,1355523939632607233,VodafoneIreland,Ireland,Not Geo-tagged,"b""@amdclarke Hi,\n\nThanks for reaching us here, if you private message the below info, I'll do my best to assist:\n- Full Name\n- Account number\n- Security PIN (or, if you don't have this, your address and date of birth)\n\nThanks,\nYugien""","$MENTION$ Hi, Thanks for reaching us here, if you private message the below info, I'll do my best to assist: - Full Name - Account number - Security PIN (or, if you don't have this, your address and date of birth) Thanks, Yugien","Hi, Thanks for reaching us here, if you private message the below info, I'll do my best to assist - Full Name - Account number - Security PIN (or, if you do not have this, your address and date of birth) Thanks, Yugien",hi thanks reaching private message info best assist full name account number security pin address date birth thanks yugien,hi thank reach private message info good assist full name account number security pin address date birth thank yugien,[],{},{},0,0,[],,['Anne-Marie Daly-Clar'],0.926
163,2021-01-30,Sat Jan 30 14:00:08 +0000 2021,1355516146062151683,IlorinInfo,Ilorin,Not Geo-tagged,b'FG to concession 12 highways to private sectors https://t.co/dfnOBYBp6l',FG to concession $NUMBER$ highways to private sectors $URL$,FG to concession highways to private sectors,fg concession highways private sectors,fg concession highway private sector,[],{},{},0,0,[],https://www.ilorin.info/fullnews.php?id=28271,[],0.0
165,2021-01-30,Sat Jan 30 13:53:08 +0000 2021,1355514387797143555,BidnessN,,Not Geo-tagged,b'@KenRoth where did I share your private info? This is unjust. \n\n https://t.co/fAVsWY3Scr',$MENTION$ where did I share your private info? This is unjust. $URL$,where did I share your private info? This is unjust.,share private info this unjust,share private info this unjust,[],{},{},0,0,[],,['Kenneth Roth'],-0.2732
70,2021-01-30,Sat Jan 30 19:25:46 +0000 2021,1355598094851854345,notmywrkaccount,"Virginia, USA",Not Geo-tagged,"b'@welsberr @cvaaustin @SheliaL35727189 @tribelaw Yes! Russia has the RNC server from 2016 and their private emails... they are all being blackmailed. And T has the info to threaten them (courtesy Putin, who wants T in power to destabilize us)'","$MENTION$ $MENTION$ $MENTION$ $MENTION$ Yes! Russia has the RNC server from $NUMBER$ and their private emails... they are all being blackmailed. And T has the info to threaten them (courtesy Putin, who wants T in power to destabilize us)","Yes! Russia has the RNC server from and their private emails.. they are all being blackmailed. And T has the info to threaten them (courtesy Putin, who wants T in power to destabilize us)",yes russia rnc server private emails blackmailed and info threaten courtesy putin wants power destabilize,yes russia rnc server private email blackmail and info threaten courtesy putin want power destabilize,[],{},{},0,0,[],,"['Wesley R. Elsberry', 'Caroline Austin', '@Myoho622', 'Laurence Tribe']",0.4389
157,2021-01-30,Sat Jan 30 14:17:29 +0000 2021,1355520513657995264,OviedoRecNPark,"Oviedo, FL","Center Lake Park, US","b'The Cultural Center and other space at Center Lake Park has increased availability this spring for private rentals (meeting, training, reception, shower, birthday anniversary, etc). Call for more info: 407-971-5585. https://t.co/frvWDze9ZS'","The Cultural Center and other space at Center Lake Park has increased availability this spring for private rentals (meeting, training, reception, shower, birthday anniversary, etc). Call for more info: $NUMBER$-971-5585. $URL$","The Cultural Center and other space at Center Lake Park has increased availability this spring for private rentals (meeting, training, reception, shower, birthday anniversary, etc). Call for more info -971-5585.",the cultural center space center lake park increased availability spring private rentals meeting training reception shower birthday anniversary etc call info,the cultural center space center lake park increase availability spring private rental meet train reception shower birthday anniversary etc call info,[],{},{},0,0,[],https://twitter.com/oviedorecnpark/status/1348708137231118337,[],0.2732
161,2021-01-30,Sat Jan 30 14:05:51 +0000 2021,1355517588013518848,meghan_lee80,,Not Geo-tagged,b'@hefeharker @FOX29philly And it changed their privacy agreement where they were not selling patient info as a non- profit and began selling patient private info with no notification',$MENTION$ $MENTION$ And it changed their privacy agreement where they were not selling patient info as a non- profit and began selling patient private info with no notification,And it changed their privacy agreement where they were not selling patient info as a non- profit and began selling patient private info with no notification,and changed privacy agreement selling patient info non profit began selling patient private info notification,and change privacy agreement sell patient info non profit begin sell patient private info notification,[],{},{},0,0,[],,"['The Gooch', 'FOX 29']",0.5994
164,2021-01-30,Sat Jan 30 14:00:00 +0000 2021,1355516113212338176,nidirect,"Belfast, Northern Ireland",Not Geo-tagged,b'Households are not allowed to mix indoors in private homes (certain exemptions apply). \nYou can form one bubble with one other household. \nMore info: https://t.co/bLVqFm9SMy @niexecutive @healthdpt https://t.co/5MQLwAnPRN',Households are not allowed to mix indoors in private homes (certain exemptions apply). You can form one bubble with one other household. More info: $URL$ $MENTION$ $MENTION$ $URL$,Households are not allowed to mix indoors in private homes (certain exemptions apply). You can form one bubble with one other household. More info,households allowed mix indoors private homes certain exemptions apply you form one bubble one household more info,household allow mix indoor private home certain exemption apply form one bubble one household more info,[],{},{},0,3,[],http://www.nidirect.gov.uk/coronavirus-restrictions,"['NI Executive', 'Department of Health']",0.2732
178,2021-01-30,Sat Jan 30 13:08:08 +0000 2021,1355503062429929483,SwanseaConnect,"Swansea, Wales",Not Geo-tagged,b'Get more info about Private Plates https://t.co/raQPNDRRTH',Get more info about Private Plates $URL$,Get more info about Private Plates,get info private plates,get info private plate,[],{},{},0,0,[],https://www.dottydirectory.com/business/port-talbot/private-plates/,[],0.0
146,2021-01-30,Sat Jan 30 15:01:16 +0000 2021,1355531530576273408,karenSl76512755,"London, England",Not Geo-tagged,b'Gift the experience this Valentine to take a trip round the Dalmatian coastline of Croatia on a private yacht tour!  Available to book now for May 2021. For more info head to our website. https://t.co/dpNVI6b8n3',Gift the experience this Valentine to take a trip round the Dalmatian coastline of Croatia on a private yacht tour! Available to book now for May $NUMBER$. For more info head to our website. $URL$,Gift the experience this Valentine to take a trip round the Dalmatian coastline of Croatia on a private yacht tour! Available to book now for May . For more info head to our website.,gift experience valentine take trip round dalmatian coastline croatia private yacht tour available book may for info head website,gift experience valentine take trip round dalmatian coastline croatia private yacht tour available book may for info head website,[],{},{},0,1,[],,[],0.4926
160,2021-01-30,Sat Jan 30 14:08:00 +0000 2021,1355518125379383301,SBGalleryLewes,"Lewes, East Sussex",Not Geo-tagged,"b'We have this beautiful Peter Messer painting \xe2\x80\x98October Evening, Castle Lane (2007)\xe2\x80\x99 from a Private Collector for sale. 60cm x 43cm (without frame); 78.5cm x 61cm (with frame)\nPrice: \xc2\xa32550\nFor more info contact Neeta Pedersen at starbrewerygallery@gmail.com https://t.co/bdFdPqVF6r'","We have this beautiful Peter Messer painting October Evening, Castle Lane (2007) from a Private Collector for sale. $NUMBER$cm x $NUMBER$cm (without frame); $NUMBER$cm x $NUMBER$cm (with frame) Price: $NUMBER$ For more info contact Neeta Pedersen at starbrewerygallery$MENTION$.com $URL$","We have this beautiful Peter Messer painting October Evening, Castle Lane (2007) from a Private Collector for sale. cm x cm (without frame); cm x cm (with frame) Price 2550 For more info contact Neeta Pedersen at starbrewerygallery.com",we beautiful peter messer painting october evening castle lane private collector sale cm without frame cm frame price for info contact neeta pedersen starbrewerygallery com,beautiful peter messer paint october evening castle lane private collector sale cm without frame cm frame price for info contact neeta pedersen starbrewerygallery com,[],{},{},0,0,[],,[],0.6833
170,2021-01-30,Sat Jan 30 13:40:41 +0000 2021,1355511253926506498,MelisaOpen,"Lampung, Indonesia",Not Geo-tagged,b'\xf0\x9f\x92\xaf%real ready #morningsexlampung TB165 BB55 BRA36B include&amp;exclude private info DM wa.082112743584\n #availopenbolampung\n#expobolampung #openbolampung #wplampung\n#bokinglampung #expolampung #bolampung #Readyopenbolampung #availboanglelampung #rekomendedopenbolampung @masnalampung https://t.co/iczoSrSh6y',$EMOJI$%real ready $HASHTAG$ TB165 BB55 BRA36B include&amp;exclude private info DM wa.082112743584 $HASHTAG$ $HASHTAG$ $HASHTAG$ $HASHTAG$ $HASHTAG$ $HASHTAG$ $HASHTAG$ $HASHTAG$ $HASHTAG$ $HASHTAG$ $MENTION$ $URL$,%real ready TB165 BB55 BRA36B include&amp;exclude private info DM wa.082112743584,real ready tb bb bra include exclude private info dm,real ready tb bb bra include exclude private info dm,[],{},{},0,2,"['morningsexlampung', 'availopenbolampung', 'expobolampung', 'openbolampung', 'wplampung', 'bokinglampung', 'expolampung', 'bolampung', 'Readyopenbolampung', 'availboanglelampung', 'rekomendedopenbolampung']",,['Masna openbo Lampung'],0.3612
159,2021-01-30,Sat Jan 30 14:13:42 +0000 2021,1355519562142408704,chicagomom,"Illinois, USA",Not Geo-tagged,"b'In addition, I have now given away her private info to both Walgreens and Walmart, including birth date. Just to determine if their site is the one where she *might* be able to get an appointment. I can\xe2\x80\x99t even find out without giving away her PII to multiple corporations.'","In addition, I have now given away her private info to both Walgreens and Walmart, including birth date. Just to determine if their site is the one where she *might* be able to get an appointment. I cant even find out without giving away her PII to multiple corporations.","In addition, I have now given away her private info to both Walgreens and Walmart, including birth date. Just to determine if their site is the one where she *might* be able to get an appointment. I can t even find out without giving away her PII to multiple corporations.",in addition given away private info walgreens walmart including birth date just determine site one might able get appointment even find without giving away pii multiple corporations,in addition give away private info walgreen walmart include birth date just determine site one may able get appointment even find without give away pii multiple corporation,[],{},{},0,0,[],,[],-0.2584
168,2021-01-30,Sat Jan 30 13:44:13 +0000 2021,1355512143198695425,rlnorthrop,"ÜT: 42.449322,-91.917491",Not Geo-tagged,b'Two \xf0\x9f\x91\x8d\xf0\x9f\x91\x8d\xf0\x9f\x91\x8d for Apple! Doing what Government should have done. This Opt-out model is CRAP. Digital companies should always have been on a Opt-in model where your info is private unless you Opt-in.  #Privacy  https://t.co/lnkw4xADhL',Two $EMOJI$$EMOJI$$EMOJI$ for Apple! Doing what Government should have done. This Opt-out model is CRAP. Digital companies should always have been on a Opt-in model where your info is private unless you Opt-in. $HASHTAG$ $URL$,Two for Apple! Doing what Government should have done. This Opt-out model is CRAP. Digital companies should always have been on a Opt-in model where your info is private unless you Opt-in.,two apple doing government done this opt model crap digital companies always opt model info private unless opt,two apple do government do this opt model crap digital company always opt model info private unless opt,[],{},{},0,0,['Privacy'],https://apple.news/As3tMuw6UQcOCtlQ8t8XPOg,[],-0.561
84,2021-01-30,Sat Jan 30 18:36:02 +0000 2021,1355585579816275969,Russ_Warrior,,Not Geo-tagged,"b""Imagine what would be the reaction in a Western country if a channel on Telegram published private info of local policemen in order to call for violence against them.\nThis is what's going on in #Russia and it's also promoted by EU-sponsored TVRain, its license should be revoked. https://t.co/qHcnmAATRl""","Imagine what would be the reaction in a Western country if a channel on Telegram published private info of local policemen in order to call for violence against them. This is what's going on in $HASHTAG$ and it's also promoted by EU-sponsored TVRain, its license should be revoked. $URL$","Imagine what would be the reaction in a Western country if a channel on Telegram published private info of local policemen in order to call for violence against them. This is what's going on in and it's also promoted by EU-sponsored TVRain, its license should be revoked.",imagine would reaction western country channel telegram published private info local policemen order call violence this going also promoted eu sponsored tvrain license revoked,imagine would reaction western country channel telegram publish private info local policeman order call violence this going also promote eu sponsor tvrain license revoke,[],{},{},36,75,['Russia'],,[],-0.3182
169,2021-01-30,Sat Jan 30 13:42:19 +0000 2021,1355511662116270080,FinnairHelps,,Not Geo-tagged,"b""@stephbb1210 Hi! That's right. If there's anything more specific we could do to help you, please send us more info (Including your booking reference, e-mail address and telephone number) via private message (DM). -Niki""","$MENTION$ Hi! That's right. If there's anything more specific we could do to help you, please send us more info (Including your booking reference, e-mail address and telephone number) via private message (DM). -Niki","Hi! That's right. If there's anything more specific we could do to help you, please send us more info (Including your booking reference, e-mail address and telephone number) via private message (DM). -Niki",hi that right if anything specific could help please send info including booking reference mail address telephone number via private message dm niki,hi that right if anything specific could help please send info include book reference mail address telephone number via private message dm niki,[],{},{},0,0,[],,['StephBB 🏆'],0.68
175,2021-01-30,Sat Jan 30 13:25:29 +0000 2021,1355507427811143688,GooglePayIndia,India,Not Geo-tagged,"b""@Ajithku22384478 Sorry to hear that. Without revealing any private info, could you let us know when was the transaction made? We'll do our best to help.""","$MENTION$ Sorry to hear that. Without revealing any private info, could you let us know when was the transaction made? We'll do our best to help.","Sorry to hear that. Without revealing any private info, could you let us know when was the transaction made? We'll do our best to help.",sorry hear without revealing private info could let know transaction made we best help,sorry hear without reveal private info could let know transaction make good help,[],{},{},0,0,[],,['Ajithkumar'],0.765
166,2021-01-30,Sat Jan 30 13:48:15 +0000 2021,1355513159059177473,cw04110817,,Not Geo-tagged,"b'@FrederickEden1 @Winning_Siempre @barronsonline If they colluded in private the way the big sharks do it, it\xe2\x80\x99d be insider trading. This way it\xe2\x80\x99s all public and zero inside info. These guys might actually stop these hedge funds from bankrupting companies and putting all their employees out of work'","$MENTION$ $MENTION$ $MENTION$ If they colluded in private the way the big sharks do it, itd be insider trading. This way its all public and zero inside info. These guys might actually stop these hedge funds from bankrupting companies and putting all their employees out of work","If they colluded in private the way the big sharks do it, it d be insider trading. This way it s all public and zero inside info. These guys might actually stop these hedge funds from bankrupting companies and putting all their employees out of work",if colluded private way big sharks insider trading this way public zero inside info these guys might actually stop hedge funds bankrupting companies putting employees work,if collude private way big shark insider trading this way public zero inside info these guy may actually stop hedge fund bankrupting company put employee work,[],{},{},0,13,[],,"['Frederick Eden', 'EJ', ""Barron's""]",-0.296
174,2021-01-30,Sat Jan 30 13:27:10 +0000 2021,1355507852966825986,RyanLaley,England,Not Geo-tagged,"b'If you want private tutoring in using Unreal Engine 4, ping me a message.\n\nSession slots for March are still available.\n\nMessage me for more info/costs/etc'","If you want private tutoring in using Unreal Engine $NUMBER$, ping me a message. Session slots for March are still available. Message me for more info/costs/etc","If you want private tutoring in using Unreal Engine , ping me a message. Session slots for March are still available. Message me for more info/costs/etc",if want private tutoring using unreal engine ping message session slots march still available message info costs etc,if want private tutoring use unreal engine ping message session slot march still available message info cost etc,[],{},{},2,1,[],,[],0.0772
167,2021-01-30,Sat Jan 30 13:45:21 +0000 2021,1355512427987648515,TylerLirones,"Castle Rock, CO",Not Geo-tagged,"b'am abandoning mainstream media and seeking out people like you, Krystal, Saagar, ect. to get the straight FACTS. You provided exactly the contextual info needed of the number of private prisons Biden is getting closed (12) and that total number of 14K as well as the over private'","am abandoning mainstream media and seeking out people like you, Krystal, Saagar, ect. to get the straight FACTS. You provided exactly the contextual info needed of the number of private prisons Biden is getting closed (12) and that total number of $NUMBER$K as well as the over private","am abandoning mainstream media and seeking out people like you, Krystal, Saagar, ect. to get the straight FACTS. You provided exactly the contextual info needed of the number of private prisons Biden is getting closed (12) and that total number of K as well as the over private",abandoning mainstream media seeking people like krystal saagar ect get straight facts you provided exactly contextual info needed number private prisons biden getting closed total number well private,abandon mainstream medium seek people like krystal saagar ect get straight fact provide exactly contextual info need number private prison biden get close total number well private,[],{},{},0,0,[],,[],0.5849
120,2021-01-30,Sat Jan 30 16:48:57 +0000 2021,1355558632801374209,diamondxp,"MIami, Florida",Not Geo-tagged,"b'@marcuslemonis Marcus, I am happy to even open my books to you and give you full transparency. Please private message me and all will share all my company info. \nThis would be a huge opportunity for me. I just want this to be discreet so my active clients do not see this discussion.'","$MENTION$ Marcus, I am happy to even open my books to you and give you full transparency. Please private message me and all will share all my company info. This would be a huge opportunity for me. I just want this to be discreet so my active clients do not see this discussion.","Marcus, I am happy to even open my books to you and give you full transparency. Please private message me and all will share all my company info. This would be a huge opportunity for me. I just want this to be discreet so my active clients do not see this discussion.",marcus happy even open books give full transparency please private message share company info this would huge opportunity want discreet active clients see discussion,marcus happy even open book give full transparency please private message share company info this would huge opportunity want discreet active client see discussion,[],{},{},0,0,[],,['Marcus Lemonis'],0.939
171,2021-01-30,Sat Jan 30 13:36:42 +0000 2021,1355510250783301632,Meghanada_,Uttrakhand/Bharat ,Not Geo-tagged,"b'@asg3073 @ParaRjs @g_grewall \xf0\x9f\x98\x82\xf0\x9f\x98\x82 Flag was recognised by everyone but not hoisted becos chacha made a law, as per law no one can unflur trianga in private property, ds law was challenged by Jindal &amp; after that Court gave permit to use Indian flag on Private properties as well &amp;4ur info RSS is a private orgnz'","$MENTION$ $MENTION$ $MENTION$ $EMOJI$$EMOJI$ Flag was recognised by everyone but not hoisted becos chacha made a law, as per law no one can unflur trianga in private property, ds law was challenged by Jindal &amp; after that Court gave permit to use Indian flag on Private properties as well &amp;4ur info RSS is a private orgnz","Flag was recognised by everyone but not hoisted becos chacha made a law, as per law no one can unflur trianga in private property, ds law was challenged by Jindal &amp; after that Court gave permit to use Indian flag on Private properties as well &amp;4ur info RSS is a private orgnz",flag recognised everyone hoisted becos chacha made law per law one unflur trianga private property law challenged jindal court gave permit use indian flag private properties well info rss private orgnz,flag recognise everyone hoist becos chacha make law per law one unflur trianga private property law challenge jindal court give permit use indian flag private property well info rss private orgnz,[],{},{},0,0,[],,"['asg', 'rupinder dhillon', 'Capt. Gurpreet Grewal']",-0.1901
189,2021-01-30,Sat Jan 30 12:19:48 +0000 2021,1355490897950089217,QueenKhadii_,,Not Geo-tagged,b'All the info I found out tonight ? I really should\xe2\x80\x99ve pursued a career in private investigations \xf0\x9f\x98\x85',All the info I found out tonight ? I really shouldve pursued a career in private investigations $EMOJI$,All the info I found out tonight ? I really should ve pursued a career in private investigations,all info found tonight really pursued career private investigations,all info find tonight really pursue career private investigation,[],{},{},0,0,[],,[],0.0
187,2021-01-30,Sat Jan 30 12:25:02 +0000 2021,1355492216039485440,coinminerss,ROMANIA,Not Geo-tagged,"b'India plans to introduce law to ban Bitcoin, other private cryptocurrencies\n#cryptocurrencymarket #cryptonews #AI #trading #buyorders #coldstorage #proofofwork #dapps\nhttps://t.co/1tpbb1uTYI'","India plans to introduce law to ban Bitcoin, other private cryptocurrencies $HASHTAG$ $HASHTAG$ $HASHTAG$ $HASHTAG$ $HASHTAG$ $HASHTAG$ $HASHTAG$ $HASHTAG$ $URL$","India plans to introduce law to ban Bitcoin, other private cryptocurrencies",india plans introduce law ban bitcoin private cryptocurrencies,india plans introduce law ban bitcoin private cryptocurrencie,[],{},{},0,0,"['cryptocurrencymarket', 'cryptonews', 'AI', 'trading', 'buyorders', 'coldstorage', 'proofofwork', 'dapps']",https://bit.ly/3cpVmYU,[],-0.5574
180,2021-01-30,Sat Jan 30 12:58:51 +0000 2021,1355500725028200448,Iron_Man_Actual,,Not Geo-tagged,"b'I\'m reminded of the OPM hacks where the government basically said ""oh what would they do with that information anyway, they can have it"" and then we find out years later that info was used to cross reference private data held by Chinese companies to track our intel officers.'","I'm reminded of the OPM hacks where the government basically said ""oh what would they do with that information anyway, they can have it"" and then we find out years later that info was used to cross reference private data held by Chinese companies to track our intel officers.","I'm reminded of the OPM hacks where the government basically said ""oh what would they do with that information anyway, they can have it"" and then we find out years later that info was used to cross reference private data held by Chinese companies to track our intel officers.",reminded opm hacks government basically said would information anyway find years later info used cross reference private data held chinese companies track intel officers,remind opm hack government basically say would information anyway find year later info use cross reference private datum hold chinese company track intel officer,[],{},{},1,13,[],,[],0.0
186,2021-01-30,Sat Jan 30 12:25:43 +0000 2021,1355492386281988097,bIoodvlnes,they/fae || minor,Not Geo-tagged,b'@emilyinnitt because you are sharing private info with a CIS MAN and if he read it he would probably be uncomfy HELLO??? \xf0\x9f\x98\xad',$MENTION$ because you are sharing private info with a CIS MAN and if he read it he would probably be uncomfy HELLO??? $EMOJI$,because you are sharing private info with a CIS MAN and if he read it he would probably be uncomfy HELLO??,sharing private info cis man read would probably uncomfy hello,share private info cis man read would probably uncomfy hello,[],{},{},0,1,[],,['emily??'],0.4871
