s_no,date,created_at,id_str,screen_name,user_location,geo-tagged_place,tweet_text,tweet_tokenized,tweet_cleaned,tweet_filtered,tweet_lemmatized,tweet_mentioned_organizations,tweet_tags_classified,tweet_orgs_classified,retweet_count,fav_count,hashtags,urls,mentions,vader_polarity
130,2021-03-10,Wed Mar 10 17:51:22 +0000 2021,1369707465353424902,CoachGlaze45,"(Overland Park, KS)",Not Geo-tagged,"b""@stevemcbrien Steve, if you see this message today, please follow me &amp; then shoot me a private DM, assuming you're amenable. I'm seeking a quick tidbit of easy Oswego HS basketball related info. which I'm thinking/hoping you might be able to provide  Thanks!""","$MENTION$ Steve, if you see this message today, please follow me &amp; then shoot me a private DM, assuming you're amenable. I'm seeking a quick tidbit of easy Oswego HS basketball related info. which I'm thinking/hoping you might be able to provide Thanks!","Steve, if you see this message today, please follow me &amp; then shoot me a private DM, assuming you're amenable. I'm seeking a quick tidbit of easy Oswego HS basketball related info. which I'm thinking/hoping you might be able to provide Thanks!",steve see message today please follow shoot private dm assuming amenable seeking quick tidbit easy oswego hs basketball related info thinking hoping might able provide thanks,steve see message today please follow shoot private dm assume amenable seek quick tidbit easy oswego hs basketball related info thinking hoping may able provide thank,[],{},{},0,1,[],,['Steve McBrien'],0.7177
148,2021-03-10,Wed Mar 10 17:11:00 +0000 2021,1369697308368076802,AdijasStocks,,Not Geo-tagged,"b'$IPLB info about Greg Filipek: Currently in the final planning stage for the first America\xe2\x80\x99s Sports Resort, a $350m private venture https://t.co/pK1nlRrGEo https://t.co/qJfK7DVO7y'","$IPLB info about Greg Filipek: Currently in the final planning stage for the first Americas Sports Resort, a $350m private venture $URL$ $URL$","$IPLB info about Greg Filipek Currently in the final planning stage for the first America s Sports Resort, a $350m private venture",iplb info greg filipek currently final planning stage first america sports resort private venture,iplb info greg filipek currently final planning stage first america sports resort private venture,[],{},{},0,1,[],http://www.soranortheast.com/greg-filipek/,[],0.0
152,2021-03-10,Wed Mar 10 17:04:06 +0000 2021,1369695569460002817,RedNirgal,"Mars, Inner Solar System, Sol",Not Geo-tagged,b'Live your 1984 myth in Greece.\n\nPolice brutality videos in the last couple of days which official private &amp; public Greek news channels whitewashed.\n\n#DefundThePolice\n#disbandThePolice\n#\xce\x9d\xce\xb5\xce\xb1\xce\xa3\xce\xbc\xcf\x85\xcf\x81\xce\xbd\xce\xb7\n#\xce\xb1\xcf\x83\xcf\x84\xcf\x85\xce\xbd\xce\xbf\xce\xbc\xce\xb9\xce\xba\xce\xae_\xce\xb2\xce\xaf\xce\xb1\n#\xce\x91\xcf\x83\xcf\x84\xcf\x85\xce\xbd\xce\xbf\xce\xbc\xce\xb9\xce\xb1\n#PoliceBrutality\n#PoliceViolence\n https://t.co/fhFuyTJxRY',Live your $NUMBER$ myth in Greece. Police brutality videos in the last couple of days which official private &amp; public Greek news channels whitewashed. $HASHTAG$ $HASHTAG$ $HASHTAG$ $HASHTAG$ $HASHTAG$ $HASHTAG$ $HASHTAG$ $URL$,Live your myth in Greece. Police brutality videos in the last couple of days which official private &amp; public Greek news channels whitewashed.,live myth greece police brutality videos last couple days official private public greek news channels whitewashed,live myth greece police brutality video last couple day official private public greek news channel whitewash,[],{},{},0,2,"['DefundThePolice', 'disbandThePolice', 'ΝεαΣμυρνη', 'αστυνομική_βία', 'Αστυνομια', 'PoliceBrutality', 'PoliceViolence']",https://info-war.gr/ta-vinteo-apo-ti-n-smyrni-poy-den-tha-dei/,[],-0.6124
146,2021-03-10,Wed Mar 10 17:19:29 +0000 2021,1369699442299965442,CryptoArtEvent,UK & Virtual,Not Geo-tagged,"b'""A Puzzling #NFT"" - https://t.co/CVHGNzzXoL - This isn\'t an easy challenge!\n\nCrack the code, sweep the private key and claim the tokens, artwork and funds stored at the ETH address!\n\nMore info: https://t.co/ht7B1Atj9Q\n\nPRIZE FUND CURRENTLY SITS AT 0.34ETH!\n\n#ETH #Ethereum #Art'","""A Puzzling $HASHTAG$"" - $URL$ - This isn't an easy challenge! Crack the code, sweep the private key and claim the tokens, artwork and funds stored at the ETH address! More info: $URL$ PRIZE FUND CURRENTLY SITS AT $NUMBER$ETH! $HASHTAG$ $HASHTAG$ $HASHTAG$","""A Puzzling "" - - This is not an easy challenge! Crack the code, sweep the private key and claim the tokens, artwork and funds stored at the ETH address! More info PRIZE FUND CURRENTLY SITS AT ETH!", puzzling this easy challenge crack code sweep private key claim tokens artwork funds stored eth address more info prize fund currently sits at eth,  puzzle this easy challenge crack code sweep private key claim token artwork fund store eth address more info prize fund currently sit at eth,[],{},{},2,3,"['NFT', 'ETH', 'Ethereum', 'Art']","https://app.rarible.com/token/0xd07dc4262bcdbf85190c01c996b4c06a461d2430:38327, https://cryptobatesgroup.co.uk/puzzling/index.html",[],0.5513
153,2021-03-10,Wed Mar 10 17:03:22 +0000 2021,1369695386374266881,l4lawrie,United States of America,Not Geo-tagged,"b'@TheRealJazMcKay Unfortunately, the Institute reported in this article is privately owned therefore credibility is in question. Information on both left and right that comes from private organizations is always up for debate. That said, this is quite this quieting info'","$MENTION$ Unfortunately, the Institute reported in this article is privately owned therefore credibility is in question. Information on both left and right that comes from private organizations is always up for debate. That said, this is quite this quieting info","Unfortunately, the Institute reported in this article is privately owned therefore credibility is in question. Information on both left and right that comes from private organizations is always up for debate. That said, this is quite this quieting info",unfortunately institute reported article privately owned therefore credibility question information left right comes private organizations always debate that said quite quieting info,unfortunately institute report article privately own therefore credibility question information leave right come private organization always debate that say quite quiet info,[],{},{},0,1,[],,['Jaz McKay THE DEPLORABLE PATRIOT!'],-0.34
167,2021-03-10,Wed Mar 10 16:29:50 +0000 2021,1369686947048919043,ugnews24,Kampala - Uganda,Not Geo-tagged,b'Private Secondary School headteachers boycott stakeholders meeting in kabale \xe2\x80\x93 The Informer\xc2\xa0UG https://t.co/egC70UmBPM',Private Secondary School headteachers boycott stakeholders meeting in kabale The InformerUG $URL$,Private Secondary School headteachers boycott stakeholders meeting in kabale The Informer UG,private secondary school headteachers boycott stakeholders meeting kabale the informer ug,private secondary school headteacher boycott stakeholder meet kabale the informer ug,[],{},{},0,0,[],https://ugnews24.info/politics/private-secondary-school-headteachers-boycott-stakeholders-meeting-in-kabale-the-informer-ug/,[],-0.3182
143,2021-03-10,Wed Mar 10 17:22:07 +0000 2021,1369700103439740931,AllSeniorsCare,Canada,Not Geo-tagged,"b'CONSTRUCTION UPDATE:\n \nCataraqui Heights Retirement Residence!\nTake a peak. Opening this Fall!\n\nAge-in-Place Living\nIndoor Parking\nLarge 2 bedroom, 2 bathroom suites\nIndoor Heated Pool\nPrivate Chauffeur service\n \nFor more info/tour, call Angela  613-583-9483\n#Kingston #Cataraqui https://t.co/FnB3hOkBzk'","CONSTRUCTION UPDATE: Cataraqui Heights Retirement Residence! Take a peak. Opening this Fall! Age-in-Place Living Indoor Parking Large $NUMBER$ bedroom, $NUMBER$ bathroom suites Indoor Heated Pool Private Chauffeur service For more info/tour, call Angela $NUMBER$-583-9483 $HASHTAG$ $HASHTAG$ $URL$","CONSTRUCTION UPDATE Cataraqui Heights Retirement Residence! Take a peak. Opening this Fall! Age-in-Place Living Indoor Parking Large bedroom, bathroom suites Indoor Heated Pool Private Chauffeur service For more info/tour, call Angela -583-9483",construction update cataraqui heights retirement residence take peak opening fall age place living indoor parking large bedroom bathroom suites indoor heated pool private chauffeur service for info tour call angela,construction update cataraqui heights retirement residence take peak opening fall age place live indoor park large bedroom bathroom suit indoor heated pool private chauffeur service for info tour call angela,[],{},{},0,1,"['Kingston', 'Cataraqui']",,[],0.0
166,2021-03-10,Wed Mar 10 16:31:24 +0000 2021,1369687341938454531,le0pikas,they/them 19 ✿,Not Geo-tagged,"b'also some of us dont want to disclose private info to strangers online like ,,, :/ https://t.co/JybyQ32XQt'","also some of us dont want to disclose private info to strangers online like ,,, :/ $URL$","also some of us dont want to disclose private info to strangers online like ,, /",also us dont want disclose private info strangers online like,also do not want disclose private info stranger online like,[],{},{},0,6,[],https://twitter.com/flickerhalo/status/1369294606467293193,[],0.3134
164,2021-03-10,Wed Mar 10 16:35:59 +0000 2021,1369688495950884872,DerplesThePanda,7 lightyears below sealevel,Not Geo-tagged,"b""friendly reminder that my ex is a cunt, gaslit the shit out of me our entire relationship, and now I have trust issues telling people private personal info in fear they'll use it against me.""","friendly reminder that my ex is a cunt, gaslit the shit out of me our entire relationship, and now I have trust issues telling people private personal info in fear they'll use it against me.","friendly reminder that my ex is a cunt, gaslit the shit out of me our entire relationship, and now I have trust issues telling people private personal info in fear they'll use it against me.",friendly reminder ex cunt gaslit shit entire relationship trust issues telling people private personal info fear use,friendly reminder ex cunt gaslit shit entire relationship trust issue tell people private personal info fear use,[],{},{},0,5,[],,[],-0.5423
160,2021-03-10,Wed Mar 10 16:46:04 +0000 2021,1369691034482077700,THEFITNESSGR,They/them He/Him,Not Geo-tagged,"b""By the way for the ones who don't know\n\nDoxing is when someone uncovers private information such as phone number, credit card info, ssn etc and releases it into the pulic\n\nDDoSing is when someone overloads your internet to stop it from working""","By the way for the ones who don't know Doxing is when someone uncovers private information such as phone number, credit card info, ssn etc and releases it into the pulic DDoSing is when someone overloads your internet to stop it from working","By the way for the ones who do not know Doxing is when someone uncovers private information such as phone number, credit card info, ssn etc and releases it into the pulic DDoSing is when someone overloads your internet to stop it from working",by way ones know doxing someone uncovers private information phone number credit card info ssn etc releases pulic ddosing someone overloads internet stop working,by way one know doxe someone uncover private information phone number credit card info ssn etc release pulic ddose someone overload internet stop work,[],{},{},0,1,[],,[],0.1779
159,2021-03-10,Wed Mar 10 16:48:05 +0000 2021,1369691538830286849,1010data,"New York, NY",Not Geo-tagged,"b'Yesterday, @Target announced the launch of a new #privatelabel #brand focused on snacks and sweet treats. Smart move considering 203% total YoY online growth for private label brands and the growing success of Good &amp; Gather. Read more here: https://t.co/IivD4pbmrL\n\n#FavoriteDay https://t.co/2wwBtZHKJv'","Yesterday, $MENTION$ announced the launch of a new $HASHTAG$ $HASHTAG$ focused on snacks and sweet treats. Smart move considering $NUMBER$% total YoY online growth for private label brands and the growing success of Good &amp; Gather. Read more here: $URL$ $HASHTAG$ $URL$","Yesterday, announced the launch of a new focused on snacks and sweet treats. Smart move considering % total YoY online growth for private label brands and the growing success of Good &amp; Gather. Read more here",yesterday announced launch new focused snacks sweet treats smart move considering total yoy online growth private label brands growing success good gather read,yesterday announce launch new focused snack sweet treat smart move consider total yoy online growth private label brand grow success good gather read,[],{},{},1,1,"['privatelabel', 'brand', 'FavoriteDay']",http://bit.ly/3bMdESc,['Target'],0.955
173,2021-03-10,Wed Mar 10 16:16:15 +0000 2021,1369683529114730502,fst_nml,,Not Geo-tagged,"b'Anyone remember making paper wallets on bitaddress, and then using blockchain info to import the private keys and send the btc?\n\n#Bitcoin https://t.co/5L5R6Pwe5N'","Anyone remember making paper wallets on bitaddress, and then using blockchain info to import the private keys and send the btc? $HASHTAG$ $URL$","Anyone remember making paper wallets on bitaddress, and then using blockchain info to import the private keys and send the btc?",anyone remember making paper wallets bitaddress using blockchain info import private keys send btc,anyone remember make paper wallet bitaddress use blockchain info import private key send btc,[],{},{},0,1,['Bitcoin'],,[],0.0
127,2021-03-10,Wed Mar 10 17:54:43 +0000 2021,1369708308664365061,Sandile_K14,Durban,Not Geo-tagged,"b""@Chris80109155 @eNCA Zondo admitted this himself when he was making a judgment against his recusal as chair of the state capture commission. He even said he went to Jacob Zuma's private residence to discuss issues of national interest. It's public info""",$MENTION$ $MENTION$ Zondo admitted this himself when he was making a judgment against his recusal as chair of the state capture commission. He even said he went to Jacob Zuma's private residence to discuss issues of national interest. It's public info,Zondo admitted this himself when he was making a judgment against his recusal as chair of the state capture commission. He even said he went to Jacob Zuma's private residence to discuss issues of national interest. It's public info,zondo admitted making judgment recusal chair state capture commission he even said went jacob zuma private residence discuss issues national interest it public info,zondo admit make judgment recusal chair state capture commission even say go jacob zuma private residence discuss issue national interest public info,[],{},{},0,0,[],,"['Chris 🇿🇦🇿🇦 (Justice for Kgaugelo Tshawane)', 'eNCA']",0.5267
175,2021-03-10,Wed Mar 10 16:01:51 +0000 2021,1369679903990382596,MadeByMyro,,Not Geo-tagged,b'@AFTVRelated Why u sharing this private info on Social media? Desperate for clicks?',$MENTION$ Why u sharing this private info on Social media? Desperate for clicks?,Why u sharing this private info on Social media? Desperate for clicks?,why sharing private info social media desperate clicks,why share private info social medium desperate click,[],{},{},0,0,[],,['Out Of Context AFTV'],0.2168
179,2021-03-10,Wed Mar 10 15:56:50 +0000 2021,1369678641257451523,Luminstarwolf,chilling with friends,Not Geo-tagged,b'@zarc_yuki change your password now&lt;its a scam to steal you private info!!!',$MENTION$ change your password now&lt;its a scam to steal you private info!!!,change your password now&lt;its a scam to steal you private info!!,change password scam steal private info,change password scam steal private info,[],{},{},0,0,[],,"['Jaden Yuki, Zarc and parts']",-0.8168
131,2021-03-10,Wed Mar 10 17:50:03 +0000 2021,1369707132703174662,ramsdesk,"Bangalore, India",Not Geo-tagged,"b'Infosys has been named as a Leader in the ISG Provider Lens\xe2\x84\xa2 Quadrant Report 2020 for Next-Gen Private/Hybrid Cloud - Data Center Services &amp; Solutions. To get more info on this, click here #InfosysCobalt https://t.co/7sH4MYIcZX'","Infosys has been named as a Leader in the ISG Provider Lens Quadrant Report $NUMBER$ for Next-Gen Private/Hybrid Cloud - Data Center Services &amp; Solutions. To get more info on this, click here $HASHTAG$ $URL$","Infosys has been named as a Leader in the ISG Provider Lens Quadrant Report for Next-Gen Private/Hybrid Cloud - Data Center Services &amp; Solutions. To get more info on this, click here",infosys named leader isg provider lens quadrant report next gen private hybrid cloud data center services solutions to get info click,infosys name leader isg provider lens quadrant report next gen private hybrid cloud data center service solution to get info click,['infosys'],"{'IT service management|IT services': ['infosys'], 'Information technology consulting|IT consulting': ['infosys']}","{'infosys': ['IT service management|IT services', 'Information technology consulting|IT consulting']}",0,0,['InfosysCobalt'],https://twitter.com/Infosys/status/1369649313257820163,[],0.1779
181,2021-03-10,Wed Mar 10 15:52:54 +0000 2021,1369677652500623364,Allstate,,Not Geo-tagged,"b'@RicEllis85 We are sorry to hear this. Please private message us a bit more info, so we can look into this. ^SE https://t.co/vYIVrwsUyL'","$MENTION$ We are sorry to hear this. Please private message us a bit more info, so we can look into this. ^SE $URL$","We are sorry to hear this. Please private message us a bit more info, so we can look into this. ^SE",we sorry hear please private message bit info look se,sorry hear please private message bit info look se,[],{},{},0,0,[],https://twitter.com/messages/compose?recipient_id=14275290,['Ric'],0.3237
161,2021-03-10,Wed Mar 10 16:42:10 +0000 2021,1369690051634954247,erlmaiden,,Not Geo-tagged,"b""I probably sound like a fun killer but I feel that fans who love to dig into private stuff way too deep won't do the community a favor in the long term with their shared info, especially when I see how some of them even brag about their 'superior knowledge' in a very toxic manner""","I probably sound like a fun killer but I feel that fans who love to dig into private stuff way too deep won't do the community a favor in the long term with their shared info, especially when I see how some of them even brag about their 'superior knowledge' in a very toxic manner","I probably sound like a fun killer but I feel that fans who love to dig into private stuff way too deep wo not do the community a favor in the long term with their shared info, especially when I see how some of them even brag about their 'superior knowledge' in a very toxic manner",probably sound like fun killer feel fans love dig private stuff way deep community favor long term shared info especially see even brag superior knowledge toxic manner,probably sound like fun killer feel fan love dig private stuff way deep community favor long term share info especially see even brag superior knowledge toxic manner,[],{},{},0,3,[],,[],0.961
168,2021-03-10,Wed Mar 10 16:29:05 +0000 2021,1369686758863106054,o_once2,,Not Geo-tagged,"b'@jmrosees @BigHitEnt Excuse me but where are you at right now? Your biggest boy group account on TT has been hacked and you\'re not helping. You\'re supposed to ""fix"" that mistakes and secure your artists privacy, specially when a person hack their account that could possibly contain private info'","$MENTION$ $MENTION$ Excuse me but where are you at right now? Your biggest boy group account on TT has been hacked and you're not helping. You're supposed to ""fix"" that mistakes and secure your artists privacy, specially when a person hack their account that could possibly contain private info","Excuse me but where are you at right now? Your biggest boy group account on TT has been hacked and you're not helping. You're supposed to ""fix"" that mistakes and secure your artists privacy, specially when a person hack their account that could possibly contain private info",excuse right your biggest boy group account tt hacked helping you supposed fix mistakes secure artists privacy specially person hack account could possibly contain private info,excuse right big boy group account tt hack help suppose fix mistake secure artist privacy specially person hack account could possibly contain private info,[],{},{},0,1,[],,"['Sᴘʀɪɴɢ⁷ 🌟', 'BigHit Entertainment']",-0.7079
169,2021-03-10,Wed Mar 10 16:27:54 +0000 2021,1369686460178329603,InterestedObs13,,Not Geo-tagged,"b'@JenCarsonTaylor @valentinelow I don\xe2\x80\x99t understand if you are convinced that the Royal Household is out to get you and leaking your info and/or telling lies about you (which they believe by their own words), why would you go to them with extremely private info.  It makes absolutely zero sense.'","$MENTION$ $MENTION$ I dont understand if you are convinced that the Royal Household is out to get you and leaking your info and/or telling lies about you (which they believe by their own words), why would you go to them with extremely private info. It makes absolutely zero sense.","I don t understand if you are convinced that the Royal Household is out to get you and leaking your info and/or telling lies about you (which they believe by their own words), why would you go to them with extremely private info. It makes absolutely zero sense.",understand convinced royal household get leaking info telling lies believe words would extremely private info it makes absolutely zero sense,understand convinced royal household get leak info tell lie believe word would extremely private info make absolutely zero sense,[],{},{},0,15,[],,"['jen', 'valentinelow']",-0.0258
182,2021-03-10,Wed Mar 10 15:49:25 +0000 2021,1369676774473224193,Acorn_Godtree,"Iskut, British Columbia",Not Geo-tagged,"b'@piersmorgan That reminds me of your appearance on HIGNFY, when you made ""jokes"" about invading the privacy of other panellists, and then when the host divulged a piece of your private info., said, ""I demand my privacy!""'","$MENTION$ That reminds me of your appearance on HIGNFY, when you made ""jokes"" about invading the privacy of other panellists, and then when the host divulged a piece of your private info., said, ""I demand my privacy!""","That reminds me of your appearance on HIGNFY, when you made ""jokes"" about invading the privacy of other panellists, and then when the host divulged a piece of your private info., said, ""I demand my privacy!""",that reminds appearance hignfy made jokes invading privacy panellists host divulged piece private info said demand privacy,that remind appearance hignfy make joke invade privacy panellist host divulge piece private info say demand privacy,[],{},{},0,1,[],,['Piers Morgan'],0.2003
178,2021-03-10,Wed Mar 10 15:59:05 +0000 2021,1369679208386027523,TeamYouTube,"San Bruno, CA",Not Geo-tagged,"b""@HAMDYHASSAN111 Thanks for the tag \xe2\x80\x93 we recommend checking your inbox as we've sent you a DM with next steps. Also, we'd like to remind you to delete the screenshot showing your email address as this is considered private info.""","$MENTION$ Thanks for the tag we recommend checking your inbox as we've sent you a DM with next steps. Also, we'd like to remind you to delete the screenshot showing your email address as this is considered private info.","Thanks for the tag we recommend checking your inbox as we've sent you a DM with next steps. Also, we'd like to remind you to delete the screenshot showing your email address as this is considered private info.",thanks tag recommend checking inbox sent dm next steps also like remind delete screenshot showing email address considered private info,thank tag recommend check inbox send dm next step also like remind delete screenshot show email address consider private info,[],{},{},0,0,[],,['Ahmed 2000'],0.7845
196,2021-03-10,Wed Mar 10 15:19:41 +0000 2021,1369669294439735301,maceywhyte,,Not Geo-tagged,b'@kourykalynn @corecalamity THAT IS MY DENTIST PRIVATE INFO YOU FREAK!',$MENTION$ $MENTION$ THAT IS MY DENTIST PRIVATE INFO YOU FREAK!,THAT IS MY DENTIST PRIVATE INFO YOU FREAK!,that is my dentist private info you freak,that be dentist private info freak,[],{},{},0,1,[],,"['soph!!!\U0001f9a6', 'cam']",-0.4926
158,2021-03-10,Wed Mar 10 16:52:32 +0000 2021,1369692660827516928,ephieeee3,,Not Geo-tagged,"b""@jxshuwu @spiral176 @jadeyanh Giving out anyone's private info to your homie without permission to do so is NEVER okay to do. The fact that it's so normalized IS the big problem. People (attractiveness levels be damned) deserve basic privacy and respect, period.\n\nI hope you can understand this pov as well.""","$MENTION$ $MENTION$ $MENTION$ Giving out anyone's private info to your homie without permission to do so is NEVER okay to do. The fact that it's so normalized IS the big problem. People (attractiveness levels be damned) deserve basic privacy and respect, period. I hope you can understand this pov as well.","Giving out anyone's private info to your homie without permission to do so is NEVER okay to do. The fact that it's so normalized IS the big problem. People (attractiveness levels be damned) deserve basic privacy and respect, period. I hope you can understand this pov as well.",giving anyone private info homie without permission never okay the fact normalized is big problem people attractiveness levels damned deserve basic privacy respect period hope understand pov well,give anyone private info homie without permission never okay the fact normalized be big problem people attractiveness level damn deserve basic privacy respect period hope understand pov well,[],{},{},0,17,[],,"['Jxshuwu', 'Mixkoat', 'Jade🌿']",0.7244
