s_no,date,created_at,id_str,screen_name,user_location,geo-tagged_place,tweet_text,tweet_tokenized,tweet_cleaned,tweet_filtered,tweet_lemmatized,tweet_mentioned_organizations,tweet_tags_classified,tweet_orgs_classified,retweet_count,fav_count,hashtags,urls,mentions,vader_polarity
13,2021-03-15,Mon Mar 15 23:07:33 +0000 2021,1371598975518707714,bufordsharkley,"Santa Clara County, CA",Not Geo-tagged,"b'@green_groacer That\xe2\x80\x99s private info, I was replying to that other guy'","$MENTION$ Thats private info, I was replying to that other guy","That s private info, I was replying to that other guy",that private info replying guy,that private info reply guy,[],{},{},0,0,[],,['greengrocer'],0.0
12,2021-03-15,Mon Mar 15 23:07:59 +0000 2021,1371599083782217730,ranbooupdate,they/them,Not Geo-tagged,b'All info is from Karl\xe2\x80\x99s private acc! https://t.co/kKB3oe7Rfz',All info is from Karls private acc! $URL$,All info is from Karl s private acc!,all info karl private acc,all info karl private acc,[],{},{},4,680,[],,[],0.0
8,2021-03-15,Mon Mar 15 23:26:50 +0000 2021,1371603828357890052,angelicphoen1x,"Boston, MA",Not Geo-tagged,b'@okaydevo @knexguy101 Imagine leaking private info only intended for customers',$MENTION$ $MENTION$ Imagine leaking private info only intended for customers,Imagine leaking private info only intended for customers,imagine leaking private info intended customers,imagine leak private info intend customer,[],{},{},0,4,[],,"['\u1cbc', 'Chris']",0.0
3,2021-03-15,Mon Mar 15 23:43:38 +0000 2021,1371608056488812545,Delta,Global,Not Geo-tagged,"b'@mitchell_randi Hey Randi, I am so sorry for the wait tonight! If we can help, please use the DM link below to send your info and we will be able to join you in that Private Chat to assist and review. Antoinette https://t.co/6iDGBJRMTU'","$MENTION$ Hey Randi, I am so sorry for the wait tonight! If we can help, please use the DM link below to send your info and we will be able to join you in that Private Chat to assist and review. Antoinette $URL$","Hey Randi, I am so sorry for the wait tonight! If we can help, please use the DM link below to send your info and we will be able to join you in that Private Chat to assist and review. Antoinette",hey randi sorry wait tonight if help please use dm link send info able join private chat assist review antoinette,hey randi sorry wait tonight if help please use dm link send info able join private chat assist review antoinette,[],{},{},0,0,[],https://twitter.com/messages/compose?recipient_id=5920532,['Randi Mitchell'],0.6957
22,2021-03-15,Mon Mar 15 22:39:41 +0000 2021,1371591963808563206,Unique_Erique,Nigeria,Not Geo-tagged,"b'Nft is the next big way to earn from your life work. It like encrypting your creation, ideas, info, art, etc for private sale https://t.co/Dz4eRpB1l4'","Nft is the next big way to earn from your life work. It like encrypting your creation, ideas, info, art, etc for private sale $URL$","Nft is the next big way to earn from your life work. It like encrypting your creation, ideas, info, art, etc for private sale",nft next big way earn life work it like encrypting creation ideas info art etc private sale,nft next big way earn life work like encrypt creation idea info art etc private sale,[],{},{},0,1,[],https://twitter.com/seethefuture007/status/1371589290715664385,[],0.5574
16,2021-03-15,Mon Mar 15 23:00:40 +0000 2021,1371597243174813699,HumbleDavenport,"Renton, WA",Not Geo-tagged,"b'If you need to purchase private workers\xe2\x80\x99 compensation insurance, we can get it for you at the most competitive cost. Contact us today for more info!\n\nhttps://t.co/n7jGzFQBj6\n\n#HumbleDavenport #BusinessInsurance #WorkersCompensationInsurance #WorkersComp https://t.co/yPe1vIP3XE'","If you need to purchase private workers compensation insurance, we can get it for you at the most competitive cost. Contact us today for more info! $URL$ $HASHTAG$ $HASHTAG$ $HASHTAG$ $HASHTAG$ $URL$","If you need to purchase private workers compensation insurance, we can get it for you at the most competitive cost. Contact us today for more info!",if need purchase private workers compensation insurance get competitive cost contact today info,if need purchase private worker compensation insurance get competitive cost contact today info,[],{},{},0,0,"['HumbleDavenport', 'BusinessInsurance', 'WorkersCompensationInsurance', 'WorkersComp']",http://ow.ly/pKuV50DPocd,[],0.3149
29,2021-03-15,Mon Mar 15 22:19:07 +0000 2021,1371586786368053258,MarkDistance,In a Galaxy far far away...,Not Geo-tagged,"b'@KrissiNixon that sounds like a scam, id be VERY careful about releasing private info...search google for this thing, check into it'","$MENTION$ that sounds like a scam, id be VERY careful about releasing private info...search google for this thing, check into it","that sounds like a scam, id be VERY careful about releasing private info..search google for this thing, check into it",sounds like scam very careful releasing private info search google thing check,sound like scam very careful release private info search google thing check,[],{},{},0,1,[],,['Kristina Nixon (Saroli)'],0.1093
21,2021-03-15,Mon Mar 15 22:45:48 +0000 2021,1371593502660964356,_artANIME,twitch.tv/art_anime,Not Geo-tagged,"b""@larz_ttv Hi! I'm an artist myself, I can draw anything you might have in mind! \n\nInfo / vouches / samples - https://t.co/oAsOzQ1ySI\n\nYou can send me a private message if you like my art!""","$MENTION$ Hi! I'm an artist myself, I can draw anything you might have in mind! Info / vouches / samples - $URL$ You can send me a private message if you like my art!","Hi! I'm an artist myself, I can draw anything you might have in mind! Info / vouches / samples - You can send me a private message if you like my art!",hi artist draw anything might mind info vouches samples you send private message like art,hi artist draw anything may mind info vouch sample send private message like art,[],{},{},0,1,[],https://www.art-anime.com/,['Larz'],0.5229
5,2021-03-15,Mon Mar 15 23:39:13 +0000 2021,1371606944784412674,shermanmicah,,Not Geo-tagged,"b""@BitcoinBiology I never really thought of the internet as a tool for private info. I think of it as infrastructure that's become necessary for participation in society, same as electricity, something that should publicly owned, held in common. Ensuring it was equally available for all to use.""","$MENTION$ I never really thought of the internet as a tool for private info. I think of it as infrastructure that's become necessary for participation in society, same as electricity, something that should publicly owned, held in common. Ensuring it was equally available for all to use.","I never really thought of the internet as a tool for private info. I think of it as infrastructure that's become necessary for participation in society, same as electricity, something that should publicly owned, held in common. Ensuring it was equally available for all to use.",never really thought internet tool private info think infrastructure become necessary participation society electricity something publicly owned held common ensuring equally available use,never really think internet tool private info think infrastructure become necessary participation society electricity something publicly own hold common ensure equally available use,[],{},{},0,0,[],,"['₿itcoin ₿iohazard, laser supremacist 🧬🔬☣️🐝💻🔑']",0.2732
42,2021-03-15,Mon Mar 15 21:47:39 +0000 2021,1371578866792243201,hamjlton,24 she/her skia,Not Geo-tagged,b'@wantstoadoptLin Doxxing is when someone releases your private info to others or online without ur consent',$MENTION$ Doxxing is when someone releases your private info to others or online without ur consent,Doxxing is when someone releases your private info to others or online without ur consent,doxxing someone releases private info others online without consent,doxxe someone release private info other online without consent,[],{},{},0,1,[],,['roossengersxd ♡'],-0.1695
19,2021-03-15,Mon Mar 15 22:54:44 +0000 2021,1371595751399292929,JonSanchez22,,Not Geo-tagged,b'@parkerjklyn Yeah... that should stay private. If the talent wants to divulge that info that\xe2\x80\x99s on them. But we should not be demanding to know who got covid or any other illness.',$MENTION$ Yeah... that should stay private. If the talent wants to divulge that info thats on them. But we should not be demanding to know who got covid or any other illness.,Yeah.. that should stay private. If the talent wants to divulge that info that s on them. But we should not be demanding to know who got covid or any other illness.,yeah stay private if talent wants divulge info but demanding know got covid illness,yeah stay private if talent want divulge info but demand know get covid illness,[],{},{},0,1,[],,['Parker Klyn'],-0.0132
11,2021-03-15,Mon Mar 15 23:09:08 +0000 2021,1371599374732685318,PostCardMeMykon,Mykonos,Not Geo-tagged,b'Mykonos has its charm in all weathers!\n\n\xf0\x9f\xa7\xbfAUTHENTIC #MYKONOS  ON A PRIVATE PHOTO TOUR \nA photo can be worth a thousand words. \n\xf0\x9f\xa7\xbf Info / booking: \xf0\x9f\x93\xa7 Inbox here ore info@postcardme.de\n\n#holiday #mykonostour  #greece #travel #photooftheday #lgbtq #gay   #travelling #greece #cruise https://t.co/idK8EIhf5A',Mykonos has its charm in all weathers! AUTHENTIC $HASHTAG$ ON A PRIVATE PHOTO TOUR A photo can be worth a thousand words. Info / booking: $EMOJI$ Inbox here ore info$MENTION$.de $HASHTAG$ $HASHTAG$ $HASHTAG$ $HASHTAG$ $HASHTAG$ $HASHTAG$ $HASHTAG$ $HASHTAG$ $HASHTAG$ $HASHTAG$ $URL$,Mykonos has its charm in all weathers! AUTHENTIC ON A PRIVATE PHOTO TOUR A photo can be worth a thousand words. Info / booking Inbox here ore info.de,mykonos charm weathers authentic on private photo tour photo worth thousand words info booking inbox ore info,mykonos charm weathers authentic on private photo tour photo worth thousand word info book inbox ore info,[],{},{},1,5,"['MYKONOS', 'holiday', 'mykonostour', 'greece', 'travel', 'photooftheday', 'lgbtq', 'gay', 'travelling', 'greece', 'cruise']",,[],0.5983
14,2021-03-15,Mon Mar 15 23:03:37 +0000 2021,1371597987554729986,Shaezybazey,,Not Geo-tagged,"b""@juancitomarvel @GabeJamesGames Thank you for the tag Juan! More examples of my work and private commission pricing info can be found at https://t.co/6QDpOpkC2U\n(my submission form is closed atm but feel free to email me at shaemarieillustration@gmail.com if there's interest or for a commercial project quote!) https://t.co/HlrxicEYKK""",$MENTION$ $MENTION$ Thank you for the tag Juan! More examples of my work and private commission pricing info can be found at $URL$ (my submission form is closed atm but feel free to email me at shaemarieillustration$MENTION$.com if there's interest or for a commercial project quote!) $URL$,Thank you for the tag Juan! More examples of my work and private commission pricing info can be found at (my submission form is closed atm but feel free to email me at shaemarieillustration.com if there's interest or for a commercial project quote!),thank tag juan more examples work private commission pricing info found submission form closed atm feel free email shaemarieillustration com interest commercial project quote,thank tag juan more example work private commission pricing info find submission form closed atm feel free email shaemarieillustration com interest commercial project quote,[],{},{},1,13,[],http://shaemarieillustration.com/commission-info,"['JuancitoMarVel', 'Gabe Hicks']",0.8953
26,2021-03-15,Mon Mar 15 22:30:16 +0000 2021,1371589593166921737,BCSC_Info,"British Columbia, Canada",Not Geo-tagged,"b'There is a common misconception that securities laws only apply to incorporated companies listed on stock exchanges. Securities laws apply to any issuer, regardless of whether they are incorporated or listed on a stock exchange. Learn more: https://t.co/W9kGg2sz4R'","There is a common misconception that securities laws only apply to incorporated companies listed on stock exchanges. Securities laws apply to any issuer, regardless of whether they are incorporated or listed on a stock exchange. Learn more: $URL$","There is a common misconception that securities laws only apply to incorporated companies listed on stock exchanges. Securities laws apply to any issuer, regardless of whether they are incorporated or listed on a stock exchange. Learn more",there common misconception securities laws apply incorporated companies listed stock exchanges securities laws apply issuer regardless whether incorporated listed stock exchange learn,there common misconception security law apply incorporated company list stock exchange security law apply issuer regardless whether incorporated listed stock exchange learn,[],{},{},0,0,[],https://bcsc.news/3i0UrOT,[],0.5267
31,2021-03-15,Mon Mar 15 22:12:25 +0000 2021,1371585098701754369,illbethe_backup,sony went and snatched my main,Not Geo-tagged,"b""*Tweets private, unproven info all day*\n\n*Thinks it's a big deal that your hand is in the movie*\n\n*Your header is a guy you worked for 15+ years ago*\n\nyeah sit this one out https://t.co/YrDiL9ozkS""","*Tweets private, unproven info all day* *Thinks it's a big deal that your hand is in the movie* *Your header is a guy you worked for $NUMBER$+ years ago* yeah sit this one out $URL$","*Tweets private, unproven info all day* *Thinks it's a big deal that your hand is in the movie* *Your header is a guy you worked for + years ago* yeah sit this one out",tweets private unproven info day thinks big deal hand movie your header guy worked years ago yeah sit one,tweet private unproven info day think big deal hand movie header guy work year ago yeah sit one,[],{},{},0,5,[],https://twitter.com/wingheart/status/1371553815070076930,[],0.6597
41,2021-03-15,Mon Mar 15 21:48:20 +0000 2021,1371579040444862465,jsforgeync,"Charlotte, NC",Not Geo-tagged,"b'@jeremynewberger Dude, keep your personal info private.'","$MENTION$ Dude, keep your personal info private.","Dude, keep your personal info private.",dude keep personal info private,dude keep personal info private,[],{},{},0,0,[],,['Mr. Newberger'],0.0
17,2021-03-15,Mon Mar 15 22:59:27 +0000 2021,1371596937565106176,CAwineLover,,Not Geo-tagged,"b""@MystiSaint @Namasteblogger2 @gonegirl0115 @MartitaO @babycakes090376 Not sure a video with private info is wise. Just discussing through DM'S is better at this point.""",$MENTION$ $MENTION$ $MENTION$ $MENTION$ $MENTION$ Not sure a video with private info is wise. Just discussing through DM'S is better at this point.,Not sure a video with private info is wise. Just discussing through DM'S is better at this point.,not sure video private info wise just discussing dm better point,not sure video private info wise just discuss dm well point,[],{},{},0,1,[],,"['Lisa, aka Bot-Mom', 'Namastebitches2', 'Ella Tallulah', 'Mo', 'Babycakes']",0.6172
18,2021-03-15,Mon Mar 15 22:57:17 +0000 2021,1371596391278116864,digital_slime,,Not Geo-tagged,"b""@IamGrief @lowder_ja @AConservativism @Garp7463 @ByronYork @MPPregent In fact that's one of the things I think forums should be refusing to host, doxxing can be legal and forums should try and stop campaigns from going to far by letting personal info be distributed to far for private figures.""","$MENTION$ $MENTION$ $MENTION$ $MENTION$ $MENTION$ $MENTION$ In fact that's one of the things I think forums should be refusing to host, doxxing can be legal and forums should try and stop campaigns from going to far by letting personal info be distributed to far for private figures.","In fact that's one of the things I think forums should be refusing to host, doxxing can be legal and forums should try and stop campaigns from going to far by letting personal info be distributed to far for private figures.",in fact one things think forums refusing host doxxing legal forums try stop campaigns going far letting personal info distributed far private figures,in fact one thing think forum refuse host doxxe legal forum try stop campaign go far let personal info distribute far private figure,[],{},{},0,0,[],,"['Matthew Carson-apab po/ta/to', 'Give A Hoot', 'Mr. Tyop, err Typo😳👍🏼', 'Mark A Marshall', 'Byron York', 'Michael P Pregent']",-0.5267
6,2021-03-15,Mon Mar 15 23:31:23 +0000 2021,1371604973092474882,Uber_Support,,Not Geo-tagged,"b""@BenLope12763185 Thanks for providing your info. In order to protect your privacy, we don't encourage users to provide their account information through social media, kindly delete your post containing this info. Please send us a DM with more info regarding your concern, so that we can assist.""","$MENTION$ Thanks for providing your info. In order to protect your privacy, we don't encourage users to provide their account information through social media, kindly delete your post containing this info. Please send us a DM with more info regarding your concern, so that we can assist.","Thanks for providing your info. In order to protect your privacy, we do not encourage users to provide their account information through social media, kindly delete your post containing this info. Please send us a DM with more info regarding your concern, so that we can assist.",thanks providing info in order protect privacy encourage users provide account information social media kindly delete post containing info please send dm info regarding concern assist,thank provide info in order protect privacy encourage user provide account information social medium kindly delete post contain info please send dm info regard concern assist,[],{},{},0,0,[],,['Ben Lopez'],0.8073
4,2021-03-15,Mon Mar 15 23:41:23 +0000 2021,1371607487913279489,romanpiso,USA,Not Geo-tagged,"b""@biblemythology I began this study by doing my own family tree. Before one judges anything that I say, they must first understand how badly Humanity has been mind-f**ked. Inner-Circle families kept their own private archives &amp; left info in royal language. To know what I do, you'd need that info.""","$MENTION$ I began this study by doing my own family tree. Before one judges anything that I say, they must first understand how badly Humanity has been mind-f**ked. Inner-Circle families kept their own private archives &amp; left info in royal language. To know what I do, you'd need that info.","I began this study by doing my own family tree. Before one judges anything that I say, they must first understand how badly Humanity has been mind-f**ked. Inner-Circle families kept their own private archives &amp; left info in royal language. To know what I do, you'd need that info.",began study family tree before one judges anything say must first understand badly humanity mind ked inner circle families kept private archives left info royal language to know need info,begin study family tree before one judge anything say must first understand badly humanity mind ke inner circle family keep private archive leave info royal language to know need info,[],{},{},0,0,[],,['Archaeologian'],-0.4767
15,2021-03-15,Mon Mar 15 23:02:29 +0000 2021,1371597699410132994,Delta,Global,Not Geo-tagged,"b'@bschoffHQ Hey there, sorry for the trouble rebooking your flight via app. Please send your info through the DM link and we will join you in that Private Chat to assist Antoinette https://t.co/6iDGBJRMTU'","$MENTION$ Hey there, sorry for the trouble rebooking your flight via app. Please send your info through the DM link and we will join you in that Private Chat to assist Antoinette $URL$","Hey there, sorry for the trouble rebooking your flight via app. Please send your info through the DM link and we will join you in that Private Chat to assist Antoinette",hey sorry trouble rebooking flight via app please send info dm link join private chat assist antoinette,hey sorry trouble rebooke flight via app please send info dm link join private chat assist antoinette,[],{},{},0,0,[],https://twitter.com/messages/compose?recipient_id=5920532,['B. A. $choff'],0.128
47,2021-03-15,Mon Mar 15 21:38:06 +0000 2021,1371576464089378820,TMobileHelp,"Bellevue, WA",Not Geo-tagged,"b""@CameelV Thank you. We would recommend that you remove the public tweet with your phone number so you can keep your info private. I'm unable to DM you any information to assist, but I will be giving you a call shortly. ^JennaLundh""","$MENTION$ Thank you. We would recommend that you remove the public tweet with your phone number so you can keep your info private. I'm unable to DM you any information to assist, but I will be giving you a call shortly. ^JennaLundh","Thank you. We would recommend that you remove the public tweet with your phone number so you can keep your info private. I'm unable to DM you any information to assist, but I will be giving you a call shortly. ^JennaLundh",thank we would recommend remove public tweet phone number keep info private unable dm information assist giving call shortly jennalundh,thank would recommend remove public tweet phone number keep info private unable dm information assist give call shortly jennalundh,[],{},{},0,0,[],,['@cvirgo01'],0.6956
24,2021-03-15,Mon Mar 15 22:35:26 +0000 2021,1371590892470087687,Mattsa_64,,Not Geo-tagged,"b""@moparholic @TW1N_66RZ @dusk_raccoon @Flora_Fox17 @DojoTheDingo @KerotheWolf Hun we burned down a mcdonald's they could have stolen nuclear codes or sell private info at least burning down a resturant isn't bad as a war crime""",$MENTION$ $MENTION$ $MENTION$ $MENTION$ $MENTION$ $MENTION$ Hun we burned down a mcdonald's they could have stolen nuclear codes or sell private info at least burning down a resturant isn't bad as a war crime,Hun we burned down a mcdonald's they could have stolen nuclear codes or sell private info at least burning down a resturant is not bad as a war crime,hun burned mcdonald could stolen nuclear codes sell private info least burning resturant bad war crime,hun burn mcdonald could stolen nuclear code sell private info least burn resturant bad war crime,[],{},{},0,0,[],,"['Sam 🍹', '❤️Billy California💛#BLM', '🦝Dusk Raccoon🦝', 'Flora_Fox17', 'dojothedingo', 'Kero The Wolf']",-0.8294
38,2021-03-15,Mon Mar 15 21:52:32 +0000 2021,1371580095111041025,JAHMlEJ,New York,Not Geo-tagged,b'But the private info is extremely private. So uncomfortably private that it often sounds unrealistic. Often times completely contradictory to what the celebrity said in public. Thus often times branding him as a liar. \n\nHow do y\xe2\x80\x99all NOT see the problem? https://t.co/no5R9NFLq5',But the private info is extremely private. So uncomfortably private that it often sounds unrealistic. Often times completely contradictory to what the celebrity said in public. Thus often times branding him as a liar. How do yall NOT see the problem? $URL$,But the private info is extremely private. So uncomfortably private that it often sounds unrealistic. Often times completely contradictory to what the celebrity said in public. Thus often times branding him as a liar. How do y all NOT see the problem?,but private info extremely private so uncomfortably private often sounds unrealistic often times completely contradictory celebrity said public thus often times branding liar how not see problem,but private info extremely private so uncomfortably private often sound unrealistic often time completely contradictory celebrity say public thus often time brand liar how not see problem,[],{},{},6,32,[],,[],-0.9069
40,2021-03-15,Mon Mar 15 21:50:34 +0000 2021,1371579600132829195,alyssxaii,she/her,Not Geo-tagged,b'@AstroAxiis2 jhgadegasdjkhfd but the gc is like rlly close friends whom im comfortable with sharing private info aaa\ni can make a new one if you want',$MENTION$ jhgadegasdjkhfd but the gc is like rlly close friends whom im comfortable with sharing private info aaa i can make a new one if you want,jhgadegasdjkhfd but the gc is like rlly close friends whom im comfortable with sharing private info aa i can make a new one if you want,jhgadegasdjkhfd like rlly close friends comfortable sharing private info make new one want,jhgadegasdjkhfd like rlly close friend comfortable share private info make new one want,[],{},{},0,1,[],,['Astro'],0.9517
2,2021-03-15,Mon Mar 15 23:44:18 +0000 2021,1371608224403574785,sis_zenko,,Not Geo-tagged,"b""@Definews_Info @PancakeSwap @CreamdotFinance DON'T go to the site until they confirm it's all clear. REFRAIN to input our seed phrase/private keys. They're working on recovery now. The fake site really clone the code of the Pancake site and catch all the thing you write on that box to submit to malicious server. Be careful!""",$MENTION$ $MENTION$ $MENTION$ DON'T go to the site until they confirm it's all clear. REFRAIN to input our seed phrase/private keys. They're working on recovery now. The fake site really clone the code of the Pancake site and catch all the thing you write on that box to submit to malicious server. Be careful!,DON'T go to the site until they confirm it's all clear. REFRAIN to input our seed phrase/private keys. They're working on recovery now. The fake site really clone the code of the Pancake site and catch all the thing you write on that box to submit to malicious server. Be careful!,don site confirm clear refrain input seed phrase private keys they working recovery the fake site really clone code pancake site catch thing write box submit malicious server be careful,don site confirm clear refrain input seed phrase private key work recovery the fake site really clone code pancake site catch thing write box submit malicious server be careful,[],{},{},0,0,[],,"['🌐 DeFi News 🌐', 'PancakeSwap 🥞 #BSC', 'Cream Finance 🍦']",0.1007
