s_no,date,created_at,id_str,screen_name,user_location,geo-tagged_place,tweet_text,tweet_tokenized,tweet_cleaned,tweet_filtered,tweet_lemmatized,tweet_mentioned_organizations,tweet_tags_classified,tweet_orgs_classified,retweet_count,fav_count,hashtags,urls,mentions,vader_polarity
147,2021-01-14,Thu Jan 14 18:10:55 +0000 2021,1349781054480031744,JustSumDoodYo,,Not Geo-tagged,"b""@Normie4C I think DM's are totally appropriate, even more so sometimes if it's more of a convo or more private info. Unfortunately I don't know the answer for #2 as I don't do videos. @nrdgrl007 probably knows though \xf0\x9f\xa4\xa0""","$MENTION$ I think DM's are totally appropriate, even more so sometimes if it's more of a convo or more private info. Unfortunately I don't know the answer for $HASHTAG$ as I don't do videos. $MENTION$ probably knows though","I think DM's are totally appropriate, even more so sometimes if it's more of a convo or more private info. Unfortunately I do not know the answer for as I do not do videos. probably knows though",think dm totally appropriate even sometimes convo private info unfortunately know answer videos probably knows though,think dm totally appropriate even sometimes convo private info unfortunately know answer video probably know though,[],{},{},0,2,[],,"['Normie4Crypto', '🤗 NrdGrl007 🤗 🐇 🕳']",-0.3947
160,2021-01-14,Thu Jan 14 17:32:53 +0000 2021,1349771481786544131,Scott_TheModel,"Georgia, USA",Not Geo-tagged,b'@TMZ those companies who gave private info should be sued.',$MENTION$ those companies who gave private info should be sued.,those companies who gave private info should be sued.,companies gave private info sued,company give private info sue,[],{},{},0,0,[],,['TMZ'],0.0
134,2021-01-14,Thu Jan 14 18:40:24 +0000 2021,1349788473884962816,availl_BJMN,,Not Geo-tagged,b'Availl day\nReady ya say ...\nHomebase : bjm-bjb\nSt - Lt - Private Booking\nInfo RR and more via DM or WA (cek bio)\n#openbanjarmasin #availbanjarmasin #bobanjarmasin #angelbanjarmasin #bispakbanjarmasin https://t.co/oJ4dUJDgdY',Availl day Ready ya say ... Homebase : bjm-bjb St - Lt - Private Booking Info RR and more via DM or WA (cek bio) $HASHTAG$ $HASHTAG$ $HASHTAG$ $HASHTAG$ $HASHTAG$ $URL$,Availl day Ready ya say .. Homebase bjm-bjb St - Lt - Private Booking Info RR and more via DM or WA (cek bio),availl day ready say homebase bjm bjb st lt private booking info rr via dm wa cek bio,availl day ready say homebase bjm bjb st lt private book info rr via dm wa cek bio,[],{},{},0,0,"['openbanjarmasin', 'availbanjarmasin', 'bobanjarmasin', 'angelbanjarmasin', 'bispakbanjarmasin']",,[],0.3612
129,2021-01-14,Thu Jan 14 18:43:23 +0000 2021,1349789222450864128,wmbogart,,Not Geo-tagged,"b""catching up. ariel pink is 100% an abusive scumbag w/ add'l unpublished shithead behavior. we need to listen to the people affected. labels/venues/collaborators knew and did nothing. publications shouldn't publish private &amp; identifying info of those affected w/o permission, etc.""","catching up. ariel pink is $NUMBER$% an abusive scumbag w/ add'l unpublished shithead behavior. we need to listen to the people affected. labels/venues/collaborators knew and did nothing. publications shouldn't publish private &amp; identifying info of those affected w/o permission, etc.","catching up. ariel pink is % an abusive scumbag w/ add'l unpublished shithead behavior. we need to listen to the people affected. labels/venues/collaborators knew and did nothing. publications should not publish private &amp; identifying info of those affected w/o permission, etc.",catching ariel pink abusive scumbag add unpublished shithead behavior need listen people affected labels venues collaborators knew nothing publications publish private identifying info affected permission etc,catch ariel pink abusive scumbag add unpublished shithead behavior nee listen people affect label venue collaborator know nothing publication publish private identify info affected permission etc,[],{},{},1,6,[],,[],-0.9403
121,2021-01-14,Thu Jan 14 19:03:30 +0000 2021,1349794286955618306,KidzRUs2010,Swinton Irlam Media Monton,Not Geo-tagged,b'How\xe2\x80\x99s your recycling? \xe2\x99\xbb\xef\xb8\x8f\n\xf0\x9f\x93\x9e Gemma 0161 743 9315\n\xf0\x9f\x93\xa9 DM for more info \n\xf0\x9f\x92\xbb Gemma@kidzrusnursery.co.uk @ Kidzrus Private Day Nurseries https://t.co/z4KjEmxqSP',Hows your recycling? $EMOJI$ $EMOJI$ Gemma $NUMBER$ $NUMBER$ $NUMBER$ $EMOJI$ DM for more info $EMOJI$ Gemma$MENTION$.co.uk $MENTION$ Kidzrus Private Day Nurseries $URL$,How s your recycling? Gemma DM for more info Gemma.co.uk Kidzrus Private Day Nurseries,how recycling gemma dm info gemma uk kidzrus private day nurseries,how recycling gemma dm info gemma uk kidzrus private day nursery,[],{},{},0,0,[],https://www.instagram.com/p/CKCVPI3nfFz/?igshid=3nprzqi5d6ww,[],0.0
154,2021-01-14,Thu Jan 14 17:50:02 +0000 2021,1349775799814152192,JoshuaGomezMusi,"Orlando, FL",Not Geo-tagged,b'@TeamYouTube understood. I don\xe2\x80\x99t see any private info on here but if y\xe2\x80\x99all could fix that it would help a lot!',$MENTION$ understood. I dont see any private info on here but if yall could fix that it would help a lot!,understood. I don t see any private info on here but if y all could fix that it would help a lot!,understood see private info could fix would help lot,understand see private info could fix would help lot,[],{},{},0,0,[],,['TeamYouTube'],0.5916
152,2021-01-14,Thu Jan 14 17:59:22 +0000 2021,1349778148267708417,BlahaFrancisco,Oceans Worlwide,"Auckland, New Zealand, NZ","b'@OpagacJulio \xe2\x80\x9cI see the whole private certification scene as hypocrisy in the best-case scenario, or neo-colonialism in the worst-case scenario\xe2\x80\x9d https://t.co/90XrXFYdtq'","$MENTION$ I see the whole private certification scene as hypocrisy in the best-case scenario, or neo-colonialism in the worst-case scenario $URL$","I see the whole private certification scene as hypocrisy in the best-case scenario, or neo-colonialism in the worst-case scenario",see whole private certification scene hypocrisy best case scenario neo colonialism worst case scenario,see whole private certification scene hypocrisy best case scenario neo colonialism worst case scenario,[],{},{},1,3,[],http://www.franciscoblaha.info/blog/2021/1/13/a-infofish-interview-on-covid-impacts-eu-yellow-cards-my-disdain-for-private-certifications-subsidies-climate-change-and-how-liberating-is-to-be-seen-as-dumb-fisherman,['Dr Julio Morón Ayala'],0.0
107,2021-01-14,Thu Jan 14 19:31:27 +0000 2021,1349801319385739264,KnockOutVolant,he/him,Not Geo-tagged,"b'@h0lyowoly like the protected tweets thing means the account owner have to approve you and the same for a private user but the sensitive info ones just makes you have to confirm you DO want to see what the image is. it works better for people who do angst, gore, nsfw and the like'","$MENTION$ like the protected tweets thing means the account owner have to approve you and the same for a private user but the sensitive info ones just makes you have to confirm you DO want to see what the image is. it works better for people who do angst, gore, nsfw and the like","like the protected tweets thing means the account owner have to approve you and the same for a private user but the sensitive info ones just makes you have to confirm you DO want to see what the image is. it works better for people who do angst, gore, nsfw and the like",like protected tweets thing means account owner approve private user sensitive info ones makes confirm do want see image works better people angst gore nsfw like,like protected tweet thing mean account owner approve private user sensitive info one make confirm do want see image work well people angst gore nsfw like,[],{},{},0,0,[],,['\U0001fab1nee\U0001fab1'],0.882
117,2021-01-14,Thu Jan 14 19:08:50 +0000 2021,1349795627803303937,KidzRUs2010,Swinton Irlam Media Monton,Not Geo-tagged,b'How true! \xf0\x9f\x91\xa8\xf0\x9f\x8f\xbb\xe2\x80\x8d\xf0\x9f\xa4\x9d\xe2\x80\x8d\xf0\x9f\x91\xa8\xf0\x9f\x8f\xbf\xf0\x9f\x91\xab\xf0\x9f\x91\xa9\xf0\x9f\x8f\xbe\xe2\x80\x8d\xf0\x9f\xa4\x9d\xe2\x80\x8d\xf0\x9f\x91\xa9\xf0\x9f\x8f\xbc\xf0\x9f\x8c\x88\xe2\x9d\xa4\xef\xb8\x8f\xf0\x9f\x8c\x88\n\xf0\x9f\x93\x9e Gemma 0161 743 9315\n\xf0\x9f\x93\xa9 DM for more info \n\xf0\x9f\x92\xbb Gemma@kidzrusnursery.co.uk @ Kidzrus Private Day Nurseries https://t.co/Me14PiaqfX',How true! $EMOJI$$EMOJI$$EMOJI$$EMOJI$$EMOJI$$EMOJI$$EMOJI$$EMOJI$$EMOJI$$EMOJI$$EMOJI$$EMOJI$ $EMOJI$ Gemma $NUMBER$ $NUMBER$ $NUMBER$ $EMOJI$ DM for more info $EMOJI$ Gemma$MENTION$.co.uk $MENTION$ Kidzrus Private Day Nurseries $URL$,How true! Gemma DM for more info Gemma.co.uk Kidzrus Private Day Nurseries,how true gemma dm info gemma uk kidzrus private day nurseries,how true gemma dm info gemma uk kidzrus private day nursery,[],{},{},0,0,[],https://www.instagram.com/p/CKCV2NmHR1j/?igshid=jjtumm32oy7f,[],0.4753
157,2021-01-14,Thu Jan 14 17:40:50 +0000 2021,1349773480653369346,NatalieWritesOn,Metro-Atlanta,Not Geo-tagged,"b""@Dirtiest_Birds @possiblyTiffany @GRNTUB But this isn't criminal. I would be furious if a reporter were in my child custody hearing. That's private info being discussed!""",$MENTION$ $MENTION$ $MENTION$ But this isn't criminal. I would be furious if a reporter were in my child custody hearing. That's private info being discussed!,But this is not criminal. I would be furious if a reporter were in my child custody hearing. That's private info being discussed!,but criminal would furious reporter child custody hearing that private info discussed,but criminal would furious reporter child custody hearing that private info discuss,[],{},{},0,10,[],,"['FGCU Dirtiest Bird', 'Tiffany McGuire', 'currently practicing positivity']",-0.3975
150,2021-01-14,Thu Jan 14 18:00:41 +0000 2021,1349778479215210498,bunnisimps,✧minor|🇵🇭🏳️‍🌈,Not Geo-tagged,"b'PLS DONT CLOG TL! I WILL ONLY B POSTING AND RTING USEFUL INFO AND PETITIONS FOR NOW! \n\nif you are livetweeting, please at least private so it\xe2\x80\x99ll clear up the tl'","PLS DONT CLOG TL! I WILL ONLY B POSTING AND RTING USEFUL INFO AND PETITIONS FOR NOW! if you are livetweeting, please at least private so itll clear up the tl","PLS DONT CLOG TL! I WILL ONLY B POSTING AND RTING USEFUL INFO AND PETITIONS FOR NOW! if you are livetweeting, please at least private so it ll clear up the tl",pls dont clog tl will only posting and rting useful info and petitions for now livetweeting please least private clear,pls do not clog tl will only post and rte useful info and petition for now livetweete please least private clear,[],{},{},0,1,[],,[],0.8863
161,2021-01-14,Thu Jan 14 17:32:41 +0000 2021,1349771429991116802,c0g1018,,Not Geo-tagged,"b'Sorry, ""Rabbi""\n\nDoxxing isn\'t about letting people\'s private info ""slip"", it\'s a specific attack of intimidation that you\'re implicitly endorsing.\n\nPathetic \n\n@RabbiZvi https://t.co/0mkOoViBL3'","Sorry, ""Rabbi"" Doxxing isn't about letting people's private info ""slip"", it's a specific attack of intimidation that you're implicitly endorsing. Pathetic $MENTION$ $URL$","Sorry, ""Rabbi"" Doxxing is not about letting people's private info ""slip"", it's a specific attack of intimidation that you're implicitly endorsing. Pathetic",sorry rabbi doxxing letting people private info slip specific attack intimidation implicitly endorsing pathetic,sorry rabbi doxxe let people private info slip specific attack intimidation implicitly endorse pathetic,[],{},{},1,6,[],,['Rabbi Zvi Solomons 🕎 follow @RabbiSolomons'],-0.872
162,2021-01-14,Thu Jan 14 17:29:38 +0000 2021,1349770665654628362,sarrruna,,Not Geo-tagged,"b""@simp4jungkook I got scared when i found out they did they same to my priv \xf0\x9f\x99\x82... they got in two of my accs !! .. guess they found nuthin tho \xf0\x9f\x98\x82\xf0\x9f\x92\x94 maybe they look for private info's or smth""",$MENTION$ I got scared when i found out they did they same to my priv $EMOJI$... they got in two of my accs !! .. guess they found nuthin tho $EMOJI$$EMOJI$ maybe they look for private info's or smth,I got scared when i found out they did they same to my priv .. they got in two of my accs !! .. guess they found nuthin tho maybe they look for private info's or smth,got scared found priv got two accs guess found nuthin tho maybe look private info smth,get scare find priv get two accs guess find nothing tho maybe look private info smth,[],{},{},0,1,[],,['Rockstar Koo⁷ 🍌🐰🌸|🐥⁸ ʸᵉᵃʳˢ ʷᶦᵗʰ ʲᶦᵐᶦⁿ'],-0.5399
158,2021-01-14,Thu Jan 14 17:40:40 +0000 2021,1349773441986146307,bitcoin_freakk,,Not Geo-tagged,b'Sign up to https://t.co/1XqpOLMuvW and complete the required conditions to catch the opportunity to buy $DAO tokens from the Startup.\n\xf0\x9f\x93\xa2Private sale will launch on January 18 2021\n#DAO #DYCO #DAOMaker @TheDaoMaker\nFor more info\xf0\x9f\x91\x87\nhttps://t.co/ESSBFjlK1D\nhttps://t.co/97vbQlKR1a',Sign up to $URL$ and complete the required conditions to catch the opportunity to buy $DAO tokens from the Startup. $EMOJI$Private sale will launch on January $NUMBER$ $NUMBER$ $HASHTAG$ $HASHTAG$ $HASHTAG$ $MENTION$ For more info$EMOJI$ $URL$ $URL$,Sign up to and complete the required conditions to catch the opportunity to buy $DAO tokens from the Startup. Private sale will launch on January For more info,sign complete required conditions catch opportunity buy dao tokens startup private sale launch january for info,sign complete require condition catch opportunity buy dao token startup private sale launch january for info,[],{},{},6,17,"['DAO', 'DYCO', 'DAOMaker']","http://gate.io, https://www.gate.io/en/article/18953",['DAO Maker'],0.4215
164,2021-01-14,Thu Jan 14 17:22:18 +0000 2021,1349768817518456833,MedicineWoman08,,Not Geo-tagged,"b'Hmm ...  @zuckerbeeg you don\xe2\x80\x99t like the taste of your own medicine? @zuckerbeeg @WhatsApp Let\xe2\x80\x99s level the playing field: summon some courage, share freely and publicly your own private info. https://t.co/B5qmcekPxs'","Hmm ... $MENTION$ you dont like the taste of your own medicine? $MENTION$ $MENTION$ Lets level the playing field: summon some courage, share freely and publicly your own private info. $URL$","Hmm .. you don t like the taste of your own medicine? Let s level the playing field summon some courage, share freely and publicly your own private info.",hmm like taste medicine let level playing field summon courage share freely publicly private info,hmm like taste medicine let level playing field summon courage share freely publicly private info,[],{},{},0,0,[],https://twitter.com/trtworld/status/1349074165249302532,"['Mark Zuckerbeeg', 'Mark Zuckerbeeg', 'WhatsApp']",0.891
146,2021-01-14,Thu Jan 14 18:11:03 +0000 2021,1349781086318985216,moxie,"California, USA",Not Geo-tagged,"b""@SGanguly101 @signalapp Contacts that you've communicated with on Signal? Signal profile photos are private, so your contacts will first approve message requests from you before you can see their profile info.""","$MENTION$ $MENTION$ Contacts that you've communicated with on Signal? Signal profile photos are private, so your contacts will first approve message requests from you before you can see their profile info.","Contacts that you've communicated with on Signal? Signal profile photos are private, so your contacts will first approve message requests from you before you can see their profile info.",contacts communicated signal signal profile photos private contacts first approve message requests see profile info,contact communicate signal signal profile photo private contact first approve message request see profile info,[],{},{},3,30,[],,"['SATADRU GANGULY', 'Signal']",0.0
156,2021-01-14,Thu Jan 14 17:43:00 +0000 2021,1349774027221569537,canva,"Sydney, Australia",Not Geo-tagged,"b""@kamiarkorful Hey there, Kami! We've replied to your DM about this just now. We suggest deleting your private info (email address) here for security purposes as well. Cheers! ^cg""","$MENTION$ Hey there, Kami! We've replied to your DM about this just now. We suggest deleting your private info (email address) here for security purposes as well. Cheers! ^cg","Hey there, Kami! We've replied to your DM about this just now. We suggest deleting your private info (email address) here for security purposes as well. Cheers! ^cg",hey kami we replied dm we suggest deleting private info email address security purposes well cheers,hey kami reply dm suggest delete private info email address security purpose well cheer,[],{},{},0,0,[],,['k arkorful'],0.8011
163,2021-01-14,Thu Jan 14 17:25:27 +0000 2021,1349769613387689984,_dhannels_,Wave Manor,Not Geo-tagged,"b'A lot of these \xe2\x80\x9cprivate clubs\xe2\x80\x9d be asking for ID and I get it, but giving up my personal info over the internet just don\xe2\x80\x99t sit right with me. I hope to catch them in person one day cuz the FOMO be real'","A lot of these private clubs be asking for ID and I get it, but giving up my personal info over the internet just dont sit right with me. I hope to catch them in person one day cuz the FOMO be real","A lot of these private clubs be asking for ID and I get it, but giving up my personal info over the internet just don t sit right with me. I hope to catch them in person one day cuz the FOMO be real", lot private clubs asking id get giving personal info internet sit right hope catch person one day cuz fomo real,  lot private club ask d get give personal info internet sit right hope catch person one day cuz fomo real,[],{},{},0,0,[],,[],0.7876
169,2021-01-14,Thu Jan 14 17:02:07 +0000 2021,1349763738468048899,FinhavenPM,,Not Geo-tagged,"b'We\xe2\x80\x99re working in lockstep with the @BCSC_Info. Finhaven Private Markets is compliant, secure and authorized to operate. https://t.co/IZ1FfIVIdX'","Were working in lockstep with the $MENTION$. Finhaven Private Markets is compliant, secure and authorized to operate. $URL$","We re working in lockstep with the . Finhaven Private Markets is compliant, secure and authorized to operate.",we working lockstep finhaven private markets compliant secure authorized operate,work lockstep finhaven private market compliant secure authorize operate,[],{},{},0,0,[],https://biv.com/article/2020/12/securities-regulator-grapples-fintech-innovations,['BC Securities Commission'],0.34
151,2021-01-14,Thu Jan 14 17:59:34 +0000 2021,1349778196804329472,ZenAndHopscotch,Four Seasons Total Landscaping,Not Geo-tagged,b'Please report this account @fuckabillyrex AKA @_steamy_mac \nfor using my friend @PoutyPink \xe2\x80\x98s family business sign as his header.\nThese people are absolutely horrid. This harassment &amp; digging up private info &amp; family photos to publicly share needs to stop.\nThank you\xf0\x9f\x99\x8f\xf0\x9f\x8f\xbc https://t.co/ycI3ie7WDZ',Please report this account $MENTION$ AKA $MENTION$ for using my friend $MENTION$ s family business sign as his header. These people are absolutely horrid. This harassment &amp; digging up private info &amp; family photos to publicly share needs to stop. Thank you$EMOJI$$EMOJI$ $URL$,Please report this account AKA for using my friend s family business sign as his header. These people are absolutely horrid. This harassment &amp; digging up private info &amp; family photos to publicly share needs to stop. Thank you,please report account aka using friend family business sign header these people absolutely horrid this harassment digging private info family photos publicly share needs stop thank,please report account aka use friend family business sign header these people absolutely horrid this harassment dig private info family photo publicly share need stop thank,[],{},{},3,9,[],,"['Mr. Bea Arthur', 'Minister of Loneliness', 'PoutyPink']",-0.3066
155,2021-01-14,Thu Jan 14 17:47:56 +0000 2021,1349775269641547779,ShayleneNeumann,"Ridgefield, CT",Not Geo-tagged,"b'\xf0\x9f\x90\x8e\xf0\x9f\x90\x8e This beautiful equestrian property offers a serene setting with a beautiful custom-built home with top-quality craftsmanship throughout, complete with an outstanding equestrian facility. Call me today for a private showing! 203-948-4655 \xf0\x9f\x90\x8e\xf0\x9f\x90\x8eInfo: https://t.co/oWLSGA9Or6'","$EMOJI$$EMOJI$ This beautiful equestrian property offers a serene setting with a beautiful custom-built home with top-quality craftsmanship throughout, complete with an outstanding equestrian facility. Call me today for a private showing! $NUMBER$-948-4655 $EMOJI$$EMOJI$Info: $URL$","This beautiful equestrian property offers a serene setting with a beautiful custom-built home with top-quality craftsmanship throughout, complete with an outstanding equestrian facility. Call me today for a private showing! -948-4655 Info",this beautiful equestrian property offers serene setting beautiful custom built home top quality craftsmanship throughout complete outstanding equestrian facility call today private showing info,this beautiful equestrian property offer serene set beautiful custom build home top quality craftsmanship throughout complete outstanding equestrian facility call today private show info,[],{},{},0,0,[],https://bit.ly/38fiebx,[],0.9441
153,2021-01-14,Thu Jan 14 17:58:12 +0000 2021,1349777854804987905,Steelcity730,,Not Geo-tagged,b'@MarkHen070393 @andyuk70 @kpk1011 @SpeakerPelosi It depends if the one giving the tour knew what would happen. I had an intern friend give me a private tour of the Capitol once. If I used that tour to gain info and commit a crime w/o that friend knowing my intentions they shouldn\xe2\x80\x99t be responsible for my act',$MENTION$ $MENTION$ $MENTION$ $MENTION$ It depends if the one giving the tour knew what would happen. I had an intern friend give me a private tour of the Capitol once. If I used that tour to gain info and commit a crime w/o that friend knowing my intentions they shouldnt be responsible for my act,It depends if the one giving the tour knew what would happen. I had an intern friend give me a private tour of the Capitol once. If I used that tour to gain info and commit a crime w/o that friend knowing my intentions they shouldn t be responsible for my act,it depends one giving tour knew would happen intern friend give private tour capitol if used tour gain info commit crime friend knowing intentions responsible act,depend one give tour know would happen intern friend give private tour capitol if use tour gain info commit crime friend know intention responsible act,[],{},{},0,0,[],,"['The Grand Wazoo', 'Andy Bailey', 'TRX', 'Nancy Pelosi']",0.9042
114,2021-01-14,Thu Jan 14 19:18:44 +0000 2021,1349798120218120198,Shawhelp,Canada,Not Geo-tagged,"b""@admcfajn Hey Adam, just to keep your info private, I'd recommend deleting this public post and sending us a direct message instead:  https://t.co/4wSB2SvmZ8 - Jack""","$MENTION$ Hey Adam, just to keep your info private, I'd recommend deleting this public post and sending us a direct message instead: $URL$ - Jack","Hey Adam, just to keep your info private, I'd recommend deleting this public post and sending us a direct message instead - Jack",hey adam keep info private recommend deleting public post sending direct message instead jack,hey adam keep info private recommend delete public post send direct message instead jack,[],{},{},0,0,[],https://twitter.com/messages/compose?recipient_id=216808077,['Adam McFadyen'],0.3612
165,2021-01-14,Thu Jan 14 17:15:25 +0000 2021,1349767086017568768,DegenerateLibe2,,Not Geo-tagged,"b""@ScottMGreer The records of many from the 1860s were systematically destroyed or randomly destroyed or lost in war. Especially if you were black..  So yes there will be a correlation between the two.. \n\nIts possible to locate what's left if youre willing to give up some private info""",$MENTION$ The records of many from the $NUMBER$s were systematically destroyed or randomly destroyed or lost in war. Especially if you were black.. So yes there will be a correlation between the two.. Its possible to locate what's left if youre willing to give up some private info,The records of many from the s were systematically destroyed or randomly destroyed or lost in war. Especially if you were black.. So yes there will be a correlation between the two.. Its possible to locate what's left if youre willing to give up some private info,the records many systematically destroyed randomly destroyed lost war especially black so yes correlation two its possible locate left youre willing give private info,the record many systematically destroy randomly destroy lose war especially black so yes correlation two possible locate leave be willing give private info,[],{},{},0,0,[],,['Scott Greer 6’2” IQ 187'],-0.8446
173,2021-01-14,Thu Jan 14 17:00:01 +0000 2021,1349763209406816257,miskinsaat,Sariyer – Istanbul Turkey,Not Geo-tagged,b'Take a look at possible designs for youre private gym. \n\nfor more info : https://t.co/9VEZpECEgV\n\nTal : +90 531 323 73 64\nhttps://t.co/tfTBrurWRJ\nhttps://t.co/q6K2d9UnbC\nhttps://t.co/rRg8lOOOct\n\n#MISK_INSAAT\n#ISTANBUL\n#TURKEY \n#invest-in-istanbul\n#new_desighn_bulid https://t.co/9w6UW8HuuM',Take a look at possible designs for youre private gym. for more info : $URL$ Tal : +90 $NUMBER$ $NUMBER$ $NUMBER$ $NUMBER$ $URL$ $URL$ $URL$ $HASHTAG$ $HASHTAG$ $HASHTAG$ $HASHTAG$-in-istanbul $HASHTAG$ $URL$,Take a look at possible designs for youre private gym. for more info Tal +90 -in-istanbul,take look possible designs youre private gym info tal istanbul,take look possible design be private gym info tal istanbul,[],{},{},0,0,"['MISK_INSAAT', 'ISTANBUL', 'TURKEY', 'invest', 'new_desighn_bulid']","http://www.miskinsaat.com, http://www.facebook.com/miskinsaat, http://www.instagram.com/miskinsaat/, https://www.twitter.com/miskinsaat",[],0.0
