s_no,date,created_at,id_str,screen_name,user_location,geo-tagged_place,tweet_text,tweet_tokenized,tweet_cleaned,tweet_filtered,tweet_lemmatized,tweet_mentioned_organizations,tweet_tags_classified,tweet_orgs_classified,retweet_count,fav_count,hashtags,urls,mentions,vader_polarity
100,2021-03-23,Tue Mar 23 18:51:39 +0000 2021,1374433679439630337,ttobesofearless,she/her   card byf! ,Not Geo-tagged,"b""@LiviesHQ hi! as much as we trust you,can you guys please confirm the google doc is tweeted by you and you weren't hacked or anything? there are many people,including minors who are worried about safety of their private info!:) waiting for your answer. x""","$MENTION$ hi! as much as we trust you,can you guys please confirm the google doc is tweeted by you and you weren't hacked or anything? there are many people,including minors who are worried about safety of their private info!:) waiting for your answer. x","hi! as much as we trust you,can you guys please confirm the google doc is tweeted by you and you were not hacked or anything? there are many people,including minors who are worried about safety of their private info! ) waiting for your answer. x",much trust guys please confirm google doc tweeted hacked anything many people including minors worried safety private info waiting answer,much trust guy please confirm google doc tweet hack anything many people include minor worry safety private info waiting answer,[],{},{},3,31,[],,"[""olivia's livies""]",0.8419
94,2021-03-23,Tue Mar 23 19:02:31 +0000 2021,1374436415572910080,DPAC,"Durham, NC",Not Geo-tagged,b'Now accepting applications!\n \nDPAC invites all public &amp; private high school students from NC to participate in the first-ever Triangle Rising Stars Virtual Showcase and Awards Show. \n \nApply here &gt;&gt;&gt; https://t.co/pLr6A3gMQA \n \nMore info &gt;&gt;&gt; https://t.co/miOe1KF02K https://t.co/XC9miTQb8N',Now accepting applications! DPAC invites all public &amp; private high school students from NC to participate in the first-ever Triangle Rising Stars Virtual Showcase and Awards Show. Apply here &gt;&gt;&gt; $URL$ More info &gt;&gt;&gt; $URL$ $URL$,Now accepting applications! DPAC invites all public &amp; private high school students from NC to participate in the first-ever Triangle Rising Stars Virtual Showcase and Awards Show. Apply here &gt;&gt;&gt; More info &gt;&gt;&gt;,now accepting applications dpac invites public private high school students nc participate first ever triangle rising stars virtual showcase awards show apply more info,now accept application dpac invite public private high school student nc participate first ever triangle rise star virtual showcase award show apply more info,[],{},{},2,4,[],"http://bit.ly/VirtualTRSApp, http://bit.ly/TRSDetails",[],0.7088
111,2021-03-23,Tue Mar 23 18:16:51 +0000 2021,1374424920445231105,SSFyimby,off the clock,Not Geo-tagged,"b'@FitzTheReporter @jilltucker @upzonethememes @recallsfboe Come on. That wasn\'t disclosure, that was giving inside info to an explicitly partisan group. What\'s ""private"" about a statement publicly posted on Twitter?'","$MENTION$ $MENTION$ $MENTION$ $MENTION$ Come on. That wasn't disclosure, that was giving inside info to an explicitly partisan group. What's ""private"" about a statement publicly posted on Twitter?","Come on. That was not disclosure, that was giving inside info to an explicitly partisan group. What's ""private"" about a statement publicly posted on Twitter?",come that disclosure giving inside info explicitly partisan group what private statement publicly posted twitter,come that disclosure give inside info explicitly partisan group what private statement publicly post twitter,[],{},{},0,3,[],,"['Joe Fitzgerald Rodriguez', 'Jill Tucker', 'Upzone the Memes', 'Recall SF School Board']",0.34
103,2021-03-23,Tue Mar 23 18:49:02 +0000 2021,1374433022099869703,B31Voices,"Northfield, Birmingham",Not Geo-tagged,b'#SWBrumJOBS - NEW: PA/Carer required for a 44 yr old lady with learning difficulties and cerebral palsy \xe2\x80\xa2  Northfield \xe2\x80\xa2 Part Time | Know somebody this might suit? Let them know! \n|\n\xe2\x80\xa2 INFO/APPLY:  https://t.co/wxDxjcdMH8\n|\n#Northfield \n#Birmingham\n#BirminghamJobs\n#BrumJobs https://t.co/6N0bbAaAl8',$HASHTAG$ - NEW: PA/Carer required for a $NUMBER$ yr old lady with learning difficulties and cerebral palsy Northfield Part Time | Know somebody this might suit? Let them know! | INFO/APPLY: $URL$ | $HASHTAG$ $HASHTAG$ $HASHTAG$ $HASHTAG$ $URL$,- NEW PA/Carer required for a yr old lady with learning difficulties and cerebral palsy Northfield Part Time | Know somebody this might suit? Let them know! | INFO/APPLY |,new pa carer required old lady learning difficulties cerebral palsy northfield part time know somebody might suit let know info apply,new pa carer require old lady learn difficulty cerebral palsy northfield part time know somebody may suit let know info apply,[],{},{},0,0,"['SWBrumJOBS', 'Northfield', 'Birmingham', 'BirminghamJobs', 'BrumJobs']",https://bvoices.uk/3rZMgHx,[],-0.3595
117,2021-03-23,Tue Mar 23 17:56:42 +0000 2021,1374419852517986313,TeamYouTube,"San Bruno, CA",Not Geo-tagged,"b""@AsmrBestt Sorry you're going through this \xe2\x80\x93 we're sending you a DM with the next steps. We also recommend deleting your tweet since it contains private info (email).""",$MENTION$ Sorry you're going through this we're sending you a DM with the next steps. We also recommend deleting your tweet since it contains private info (email).,Sorry you're going through this we're sending you a DM with the next steps. We also recommend deleting your tweet since it contains private info (email).,sorry going sending dm next steps we also recommend deleting tweet since contains private info email,sorry go send dm next step also recommend delete tweet since contain private info email,[],{},{},0,1,[],,['bestty_asmr'],0.296
106,2021-03-23,Tue Mar 23 18:39:07 +0000 2021,1374430523649519617,GrumpyDragonPro,Castle Grayskull,Not Geo-tagged,"b'@TinySlipOnShoe LoL  I eyerolled so much I thought I was going to backflip from the ""too hard to do hair""  meanwhile, ""Buttplate Enclave Power Armor"".  Yeah I was sorely disappointed by the ""we\'re getting to it"" sort of answer session.  I was hoping for more info about the private worlds.'","$MENTION$ LoL I eyerolled so much I thought I was going to backflip from the ""too hard to do hair"" meanwhile, ""Buttplate Enclave Power Armor"". Yeah I was sorely disappointed by the ""we're getting to it"" sort of answer session. I was hoping for more info about the private worlds.","LoL I eyerolled so much I thought I was going to backflip from the ""too hard to do hair"" meanwhile, ""Buttplate Enclave Power Armor"". Yeah I was sorely disappointed by the ""we're getting to it"" sort of answer session. I was hoping for more info about the private worlds.",lol eyerolled much thought going backflip hard hair meanwhile buttplate enclave power armor yeah sorely disappointed getting sort answer session hoping info private worlds,lol eyerolle much thought go backflip hard hair meanwhile buttplate enclave power armor yeah sorely disappointed get sort answer session hope info private world,[],{},{},0,7,[],,['🕸🕷ꪻinƴϚℓiքOnϚhoᏋ🕷🕸'],0.5106
108,2021-03-23,Tue Mar 23 18:26:13 +0000 2021,1374427280315871242,chatham_rock,New Zealand,Not Geo-tagged,b'News Release: Chatham Announces Private Placement\nLearn more at this link \xe2\x9e\xa1\xef\xb8\x8f https://t.co/6ifuy0ZkZh\n\xe2\x9a\x92\xef\xb8\x8f #investinmining #resourcestocks #miningnews miningstocks #TSXV\n\xf0\x9f\x87\xa8\xf0\x9f\x87\xa6 $NZN.CA https://t.co/wKHh45wAA5',News Release: Chatham Announces Private Placement Learn more at this link $EMOJI$ $URL$ $EMOJI$ $HASHTAG$ $HASHTAG$ $HASHTAG$ miningstocks $HASHTAG$ $NZN.CA $URL$,News Release Chatham Announces Private Placement Learn more at this link miningstocks $NZN.CA,news release chatham announces private placement learn link miningstocks nzn ca,news release chatham announce private placement learn link miningstock nzn ca,[],{},{},0,3,"['investinmining', 'resourcestocks', 'miningnews', 'TSXV']",https://stockmkt.info/3slNmO0,[],0.0
98,2021-03-23,Tue Mar 23 18:55:38 +0000 2021,1374434683111362568,mellohigogy,18. bun/buns + he/him,Not Geo-tagged,"b'by doing things like apologizing for things they didn\xe2\x80\x99t do, making twitter threads or videos to address a situation they did nothing wrong in, or even feel pressured to release private info just to reassure someone\xe2\x80\x99s baseless claims aren\xe2\x80\x99t true (the qbaiting thing)-'","by doing things like apologizing for things they didnt do, making twitter threads or videos to address a situation they did nothing wrong in, or even feel pressured to release private info just to reassure someones baseless claims arent true (the qbaiting thing)-","by doing things like apologizing for things they didn t do, making twitter threads or videos to address a situation they did nothing wrong in, or even feel pressured to release private info just to reassure someone s baseless claims aren t true (the qbaiting thing)-",things like apologizing things making twitter threads videos address situation nothing wrong even feel pressured release private info reassure someone baseless claims true qbaiting thing,thing like apologize thing make twitt thread video address situation nothing wrong even feel pressured release private info reassure someone baseless claim true qbaite thing,[],{},{},0,0,[],,[],0.7937
112,2021-03-23,Tue Mar 23 18:10:25 +0000 2021,1374423301653630977,BernsteinData,,Not Geo-tagged,b'A UK regulator has ordered Experian to make fundamental changes to the way it handles personal data. Learn about the steps companies must take to avoid the same fate in the podcast Operationalizing Information Governance. https://t.co/dQbibsaJF2\n#dataprivacy https://t.co/dhit7lSr4J',A UK regulator has ordered Experian to make fundamental changes to the way it handles personal data. Learn about the steps companies must take to avoid the same fate in the podcast Operationalizing Information Governance. $URL$ $HASHTAG$ $URL$,A UK regulator has ordered Experian to make fundamental changes to the way it handles personal data. Learn about the steps companies must take to avoid the same fate in the podcast Operationalizing Information Governance., uk regulator ordered experian make fundamental changes way handles personal data learn steps companies must take avoid fate podcast operationalizing information governance,  uk regulator order experian make fundamental change way handle personal datum learn step company must take avoid fate podcast operationalize information governance,[],{},{},0,0,['dataprivacy'],https://hubs.li/H0JLTzv0,[],-0.296
109,2021-03-23,Tue Mar 23 18:19:09 +0000 2021,1374425499062083586,desert_starr_57,"PA, USA",Not Geo-tagged,"b'For example @rewritingripley keeps doing this. \n\nNow they are trying to say their private info is on a  ""website known for publishing materials related to the Christchurch mosque shootings.""\n\nI do want to say. Don\'t post people\'s private info if it wasn\'t public.'","For example $MENTION$ keeps doing this. Now they are trying to say their private info is on a ""website known for publishing materials related to the Christchurch mosque shootings."" I do want to say. Don't post people's private info if it wasn't public.","For example keeps doing this. Now they are trying to say their private info is on a ""website known for publishing materials related to the Christchurch mosque shootings."" I do want to say. Do not post people's private info if it was not public.",for example keeps now trying say private info website known publishing materials related christchurch mosque shootings want say do post people private info public,for example keep now try say private info website know publishing material relate christchurch mosque shooting want say do post people private info public,[],{},{},11,75,[],,['Rewriting Ripley Pod'],0.0772
115,2021-03-23,Tue Mar 23 18:01:18 +0000 2021,1374421008631750666,lillibetbrf,"Liverpool, England",Not Geo-tagged,"b""@SabirahLohn Humanitarian who destroyed his 95 year old grandmother's life work on oprah and peddles info of there private conversations to that other vulture @GayleKing and military veteran who swerved his duties to army to attend a film premier and pimp his wife out to Disney \xf0\x9f\xa4\xa3\xf0\x9f\xa4\xa3\xf0\x9f\x91\x8d!""",$MENTION$ Humanitarian who destroyed his $NUMBER$ year old grandmother's life work on oprah and peddles info of there private conversations to that other vulture $MENTION$ and military veteran who swerved his duties to army to attend a film premier and pimp his wife out to Disney $EMOJI$!,Humanitarian who destroyed his year old grandmother's life work on oprah and peddles info of there private conversations to that other vulture and military veteran who swerved his duties to army to attend a film premier and pimp his wife out to Disney !,humanitarian destroyed year old grandmother life work oprah peddles info private conversations vulture military veteran swerved duties army attend film premier pimp wife disney,humanitarian destroy year old grandmother life work oprah peddle info private conversation vulture military veteran swerve duty army attend film premier pimp wife disney,[],{},{},0,3,[],,"['Sabirah Lohn Chief Impact Officer of Drama', 'Gayle King']",-0.7574
104,2021-03-23,Tue Mar 23 18:48:33 +0000 2021,1374432897457819650,Odessa_Bless,"Seattle, WA",Not Geo-tagged,b'@CharleeBeckett Medical records are private information. The normalcy of sharing vaccine document selfies doesn\xe2\x80\x99t seem too far away from the expectation of clients demanding STI screening info. I look to the AIDS crisis for an example of how the divide between vaccinated and non-vaccinated',$MENTION$ Medical records are private information. The normalcy of sharing vaccine document selfies doesnt seem too far away from the expectation of clients demanding STI screening info. I look to the AIDS crisis for an example of how the divide between vaccinated and non-vaccinated,Medical records are private information. The normalcy of sharing vaccine document selfies doesn t seem too far away from the expectation of clients demanding STI screening info. I look to the AIDS crisis for an example of how the divide between vaccinated and non-vaccinated,medical records private information the normalcy sharing vaccine document selfies seem far away expectation clients demanding sti screening info look aids crisis example divide vaccinated non vaccinated,medical record private information the normalcy share vaccine document selfie seem far away expectation client demand sti screen info look aids crisis example divide vaccinate non vaccinated,[],{},{},0,43,[],,['𝕔𝕙𝕒𝕣𝕝𝕖𝕖 💉 pfizer vaccinated!'],-0.4939
132,2021-03-23,Tue Mar 23 17:30:21 +0000 2021,1374413217288445968,Allstate,,Not Geo-tagged,"b'@DY_Lee11 We are sorry to hear this. Please private message us a bit more info, so we can look into this. ^SE https://t.co/vYIVrwKvqj'","$MENTION$ We are sorry to hear this. Please private message us a bit more info, so we can look into this. ^SE $URL$","We are sorry to hear this. Please private message us a bit more info, so we can look into this. ^SE",we sorry hear please private message bit info look se,sorry hear please private message bit info look se,[],{},{},0,0,[],https://twitter.com/messages/compose?recipient_id=14275290,['Dylan Young | DY'],0.3237
135,2021-03-23,Tue Mar 23 17:27:00 +0000 2021,1374412377693716485,Allstate,,Not Geo-tagged,"b'@Shareemx3 We are sorry to hear this. Please private message us a bit more info, so we can look into this. ^SE https://t.co/vYIVrwKvqj'","$MENTION$ We are sorry to hear this. Please private message us a bit more info, so we can look into this. ^SE $URL$","We are sorry to hear this. Please private message us a bit more info, so we can look into this. ^SE",we sorry hear please private message bit info look se,sorry hear please private message bit info look se,[],{},{},0,0,[],https://twitter.com/messages/compose?recipient_id=14275290,['reem dream'],0.3237
61,2021-03-23,Tue Mar 23 20:49:07 +0000 2021,1374463242538340353,designedtosellm,"Kalispell, MT",Not Geo-tagged,"b'\xf0\x9f\x92\xa5JUST LISTED!\xf0\x9f\x92\xa5Awesome Kalispell Home On 7 Horse Friendly Acres \xf0\x9f\x90\x8e\n\xf0\x9f\x93\xb8Photos, Details &amp; More Info \xe2\x9e\xa1 https://t.co/756dqE2fR4\n\xe2\x98\x8eCall/Text Stefanie Hanson 406-250-1782 or email shanson@beckmansrealestatemt.com for more information or to schedule your private showing. https://t.co/xHNWYsxhWP'","$EMOJI$JUST LISTED!$EMOJI$Awesome Kalispell Home On $NUMBER$ Horse Friendly Acres $EMOJI$ $EMOJI$Photos, Details &amp; More Info $EMOJI$ $URL$ $EMOJI$Call/Text Stefanie Hanson $NUMBER$-250-1782 or email shanson$MENTION$.com for more information or to schedule your private showing. $URL$","JUST LISTED! Awesome Kalispell Home On Horse Friendly Acres Photos, Details &amp; More Info Call/Text Stefanie Hanson -250-1782 or email shanson.com for more information or to schedule your private showing.",just listed awesome kalispell home on horse friendly acres photos details more info call text stefanie hanson email shanson com information schedule private showing,just list awesome kalispell home on horse friendly acre photo detail more info call text stefanie hanson email shanson com information schedule private showing,[],{},{},0,0,[],https://bit.ly/3c6Xjci,[],0.8221
128,2021-03-23,Tue Mar 23 17:38:19 +0000 2021,1374415225584119808,ranbooisswag,denial,Not Geo-tagged,"b""@sadgaysong that's her private info pls don't use it, I know she's said fucked up things and stuff but it's not a good idea to use her credit card or anything like that""","$MENTION$ that's her private info pls don't use it, I know she's said fucked up things and stuff but it's not a good idea to use her credit card or anything like that","that's her private info pls do not use it, I know she's said fucked up things and stuff but it's not a good idea to use her credit card or anything like that",private info pls use know said fucked things stuff good idea use credit card anything like,private info pls use know say fucked thing stuff good idea use credit card anything like,[],{},{},1,17,[],,['hira'],0.2479
136,2021-03-23,Tue Mar 23 17:25:00 +0000 2021,1374411872217141260,Allstate,,Not Geo-tagged,"b'@DrClark1908 We are sorry to hear this. Please private message us a bit more info, so we can look into this. ^SE https://t.co/vYIVrwKvqj'","$MENTION$ We are sorry to hear this. Please private message us a bit more info, so we can look into this. ^SE $URL$","We are sorry to hear this. Please private message us a bit more info, so we can look into this. ^SE",we sorry hear please private message bit info look se,sorry hear please private message bit info look se,[],{},{},0,0,[],https://twitter.com/messages/compose?recipient_id=14275290,['Dr. Tiffany Clark'],0.3237
124,2021-03-23,Tue Mar 23 17:46:14 +0000 2021,1374417216964235281,palembang_real,Kota Palembang,Not Geo-tagged,b'Ready slot \n-Booking private\n-vcs\n-massage\nInfo lebih lanjut Dm\xf0\x9f\x92\x8c https://t.co/6eSGTkBu8x new wa\xf0\x9f\x91\x88\n\n#Bispakpalembang\n#openbopalembang #availpalembang #bopalembang\n#lendirpalembang #bisyarpalembang #vcsbugil\n#sangeberat #RealAccount #vcscolmek #vcsberbayar #vcscroot #vcsyuk \n#vcs https://t.co/Wlh7QYPbV7',Ready slot -Booking private -vcs -massage Info lebih lanjut Dm$EMOJI$ $URL$ new wa$EMOJI$ $HASHTAG$ $HASHTAG$ $HASHTAG$ $HASHTAG$ $HASHTAG$ $HASHTAG$ $HASHTAG$ $HASHTAG$ $HASHTAG$ $HASHTAG$ $HASHTAG$ $HASHTAG$ $HASHTAG$ $HASHTAG$ $URL$,Ready slot -Booking private -vcs -massage Info lebih lanjut Dm new wa,ready slot booking private vcs massage info lebih lanjut dm new,ready slot book private vcs massage info lebih lanjut dm new,[],{},{},0,0,"['Bispakpalembang', 'openbopalembang', 'availpalembang', 'bopalembang', 'lendirpalembang', 'bisyarpalembang', 'vcsbugil', 'sangeberat', 'RealAccount', 'vcscolmek', 'vcsberbayar', 'vcscroot', 'vcsyuk', 'vcs']",http://wa.me/+6287771760835,[],0.3612
118,2021-03-23,Tue Mar 23 17:56:28 +0000 2021,1374419793680367621,SarahDemp,,Not Geo-tagged,"b""@heathdwilliams right, i'm not giving props for the two times a day that the broken clock is right. just because itchy isn't literally posting private info doesn't mean he doesn't feed into this exact mentality. have some fucking standards, people.""","$MENTION$ right, i'm not giving props for the two times a day that the broken clock is right. just because itchy isn't literally posting private info doesn't mean he doesn't feed into this exact mentality. have some fucking standards, people.","right, i'm not giving props for the two times a day that the broken clock is right. just because itchy is not literally posting private info does not mean he does not feed into this exact mentality. have some fucking standards, people.",right giving props two times day broken clock right itchy literally posting private info mean feed exact mentality fucking standards people,right give prop two time day broken clock right itchy literally post private info mean feed exact mentality fucking standard people,[],{},{},0,29,[],,['𝘀𝗵𝗶𝗽 𝗼𝗳 𝗵𝗲𝗮𝘁𝗵𝗲𝘂𝘀'],-0.738
129,2021-03-23,Tue Mar 23 17:38:15 +0000 2021,1374415206374203402,ushouldknow13,"New Mexico, USA",Not Geo-tagged,b'Why can the public look up my private info like home value or taxes.  But I can\xe2\x80\x99t see if they received a stimulus check. Shouldn\xe2\x80\x99t it be public info????? Tax dollars....',Why can the public look up my private info like home value or taxes. But I cant see if they received a stimulus check. Shouldnt it be public info????? Tax dollars....,Why can the public look up my private info like home value or taxes. But I can t see if they received a stimulus check. Shouldn t it be public info?? Tax dollars..,why public look private info like home value taxes but see received stimulus check shouldn public info tax dollars,why public look private info like home value taxis but see receive stimulus check shouldn public info tax dollar,[],{},{},0,0,[],,[],0.4234
123,2021-03-23,Tue Mar 23 17:48:22 +0000 2021,1374417751956058112,SantaClaraPD,601 El Camino Real,Not Geo-tagged,"b""@w3ing 2/2 Per Ordinance No. 1996, a private citizen may bring a civil action to enforce the provisions of the ordinance. Details at https://t.co/YrrDpSj8gC\n\nFor additional info, contact the City's Community Development Department 408-615-2460""","$MENTION$ $NUMBER$/2 Per Ordinance No. $NUMBER$, a private citizen may bring a civil action to enforce the provisions of the ordinance. Details at $URL$ For additional info, contact the City's Community Development Department $NUMBER$-615-2460","/2 Per Ordinance No. , a private citizen may bring a civil action to enforce the provisions of the ordinance. Details at For additional info, contact the City's Community Development Department -615-2460",per ordinance no private citizen may bring civil action enforce provisions ordinance details for additional info contact city community development department,per ordinance no private citizen may bring civil action enforce provision ordinance detail for additional info contact city community development department,[],{},{},0,0,[],http://bit.ly/39bOhJg,['Sam Battat'],0.0
120,2021-03-23,Tue Mar 23 17:55:28 +0000 2021,1374419540382126087,wackyrachel99,not israel :(,Not Geo-tagged,b'PSA: PLEASE do not post pics of  your vaccine card without blurring out the info! it is protected health information and posting it online means that your HIPAA protection is voided! people can steal your private health info just from the card!',PSA: PLEASE do not post pics of your vaccine card without blurring out the info! it is protected health information and posting it online means that your HIPAA protection is voided! people can steal your private health info just from the card!,PSA PLEASE do not post pics of your vaccine card without blurring out the info! it is protected health information and posting it online means that your HIPAA protection is voided! people can steal your private health info just from the card!,psa please post pics vaccine card without blurring info protected health information posting online means hipaa protection voided people steal private health info card,psa please post pics vaccine card without blur info protect health information post online mean hipaa protection void people steal private health info card,[],{},{},0,6,[],,[],0.5587
