s_no,date,created_at,id_str,screen_name,user_location,geo-tagged_place,tweet_text,tweet_tokenized,tweet_cleaned,tweet_filtered,tweet_lemmatized,tweet_mentioned_organizations,tweet_tags_classified,tweet_orgs_classified,retweet_count,fav_count,hashtags,urls,mentions,vader_polarity
215,2021-03-05,Fri Mar 05 14:07:03 +0000 2021,1367839074850050048,VodafoneIreland,Ireland,Not Geo-tagged,"b""@johnmsweeney Hi, \n\nThanks for reaching us here, if you private message the below info, I'll do my best to assist: \n\n- Full Name \n- Account number\n- Security PIN (or, if you don't have this, your address and date of birth) \n\nThanks,\nYugien""","$MENTION$ Hi, Thanks for reaching us here, if you private message the below info, I'll do my best to assist: - Full Name - Account number - Security PIN (or, if you don't have this, your address and date of birth) Thanks, Yugien","Hi, Thanks for reaching us here, if you private message the below info, I'll do my best to assist - Full Name - Account number - Security PIN (or, if you do not have this, your address and date of birth) Thanks, Yugien",hi thanks reaching private message info best assist full name account number security pin address date birth thanks yugien,hi thank reach private message info good assist full name account number security pin address date birth thank yugien,[],{},{},0,1,[],,['John M Sweeney'],0.926
216,2021-03-05,Fri Mar 05 14:06:34 +0000 2021,1367838955580850180,booksneggs,"Austin, TX",Not Geo-tagged,"b""@QueerandME Could you create a new email address just for the shop and allow helper person to access that? I guess they'd still see private info. \xf0\x9f\x98\xac Non-admin login access is a great idea.""",$MENTION$ Could you create a new email address just for the shop and allow helper person to access that? I guess they'd still see private info. $EMOJI$ Non-admin login access is a great idea.,Could you create a new email address just for the shop and allow helper person to access that? I guess they'd still see private info. Non-admin login access is a great idea.,could create new email address shop allow helper person access guess still see private info non admin login access great idea,could create new email address shop allow helper person access guess still see private info non admin login access great idea,[],{},{},0,0,[],,['the garter girl 🍒🌈♿'],0.8591
224,2021-03-05,Fri Mar 05 13:50:02 +0000 2021,1367834794915151878,PublicSourcePA,"Pittsburgh, PA",Not Geo-tagged,b'PA to administer one-dose vaccine to public and private school employees: https://t.co/4YEJOBgdfD',PA to administer one-dose vaccine to public and private school employees: $URL$,PA to administer one-dose vaccine to public and private school employees,pa administer one dose vaccine public private school employees,pa administer one dose vaccine public private school employee,[],{},{},0,0,[],https://www.publicsource.org/important-info-on-coronavirus-preparation-in-allegheny-county/,[],0.0
230,2021-03-05,Fri Mar 05 13:32:57 +0000 2021,1367830492163305474,ReallyWittyy,,Not Geo-tagged,b'@SonaDrawzStuff Here [This text has been censored for private info leaks]. Now you can buy alot of bobuc',$MENTION$ Here [This text has been censored for private info leaks]. Now you can buy alot of bobuc,Here [This text has been censored for private info leaks]. Now you can buy alot of bobuc,here this text censored private info leaks now buy alot bobuc,here this text censor private info leak now buy alot bobuc,[],{},{},0,2,[],,['SonaPoopzStuff'],-0.1531
232,2021-03-05,Fri Mar 05 13:19:47 +0000 2021,1367827181083181063,Specsavers,UK,Not Geo-tagged,"b""@LaurenRobb10 We'd like to look into this further, Lauren. Could you send us a private message with some more info, please? https://t.co/VCGsXNjRfW""","$MENTION$ We'd like to look into this further, Lauren. Could you send us a private message with some more info, please? $URL$","We'd like to look into this further, Lauren. Could you send us a private message with some more info, please?",we like look lauren could send private message info please,like look lauren could send private message info please,[],{},{},0,0,[],https://twitter.com/messages/compose?recipient_id=151871119,['Lauren'],0.6222
218,2021-03-05,Fri Mar 05 14:05:31 +0000 2021,1367838691608190979,OzaneWolf,"Manchester, England",Not Geo-tagged,"b""Thinking about how my mother called me saying that my school called her saying I'm sharing private info and asking for private info, but it was actually a message to everyone saying to be careful when downloading apps and sharing private information such as birthdates""","Thinking about how my mother called me saying that my school called her saying I'm sharing private info and asking for private info, but it was actually a message to everyone saying to be careful when downloading apps and sharing private information such as birthdates","Thinking about how my mother called me saying that my school called her saying I'm sharing private info and asking for private info, but it was actually a message to everyone saying to be careful when downloading apps and sharing private information such as birthdates",thinking mother called saying school called saying sharing private info asking private info actually message everyone saying careful downloading apps sharing private information birthdates,think mother call say school call say share private info ask private info actually message everyone say careful downloading app share private information birthdate,[],{},{},1,2,[],,[],0.7579
19,2021-03-05,Fri Mar 05 22:44:03 +0000 2021,1367969183527542786,MarkLevineNYC,The Island of Manhattan,Not Geo-tagged,b'@Mssarahmssarah NYC is not yet reporting on the b.1.526 variant. All the info we have is from private labs. City will likely release info on this next week.\n\nBut it is virtually certain that the variant(s) are a big reason there continues to be so many cases in NYC.',$MENTION$ NYC is not yet reporting on the b.1.526 variant. All the info we have is from private labs. City will likely release info on this next week. But it is virtually certain that the variant(s) are a big reason there continues to be so many cases in NYC.,NYC is not yet reporting on the b.1.526 variant. All the info we have is from private labs. City will likely release info on this next week. But it is virtually certain that the variant(s) are a big reason there continues to be so many cases in NYC.,nyc yet reporting variant all info private labs city likely release info next week but virtually certain variant big reason continues many cases nyc,nyc yet report variant all info private lab city likely release info next week but virtually certain variant big reason continue many case nyc,[],{},{},3,24,[],,['Sarah Allen'],0.3919
214,2021-03-05,Fri Mar 05 14:09:08 +0000 2021,1367839598467047428,GrahamKael,Conwy,Not Geo-tagged,b'@BBCPanorama A Levels GCSE info: Independent school planning on using mostly homework and class work as evidence of grades. State schools are mostly planning on tests/mocks. The latter allows fair grade distributions. Private schools are cheating despite teaching during lockdown.',$MENTION$ A Levels GCSE info: Independent school planning on using mostly homework and class work as evidence of grades. State schools are mostly planning on tests/mocks. The latter allows fair grade distributions. Private schools are cheating despite teaching during lockdown.,A Levels GCSE info Independent school planning on using mostly homework and class work as evidence of grades. State schools are mostly planning on tests/mocks. The latter allows fair grade distributions. Private schools are cheating despite teaching during lockdown., levels gcse info independent school planning using mostly homework class work evidence grades state schools mostly planning tests mocks the latter allows fair grade distributions private schools cheating despite teaching lockdown,  level gcse info independent school planning use mostly homework class work evidence grade state school mostly plan test mock the latter allow fair grade distribution private school cheat despite teaching lockdown,[],{},{},0,0,[],,['Panorama 🌐'],-0.3182
213,2021-03-05,Fri Mar 05 14:12:51 +0000 2021,1367840534526496768,mydarIingkoo,"すべて for you, 答えなんて, なくていい全ては, 君の笑顔の中にある ➶ SHE!HER ; read carrd !",Not Geo-tagged,"b'armys why believe and give attention to every damn tweet \xf0\x9f\x98\x84 like pls stop believing everything you see in here not unless posted by true fanbase accounts or if mentioned by verified 875 accounts \xf0\x9f\x98\x84 and besides why are you guys even looking for that info, it could be private'","armys why believe and give attention to every damn tweet $EMOJI$ like pls stop believing everything you see in here not unless posted by true fanbase accounts or if mentioned by verified $NUMBER$ accounts $EMOJI$ and besides why are you guys even looking for that info, it could be private","armys why believe and give attention to every damn tweet like pls stop believing everything you see in here not unless posted by true fanbase accounts or if mentioned by verified accounts and besides why are you guys even looking for that info, it could be private",armys believe give attention every damn tweet like pls stop believing everything see unless posted true fanbase accounts mentioned verified accounts besides guys even looking info could private,armys believe give attention every damn tweet like pls stop believe everything see unless post true fanbase account mention verified account besides guy even look info could private,[],{},{},0,0,[],,[],0.1779
198,2021-03-05,Fri Mar 05 14:50:36 +0000 2021,1367850036592316420,CrowKing21,The Nest,Not Geo-tagged,"b'@wcast08 @chamath Yea he could have sold spce for a million reasons, just pure profit before dip, to back fill a pipe he just did, or for a future pipe, or maybe to buy a private plane lol who knows, it\xe2\x80\x99s useful info if ur a spce holder, but about it otherwise.'","$MENTION$ $MENTION$ Yea he could have sold spce for a million reasons, just pure profit before dip, to back fill a pipe he just did, or for a future pipe, or maybe to buy a private plane lol who knows, its useful info if ur a spce holder, but about it otherwise.","Yea he could have sold spce for a million reasons, just pure profit before dip, to back fill a pipe he just did, or for a future pipe, or maybe to buy a private plane lol who knows, it s useful info if ur a spce holder, but about it otherwise.",yea could sold spce million reasons pure profit dip back fill pipe future pipe maybe buy private plane lol knows useful info ur spce holder otherwise,yea could sell spce million reason pure profit dip back fill pipe future pipe maybe buy private plane lol know useful info ur spce holder otherwise,[],{},{},0,1,[],,"['Will', 'Chamath Palihapitiya']",0.5859
227,2021-03-05,Fri Mar 05 13:48:33 +0000 2021,1367834418547720201,mapofhoseok,19 | she/her ^♡^,Not Geo-tagged,"b'normalise not spreading info about what bts do in their private life etc. especially when you don\xe2\x80\x99t know where that info has come from because 9 times out of 10 it\xe2\x80\x99s some illegal, invasive method. this is just a general thought don\xe2\x80\x99t ask me what\xe2\x80\x99s happened lmao'","normalise not spreading info about what bts do in their private life etc. especially when you dont know where that info has come from because $NUMBER$ times out of $NUMBER$ its some illegal, invasive method. this is just a general thought dont ask me whats happened lmao","normalise not spreading info about what bts do in their private life etc. especially when you don t know where that info has come from because times out of it s some illegal, invasive method. this is just a general thought don t ask me what s happened lmao",normalise spreading info bts private life etc especially know info come times illegal invasive method general thought ask happened lmao,normalise spread info bts private life etc especially know info come time illegal invasive method general thought ask happen lmao,[],{},{},51,206,[],,[],0.0772
225,2021-03-05,Fri Mar 05 13:49:31 +0000 2021,1367834663839010822,TrainingTom,"Dublin City, Ireland",Not Geo-tagged,"b'Some nice info with regards to some of our Data Protection / Privacy services on offer here at BSI, dont forget we also offer a number of privacy related training services\nhttps://t.co/umyQEnxfB2\n\n#gdpr #dataprotectionact #iapp #cippe #cipt #cipm #privacy\xe2\x80\xa6https://t.co/8vNc6VxCNq'","Some nice info with regards to some of our Data Protection / Privacy services on offer here at BSI, dont forget we also offer a number of privacy related training services $URL$ $HASHTAG$ $HASHTAG$ $HASHTAG$ $HASHTAG$ $HASHTAG$ $HASHTAG$ $HASHTAG$://$URL$","Some nice info with regards to some of our Data Protection / Privacy services on offer here at BSI, dont forget we also offer a number of privacy related training services",some nice info regards data protection privacy services offer bsi dont forget also offer number privacy related training services,some nice info regard datum protection privacy service offer bsi do not forget also offer number privacy related training service,[],{},{},0,1,"['gdpr', 'dataprotectionact', 'iapp', 'cippe', 'cipt', 'cipm', 'privacy']","https://lnkd.in/epKc6MG, https://lnkd.in/edfVK-t",[],0.5812
235,2021-03-05,Fri Mar 05 13:11:14 +0000 2021,1367825029606506497,AirReefJet,"Punta Cana , Dom.Rep",Not Geo-tagged,b'Is the weekend and the #islandhopper and #caribbeanhopper knows it! \xe2\x9c\x88\xef\xb8\x8f\xf0\x9f\x8e\x89\n.\n.\nFor more info of our private flights LINK IN BIO \xf0\x9f\x93\xb1\xe2\x9c\x88\xef\xb8\x8f @ Aeropuerto Internacional Las Am\xc3\xa9ricas https://t.co/tNlLujUj32',Is the weekend and the $HASHTAG$ and $HASHTAG$ knows it! $EMOJI$$EMOJI$ . . For more info of our private flights LINK IN BIO $EMOJI$$EMOJI$ $MENTION$ Aeropuerto Internacional Las Amricas $URL$,Is the weekend and the and knows it! . . For more info of our private flights LINK IN BIO Aeropuerto Internacional Las Am ricas,is weekend knows for info private flights link in bio aeropuerto internacional las am ricas,be weekend know for info private flight link in bio aeropuerto internacional las be ricas,[],{},{},0,0,"['islandhopper', 'caribbeanhopper']",https://www.instagram.com/p/CMCcqqJL8MV/?igshid=owxcpa5llhwq,[],0.0
242,2021-03-05,Fri Mar 05 12:47:30 +0000 2021,1367819056686923776,Mega22368504,"Ponorogo, Jawa Timur","Amaris Hotel Ponorogo, ID",b'#Availponorogo\nNewbie . Menerima st/lt/Private\ninclude &amp; exclude room \ninfo booking - https://t.co/BbhLLQud8m\n.\n.\n#Openboponorogo\n#ponorogo\n#Wpponorogo\n#Recomended4BO\n#TRUSTEDBISYAR\n#boponorogo\nhttps://t.co/Qmu1lAjUlq https://t.co/QSfFOZmv6Q',$HASHTAG$ Newbie . Menerima st/lt/Private include &amp; exclude room info booking - $URL$ . . $HASHTAG$ $HASHTAG$ $HASHTAG$ $HASHTAG$ $HASHTAG$ $HASHTAG$ $URL$ $URL$,Newbie . Menerima st/lt/Private include &amp; exclude room info booking - . .,newbie menerima lt private include exclude room info booking,newbie menerima lt private include exclude room info booking,[],{},{},0,2,"['Availponorogo', 'Openboponorogo', 'ponorogo', 'Wpponorogo', 'Recomended4BO', 'TRUSTEDBISYAR', 'boponorogo']","http://wa.me/6288242106290, https://www.google.com/travel/hotels/s/psghe",[],-0.2263
229,2021-03-05,Fri Mar 05 13:35:24 +0000 2021,1367831111565336576,7puzzle_pieces,btspopper,Not Geo-tagged,"b""if y'all are screaming abt taekook that some anon acc told something and spread private info just like that jikook thing .. I'm ready to throw my hands""",if y'all are screaming abt taekook that some anon acc told something and spread private info just like that jikook thing .. I'm ready to throw my hands,if y'all are screaming abt taekook that some anon acc told something and spread private info just like that jikook thing .. I'm ready to throw my hands,screaming abt taekook anon acc told something spread private info like jikook thing ready throw hands,scream abt taekook anon acc tell something spread private info like jikook thing ready throw hand,[],{},{},0,2,[],,[],0.34
253,2021-03-05,Fri Mar 05 12:08:56 +0000 2021,1367809350870384644,soobbinnie1,,Not Geo-tagged,b'@aatma313 @BeomgyuTheBear Posting private info without consent..this can lead to serious consequences',$MENTION$ $MENTION$ Posting private info without consent..this can lead to serious consequences,Posting private info without consent..this can lead to serious consequences,posting private info without consent lead serious consequences,post private info without consent lead serious consequence,[],{},{},0,0,[],,"['Bamtori', 'Nicky ⁷ ✜ AU 📌🧸🍊']",-0.0772
233,2021-03-05,Fri Mar 05 13:19:30 +0000 2021,1367827110212087816,ken_nicoletti,,Not Geo-tagged,"b'@neasa_neasa Is it true this private entity that will handle our National assets, will be  beyond  ""freedom of info"" ?  Thanks.'","$MENTION$ Is it true this private entity that will handle our National assets, will be beyond ""freedom of info"" ? Thanks.","Is it true this private entity that will handle our National assets, will be beyond ""freedom of info"" ? Thanks.",is true private entity handle national assets beyond freedom info thanks,be true private entity handle national asset beyond freedom info thank,[],{},{},0,0,[],,['Neasa Hourigan TD'],0.891
239,2021-03-05,Fri Mar 05 12:55:14 +0000 2021,1367821002659487747,SmartMoneyM,Usa,Not Geo-tagged,b'Stamp duty holiday extension: How likely are you to complete before June? - https://t.co/SIciLkj6gM #Wealth #Transaction #Asset #Privacy #Options #Forex #Inflation #Information #Management #Qrcode https://t.co/L0QcMkGg9G',Stamp duty holiday extension: How likely are you to complete before June? - $URL$ $HASHTAG$ $HASHTAG$ $HASHTAG$ $HASHTAG$ $HASHTAG$ $HASHTAG$ $HASHTAG$ $HASHTAG$ $HASHTAG$ $HASHTAG$ $URL$,Stamp duty holiday extension How likely are you to complete before June? -,stamp duty holiday extension how likely complete june,stamp duty holiday extension how likely complete june,[],{},{},0,0,"['Wealth', 'Transaction', 'Asset', 'Privacy', 'Options', 'Forex', 'Inflation', 'Information', 'Management', 'Qrcode']",https://www.smartmoneymanagement.info/2021/03/stamp-duty-holiday-extension-how-likely.html,[],0.4019
228,2021-03-05,Fri Mar 05 13:38:19 +0000 2021,1367831846122262531,jesusinadayspa,she/they,Not Geo-tagged,"b""it's disgusting how parents think having full control of their childs phone, checking texts or dms, going through their photos or other private info etc is completely normal. it isn't and it should be highly normalized to give your kids actual privacy""","it's disgusting how parents think having full control of their childs phone, checking texts or dms, going through their photos or other private info etc is completely normal. it isn't and it should be highly normalized to give your kids actual privacy","it's disgusting how parents think having full control of their childs phone, checking texts or dms, going through their photos or other private info etc is completely normal. it is not and it should be highly normalized to give your kids actual privacy",disgusting parents think full control childs phone checking texts dms going photos private info etc completely normal highly normalized give kids actual privacy,disgusting parent think full control child phone check text dms go photo private info etc completely normal highly normalized give kid actual privacy,[],{},{},46,145,[],,[],-0.5267
238,2021-03-05,Fri Mar 05 12:55:39 +0000 2021,1367821108880281602,KevinLo65913574,"Seaton. Devon, England",Not Geo-tagged,b'@Grwguk @brexitblog_info You can add to that 20.6% employer contribution to their pension fund. No one in the private sector gets anything like that.',$MENTION$ $MENTION$ You can add to that $NUMBER$% employer contribution to their pension fund. No one in the private sector gets anything like that.,You can add to that % employer contribution to their pension fund. No one in the private sector gets anything like that.,you add employer contribution pension fund no one private sector gets anything like,add employer contribution pension fund no one private sector get anything like,[],{},{},0,5,[],,"['Winston’s Trowel', 'Voice of Reason']",0.0772
231,2021-03-05,Fri Mar 05 13:30:01 +0000 2021,1367829753768538115,givingmore4all,South Africa,Not Geo-tagged,"b'Make it Magical\n\nAt Make it Magical in Cape Town, we help you transport your little ones back to a time before technology existed, just for a little while\xe2\x80\xa6Through our Fairy House Building workshops and private birthday parties.\n\nFor more info visit https://t.co/QGd1yG83eC https://t.co/DIcYq2zfov'","Make it Magical At Make it Magical in Cape Town, we help you transport your little ones back to a time before technology existed, just for a little whileThrough our Fairy House Building workshops and private birthday parties. For more info visit $URL$ $URL$","Make it Magical At Make it Magical in Cape Town, we help you transport your little ones back to a time before technology existed, just for a little while Through our Fairy House Building workshops and private birthday parties. For more info visit",make magical at make magical cape town help transport little ones back time technology existed little through fairy house building workshops private birthday parties for info visit,make magical at make magical cape town help transport little one back time technology exist little through fairy house building workshop private birthday party for info visit,[],{},{},0,1,[],http://www.makeitmagical.co.za,[],0.6597
263,2021-03-05,Fri Mar 05 11:05:49 +0000 2021,1367793467867402242,cIoudstiles,void,Not Geo-tagged,b'@peepeep40013329 @C0RPSEFreak @itaintaaron ur weird stop leaking private info',$MENTION$ $MENTION$ $MENTION$ ur weird stop leaking private info,ur weird stop leaking private info,weird stop leaking private info,weird stop leak private info,[],{},{},0,2,[],,"['peepeepoopooooo', 'May🕸🖤', 'aaron liebregts']",-0.4404
245,2021-03-05,Fri Mar 05 12:37:31 +0000 2021,1367816541891354631,GooglePayIndia,India,Not Geo-tagged,"b""@PreshitAgarwal Sorry to hear that. Without revealing any private info, could you let us know when was the transaction made? We'll do our best to help.""","$MENTION$ Sorry to hear that. Without revealing any private info, could you let us know when was the transaction made? We'll do our best to help.","Sorry to hear that. Without revealing any private info, could you let us know when was the transaction made? We'll do our best to help.",sorry hear without revealing private info could let know transaction made we best help,sorry hear without reveal private info could let know transaction make good help,[],{},{},0,0,[],,['The _devastator'],0.765
234,2021-03-05,Fri Mar 05 13:15:34 +0000 2021,1367826118577971200,CuraFS,"Filey, North Yorkshire",Not Geo-tagged,"b'""Mark was incredibly helpful &amp; found us both insurance when we were struggling to get cover elsewhere. Mark made my wife feel at ease in discussing private &amp; confidential matters.""\n\nFor advice &amp; info on your #ProtectionInsurance needs visit:\nhttps://t.co/uxyGxevL0x\n\n#ClientReview https://t.co/2A0LV4UOvU'","""Mark was incredibly helpful &amp; found us both insurance when we were struggling to get cover elsewhere. Mark made my wife feel at ease in discussing private &amp; confidential matters."" For advice &amp; info on your $HASHTAG$ needs visit: $URL$ $HASHTAG$ $URL$","""Mark was incredibly helpful &amp; found us both insurance when we were struggling to get cover elsewhere. Mark made my wife feel at ease in discussing private &amp; confidential matters."" For advice &amp; info on your needs visit",mark incredibly helpful found insurance struggling get cover elsewhere mark made wife feel ease discussing private confidential matters for advice info needs visit,mark incredibly helpful find insurance struggle get cover elsewhere mark make wife feel ease discuss private confidential matter for advice info need visit,[],{},{},1,5,"['ProtectionInsurance', 'ClientReview']",https://www.specialrisksbureau.co.uk/,[],0.4391
236,2021-03-05,Fri Mar 05 13:11:14 +0000 2021,1367825028805505025,htomborr,"Brooklyn, NY","Brooklyn, NY, US",b'@nitehawkcinema I imagine you\xe2\x80\x99re swamped getting ready for today in #brooklyn but sent a request for more info about private event and would love to hear back. Stay safe!',$MENTION$ I imagine youre swamped getting ready for today in $HASHTAG$ but sent a request for more info about private event and would love to hear back. Stay safe!,I imagine you re swamped getting ready for today in but sent a request for more info about private event and would love to hear back. Stay safe!,imagine swamped getting ready today sent request info private event would love hear back stay safe,imagine swamp get ready today send request info private event would love hear back stay safe,[],{},{},0,0,['brooklyn'],,['Nitehawk Cinema'],0.9134
219,2021-03-05,Fri Mar 05 14:03:13 +0000 2021,1367838110533509122,ZuluTwoOneAlpha,,Not Geo-tagged,b'@BobInDeepXRP @JohnEDeaton1 Yeh just send all your private info and the fact that you hold Crypto.... no thanks \xf0\x9f\x98\x82',$MENTION$ $MENTION$ Yeh just send all your private info and the fact that you hold Crypto.... no thanks $EMOJI$,Yeh just send all your private info and the fact that you hold Crypto.. no thanks,yeh send private info fact hold crypto thanks,yeh send private info fact hold crypto thank,[],{},{},0,1,[],,"[""Where's Bob?"", 'John E Deaton']",-0.3412
