s_no,date,created_at,id_str,screen_name,user_location,geo-tagged_place,tweet_text,tweet_tokenized,tweet_cleaned,tweet_filtered,tweet_lemmatized,tweet_mentioned_organizations,tweet_tags_classified,tweet_orgs_classified,retweet_count,fav_count,hashtags,urls,mentions,vader_polarity
5,2021-02-07,Sun Feb 07 23:44:46 +0000 2021,1358562380070981632,Ta5adaq,,Not Geo-tagged,b'@MoSalah Private UK car registration plate for sale : Y4LHA. Contact for further info :- 07365623074',$MENTION$ Private UK car registration plate for sale : Y4LHA. Contact for further info :- $NUMBER$,Private UK car registration plate for sale Y4LHA. Contact for further info -,private uk car registration plate sale lha contact info,private uk car registration plate sale lha contact info,[],{},{},0,0,[],,['Mohamed Salah'],0.0
2,2021-02-07,Sun Feb 07 23:50:47 +0000 2021,1358563892440387584,MitaMALANGBO,"Malang, Jawa Timur",Not Geo-tagged,b'OPEN MORNING SEX \xe2\x9d\xa4\xe2\x9d\xa4\nST / LT / PRIVATE READY\xf0\x9f\x92\xa2\nINFO WA/DM\xf0\x9f\xa5\xb0\nWA\xe2\x9e\xa1\xef\xb8\x8fhttps://t.co/K8Dar4NRsZ\n\n#availmalang #availmalangcod #openbomalang #ready4BO #Recomended4BO #malangopenBO #malangcod #malangbirahi #malangincluderoom #Bispakmalang #wpmalang #wisatalendir #KulinerLendir https://t.co/GoNOxORN4q',OPEN MORNING SEX $EMOJI$$EMOJI$ ST / LT / PRIVATE READY$EMOJI$ INFO WA/DM WA$EMOJI$$URL$ $HASHTAG$ $HASHTAG$ $HASHTAG$ $HASHTAG$ $HASHTAG$ $HASHTAG$ $HASHTAG$ $HASHTAG$ $HASHTAG$ $HASHTAG$ $HASHTAG$ $HASHTAG$ $HASHTAG$ $URL$,OPEN MORNING SEX ST / LT / PRIVATE READY INFO WA/DM WA,open morning sex st lt private ready info wa dm wa,open morning sex st lt private ready info wa dm wa,[],{},{},0,1,"['availmalang', 'availmalangcod', 'openbomalang', 'ready4BO', 'Recomended4BO', 'malangopenBO', 'malangcod', 'malangbirahi', 'malangincluderoom', 'Bispakmalang', 'wpmalang', 'wisatalendir', 'KulinerLendir']",https://wa.me/message/QSOZIQPZ5HBPC1,[],0.4995
11,2021-02-07,Sun Feb 07 23:09:52 +0000 2021,1358553593498976256,diamond57933850,Moon,Not Geo-tagged,b'@AmandaCerny That\xe2\x80\x99s a lot of info for a Sunday evening \xf0\x9f\x98\x90 sex life should stay private.',$MENTION$ Thats a lot of info for a Sunday evening $EMOJI$ sex life should stay private.,That s a lot of info for a Sunday evening sex life should stay private.,that lot info sunday evening sex life stay private,that lot info sunday evening sex life stay private,[],{},{},0,0,[],,['Amanda Cerny'],0.0
13,2021-02-07,Sun Feb 07 23:06:37 +0000 2021,1358552776213745664,Ta5adaq,,Not Geo-tagged,b'@MoSalah Private UK car registration plate for sale : Y4LHA. Contact for further info :- 07365623074',$MENTION$ Private UK car registration plate for sale : Y4LHA. Contact for further info :- $NUMBER$,Private UK car registration plate for sale Y4LHA. Contact for further info -,private uk car registration plate sale lha contact info,private uk car registration plate sale lha contact info,[],{},{},0,0,[],,['Mohamed Salah'],0.0
1,2021-02-07,Sun Feb 07 23:59:58 +0000 2021,1358566204424605698,pizzahut,United States,Not Geo-tagged,"b""@MaxaMMason We're sorry we let you down. Mind sending us a private message with your contact info and store address so that we can look into this further? https://t.co/PQtSXiQxeo""",$MENTION$ We're sorry we let you down. Mind sending us a private message with your contact info and store address so that we can look into this further? $URL$,We're sorry we let you down. Mind sending us a private message with your contact info and store address so that we can look into this further?,we sorry let mind sending private message contact info store address look,sorry let mind send private message contact info store address look,[],{},{},0,1,[],https://twitter.com/messages/compose?recipient_id=11018442,['MaxaM'],-0.0772
42,2021-02-07,Sun Feb 07 21:18:32 +0000 2021,1358525575405596672,botemiya,,Not Geo-tagged,"b""A confidential message from Chaldea...? I didn't know they had my private contact info.""",A confidential message from Chaldea...? I didn't know they had my private contact info.,A confidential message from Chaldea..? I did not know they had my private contact info., confidential message chaldea know private contact info,  confidential message chaldea know private contact info,[],{},{},0,0,[],,[],0.0
3,2021-02-07,Sun Feb 07 23:49:53 +0000 2021,1358563664140197888,pizzahut,United States,Not Geo-tagged,"b""@guffstr Hi there, that's definitely not the experience we want for you. Would you mind sending us a private message with your contact info and the store's address so we can look into this? https://t.co/PQtSXiQxeo""","$MENTION$ Hi there, that's definitely not the experience we want for you. Would you mind sending us a private message with your contact info and the store's address so we can look into this? $URL$","Hi there, that's definitely not the experience we want for you. Would you mind sending us a private message with your contact info and the store's address so we can look into this?",hi definitely experience want would mind sending private message contact info store address look,hi definitely experience want would mind send private message contact info store address look,[],{},{},0,0,[],https://twitter.com/messages/compose?recipient_id=11018442,['Proud American'],0.4588
27,2021-02-07,Sun Feb 07 22:21:01 +0000 2021,1358541302724370432,alta_ricky,,Not Geo-tagged,b'@COLDCARDwallet it would be amazing if we could manually input our cherished private info onto the mini calculator such as:\n1. Passwords\n2. Google Authenticator keys\n3. and so on...\n\n\xf0\x9f\x91\x80',$MENTION$ it would be amazing if we could manually input our cherished private info onto the mini calculator such as: $NUMBER$. Passwords $NUMBER$. Google Authenticator keys $NUMBER$. and so on... $EMOJI$,it would be amazing if we could manually input our cherished private info onto the mini calculator such as . Passwords . Google Authenticator keys . and so on..,would amazing could manually input cherished private info onto mini calculator passwords google authenticator keys,would amazing could manually input cherish private info onto mini calculator passwords google authenticator key,[],{},{},0,0,[],,['COLDCARD™'],0.7964
25,2021-02-07,Sun Feb 07 22:28:50 +0000 2021,1358543268963880972,FinanceRedpill,,Not Geo-tagged,b'@MikeCustomPC @RaphanusR @TraceEvader What about private nodes that don\xe2\x80\x99t display any info on the ledger?',$MENTION$ $MENTION$ $MENTION$ What about private nodes that dont display any info on the ledger?,What about private nodes that don t display any info on the ledger?,what private nodes display info ledger,what private node display info ledger,[],{},{},0,0,[],,"['Mike Leonard', 'Raphanus Raphanistrum', 'TraceEvader']",0.0
6,2021-02-07,Sun Feb 07 23:44:21 +0000 2021,1358562274923991040,g4yvelvet,they/he,Not Geo-tagged,b'can someone help me spam report my old acc it has some private info about me plus my dead name https://t.co/Ddx4zISyR6',can someone help me spam report my old acc it has some private info about me plus my dead name $URL$,can someone help me spam report my old acc it has some private info about me plus my dead name,someone help spam report old acc private info plus dead name,someone help spam report old acc private info plus dead name,[],{},{},0,0,[],,[],-0.6249
15,2021-02-07,Sun Feb 07 23:02:53 +0000 2021,1358551837171994628,Mike_DCollege,,Not Geo-tagged,b'I believe that it is the responsibility of both the social media platform and the user to resolve this. Limiting the information needed and securing privacy/personal info of the user is very important aspect from the platforms side. #GNED1411 5.3',I believe that it is the responsibility of both the social media platform and the user to resolve this. Limiting the information needed and securing privacy/personal info of the user is very important aspect from the platforms side. $HASHTAG$ $NUMBER$,I believe that it is the responsibility of both the social media platform and the user to resolve this. Limiting the information needed and securing privacy/personal info of the user is very important aspect from the platforms side.,believe responsibility social media platform user resolve limiting information needed securing privacy personal info user important aspect platforms side,believe responsibility social medium platform user resolve limit information need secure privacy personal info user important aspect platform side,[],{},{},0,0,['GNED1411'],,[],0.7178
34,2021-02-07,Sun Feb 07 21:54:34 +0000 2021,1358534646410141696,maylux5,nyc,Not Geo-tagged,"b'anyways if you ever actively sought out private info about an idol, just know that idol hates you \xe2\x9d\xa4\xef\xb8\x8f'","anyways if you ever actively sought out private info about an idol, just know that idol hates you $EMOJI$","anyways if you ever actively sought out private info about an idol, just know that idol hates you",anyways ever actively sought private info idol know idol hates,anyways ever actively seek private info idol know idol hate,[],{},{},0,3,[],,[],-0.1531
20,2021-02-07,Sun Feb 07 22:52:14 +0000 2021,1358549158467149828,wolfgangACNH,"Kanto Island, North Hemisphere",Not Geo-tagged,"b'@honeyfika_isle I hate paypal they always screw something up or leak my private info somehow, I stopped using it a long time ago'","$MENTION$ I hate paypal they always screw something up or leak my private info somehow, I stopped using it a long time ago","I hate paypal they always screw something up or leak my private info somehow, I stopped using it a long time ago",hate paypal always screw something leak private info somehow stopped using long time ago,hate paypal always screw something leak private info somehow stop use long time ago,[],{},{},0,1,[],,['gnat 🐝\U0001fab4'],-0.8126
26,2021-02-07,Sun Feb 07 22:28:26 +0000 2021,1358543167856009219,library_deborah,"Philadelphia, PA",Not Geo-tagged,"b""As much as I love what friends of friends are doing to make vaccine info more discoverable, it's ludicrous and infuriating that the state is relying on pro bono work from private citizens for this basic governmental function.""","As much as I love what friends of friends are doing to make vaccine info more discoverable, it's ludicrous and infuriating that the state is relying on pro bono work from private citizens for this basic governmental function.","As much as I love what friends of friends are doing to make vaccine info more discoverable, it's ludicrous and infuriating that the state is relying on pro bono work from private citizens for this basic governmental function.",as much love friends friends make vaccine info discoverable ludicrous infuriating state relying pro bono work private citizens basic governmental function,as much love friend friend make vaccine info discoverable ludicrous infuriate state rely pro bono work private citizen basic governmental function,[],{},{},0,4,[],,[],0.6412
24,2021-02-07,Sun Feb 07 22:30:08 +0000 2021,1358543597977632768,Ta5adaq,,Not Geo-tagged,b'@AJEnglish Private UK car registration plate for sale : Y4LHA. Contact for further info :- 07365623074.',$MENTION$ Private UK car registration plate for sale : Y4LHA. Contact for further info :- $NUMBER$.,Private UK car registration plate for sale Y4LHA. Contact for further info - .,private uk car registration plate sale lha contact info,private uk car registration plate sale lha contact info,[],{},{},0,0,[],,['Al Jazeera English'],0.0
10,2021-02-07,Sun Feb 07 23:11:42 +0000 2021,1358554056466313228,TeamYouTube,"San Bruno, CA",Not Geo-tagged,"b""@_TexasTerror The team is still looking into your channel's suspension. We'll let you know as soon as we have an update.\n\nBy the way, we recommend deleting the first set of screenshots you shared since they contain private info (email address).""","$MENTION$ The team is still looking into your channel's suspension. We'll let you know as soon as we have an update. By the way, we recommend deleting the first set of screenshots you shared since they contain private info (email address).","The team is still looking into your channel's suspension. We'll let you know as soon as we have an update. By the way, we recommend deleting the first set of screenshots you shared since they contain private info (email address).",the team still looking channel suspension we let know soon update by way recommend deleting first set screenshots shared since contain private info email address,the team still look channel suspension let know soon update by way recommend delete first set screenshot share since contain private info email address,[],{},{},0,0,[],,['┌П┐DjPurpleI5h┌П┐'],0.5994
4,2021-02-07,Sun Feb 07 23:49:01 +0000 2021,1358563445772328960,Mary99428726,,Not Geo-tagged,"b""@TeamYouTube please investigate all of Lillee Jean's copyright claims she is making false copyright claims in order to get creators' private info. Please Help Them!""",$MENTION$ please investigate all of Lillee Jean's copyright claims she is making false copyright claims in order to get creators' private info. Please Help Them!,please investigate all of Lillee Jean's copyright claims she is making false copyright claims in order to get creators' private info. Please Help Them!,please investigate lillee jean copyright claims making false copyright claims order get creators private info please help them,please investigate lillee jean copyright claim make false copyright claim order get creator private info please help,[],{},{},0,3,[],,['TeamYouTube'],0.7644
7,2021-02-07,Sun Feb 07 23:42:16 +0000 2021,1358561749587419139,mqrgans,they/them,Not Geo-tagged,b'you mean taylor that gives out her best friend\xe2\x80\x99s private info https://t.co/R4nKsQVFCW',you mean taylor that gives out her best friends private info $URL$,you mean taylor that gives out her best friend s private info,mean taylor gives best friend private info,mean taylor give good friend private info,[],{},{},0,6,[],https://twitter.com/barchie2021/status/1358555730811437059,[],0.8126
12,2021-02-07,Sun Feb 07 23:08:49 +0000 2021,1358553331245973508,lana_ladi,,Not Geo-tagged,b'I finally understand the whole keeping yo life private thing bc the SNIPPET of info some of y\xe2\x80\x99all got yall tried to start with me\xf0\x9f\x98\x82 lemme go back to my happy boring life',I finally understand the whole keeping yo life private thing bc the SNIPPET of info some of yall got yall tried to start with me$EMOJI$ lemme go back to my happy boring life,I finally understand the whole keeping yo life private thing bc the SNIPPET of info some of y all got yall tried to start with me lemme go back to my happy boring life,finally understand whole keeping life private thing snippet info got yall tried start lem back happy boring life,finally understand whole keep life private thing snippet info get all try start lem back happy boring life,[],{},{},0,0,[],,[],0.34
31,2021-02-07,Sun Feb 07 22:04:09 +0000 2021,1358537056893370368,gtez,"Vancouver, BC, CA",Not Geo-tagged,"b'@goodkindalex @mitchellmebane @parseword @SwiftOnSecurity I can tell you that Canadian laws dictate service requirements, and that you can\xe2\x80\x99t trade private info (email counts) for public wifi access. I can\xe2\x80\x99t speak to us state laws'","$MENTION$ $MENTION$ $MENTION$ $MENTION$ I can tell you that Canadian laws dictate service requirements, and that you cant trade private info (email counts) for public wifi access. I cant speak to us state laws","I can tell you that Canadian laws dictate service requirements, and that you can t trade private info (email counts) for public wifi access. I can t speak to us state laws",tell canadian laws dictate service requirements trade private info email counts public wifi access speak us state laws,tell canadian law dictate service requirement trade private info email count public wifi access speak us state law,[],{},{},0,2,[],,"['alex', 'Just Zis Guy, You Know?', 'parseword', 'SwiftOnSecurity']",0.0
21,2021-02-07,Sun Feb 07 22:39:58 +0000 2021,1358546070410698753,pizzahut,United States,Not Geo-tagged,"b""@cm_sqldba That's definitely not the experience we want for you. Would you mind sending us a private message with your contact info and the store's address so we can look into this? https://t.co/PQtSXiQxeo""",$MENTION$ That's definitely not the experience we want for you. Would you mind sending us a private message with your contact info and the store's address so we can look into this? $URL$,That's definitely not the experience we want for you. Would you mind sending us a private message with your contact info and the store's address so we can look into this?,that definitely experience want would mind sending private message contact info store address look,that definitely experience want would mind send private message contact info store address look,[],{},{},0,0,[],https://twitter.com/messages/compose?recipient_id=11018442,['ChandraMohan Nandula'],0.4588
47,2021-02-07,Sun Feb 07 21:05:53 +0000 2021,1358522394122588160,Hboog32,United States,Not Geo-tagged,b'Private Super Bowl Watch Party In Tampa Today! DM for info https://t.co/ddvBbj4dTt',Private Super Bowl Watch Party In Tampa Today! DM for info $URL$,Private Super Bowl Watch Party In Tampa Today! DM for info,private super bowl watch party in tampa today dm info,private super bowl watch party in tampa today dm info,[],{},{},0,5,[],,[],0.784
19,2021-02-07,Sun Feb 07 22:56:29 +0000 2021,1358550227540537346,pizzahut,United States,Not Geo-tagged,"b""@SLC2BC380 Thank you for reaching out. Would you mind sending us a private message with your contact info and the store's address so we can look into this? https://t.co/PQtSXiQxeo""",$MENTION$ Thank you for reaching out. Would you mind sending us a private message with your contact info and the store's address so we can look into this? $URL$,Thank you for reaching out. Would you mind sending us a private message with your contact info and the store's address so we can look into this?,thank reaching would mind sending private message contact info store address look,thank reach would mind send private message contact info store address look,[],{},{},0,0,[],https://twitter.com/messages/compose?recipient_id=11018442,['SAMPSON'],0.5106
18,2021-02-07,Sun Feb 07 22:58:38 +0000 2021,1358550769813712897,pizzahut,United States,Not Geo-tagged,"b""@jer_johns Thank you for bringing this to our attention. Would you mind sending us a private message with your contact info and the store's address so we can look into this? https://t.co/PQtSXiQxeo""",$MENTION$ Thank you for bringing this to our attention. Would you mind sending us a private message with your contact info and the store's address so we can look into this? $URL$,Thank you for bringing this to our attention. Would you mind sending us a private message with your contact info and the store's address so we can look into this?,thank bringing attention would mind sending private message contact info store address look,thank bring attention would mind send private message contact info store address look,[],{},{},0,0,[],https://twitter.com/messages/compose?recipient_id=11018442,['Jer Johns'],0.3612
44,2021-02-07,Sun Feb 07 21:11:28 +0000 2021,1358523797721260033,Hboog32,United States,Not Geo-tagged,b'Private Super Bowl Watch Party In Tampa Today! DM for info https://t.co/rd93mm2XzW',Private Super Bowl Watch Party In Tampa Today! DM for info $URL$,Private Super Bowl Watch Party In Tampa Today! DM for info,private super bowl watch party in tampa today dm info,private super bowl watch party in tampa today dm info,[],{},{},0,0,[],,[],0.784
22,2021-02-07,Sun Feb 07 22:34:44 +0000 2021,1358544752250077187,MvGalloway,,Not Geo-tagged,b'@GovLarryHogan is there a way to get vaccination to educators better? I ask this Bc I am an assistant teacher in a private pre-k. I have filled out all necessary info and I still can\xe2\x80\x99t find a vaccination. I have been in person teaching since August. We need something.',$MENTION$ is there a way to get vaccination to educators better? I ask this Bc I am an assistant teacher in a private pre-k. I have filled out all necessary info and I still cant find a vaccination. I have been in person teaching since August. We need something.,is there a way to get vaccination to educators better? I ask this Bc I am an assistant teacher in a private pre-k. I have filled out all necessary info and I still can t find a vaccination. I have been in person teaching since August. We need something.,way get vaccination educators better ask bc assistant teacher private pre filled necessary info still find vaccination person teaching since august we need something,way get vaccination educator well ask bc assistant teacher private pre filled necessary info still find vaccination person teach since august need something,[],{},{},0,0,[],,['Governor Larry Hogan'],0.4404
56,2021-02-07,Sun Feb 07 20:28:32 +0000 2021,1358512993164816387,TweetsBeach,,Not Geo-tagged,b'@DerekPutin These auto fill info based on your private mode searches',$MENTION$ These auto fill info based on your private mode searches,These auto fill info based on your private mode searches,these auto fill info based private mode searches,these auto fill info base private mode search,[],{},{},0,13,[],,['Дерек Путин'],0.0
32,2021-02-07,Sun Feb 07 22:02:49 +0000 2021,1358536719868559363,Uber_Support,,Not Geo-tagged,"b""@lmfurst We appreciate you for letting us know. In order to protect your privacy, we don't encourage users to provide their account information through social media, please delete your post containing this info.""","$MENTION$ We appreciate you for letting us know. In order to protect your privacy, we don't encourage users to provide their account information through social media, please delete your post containing this info.","We appreciate you for letting us know. In order to protect your privacy, we do not encourage users to provide their account information through social media, please delete your post containing this info.",we appreciate letting know in order protect privacy encourage users provide account information social media please delete post containing info,appreciate let know in order protect privacy encourage user provide account information social medium please delete post contain info,[],{},{},0,0,[],,['Laura Furst'],0.5991
52,2021-02-07,Sun Feb 07 20:46:05 +0000 2021,1358517411411079169,MsCherylTalbot,"Virginia Beach, Virginia USA",Not Geo-tagged,b'A private backyard space doesn\xe2\x80\x99t have to be the stuff of dreams. Make it a reality in your own home by utilizing these clever ideas. Most of them are fairly easy to accomplish! https://t.co/hIBGI5Zkx2',A private backyard space doesnt have to be the stuff of dreams. Make it a reality in your own home by utilizing these clever ideas. Most of them are fairly easy to accomplish! $URL$,A private backyard space doesn t have to be the stuff of dreams. Make it a reality in your own home by utilizing these clever ideas. Most of them are fairly easy to accomplish!, private backyard space stuff dreams make reality home utilizing clever ideas most fairly easy accomplish,  private backyard space stuff dream make reality home utilize clever idea most fairly easy accomplish,[],{},{},0,0,[],http://insidethemarket.info/rWj69w,[],0.8932
16,2021-02-07,Sun Feb 07 22:59:50 +0000 2021,1358551071778426880,BreederDodo,On Chain,Not Geo-tagged,b'\xf0\x9f\x94\xa5Another good week at @BreederDodo HQ\n\n\xf0\x9f\xa7\xaa DODO v2 Private Beta underway (great feedback!)\n\n\xe2\x84\xb9\xef\xb8\x8f DODOnomics info out this week...\n\n\xf0\x9f\x90\xa3Hope you enjoyed our presentations at @binance Blockchain week too! We had a blast! https://t.co/MjxsAFLGyS',$EMOJI$Another good week at $MENTION$ HQ DODO v2 Private Beta underway (great feedback!) DODOnomics info out this week... $EMOJI$Hope you enjoyed our presentations at $MENTION$ Blockchain week too! We had a blast! $URL$,Another good week at HQ DODO v2 Private Beta underway (great feedback!) DODOnomics info out this week.. Hope you enjoyed our presentations at Blockchain week too! We had a blast!,another good week hq dodo private beta underway great feedback dodonomics info week hope enjoyed presentations blockchain week we blast,another good week hq dodo private beta underway great feedback dodonomic info week hope enjoy presentation blockchain week blast,[],{},{},12,70,[],,"['DODO DEX', 'Binance']",0.9334
8,2021-02-07,Sun Feb 07 23:19:08 +0000 2021,1358555928866471937,dreyfus_marion,Global,Not Geo-tagged,"b""Not letting #BankOfAmerica slip the guilt, either, 4their unconscionable+unprecedented scuppering of private info released 4data mining agencies.This nation, under FeeB78,becomes impovRished+nauseatingly lawless,#FeeB78 a 'leader' in zip but illegal theft fr/US greatness.#SickB78 https://t.co/kP8IeEzEEu""","Not letting $HASHTAG$ slip the guilt, either, $NUMBER$their unconscionable+unprecedented scuppering of private info released $NUMBER$data mining agencies.This nation, under FeeB78,becomes impovRished+nauseatingly lawless,$HASHTAG$ a 'leader' in zip but illegal theft fr/US greatness.$HASHTAG$ $URL$","Not letting slip the guilt, either, their unconscionable+unprecedented scuppering of private info released data mining agencies.This nation, under FeeB78,becomes impovRished+nauseatingly lawless, a 'leader' in zip but illegal theft fr/US greatness.",not letting slip guilt either unconscionable unprecedented scuppering private info released data mining agencies this nation feeb becomes impovrished nauseatingly lawless leader zip illegal theft us greatness,not let slip guilt either unconscionable unprecedented scuppering private info release datum mining agency this nation feeb become impovrishe nauseatingly lawless leader zip illegal theft greatness,[],{},{},0,1,"['BankOfAmerica', 'FeeB78', 'SickB78']",https://twitter.com/DuckDuckGo/status/1356977496474988546,[],-0.7543
