s_no,date,created_at,id_str,screen_name,user_location,geo-tagged_place,tweet_text,tweet_tokenized,tweet_cleaned,tweet_filtered,tweet_lemmatized,tweet_mentioned_organizations,tweet_tags_classified,tweet_orgs_classified,retweet_count,fav_count,hashtags,urls,mentions,vader_polarity
260,2021-02-07,Sun Feb 07 03:47:28 +0000 2021,1358261068737503235,MyungjunsSmile,MJ’s heart,Not Geo-tagged,"b'@MostlyMj_ Info from the set that shouldn\xe2\x80\x99t be released, that stuff would likely violate contract. Also the private picture.'","$MENTION$ Info from the set that shouldnt be released, that stuff would likely violate contract. Also the private picture.","Info from the set that shouldn t be released, that stuff would likely violate contract. Also the private picture.",info set released stuff would likely violate contract also private picture,info set release stuff would likely violate contract also private picture,[],{},{},0,0,[],,['❍ᴥ❍//𝗔𝗿𝗼𝗵𝗮ఌ'],-0.4939
250,2021-02-07,Sun Feb 07 04:34:48 +0000 2021,1358272977637306374,girl_a_fortiori,"California, USA",Not Geo-tagged,b'@Amanda19892383 @JohnSma47169088 @websleuths I was dealing with someone named Nancy who verifies insiders in private email. It makes me super uncomfortable that she has a lot of my private info &amp; a copy of my drivers license',$MENTION$ $MENTION$ $MENTION$ I was dealing with someone named Nancy who verifies insiders in private email. It makes me super uncomfortable that she has a lot of my private info &amp; a copy of my drivers license,I was dealing with someone named Nancy who verifies insiders in private email. It makes me super uncomfortable that she has a lot of my private info &amp; a copy of my drivers license,dealing someone named nancy verifies insiders private email it makes super uncomfortable lot private info copy drivers license,deal someone name nancy verifie insider private email make super uncomfortable lot private info copy driver license,[],{},{},0,2,[],,"['Amanda', 'John Smalls', 'Websleuths']",0.3182
257,2021-02-07,Sun Feb 07 03:53:56 +0000 2021,1358262695900958722,poutsjacob,아스트로 ; 더보이즈 ; 허현준,Not Geo-tagged,"b""someone said they didnt pay for the info but still you are encouraging stalking behavior showing up at private schedules all because you're obsessed over a tv show please relax........""",someone said they didnt pay for the info but still you are encouraging stalking behavior showing up at private schedules all because you're obsessed over a tv show please relax........,someone said they didnt pay for the info but still you are encouraging stalking behavior showing up at private schedules all because you're obsessed over a tv show please relax..,someone said didnt pay info still encouraging stalking behavior showing private schedules obsessed show please relax,someone say do not pay info still encourage stalk behavior show private schedule obsess show please relax,[],{},{},0,1,[],,[],0.8885
252,2021-02-07,Sun Feb 07 04:16:46 +0000 2021,1358268439912214529,Super_Shat,,Not Geo-tagged,"b'@ByrdDFW @thearn14 True story. I had a drill sergeant in basic who was from India and lived in California.\nHe looks at my index card with my info and sees Mesquite. He immediately says, \xe2\x80\x9cPrivate, you\xe2\x80\x99re from that rodeo city\xe2\x80\x9d. \nLater I had a 1SG who thought that I meant Mesquite in Borden County.'","$MENTION$ $MENTION$ True story. I had a drill sergeant in basic who was from India and lived in California. He looks at my index card with my info and sees Mesquite. He immediately says, Private, youre from that rodeo city. Later I had a $NUMBER$SG who thought that I meant Mesquite in Borden County.","True story. I had a drill sergeant in basic who was from India and lived in California. He looks at my index card with my info and sees Mesquite. He immediately says, Private, you re from that rodeo city . Later I had a SG who thought that I meant Mesquite in Borden County.",true story drill sergeant basic india lived california he looks index card info sees mesquite he immediately says private rodeo city later sg thought meant mesquite borden county,true story drill sergeant basic india live california look index card info see mesquite immediately say private rodeo city later sg think mean mesquite borden county,[],{},{},0,2,[],,"['Andrew Byrd', 'Taylor Hearn']",0.4215
275,2021-02-07,Sun Feb 07 02:23:21 +0000 2021,1358239897526538244,TotallyNotArrow,turn around,Not Geo-tagged,b'@Chicken_Boiiii @kiraa_one stfu thats private info',$MENTION$ $MENTION$ stfu thats private info,stfu thats private info,stfu thats private info,stfu that s private info,[],{},{},0,0,[],,"['Chicken-Kun 🐞', 'kira 👑']",0.0
273,2021-02-07,Sun Feb 07 02:25:40 +0000 2021,1358240482321600514,grillick,"Albuquerque, NM",Not Geo-tagged,b'@IDreamOfNinja @yeralizard I wish we wouldn\xe2\x80\x99t get notifications or info about private accounts interacting with us. It makes me anxious.',$MENTION$ $MENTION$ I wish we wouldnt get notifications or info about private accounts interacting with us. It makes me anxious.,I wish we wouldn t get notifications or info about private accounts interacting with us. It makes me anxious.,wish get notifications info private accounts interacting it makes anxious,wish get notification info private account interact make anxious,[],{},{},0,5,[],,"['FemiNinja', 'Liz Bernstein']",0.1779
267,2021-02-07,Sun Feb 07 02:58:56 +0000 2021,1358248855045890048,maylux5,nyc,Not Geo-tagged,b'how do you pay someone for private info about an idol &amp; still claim to be their fan.. wtf',how do you pay someone for private info about an idol &amp; still claim to be their fan.. wtf,how do you pay someone for private info about an idol &amp; still claim to be their fan.. wtf,pay someone private info idol still claim fan wtf,pay someone private info idol still claim fan wtf,[],{},{},0,5,[],,[],-0.4404
255,2021-02-07,Sun Feb 07 03:58:32 +0000 2021,1358263853902155777,MyungjunsSmile,MJ’s heart,Not Geo-tagged,"b'I would NEVER do this to MJ. This isn\xe2\x80\x99t normal fan behavior, you had someone working in the staff at TB send you info and a private picture, that\xe2\x80\x99s not okay. You don\xe2\x80\x99t invade their private. Fans stick with public info the rest y\xe2\x80\x99all don\xe2\x80\x99t need to know. I\xe2\x80\x99m livid.'","I would NEVER do this to MJ. This isnt normal fan behavior, you had someone working in the staff at TB send you info and a private picture, thats not okay. You dont invade their private. Fans stick with public info the rest yall dont need to know. Im livid.","I would NEVER do this to MJ. This isn t normal fan behavior, you had someone working in the staff at TB send you info and a private picture, that s not okay. You don t invade their private. Fans stick with public info the rest y all don t need to know. I m livid.",would never mj this normal fan behavior someone working staff tb send info private picture okay you invade private fans stick public info rest need know livid,would never mj this normal fan behavior someone work staff tb send info private picture okay invade private fan stick public info rest nee know livid,[],{},{},0,3,[],,[],-0.434
265,2021-02-07,Sun Feb 07 03:04:30 +0000 2021,1358250253569449986,crustyoutlook,,Not Geo-tagged,"b'@RBlakeBrown @Docs4GunControl @CCFR_CCDAF A brick for you @rblakebrown for trying and succeeding at being petty, and a bouquet to @CCFR_CCDAF for taking the moral high road and protecting privacy, I wouldn\xe2\x80\x99t want any club I\xe2\x80\x99m in to give away private info'","$MENTION$ $MENTION$ $MENTION$ A brick for you $MENTION$ for trying and succeeding at being petty, and a bouquet to $MENTION$ for taking the moral high road and protecting privacy, I wouldnt want any club Im in to give away private info","A brick for you for trying and succeeding at being petty, and a bouquet to for taking the moral high road and protecting privacy, I wouldn t want any club I m in to give away private info", brick trying succeeding petty bouquet taking moral high road protecting privacy want club give away private info,  brick try succeed petty bouquet take moral high road protect privacy want club give away private info,[],{},{},0,4,[],,"['Blake Brown', 'Docs4ProtectionfromGuns', 'CCFR/CCDAF', 'Blake Brown', 'CCFR/CCDAF']",0.4019
270,2021-02-07,Sun Feb 07 02:46:20 +0000 2021,1358245685225795592,SpotifyCares,,Not Geo-tagged,"b""@beanbagsrgreat Hey there, we've got just the thing for this! We'd recommend checking out: https://t.co/43lcIdjqEq for more info. For anything else, we'll be a tweet away \xf0\x9f\x92\x9a /KR""","$MENTION$ Hey there, we've got just the thing for this! We'd recommend checking out: $URL$ for more info. For anything else, we'll be a tweet away $EMOJI$ /KR","Hey there, we've got just the thing for this! We'd recommend checking out for more info. For anything else, we'll be a tweet away /KR",hey got thing we recommend checking info for anything else tweet away kr,hey get thing recommend check info for anything else tweet away kr,[],{},{},0,0,[],https://bit.ly/2Na1qKF,"[""you're not my dad""]",0.4199
227,2021-02-07,Sun Feb 07 06:43:11 +0000 2021,1358305289167110150,ugnews24,Kampala - Uganda,Not Geo-tagged,b'Health Ministry Can\xe2\x80\x99t Control COVID Charges in Private\xc2\xa0Hospitals https://t.co/WtR7rzqlfE',Health Ministry Cant Control COVID Charges in PrivateHospitals $URL$,Health Ministry Can t Control COVID Charges in Private Hospitals,health ministry can control covid charges private hospitals,health ministry can control covid charge private hospital,[],{},{},0,0,[],https://ugnews24.info/uganda-news/health-ministry-cant-control-covid-charges-in-private-hospitals/,[],-0.2732
213,2021-02-07,Sun Feb 07 08:04:23 +0000 2021,1358325722578829316,agavi6,,Not Geo-tagged,"b""@lycamobile Germany is leaking sensitive client information through their App.\n\nWhen I tried to register My Lyca Sim, I found the name &amp; address of the previous user (I guess) in their app. I thought in EU there's a data privacy law applicable for such information.\n\n@BfDI_info https://t.co/IRd1gT3VKi""","$MENTION$ Germany is leaking sensitive client information through their App. When I tried to register My Lyca Sim, I found the name &amp; address of the previous user (I guess) in their app. I thought in EU there's a data privacy law applicable for such information. $MENTION$ $URL$","Germany is leaking sensitive client information through their App. When I tried to register My Lyca Sim, I found the name &amp; address of the previous user (I guess) in their app. I thought in EU there's a data privacy law applicable for such information.",germany leaking sensitive client information app when tried register my lyca sim found name address previous user guess app thought eu data privacy law applicable information,germany leak sensitive client information app when try register lyca sim find name address previous user guess app think eu data privacy law applicable information,[],{},{},0,0,[],,"['Lycamobile', 'Bundesbeauftragter für Datenschutz & Infofreiheit']",0.0
180,2021-02-07,Sun Feb 07 11:01:48 +0000 2021,1358370370437304320,jordanolling,"Danville, California",Not Geo-tagged,"b'Bank Of America \xe2\x80\x98Is Without The Knowledge Or The Consent\xe2\x80\x99 Of Customers \xe2\x80\x98Sharing Private\xe2\x80\x99 Info With Feds, Tucker Carlson Reports https://t.co/57YgiB5lmA'","Bank Of America Is Without The Knowledge Or The Consent Of Customers Sharing Private Info With Feds, Tucker Carlson Reports $URL$","Bank Of America Is Without The Knowledge Or The Consent Of Customers Sharing Private Info With Feds, Tucker Carlson Reports",bank of america is without the knowledge or the consent of customers sharing private info with feds tucker carlson reports,bank of america be without the knowledge or the consent of customer share private info with fed tucker carlson report,['bank of america'],{'Financial services': ['bank of america']},{'bank of america': ['Financial services']},0,1,[],https://www.dailywire.com/news/bank-of-america-is-without-the-knowledge-or-the-consent-of-customers-sharing-private-info-with-feds-tucker-carlson-reports/,[],0.5719
161,2021-02-07,Sun Feb 07 13:35:51 +0000 2021,1358409138993250305,EastDulwichMum,London SE22,Not Geo-tagged,"b""@FBarrone @ToeKneesTweets @rob9massive Please can you follow me so I can send you a private message? Prof Geoff Pilkington did some fascinating research into positive effects of tricyclic antidepressants on brain tumours and I'd love to share the info and contact details x""",$MENTION$ $MENTION$ $MENTION$ Please can you follow me so I can send you a private message? Prof Geoff Pilkington did some fascinating research into positive effects of tricyclic antidepressants on brain tumours and I'd love to share the info and contact details x,Please can you follow me so I can send you a private message? Prof Geoff Pilkington did some fascinating research into positive effects of tricyclic antidepressants on brain tumours and I'd love to share the info and contact details x,please follow send private message prof geoff pilkington fascinating research positive effects tricyclic antidepressants brain tumours love share info contact details,please follow send private message prof geoff pilkington fascinating research positive effect tricyclic antidepressant brain tumour love share info contact detail,[],{},{},0,0,[],,"['Frances Barrone 💙', 'Tony', 'rob ablewhite 🇪🇺']",0.9413
266,2021-02-07,Sun Feb 07 03:02:24 +0000 2021,1358249726441738240,taebungie,"s/h, 24",Not Geo-tagged,"b""@yeettanni nobody knows how often they met their family since it's private info. on earlier years, it might be understandably hard since, but now? they're adults who can manage themselves, it's up to them to squeeze time between schedule to met them, nothing's impossible\xf0\x9f\x98\x85""","$MENTION$ nobody knows how often they met their family since it's private info. on earlier years, it might be understandably hard since, but now? they're adults who can manage themselves, it's up to them to squeeze time between schedule to met them, nothing's impossible$EMOJI$","nobody knows how often they met their family since it's private info. on earlier years, it might be understandably hard since, but now? they're adults who can manage themselves, it's up to them to squeeze time between schedule to met them, nothing's impossible",nobody knows often met family since private info earlier years might understandably hard since adults manage squeeze time schedule met nothing impossible,nobody know often meet family since private info early year may understandably hard since adult manage squeeze time schedule meet nothing impossible,[],{},{},0,2,[],,['🍓⁷'],-0.0516
261,2021-02-07,Sun Feb 07 03:46:31 +0000 2021,1358260829758648320,mileyandcompany,,Not Geo-tagged,b'people mad because I recorded the sound check... obviously it wasn\xe2\x80\x99t for you then. I was miles away from her stage and you could still hear her clear as day. Locals were filming. It\xe2\x80\x99s not like I hacked into her iCloud and leaked her private info or her unreleased songs \xf0\x9f\xa4\xad',people mad because I recorded the sound check... obviously it wasnt for you then. I was miles away from her stage and you could still hear her clear as day. Locals were filming. Its not like I hacked into her iCloud and leaked her private info or her unreleased songs,people mad because I recorded the sound check.. obviously it wasn t for you then. I was miles away from her stage and you could still hear her clear as day. Locals were filming. It s not like I hacked into her iCloud and leaked her private info or her unreleased songs,people mad recorded sound check obviously miles away stage could still hear clear day locals filming it like hacked icloud leaked private info unreleased songs,people mad record sound check obviously mile away stage could still hear clear day local film like hack icloud leak private info unrelease song,[],{},{},1,25,[],,[],-0.4122
276,2021-02-07,Sun Feb 07 02:21:32 +0000 2021,1358239440976633856,EngineersDay,"Atlanta, GA USA",Not Geo-tagged,"b'[Job] Industrial/Production Engineer, Automotive Engineer, Others | Company: Unicca Emporis Private Limited | Location: Delhi DL  India | #Delhi #Automotive #Engineering #Jobs | More info at  https://t.co/Ej3FvPiO5G'","[Job] Industrial/Production Engineer, Automotive Engineer, Others | Company: Unicca Emporis Private Limited | Location: Delhi DL India | $HASHTAG$ $HASHTAG$ $HASHTAG$ $HASHTAG$ | More info at $URL$","[Job] Industrial/Production Engineer, Automotive Engineer, Others | Company Unicca Emporis Private Limited | Location Delhi DL India | | More info at",job industrial production engineer automotive engineer others company unicca emporis private limited location delhi dl india more info,job industrial production engineer automotive engineer other company unicca emporis private limit location delhi dl india more info,[],{},{},1,0,"['Delhi', 'Automotive', 'Engineering', 'Jobs']",https://g.drctry.biz/r/u0DYX,[],-0.2263
277,2021-02-07,Sun Feb 07 02:21:27 +0000 2021,1358239419380162561,EngineersDay,"Atlanta, GA USA",Not Geo-tagged,b'[Job] PCB Design Engineering Internship | Company: TRESA Energy Private Limited | Location: Bengaluru KA Karnataka India | #Bengaluru #Automotive #Engineering #Jobs | More info at  https://t.co/1s6TqkFF8u',[Job] PCB Design Engineering Internship | Company: TRESA Energy Private Limited | Location: Bengaluru KA Karnataka India | $HASHTAG$ $HASHTAG$ $HASHTAG$ $HASHTAG$ | More info at $URL$,[Job] PCB Design Engineering Internship | Company TRESA Energy Private Limited | Location Bengaluru KA Karnataka India | | More info at,job pcb design engineering internship company tresa energy private limited location bengaluru ka karnataka india more info,job pcb design engineering internship company tresa energy private limited location bengaluru ka karnataka india more info,[],{},{},2,0,"['Bengaluru', 'Automotive', 'Engineering', 'Jobs']",https://g.drctry.biz/r/3138y,[],0.0516
272,2021-02-07,Sun Feb 07 02:36:13 +0000 2021,1358243135848144897,Uber_Support,,Not Geo-tagged,"b""@divettnatalie In order to protect your privacy, we don't encourage users to provide their account information through public tweets. Please delete your post containing this info and send us the details through DM.""","$MENTION$ In order to protect your privacy, we don't encourage users to provide their account information through public tweets. Please delete your post containing this info and send us the details through DM.","In order to protect your privacy, we do not encourage users to provide their account information through public tweets. Please delete your post containing this info and send us the details through DM.",in order protect privacy encourage users provide account information public tweets please delete post containing info send details dm,in order protect privacy encourage user provide account information public tweet please delete post contain info send detail dm,[],{},{},0,0,[],,['Sustainable Actions'],0.2955
240,2021-02-07,Sun Feb 07 05:14:18 +0000 2021,1358282919463161856,Astrohacity,,Not Geo-tagged,"b""I'm sorry but what happen?\xf0\x9f\x98\x9f Why is there so many Rohas talking about sasaeng, private info and obsession...could someone tell me\xf0\x9f\x98\x9f""","I'm sorry but what happen?$EMOJI$ Why is there so many Rohas talking about sasaeng, private info and obsession...could someone tell me$EMOJI$","I'm sorry but what happen? Why is there so many Rohas talking about sasaeng, private info and obsession..could someone tell me",sorry happen why many rohas talking sasaeng private info obsession could someone tell,sorry happen why many roha talk sasaeng private info obsession could someone tell,[],{},{},0,0,[],,[],-0.0387
184,2021-02-07,Sun Feb 07 10:19:52 +0000 2021,1358359817396568065,TeamYouTube,"San Bruno, CA",Not Geo-tagged,"b'@Mr_Faulty02 Appreciate the tag \xe2\x80\x93 once you reach 1k+ subs, you need to maintain this threshold for 7 days to be eligible for the Community tab: https://t.co/aOltLEBdD2. Also, we recommend deleting your tweet because it contains your private info. Tweet back @ us if needed.'","$MENTION$ Appreciate the tag once you reach $NUMBER$k+ subs, you need to maintain this threshold for $NUMBER$ days to be eligible for the Community tab: $URL$. Also, we recommend deleting your tweet because it contains your private info. Tweet back $MENTION$ us if needed.","Appreciate the tag once you reach k+ subs, you need to maintain this threshold for days to be eligible for the Community tab . Also, we recommend deleting your tweet because it contains your private info. Tweet back us if needed.",appreciate tag reach subs need maintain threshold days eligible community tab also recommend deleting tweet contains private info tweet back needed,appreciate tag reach sub need maintain threshold day eligible community tab also recommend delete tweet contain private info tweet back need,[],{},{},0,1,[],https://yt.be/help/p5bA,['Mr Faulty'],0.6486
186,2021-02-07,Sun Feb 07 10:07:00 +0000 2021,1358356580807241730,SwiftYaksha,Penned by Kitsu,Not Geo-tagged,"b'""I deal in death. If you cannot bring yourself to kill -- speak my name.""\n\n  Indie Private/Selective Xiao \n                RP Account\nPenned by Kitsu (#kitsune_kisses)\n\n#GenshinImpactRP\n#GIRP #MVRP\n              More Info Below\n( Please do not reply. \n   Like and Retweet instead) https://t.co/wJcPIJGGtt'","""I deal in death. If you cannot bring yourself to kill -- speak my name."" Indie Private/Selective Xiao RP Account Penned by Kitsu ($HASHTAG$) $HASHTAG$ $HASHTAG$ $HASHTAG$ More Info Below ( Please do not reply. Like and Retweet instead) $URL$","""I deal in death. If you cannot bring yourself to kill -- speak my name."" Indie Private/Selective Xiao RP Account Penned by Kitsu () More Info Below ( Please do not reply. Like and Retweet instead)",deal death if bring kill speak name indie private selective xiao rp account penned kitsu more info below please reply like retweet instead,deal death if bring kill speak name indie private selective xiao rp account pen kitsu more info below please reply like retweet instead,[],{},{},13,18,"['kitsune_kisses', 'GenshinImpactRP', 'GIRP', 'MVRP']",,[],-0.8559
285,2021-02-07,Sun Feb 07 01:44:35 +0000 2021,1358230144058548226,MFROSHI,,Not Geo-tagged,b'my girl better chill she leakin private info https://t.co/3NstynHDEW',my girl better chill she leakin private info $URL$,my girl better chill she leakin private info,girl better chill leakin private info,girl well chill leakin private info,[],{},{},0,6,[],https://twitter.com/callmemsparker/status/1357951220405710849,[],0.4404
284,2021-02-07,Sun Feb 07 01:51:28 +0000 2021,1358231875890917382,Info_Scientists,Librarians are everywhere.,Not Geo-tagged,"b""@JimmyMak1 We don't have one because Unity, ME is private.""","$MENTION$ We don't have one because Unity, ME is private.","We do not have one because Unity, ME is private.",we one unity me private,one unity private,[],{},{},0,0,[],,['Jimmy Mak'],0.0
271,2021-02-07,Sun Feb 07 02:42:21 +0000 2021,1358244680757112833,rubyslprlawgirl,,Not Geo-tagged,"b""Ppl's fear of crime is rising, despite crime rates being historically low, these companies make grand, unsubstantiated claims about crime reduction. While at the same time putting massive amounts of info about private, innocent ppl in the hands of their neighbors...\n\n/9""","Ppl's fear of crime is rising, despite crime rates being historically low, these companies make grand, unsubstantiated claims about crime reduction. While at the same time putting massive amounts of info about private, innocent ppl in the hands of their neighbors... /9","Ppl's fear of crime is rising, despite crime rates being historically low, these companies make grand, unsubstantiated claims about crime reduction. While at the same time putting massive amounts of info about private, innocent ppl in the hands of their neighbors.. /9",ppl fear crime rising despite crime rates historically low companies make grand unsubstantiated claims crime reduction while time putting massive amounts info private innocent ppl hands neighbors,ppl fear crime rise despite crime rate historically low company make grand unsubstantiated claim crime reduction while time put massive amount info private innocent ppl hand neighbor,[],{},{},0,0,[],,[],-0.6187
264,2021-02-07,Sun Feb 07 03:06:57 +0000 2021,1358250873382658049,agoda,,Not Geo-tagged,"b'@papo_kgomotso Hi @papo_kgomotso, If you need our assistance, please send us private message with your Booking ID, Lead guest name, Email address, Phone number(including country code) and your inquiry to look into it. You still can call or email at https://t.co/srGD4vs7t4\nThank you. ^Sienna https://t.co/bBGYfMOIlz'","$MENTION$ Hi $MENTION$, If you need our assistance, please send us private message with your Booking ID, Lead guest name, Email address, Phone number(including country code) and your inquiry to look into it. You still can call or email at $URL$ Thank you. ^Sienna $URL$","Hi , If you need our assistance, please send us private message with your Booking ID, Lead guest name, Email address, Phone number(including country code) and your inquiry to look into it. You still can call or email at Thank you. ^Sienna",hi if need assistance please send private message booking id lead guest name email address phone number including country code inquiry look you still call email thank sienna,hi if need assistance please send private message book d lead guest name email address phone number include country code inquiry look still call email thank sienna,[],{},{},0,0,[],"https://www.agoda.com/en-sg/info/contact-agoda.html, https://twitter.com/messages/compose?recipient_id=18797910","['kgomotso papo🌈🌈', 'kgomotso papo🌈🌈']",0.5859
