s_no,date,created_at,id_str,screen_name,user_location,geo-tagged_place,tweet_text,tweet_tokenized,tweet_cleaned,tweet_filtered,tweet_lemmatized,tweet_mentioned_organizations,tweet_tags_classified,tweet_orgs_classified,retweet_count,fav_count,hashtags,urls,mentions,vader_polarity
80,2021-02-07,Sun Feb 07 18:31:58 +0000 2021,1358483658856947716,Andrewemcameron,"Aurora, Ontario",Not Geo-tagged,"b""@fishyfish67 @ammocrypta @Jamz129 @glinch72 @JohnOz1900 @B_Bolshevik100 @richardwakelin3 @Tragic4Libs @MikeDel21893959 @DK25769559 @TheDisproof @BubbasRanch @KCTaz @MATTP1949 @aSinister @DigitalPsyche @Mark_A_Lunn @WeaponizedPatr1 @OfReason23 @Birthday_Chris @Jaisans @Willard1951 @Tangomitteckel @0Sundance @jwickers @davidyoung13 @SimonGr41594862 @IngersolRobert @ClimateCatastr3 @swcrisis @joetheatheistp @Climatehope2 @91996340e81d45a @BridgetHolmstro @RealMikeDelta1 @fcmfcs2019 @TruePat89736316 @RelampagoBlanc2 @JamesRider3 @RemCent @PaprikaLady @dynamikcre8tor9 @Over400ppm @fknsavages27 @dense_evi @AtomsksSanakan @Anvndarnamn5 @insane_voice @TwitterSafety @TwitterSupport \xf0\x9f\x98\x82 \xf0\x9f\xa4\xa3 \xf0\x9f\x98\x82 \xf0\x9f\xa4\xa3 \xf0\x9f\xa4\xa3 \xf0\x9f\x98\x82\n\nYou believe that?\n\nReally?\n\nDid you watch the video and everything? That convinced you?\n\nWanna buy some anti-covid voodoo dolls from me? They'll protect your private info from Hackers for over a year too. https://t.co/or0MpcXgSQ""",$MENTION$ $MENTION$ $MENTION$ $MENTION$ $MENTION$ $MENTION$ $MENTION$ $MENTION$ $MENTION$ $MENTION$ $MENTION$ $MENTION$ $MENTION$ $MENTION$ $MENTION$ $MENTION$ $MENTION$ $MENTION$ $MENTION$ $MENTION$ $MENTION$ $MENTION$ $MENTION$ $MENTION$ $MENTION$ $MENTION$ $MENTION$ $MENTION$ $MENTION$ $MENTION$ $MENTION$ $MENTION$ $MENTION$ $MENTION$ $MENTION$ $MENTION$ $MENTION$ $MENTION$ $MENTION$ $MENTION$ $MENTION$ $MENTION$ $MENTION$ $MENTION$ $MENTION$ $MENTION$ $MENTION$ $MENTION$ $MENTION$ $MENTION$ $EMOJI$ $EMOJI$ $EMOJI$ You believe that? Really? Did you watch the video and everything? That convinced you? Wanna buy some anti-covid voodoo dolls from me? They'll protect your private info from Hackers for over a year too. $URL$,You believe that? Really? Did you watch the video and everything? That convinced you? Wanna buy some anti-covid voodoo dolls from me? They'll protect your private info from Hackers for over a year too.,you believe really did watch video everything that convinced wan na buy anti covid voodoo dolls they protect private info hackers year,believe really do watch video everything that convince wan na buy anti covid voodoo doll protect private info hacker year,[],{},{},0,4,[],,"['Jim Fish', 'Chris Taylor', 'Jamz12', 'liam mcglinchey', 'John Oz', 'Bourgeois Bolshevik ☢', 'richard wakelin', '₮Ɽ₳₲ł₵₵Ø₥ĐɆɎ🎭🕊☝🏼💯🥊', 'MikeDelta _Gab:@MikeDeltaOne', 'Cave -DK- Johnson', 'Bonus', 'BubbasPossumRanch', 'KCTaz', 'Matthew Petryszak 🇺🇸', 'ben / 🅂🄸🄽🄸🅂🅃🄴🅁 🅱🅈 🄳🄴🅂🄸🄶🄽', 'DP', 'Mark Lunn', 'Weaponized Patriot', 'Hank Scorpio', 'Chris', 'biden is prez', 'James William Owens', '""Biden Won"" = biggest fraud in US history', 'Dr. Sundance', 'Jeremy Wickersheimer', '💧David Young', 'Simon Green', 'Robert Ingersol', '@ClimateCatastrophist4', 'Jack Eddyfier', 'JoeDavis', 'Climatehope', 'Peter 💙', 'Bridget Holmstrom', 'RealMikeDelta', 'FCM: Reason not hysteria. Evidence not propaganda', 'True Patriot', 'RelampagoBlanco', 'James Rider', 'Rem', 'Paprika Lady', 'DynamikCre8tor', 'Over400ppm', 'CrankYankee', 'EvidenceChallenge', ""Atomsk's Sanakan"", 'Olof', 'Voice Of Insane', 'Twitter Safety', 'Twitter Support']",0.7399
60,2021-02-07,Sun Feb 07 19:48:25 +0000 2021,1358502899320504330,christse,,Not Geo-tagged,"b'@harper @WalletConnect Using a Web3 wallet as an OAuth replacement has the additional benefit of being pseudonymous to start. Similar to goal of Apple ID\xe2\x80\x99s private relay but a lot more natural.\n\nUser can provide more personal info later, but that data exchange must be earned by the app/service.'","$MENTION$ $MENTION$ Using a Web3 wallet as an OAuth replacement has the additional benefit of being pseudonymous to start. Similar to goal of Apple IDs private relay but a lot more natural. User can provide more personal info later, but that data exchange must be earned by the app/service.","Using a Web3 wallet as an OAuth replacement has the additional benefit of being pseudonymous to start. Similar to goal of Apple ID s private relay but a lot more natural. User can provide more personal info later, but that data exchange must be earned by the app/service.",using web wallet oauth replacement additional benefit pseudonymous start similar goal apple id private relay lot natural user provide personal info later data exchange must earned app service,use web wallet oauth replacement additional benefit pseudonymous start similar goal apple d private relay lot natural user provide personal info later datum exchange must earned app service,[],{},{},0,3,[],,"['harper 🤯', 'WalletConnect 📲']",0.6897
88,2021-02-07,Sun Feb 07 18:00:22 +0000 2021,1358475706502680582,StaffsPolice,"Staffordshire, UK",Not Geo-tagged,"b'Our aim is to safeguard children &amp; young people being exploited by criminal gangs.\n\nIf you are worried that someone is at immediate risk of harm, contact 999. If you need to report something to us, please private message us. \n\nFor more info\xf0\x9f\x91\x87\nhttps://t.co/TIZQAnBO4A \n#CountyLines https://t.co/eTikEMBWIK'","Our aim is to safeguard children &amp; young people being exploited by criminal gangs. If you are worried that someone is at immediate risk of harm, contact $NUMBER$. If you need to report something to us, please private message us. For more info$EMOJI$ $URL$ $HASHTAG$ $URL$","Our aim is to safeguard children &amp; young people being exploited by criminal gangs. If you are worried that someone is at immediate risk of harm, contact . If you need to report something to us, please private message us. For more info",our aim safeguard children young people exploited criminal gangs if worried someone immediate risk harm contact if need report something us please private message for info,aim safeguard child young people exploit criminal gang if worry someone immediate risk harm contact if need report something please private message for info,[],{},{},8,5,['CountyLines'],http://orlo.uk/gxQUL,[],-0.8519
86,2021-02-07,Sun Feb 07 18:01:05 +0000 2021,1358475889416294404,Elizabeth_in_MN,,Not Geo-tagged,"b'@Plasticdoe @WendyOrent @MagantiAnu @AlexBerenson The miscarriage information I provided is correct. Not totally on board with the private info being shared in orig tweet, but the Mayo Clinic screenshot in the reply is just misleading. Majority of miscarriages happen well before 14 weeks.'","$MENTION$ $MENTION$ $MENTION$ $MENTION$ The miscarriage information I provided is correct. Not totally on board with the private info being shared in orig tweet, but the Mayo Clinic screenshot in the reply is just misleading. Majority of miscarriages happen well before $NUMBER$ weeks.","The miscarriage information I provided is correct. Not totally on board with the private info being shared in orig tweet, but the Mayo Clinic screenshot in the reply is just misleading. Majority of miscarriages happen well before weeks.",the miscarriage information provided correct not totally board private info shared orig tweet mayo clinic screenshot reply misleading majority miscarriages happen well weeks,the miscarriage information provide correct not totally board private info share orig tweet mayo clinic screenshot reply misleading majority miscarriage happen well week,[],{},{},0,0,[],,"['Sarah', '(((Wendy Orent)))', 'Anu', 'Alex Berenson']",-0.0516
102,2021-02-07,Sun Feb 07 17:27:39 +0000 2021,1358467472098263045,MidEastInfo,Cairo | Abu Dhabi | Mid-East,Not Geo-tagged,b'#MA\xe2\x80\x99AN JOINS THE HOPE CONSORTIUM IN A STRATEGIC MOVE OF #PRIVATE AND #PUBLIC SECTOR UNITY https://t.co/55ed8sDYn4',$HASHTAG$ JOINS THE HOPE CONSORTIUM IN A STRATEGIC MOVE OF $HASHTAG$ AND $HASHTAG$ SECTOR UNITY $URL$,AN JOINS THE HOPE CONSORTIUM IN A STRATEGIC MOVE OF AND SECTOR UNITY,an joins the hope consortium in strategic move of and sector unity,an join the hope consortium in strategic move of and sector unity,[],{},{},0,0,"['MA', 'PRIVATE', 'PUBLIC']",https://mid-east.info/maan-joins-the-hope-consortium-in-a-strategic-move-of-private-and-public-sector-unity/,[],0.4404
84,2021-02-07,Sun Feb 07 18:14:03 +0000 2021,1358479150139338754,fireflyann,"Bay Area, California",Not Geo-tagged,"b'@subatomicdoc @JulieMcCrossin @Facebook will have to read up more.\n\nI have groups that are ""secret"" that used to be called ""private"". Not sure if searchable.\n\nSome that are clearly Public (e.g. BRAF CRC library)- but I warn re Public nature when people join it.  But if it\'s a concern, they can still access info &amp; share'","$MENTION$ $MENTION$ $MENTION$ will have to read up more. I have groups that are ""secret"" that used to be called ""private"". Not sure if searchable. Some that are clearly Public (e.g. BRAF CRC library)- but I warn re Public nature when people join it. But if it's a concern, they can still access info &amp; share","will have to read up more. I have groups that are ""secret"" that used to be called ""private"". Not sure if searchable. Some that are clearly Public (e.g. BRAF CRC library)- but I warn re Public nature when people join it. But if it's a concern, they can still access info &amp; share",read groups secret used called private not sure searchable some clearly public braf crc library warn public nature people join but concern still access info share,read group secret use call private not sure searchable some clearly public braf crc library warn public nature people join but concern still access info share,[],{},{},0,1,[],,"['Matthew Katz, MD 🇺🇸', 'Julie McCrossin AM', 'Facebook']",0.6563
92,2021-02-07,Sun Feb 07 17:49:09 +0000 2021,1358472885757566978,BanMidou12,,Not Geo-tagged,"b""@rukgami @aharnisham Why can't these people keep these things private? Milta kya hai iss info ko furnish karke bc xD""",$MENTION$ $MENTION$ Why can't these people keep these things private? Milta kya hai iss info ko furnish karke bc xD,Why ca not these people keep these things private? Milta kya hai iss info ko furnish karke bc xD,why people keep things private milta kya hai iss info furnish karke xd,why people keep thing private milta kya hai iss info furnish karke xd,[],{},{},0,2,[],,"['CHED Ü𝖇𝖊𝖗𝖒𝖊𝖓𝖘𝖈𝖍 😼', 'aharnisham']",0.5859
53,2021-02-07,Sun Feb 07 20:41:29 +0000 2021,1358516255049809921,myecoll, NY & NJ ,Not Geo-tagged,"b'\xe2\x80\x9clawsuit..asks a judge to weigh..against disclosure &amp; requests that the [reporter] pay..legal fees\n\nlawsuit argues that the documents Gallo seeks contain \xe2\x80\x9cprivate info.., constitutionally protected\xe2\x80\x9d\n\n\xe2\x80\x9cGallo\xe2\x80\x99s request \xe2\x80\x94for sexual harassment allegations against [AG official] Magee\xe2\x80\x9d https://t.co/DGEN1RIKk2'","lawsuit..asks a judge to weigh..against disclosure &amp; requests that the [reporter] pay..legal fees lawsuit argues that the documents Gallo seeks contain private info.., constitutionally protected Gallos request for sexual harassment allegations against [AG official] Magee $URL$","lawsuit..asks a judge to weigh..against disclosure &amp; requests that the [reporter] pay..legal fees lawsuit argues that the documents Gallo seeks contain private info.., constitutionally protected Gallo s request for sexual harassment allegations against [AG official] Magee",lawsuit asks judge weigh disclosure requests reporter pay legal fees lawsuit argues documents gallo seeks contain private info constitutionally protected gallo request sexual harassment allegations ag official magee,lawsuit ask judge weigh disclosure request reporter pay legal fee lawsuit argue document gallo seek contain private info constitutionally protect gallo request sexual harassment allegation ag official magee,[],{},{},0,0,[],https://twitter.com/schoofsfeed/status/1358507921236197382,[],-0.6249
96,2021-02-07,Sun Feb 07 17:35:47 +0000 2021,1358469520105611265,Paulananke,,Not Geo-tagged,"b'@dem_cath Yes, the new Integrated Care Systems will be in the hands of private companies. Bidding for provider tenders replaced with direct contracting to private providers. The next step in the journey towards a health insurance style health service https://t.co/h5nQQTybKt'","$MENTION$ Yes, the new Integrated Care Systems will be in the hands of private companies. Bidding for provider tenders replaced with direct contracting to private providers. The next step in the journey towards a health insurance style health service $URL$","Yes, the new Integrated Care Systems will be in the hands of private companies. Bidding for provider tenders replaced with direct contracting to private providers. The next step in the journey towards a health insurance style health service",yes new integrated care systems hands private companies bidding provider tenders replaced direct contracting private providers the next step journey towards health insurance style health service,yes new integrated care system hand private company bid provider tender replace direct contracting private provider the next step journey towards health insurance style health service,[],{},{},3,5,[],https://lowdownnhs.info/integrated-care/whos-cashing-in-on-icss/,['Cath #Standup 💙💔 💚🐝'],0.7579
90,2021-02-07,Sun Feb 07 17:57:41 +0000 2021,1358475030238277648,Asuraid,"Ontario, Canada",Not Geo-tagged,"b'i mean not that im not gonna introduce more, i gotta haul over a lot of OCs that are just on flight rising or have been worked out in private so i have a solid place with all their info cause my memory is doodoo'","i mean not that im not gonna introduce more, i gotta haul over a lot of OCs that are just on flight rising or have been worked out in private so i have a solid place with all their info cause my memory is doodoo","i mean not that im not gonna introduce more, i gotta haul over a lot of OCs that are just on flight rising or have been worked out in private so i have a solid place with all their info cause my memory is doodoo",mean gon na introduce got ta haul lot ocs flight rising worked private solid place info cause memory doodoo,mean gon na introduce get ta haul lot ocs flight rise work private solid place info cause memory doodoo,[],{},{},0,0,[],,[],0.1531
79,2021-02-07,Sun Feb 07 18:41:43 +0000 2021,1358486112688353290,OpenFCPS2020,Fairfax County,Not Geo-tagged,"b""@ericjanson23 Perhaps a good way you could get more info would be to ask private schools how many apps they've gotten for next year.  \n\nNot sure how else we could get non-anecdotal info. But, I emphasize we are hearing it all the time, &amp; from many that aren't even in our group.""","$MENTION$ Perhaps a good way you could get more info would be to ask private schools how many apps they've gotten for next year. Not sure how else we could get non-anecdotal info. But, I emphasize we are hearing it all the time, &amp; from many that aren't even in our group.","Perhaps a good way you could get more info would be to ask private schools how many apps they've gotten for next year. Not sure how else we could get non-anecdotal info. But, I emphasize we are hearing it all the time, &amp; from many that are not even in our group.",perhaps good way could get info would ask private schools many apps gotten next year not sure else could get non anecdotal info but emphasize hearing time many even group,perhaps good way could get info would ask private school many app get next year not sure else could get non anecdotal info but emphasize hearing time many even group,[],{},{},0,1,[],,['Eric Janson'],0.1202
111,2021-02-07,Sun Feb 07 16:49:03 +0000 2021,1358457758706720774,HarryAA,🇬🇧 17 y/o,Not Geo-tagged,"b""@Stojke_Car Yo how'd you find that? Private info bruh""",$MENTION$ Yo how'd you find that? Private info bruh,Yo how'd you find that? Private info bruh,yo find private info bruh,yo find private info bruh,[],{},{},0,1,[],,['Stojan🦍'],0.0
108,2021-02-07,Sun Feb 07 17:00:16 +0000 2021,1358460582924591105,SofiaVoloWine,"Baltimore, MD",Not Geo-tagged,b'Host a Private #Wine Tasting in your home. We make it easy! More Info: https://t.co/R7PZdjWB15 #Baltimore #MDwine',Host a Private $HASHTAG$ Tasting in your home. We make it easy! More Info: $URL$ $HASHTAG$ $HASHTAG$,Host a Private Tasting in your home. We make it easy! More Info,host private tasting home we make easy more info,host private tasting home make easy more info,[],{},{},0,0,"['Wine', 'Baltimore', 'MDwine']",http://goo.gl/fRWhQz,[],0.4926
48,2021-02-07,Sun Feb 07 21:04:52 +0000 2021,1358522136089006080,mqrgans,they/them,Not Geo-tagged,b'you literally said you don\xe2\x80\x99t like lili why are you defending her all the sudden \xe2\x80\x94 anon i don\xe2\x80\x99t have to like lili to know how wrong taylor was for exposing her private info like that... https://t.co/7wB22Ywv2F',you literally said you dont like lili why are you defending her all the sudden anon i dont have to like lili to know how wrong taylor was for exposing her private info like that... $URL$,you literally said you don t like lili why are you defending her all the sudden anon i don t have to like lili to know how wrong taylor was for exposing her private info like that..,literally said like lili defending sudden anon like lili know wrong taylor exposing private info like,literally say like lili defend sudden anon like lili know wrong taylor expose private info like,[],{},{},0,8,[],https://curiouscat.qa/mqrgans/post/1181440565,[],0.3182
91,2021-02-07,Sun Feb 07 17:51:36 +0000 2021,1358473499698991105,only_Current,"Pasni, Karachi Quetta ",Not Geo-tagged,"b'It\xe2\x80\x99s been 47 days since #KarimaBaloch\xe2\x80\x99s body was found in Toronto but @JustinTrudeau\xe2\x80\x99s govt is still silent on her mysterious death, pretending nothing happened. Even the govt did nothing when @PakinCanada_ shared our private info online.\xf0\x9f\x98\xa2\n#JusticeForKarimaBaloch\n@cafreeland https://t.co/Cq5HvMpNEh'","Its been $NUMBER$ days since $HASHTAG$ body was found in Toronto but $MENTION$ govt is still silent on her mysterious death, pretending nothing happened. Even the govt did nothing when $MENTION$ shared our private info online.$EMOJI$ $HASHTAG$ $MENTION$ $URL$","It s been days since s body was found in Toronto but s govt is still silent on her mysterious death, pretending nothing happened. Even the govt did nothing when shared our private info online.",it days since body found toronto govt still silent mysterious death pretending nothing happened even govt nothing shared private info online,day since body find toronto govt still silent mysterious death pretend nothing happen even govt nothing share private info online,[],{},{},0,1,"['KarimaBaloch', 'JusticeForKarimaBaloch']",https://twitter.com/LateefJohar/status/1358406909041254406,"['Justin Trudeau', 'Pakistan High Commission Canada', 'Chrystia Freeland']",-0.8076
94,2021-02-07,Sun Feb 07 17:41:16 +0000 2021,1358470901390581761,VodafoneIreland,Ireland,Not Geo-tagged,"b""@CorkyCastle Hi,\n\nThanks for reaching us here, if you private message the below info, I'll do my best to assist:\n\n- Full Name\n- Account number\n- Security PIN (or, if you don't have this, your address and date of birth)\n\nThanks,\nYugien""","$MENTION$ Hi, Thanks for reaching us here, if you private message the below info, I'll do my best to assist: - Full Name - Account number - Security PIN (or, if you don't have this, your address and date of birth) Thanks, Yugien","Hi, Thanks for reaching us here, if you private message the below info, I'll do my best to assist - Full Name - Account number - Security PIN (or, if you do not have this, your address and date of birth) Thanks, Yugien",hi thanks reaching private message info best assist full name account number security pin address date birth thanks yugien,hi thank reach private message info good assist full name account number security pin address date birth thank yugien,[],{},{},0,0,[],,['The_Castle'],0.926
70,2021-02-07,Sun Feb 07 19:13:11 +0000 2021,1358494030364102658,lilyDefiance126,"Tokyo-to, Japan",Not Geo-tagged,"b'@MisuCarlota @knittedjeje My reason is cuz the app displays too much private info from its users not for what JJ talks with his friends, I love seeing him interacting with his friends but I would prefer for his personal info not to be so exposed for antis and sasaengs to benefit from it.'","$MENTION$ $MENTION$ My reason is cuz the app displays too much private info from its users not for what JJ talks with his friends, I love seeing him interacting with his friends but I would prefer for his personal info not to be so exposed for antis and sasaengs to benefit from it.","My reason is cuz the app displays too much private info from its users not for what JJ talks with his friends, I love seeing him interacting with his friends but I would prefer for his personal info not to be so exposed for antis and sasaengs to benefit from it.",my reason cuz app displays much private info users jj talks friends love seeing interacting friends would prefer personal info exposed antis sasaengs benefit,reason cuz app display much private info user jj talk friend love see interact friend would prefer personal info expose antis sasaeng benefit,[],{},{},0,2,[],,"['Misu Fortuna', 'W 🔁 WWW']",0.7874
106,2021-02-07,Sun Feb 07 17:15:30 +0000 2021,1358464416157687811,SimonesFiasco,,Not Geo-tagged,"b'@loveakhiraaaa this is 100% unnecessary, private info that is unrelated to the larger story, BUT if her page is public then that info is accessible\nhowever, this is why not everyone can just up and do journalism, because she should\xe2\x80\x99ve stopped at her being 40 and from LA'","$MENTION$ this is $NUMBER$% unnecessary, private info that is unrelated to the larger story, BUT if her page is public then that info is accessible however, this is why not everyone can just up and do journalism, because she shouldve stopped at her being $NUMBER$ and from LA","this is % unnecessary, private info that is unrelated to the larger story, BUT if her page is public then that info is accessible however, this is why not everyone can just up and do journalism, because she should ve stopped at her being and from LA",unnecessary private info unrelated larger story but page public info accessible however everyone journalism stopped la,unnecessary private info unrelated large story but page public info accessible however everyone journalism stop la,[],{},{},0,0,[],,['the second self of God'],-0.3291
101,2021-02-07,Sun Feb 07 17:31:08 +0000 2021,1358468351291449349,PoetKinetic,Texas,Not Geo-tagged,b'LIVE\n\nDoin a little more Valheim today on my private server. If any content creators want a home to stream Valheim feel free to hit me up and I will provide the server info.\n\nhttps://t.co/BT139Yj2kx',LIVE Doin a little more Valheim today on my private server. If any content creators want a home to stream Valheim feel free to hit me up and I will provide the server info. $URL$,LIVE Doin a little more Valheim today on my private server. If any content creators want a home to stream Valheim feel free to hit me up and I will provide the server info.,live doin little valheim today private server if content creators want home stream valheim feel free hit provide server info,live do little valheim today private server if content creator want home stream valheim feel free hit provide server info,[],{},{},0,2,[],http://twitch.tv/kineticpoet,[],0.5574
95,2021-02-07,Sun Feb 07 17:38:55 +0000 2021,1358470308651552769,Stpolishook,"New York, NY",Not Geo-tagged,"b'@ajuxtoposition For having this opinion (just anti-doxx, anti-using private info online when asked not to) I have been blocked by many &amp; accused of \xe2\x80\x9cbothsidesim\xe2\x80\x9d. I will continue to be anti-doxx in all forms. Continue to say this behavior endangers us all. That shouldnt be controversial'","$MENTION$ For having this opinion (just anti-doxx, anti-using private info online when asked not to) I have been blocked by many &amp; accused of bothsidesim. I will continue to be anti-doxx in all forms. Continue to say this behavior endangers us all. That shouldnt be controversial","For having this opinion (just anti-doxx, anti-using private info online when asked not to) I have been blocked by many &amp; accused of bothsidesim . I will continue to be anti-doxx in all forms. Continue to say this behavior endangers us all. That shouldnt be controversial",for opinion anti doxx anti using private info online asked blocked many accused bothsidesim continue anti doxx forms continue say behavior endangers that shouldnt controversial,for opinion anti doxx anti use private info online ask block many accuse bothsidesim continue anti doxx form continue say behavior endanger that should not controversial,[],{},{},0,0,[],,['Izzy said take care of yourself'],-0.4035
