s_no,date,created_at,id_str,screen_name,user_location,geo-tagged_place,tweet_text,tweet_tokenized,tweet_cleaned,tweet_filtered,tweet_lemmatized,tweet_mentioned_organizations,tweet_tags_classified,tweet_orgs_classified,retweet_count,fav_count,hashtags,urls,mentions,vader_polarity
80,2021-01-30,Sat Jan 30 18:55:37 +0000 2021,1355590509675347968,ACUVUE,,Not Geo-tagged,b'@brendscg We\xe2\x80\x99re sorry to hear this! Could you please reply back in a private message with your email address in case we need to reach back out for more info? Hope to talk to you soon! \xe2\x80\x8bhttps://t.co/BKYibvwIcO',$MENTION$ Were sorry to hear this! Could you please reply back in a private message with your email address in case we need to reach back out for more info? Hope to talk to you soon! $URL$,We re sorry to hear this! Could you please reply back in a private message with your email address in case we need to reach back out for more info? Hope to talk to you soon!,we sorry hear could please reply back private message email address case need reach back info hope talk soon,sorry hear could please reply back private message email address case nee reach back info hope talk soon,[],{},{},0,1,[],https://goo.gl/BtyAJ1,['madame'],0.7061
49,2021-01-30,Sat Jan 30 20:57:05 +0000 2021,1355621074961002498,anrymeel,,Not Geo-tagged,b'@DebtTrut This is scary \xf0\x9f\x92\xa9. I think I read something similar when reading Angels &amp; Demons &amp; I researched some info about the Knights Templar &amp; jumping to the \xe2\x80\x9cold boys clubs\xe2\x80\x9d of private schools &amp; Harvard &amp; powerful men who run the world \xf0\x9f\x98\xb1',$MENTION$ This is scary $EMOJI$. I think I read something similar when reading Angels &amp; Demons &amp; I researched some info about the Knights Templar &amp; jumping to the old boys clubs of private schools &amp; Harvard &amp; powerful men who run the world $EMOJI$,This is scary . I think I read something similar when reading Angels &amp; Demons &amp; I researched some info about the Knights Templar &amp; jumping to the old boys clubs of private schools &amp; Harvard &amp; powerful men who run the world,this scary think read something similar reading angels demons researched info knights templar jumping old boys clubs private schools harvard powerful men run world,this scary think read something similar reading angel demon research info knight templar jump old boy club private school harvard powerful man run world,[],{},{},0,0,[],,['Linda'],-0.1027
91,2021-01-30,Sat Jan 30 18:12:59 +0000 2021,1355579777294467072,norespawns,"London, UK",Not Geo-tagged,"b""@a5oNGaming I actually didn't check and have already switched worlds - always a bit cautious sharing their info too, as some might wanna be private etc.""","$MENTION$ I actually didn't check and have already switched worlds - always a bit cautious sharing their info too, as some might wanna be private etc.","I actually did not check and have already switched worlds - always a bit cautious sharing their info too, as some might wanna be private etc.",actually check already switched worlds always bit cautious sharing info might wan na private etc,actually check already switch world always bite cautious sharing info may wan na private etc,[],{},{},0,1,[],,['a5oNGaming'],0.34
86,2021-01-30,Sat Jan 30 18:23:25 +0000 2021,1355582405571035137,Filmyboy3,India,Not Geo-tagged,b'#ffnews Rashid is leaking shooting videos of #Pathan @yrf @yrfmusic @AiplexSoftware\n@aiplexdigital @rohan_m01\nKindly report take action For leaking private info spreading false rumours(.p.s) he has an FIR on him and has been sued for 500cr by @akshaykumar\nhttps://t.co/Nqx2eXG3tA',$HASHTAG$ Rashid is leaking shooting videos of $HASHTAG$ $MENTION$ $MENTION$ $MENTION$ $MENTION$ $MENTION$ Kindly report take action For leaking private info spreading false rumours(.p.s) he has an FIR on him and has been sued for $NUMBER$cr by $MENTION$ $URL$,Rashid is leaking shooting videos of Kindly report take action For leaking private info spreading false rumours(.p.s) he has an FIR on him and has been sued for cr by,rashid leaking shooting videos kindly report take action for leaking private info spreading false rumours fir sued,rashid leak shooting video kindly report take action for leak private info spread false rumour fir sue,[],{},{},2,4,"['ffnews', 'Pathan']",https://youtu.be/y572wbo0Q9M,"['Yash Raj Films', 'YRF Music', 'AiPlex Software Pvt. Ltd.', 'Aiplex Digital', 'Rohan Malhotra', 'Akshay Kumar']",0.4939
82,2021-01-30,Sat Jan 30 18:50:35 +0000 2021,1355589241930186754,realwiley1,,Not Geo-tagged,"b'JUST LISTED! \xe2\x9c\xa8\n2224 Garden Court in San Marcos! \n$360,000 \n3 Beds, 2.5 Bath\nFireplace \nPrivate Road\nInterested? Contact me! Info in bio! \xe2\x9c\xa8\n\n\xe2\x9d\xa4\xef\xb8\x8fStay Humble\xe2\x9d\xa4\xef\xb8\x8fWork Hard\xe2\x9d\xa4\xef\xb8\x8fBe Kind\xe2\x9d\xa4\xef\xb8\x8f\n\n#JustListed #RealBrokerLLC #RobbieSellsHillCountry #SanMarcosTX #SanMarcosHomes #SanMarcosRealEstate https://t.co/H82NaJTanQ'","JUST LISTED! $EMOJI$ $NUMBER$ Garden Court in San Marcos! $360,000 $NUMBER$ Beds, $NUMBER$ Bath Fireplace Private Road Interested? Contact me! Info in bio! $EMOJI$ $EMOJI$Stay Humble$EMOJI$Work Hard$EMOJI$Be Kind$EMOJI$ $HASHTAG$ $HASHTAG$ $HASHTAG$ $HASHTAG$ $HASHTAG$ $HASHTAG$ $URL$","JUST LISTED! Garden Court in San Marcos! $360,00 Beds, Bath Fireplace Private Road Interested? Contact me! Info in bio! Stay Humble Work Hard Be Kind",just listed garden court san marcos beds bath fireplace private road interested contact info bio stay humble work hard be kind,just list garden court san marcos beds bath fireplace private road interested contact info bio stay humble work hard be kind,[],{},{},0,0,"['JustListed', 'RealBrokerLLC', 'RobbieSellsHillCountry', 'SanMarcosTX', 'SanMarcosHomes', 'SanMarcosRealEstate']",,[],0.7825
79,2021-01-30,Sat Jan 30 18:56:15 +0000 2021,1355590666584281103,miskaknapek,.dk .fi .de .no .se .cz,Not Geo-tagged,"b""@SergiCathy @SchiefferDr @darrenabrown ...\n\nPerhaps the NHS might have some experts in functional medicine. Should that not work, and should you find no private practitioner where you live, I'd be happy to pass along the contact info to some good Finnish practitioners.""","$MENTION$ $MENTION$ $MENTION$ ... Perhaps the NHS might have some experts in functional medicine. Should that not work, and should you find no private practitioner where you live, I'd be happy to pass along the contact info to some good Finnish practitioners.",".. Perhaps the NHS might have some experts in functional medicine. Should that not work, and should you find no private practitioner where you live, I'd be happy to pass along the contact info to some good Finnish practitioners.",perhaps nhs might experts functional medicine should work find private practitioner live happy pass along contact info good finnish practitioners,perhaps nhs may expert functional medicine should work find private practitioner live happy pass along contact info good finnish practitioner,[],{},{},0,1,[],,"['Cathy Sergi', 'Dr. med. Elisabeth Schieffer', 'Darren Brown💙 HIV Physiotherapist']",0.6597
87,2021-01-30,Sat Jan 30 18:21:07 +0000 2021,1355581824097943552,giorgiomomurder,zone,Not Geo-tagged,b'Every month there\xe2\x80\x99s another Cambridge Analytical type scandal in China where people try to take down private data surveillance and commodification of personal info',Every month theres another Cambridge Analytical type scandal in China where people try to take down private data surveillance and commodification of personal info,Every month there s another Cambridge Analytical type scandal in China where people try to take down private data surveillance and commodification of personal info,every month another cambridge analytical type scandal china people try take private data surveillance commodification personal info,every month another cambridge analytical type scandal china people try take private datum surveillance commodification personal info,[],{},{},0,13,[],,[],-0.4404
72,2021-01-30,Sat Jan 30 19:22:35 +0000 2021,1355597294008209416,AARPadvocates,United States,Not Geo-tagged,"b""The COVID-19 vaccine is free -- whether you have Medicare, private insurance or are uninsured. Here's a breakdown of how it will work behind the scenes and why you can expect to show your insurance card at your vaccine appointment. https://t.co/u0gv6AKcdX""","The COVID-19 vaccine is free -- whether you have Medicare, private insurance or are uninsured. Here's a breakdown of how it will work behind the scenes and why you can expect to show your insurance card at your vaccine appointment. $URL$","The COVID-19 vaccine is free -- whether you have Medicare, private insurance or are uninsured. Here's a breakdown of how it will work behind the scenes and why you can expect to show your insurance card at your vaccine appointment.",the covid vaccine free whether medicare private insurance uninsured here breakdown work behind scenes expect show insurance card vaccine appointment,the covid vaccine free whether medicare private insurance uninsure here breakdown work behind scene expect show insurance card vaccine appointment,[],{},{},7,14,[],http://spr.ly/6015HjWuV,[],0.5106
64,2021-01-30,Sat Jan 30 19:43:11 +0000 2021,1355602479468187649,maxcapacity_,it/its pronouns,Not Geo-tagged,"b""@IikeClockwork tbf it was still a very bad joke, her being trans (secretly) at the time can't exactly be blamed seeing as it was private information that nobody was privvy to. like, even if you think the joke was good or w/e, you can't really hold people accountable for info they didn't have""","$MENTION$ tbf it was still a very bad joke, her being trans (secretly) at the time can't exactly be blamed seeing as it was private information that nobody was privvy to. like, even if you think the joke was good or w/e, you can't really hold people accountable for info they didn't have","tbf it was still a very bad joke, her being trans (secretly) at the time ca not exactly be blamed seeing as it was private information that nobody was privvy to. like, even if you think the joke was good or w/e, you ca not really hold people accountable for info they did not have",tbf still bad joke trans secretly time exactly blamed seeing private information nobody privvy like even think joke good really hold people accountable info,tbf still bad joke tran secretly time exactly blame see private information nobody privvy like even think joke good really hold people accountable info,[],{},{},0,5,[],,['That’s Right'],0.7808
95,2021-01-30,Sat Jan 30 18:00:52 +0000 2021,1355576729318825987,Availbooking5,"Bogor, Jawa Barat",Not Geo-tagged,"b'ReadyBogor Booking &amp; vcs nya say, Open Private, Include &amp; Exclude Room, Info Price &amp; Rules DM/WA\xf0\x9f\x92\x8c\n\nhttps://t.co/8rAkVDla3i \n\n#openbobogor #AngelBogor #expobogor #availbogor #bogorBO #vcs #vcscolmek #vcscroot #vcsjilbab #bobogor #Bogornakal #Bogorbirahi #bispakbogor #bisyarbogor https://t.co/mH6URkVCnF'","ReadyBogor Booking &amp; vcs nya say, Open Private, Include &amp; Exclude Room, Info Price &amp; Rules DM/WA$EMOJI$ $URL$ $HASHTAG$ $HASHTAG$ $HASHTAG$ $HASHTAG$ $HASHTAG$ $HASHTAG$ $HASHTAG$ $HASHTAG$ $HASHTAG$ $HASHTAG$ $HASHTAG$ $HASHTAG$ $HASHTAG$ $HASHTAG$ $URL$","ReadyBogor Booking &amp; vcs nya say, Open Private, Include &amp; Exclude Room, Info Price &amp; Rules DM/WA",readybogor booking vcs nya say open private include exclude room info price rules dm wa,readybogor booking vcs nya say open private include exclude room info price rule dm wa,[],{},{},1,1,"['openbobogor', 'AngelBogor', 'expobogor', 'availbogor', 'bogorBO', 'vcs', 'vcscolmek', 'vcscroot', 'vcsjilbab', 'bobogor', 'Bogornakal', 'Bogorbirahi', 'bispakbogor', 'bisyarbogor']",https://wa.me/62895340487802,[],-0.2263
92,2021-01-30,Sat Jan 30 18:11:58 +0000 2021,1355579522456948736,JasGKaur,,Not Geo-tagged,b'Guys make sure we only get the info of our warriors through private DM. We don\xe2\x80\x99t want his family or him as a target as well know what government is capable of. #ModiPlanningFarmerGenocide #freeMandeepPunia #FreeRanjit https://t.co/Np5GEpHe2s',Guys make sure we only get the info of our warriors through private DM. We dont want his family or him as a target as well know what government is capable of. $HASHTAG$ $HASHTAG$ $HASHTAG$ $URL$,Guys make sure we only get the info of our warriors through private DM. We don t want his family or him as a target as well know what government is capable of.,guys make sure get info warriors private dm we want family target well know government capable,guy make sure get info warrior private dm want family target well know government capable,[],{},{},1,2,"['ModiPlanningFarmerGenocide', 'freeMandeepPunia', 'FreeRanjit']",,[],0.743
76,2021-01-30,Sat Jan 30 19:11:42 +0000 2021,1355594556654428166,gal_in_dis,}{North~America}{,Not Geo-tagged,"b'@LAMPCHC_info @HousingNowTO having a affordable home and pursuing post secondary for status Indians in Canada needs have never been met . residential schools failed, public schools are failing our kids and our kids cant afford private school supports and our stats suck in Canada #MentalHealthAwareness'","$MENTION$ $MENTION$ having a affordable home and pursuing post secondary for status Indians in Canada needs have never been met . residential schools failed, public schools are failing our kids and our kids cant afford private school supports and our stats suck in Canada $HASHTAG$","having a affordable home and pursuing post secondary for status Indians in Canada needs have never been met . residential schools failed, public schools are failing our kids and our kids cant afford private school supports and our stats suck in Canada",affordable home pursuing post secondary status indians canada needs never met residential schools failed public schools failing kids kids cant afford private school supports stats suck canada,affordable home pursue post secondary status indians canada need never meet residential school fail public school fail kid kid can not afford private school support stat suck canada,[],{},{},0,0,['MentalHealthAwareness'],,"['LAMPCHC_info', 'HousingNowTO']",-0.7906
88,2021-01-30,Sat Jan 30 18:19:45 +0000 2021,1355581483063406593,TraderAdept,United States,Not Geo-tagged,b'Shouldn\xe2\x80\x99t it make you think about that also? More expensive companies have gone private when there was smth they saw. The question is Why? management has all the inside info of the company &amp; if management didn\xe2\x80\x99t take this private I have to start thinking there is a reason...',Shouldnt it make you think about that also? More expensive companies have gone private when there was smth they saw. The question is Why? management has all the inside info of the company &amp; if management didnt take this private I have to start thinking there is a reason...,Shouldn t it make you think about that also? More expensive companies have gone private when there was smth they saw. The question is Why? management has all the inside info of the company &amp; if management didn t take this private I have to start thinking there is a reason..,shouldn make think also more expensive companies gone private smth saw the question why management inside info company management take private start thinking reason,shouldn make think also more expensive company go private smth see the question why management inside info company management take private start think reason,[],{},{},0,0,[],,[],0.0
96,2021-01-30,Sat Jan 30 17:59:59 +0000 2021,1355576507842895877,cltbeom,I’m grown 🔞,Not Geo-tagged,b'Idc if it his dad at his big age he posted mk private info. https://t.co/93V0Hv2NfU',Idc if it his dad at his big age he posted mk private info. $URL$,Idc if it his dad at his big age he posted mk private info.,idc dad big age posted private info,idc dad big age post private info,[],{},{},0,6,[],https://twitter.com/caliskindahood/status/1355551514761207814,[],0.0
98,2021-01-30,Sat Jan 30 17:54:45 +0000 2021,1355575192303652865,TeamYouTube,"San Bruno, CA",Not Geo-tagged,"b'@JulianRO (2/2) Lastly, we recommend deleting your tweet since it contains private info (full name). Reach back out if needed.'","$MENTION$ (2/2) Lastly, we recommend deleting your tweet since it contains private info (full name). Reach back out if needed.","(2/2) Lastly, we recommend deleting your tweet since it contains private info (full name). Reach back out if needed.",lastly recommend deleting tweet since contains private info full name reach back needed,lastly recommend delete tweet since contain private info full name reach back need,[],{},{},0,0,[],,['JulianRO and 98 others'],0.3818
94,2021-01-30,Sat Jan 30 18:04:00 +0000 2021,1355577518993117186,Manotick3,,Not Geo-tagged,b'@laurenboebert So you\xe2\x80\x99re in a tizzy because private citizen Yellen made a pile of money doing speeches and then disclosed all this info to the US office for Government Ethics but your ok with Trump not disclosing his tax returns &amp; maintaining ties to all his business etc. \xf0\x9f\xa5\xb4',$MENTION$ So youre in a tizzy because private citizen Yellen made a pile of money doing speeches and then disclosed all this info to the US office for Government Ethics but your ok with Trump not disclosing his tax returns &amp; maintaining ties to all his business etc.,So you re in a tizzy because private citizen Yellen made a pile of money doing speeches and then disclosed all this info to the US office for Government Ethics but your ok with Trump not disclosing his tax returns &amp; maintaining ties to all his business etc.,so tizzy private citizen yellen made pile money speeches disclosed info us office government ethics trump disclosing tax returns maintaining ties business etc,so tizzy private citizen yellen make pile money speech disclose info us office government ethic trump disclose tax return maintain tie business etc,[],{},{},0,0,[],,['Lauren Boebert'],0.4215
83,2021-01-30,Sat Jan 30 18:41:47 +0000 2021,1355587025555099648,ElSalahudeen,,Not Geo-tagged,b'U.S. Navy Officials Arrested for Selling Private Info of 9000+ People for Cryptocurrency\nhttps://t.co/pK0eADhgX2',U.S. Navy Officials Arrested for Selling Private Info of $NUMBER$+ People for Cryptocurrency $URL$,U.S. Navy Officials Arrested for Selling Private Info of + People for Cryptocurrency, s navy officials arrested selling private info people cryptocurrency,  s navy official arrest sell private info people cryptocurrency,[],{},{},0,0,[],https://cryptonews.net/459728/?utm_source=CryptoNews&utm_medium=app&utm_campaign=shared,[],-0.4767
101,2021-01-30,Sat Jan 30 17:53:13 +0000 2021,1355574806188584961,xKhiran,The Hidden Leaf Village ,Not Geo-tagged,"b'@richswae Leaking private info, getting your IP address and booting you internet offline'","$MENTION$ Leaking private info, getting your IP address and booting you internet offline","Leaking private info, getting your IP address and booting you internet offline",leaking private info getting ip address booting internet offline,leak private info get ip address boot internet offline,[],{},{},0,2,[],,['Rj ༄'],-0.128
109,2021-01-30,Sat Jan 30 17:35:29 +0000 2021,1355570342962601996,SendItToDame,@Home,Not Geo-tagged,b'@Popcorn_Perry @YouTube time to come off private. i gotta share this info',$MENTION$ $MENTION$ time to come off private. i gotta share this info,time to come off private. i gotta share this info,time come private got ta share info,time come private get ta share info,[],{},{},0,0,[],,"['John Perry', 'YouTube']",0.296
104,2021-01-30,Sat Jan 30 17:51:47 +0000 2021,1355574444761165833,GoldenGraduate,United Kingdom,Not Geo-tagged,"b'@Turquoiselady It was private, someone must have lied. I wonder if they got info from another supply teachers page?'","$MENTION$ It was private, someone must have lied. I wonder if they got info from another supply teachers page?","It was private, someone must have lied. I wonder if they got info from another supply teachers page?",it private someone must lied wonder got info another supply teachers page,private someone must lied wonder get info another supply teacher page,[],{},{},0,0,[],,['Turquoiselady 💙NHS'],-0.3818
37,2021-01-30,Sat Jan 30 21:30:31 +0000 2021,1355629491196837888,LaurieR40452745,,Not Geo-tagged,"b'@GillyMaldova @gtconway3d Trump ""has something"" on all the old GOP Leaders. They All spoke out PUBLICLY against him during his campaign &amp; election. But 1 ""private"" meeting with him and they all turned &amp; supported him. Russia interfered in 2016 election for Trump &amp; probably him blackmail info.'","$MENTION$ $MENTION$ Trump ""has something"" on all the old GOP Leaders. They All spoke out PUBLICLY against him during his campaign &amp; election. But $NUMBER$ ""private"" meeting with him and they all turned &amp; supported him. Russia interfered in $NUMBER$ election for Trump &amp; probably him blackmail info.","Trump ""has something"" on all the old GOP Leaders. They All spoke out PUBLICLY against him during his campaign &amp; election. But ""private"" meeting with him and they all turned &amp; supported him. Russia interfered in election for Trump &amp; probably him blackmail info.",trump something old gop leaders they all spoke publicly campaign election but private meeting turned supported russia interfered election trump probably blackmail info,trump something old gop leader all speak publicly campaign election but private meeting turn support russia interfere election trump probably blackmail info,[],{},{},0,3,[],,"['Gilly Maldova 🇺🇸', 'George Conway']",0.4497
107,2021-01-30,Sat Jan 30 17:39:47 +0000 2021,1355571424866533378,KwaraInfo,Nigeria,Not Geo-tagged,b'FG to concession 12 highways to private sectors https://t.co/I8rr8ibl7m',FG to concession $NUMBER$ highways to private sectors $URL$,FG to concession highways to private sectors,fg concession highways private sectors,fg concession highway private sector,[],{},{},0,0,[],https://www.ilorin.info/fullnews.php?id=28271,[],0.0
99,2021-01-30,Sat Jan 30 17:54:13 +0000 2021,1355575054805905410,KevinBa77752182,,Not Geo-tagged,"b'@profitwithant Hello! We have decided to allow 25-50 people into our private stock trading chat. All members were informed about and bought into GME and AMC, WEEKS AGO and are now reaping the benefits! DM me for more info ! Good luck!'","$MENTION$ Hello! We have decided to allow $NUMBER$-50 people into our private stock trading chat. All members were informed about and bought into GME and AMC, WEEKS AGO and are now reaping the benefits! DM me for more info ! Good luck!","Hello! We have decided to allow -50 people into our private stock trading chat. All members were informed about and bought into GME and AMC, WEEKS AGO and are now reaping the benefits! DM me for more info ! Good luck!",hello we decided allow people private stock trading chat all members informed bought gme amc weeks ago reaping benefits dm info good luck,hello decide allow people private stock trading chat all member inform buy gme amc week ago reap benefit dm info good luck,[],{},{},0,0,[],,['Alejandro 🇨🇴'],0.8964
100,2021-01-30,Sat Jan 30 17:54:10 +0000 2021,1355575042508263424,Dr_KOConnor,Chicago ,Not Geo-tagged,"b'@klsmolen @Larryferlazzo It\xe2\x80\x99s a privacy issue. The background check you have as an employee contains sensitive information that our government has collected &amp; shared. Your employer cannot then share that info for any purpose. But, of course, it is also ridiculous. They should find ways to make it work.'","$MENTION$ $MENTION$ Its a privacy issue. The background check you have as an employee contains sensitive information that our government has collected &amp; shared. Your employer cannot then share that info for any purpose. But, of course, it is also ridiculous. They should find ways to make it work.","It s a privacy issue. The background check you have as an employee contains sensitive information that our government has collected &amp; shared. Your employer cannot then share that info for any purpose. But, of course, it is also ridiculous. They should find ways to make it work.",it privacy issue the background check employee contains sensitive information government collected shared your employer share info purpose but course also ridiculous they find ways make work,privacy issue the background check employee contain sensitive information government collect share employer share info purpose but course also ridiculous find way make work,[],{},{},0,2,[],,"['Kim Smolen', 'Larry Ferlazzo']",-0.4577
103,2021-01-30,Sat Jan 30 17:51:56 +0000 2021,1355574482866483203,killuhua,10026225,Not Geo-tagged,b'@yshfae circa late 2018/early 2019 during a vacation/off period for the girls (essentially what should be private/unscheduled travel info) they followed her home and took videos/photos of her in the airport while she was on the phone with her dad and more in the same train as her',$MENTION$ circa late $NUMBER$/early $NUMBER$ during a vacation/off period for the girls (essentially what should be private/unscheduled travel info) they followed her home and took videos/photos of her in the airport while she was on the phone with her dad and more in the same train as her,circa late /early during a vacation/off period for the girls (essentially what should be private/unscheduled travel info) they followed her home and took videos/photos of her in the airport while she was on the phone with her dad and more in the same train as her,circa late early vacation period girls essentially private unscheduled travel info followed home took videos photos airport phone dad train,circa late early vacation period girl essentially private unscheduled travel info follow home take video photo airport phone dad train,[],{},{},0,2,[],,['밥 (ia📚)'],0.0
