s_no,date,created_at,id_str,screen_name,user_location,geo-tagged_place,tweet_text,tweet_tokenized,tweet_cleaned,tweet_filtered,tweet_lemmatized,tweet_mentioned_organizations,tweet_tags_classified,tweet_orgs_classified,retweet_count,fav_count,hashtags,urls,mentions,vader_polarity
102,2021-03-22,Mon Mar 22 18:53:00 +0000 2021,1374071631388282882,Portknockieloon,,Not Geo-tagged,"b""@FraserNelson Couple of points/questions\n1. Exactly how does the SNP have too much power? They don't even have a majority in Holyrood?\n\n2. Given you like digging into things. Are you going to investigate who on the c'tee leaked the draft findings and info about the private evidence?""",$MENTION$ Couple of points/questions $NUMBER$. Exactly how does the SNP have too much power? They don't even have a majority in Holyrood? $NUMBER$. Given you like digging into things. Are you going to investigate who on the c'tee leaked the draft findings and info about the private evidence?,Couple of points/questions . Exactly how does the SNP have too much power? They do not even have a majority in Holyrood? . Given you like digging into things. Are you going to investigate who on the c'tee leaked the draft findings and info about the private evidence?,couple points questions exactly snp much power they even majority holyrood given like digging things are going investigate tee leaked draft findings info private evidence,couple point question exactly snp much power even majority holyrood give like dig thing be go investigate tee leak draft finding info private evidence,[],{},{},0,3,[],,['Fraser Nelson'],0.1877
108,2021-03-22,Mon Mar 22 18:30:10 +0000 2021,1374065884831027207,AvBuyer,US/UK,Not Geo-tagged,b'1990 Astra/Gulfstream 1125 SP for sale by @DuncanAviation\n\nAFTT: 3893.8 | Engines on MSP Gold | June 2020 C-Check by Trimec | Excellent Ownership History | Motivated Seller\n\nFind more info and images here:\nhttps://t.co/IkazJ3jINj https://t.co/nCvnOsAa5n',$NUMBER$ Astra/Gulfstream $NUMBER$ SP for sale by $MENTION$ AFTT: $NUMBER$ | Engines on MSP Gold | June $NUMBER$ C-Check by Trimec | Excellent Ownership History | Motivated Seller Find more info and images here: $URL$ $URL$,Astra/Gulfstream SP for sale by AFTT | Engines on MSP Gold | June C-Check by Trimec | Excellent Ownership History | Motivated Seller Find more info and images here,astra gulfstream sp sale aftt engines msp gold june check trimec excellent ownership history motivated seller find info images,astra gulfstream sp sale aftt engine msp gold june check trimec excellent ownership history motivate seller find info image,[],{},{},0,2,[],http://ow.ly/ItZb50E5irr,['Duncan Aviation'],0.7717
97,2021-03-22,Mon Mar 22 19:00:49 +0000 2021,1374073597875036162,blakngold86,"Arizona, USA",Not Geo-tagged,"b'This is where the problem lies.  Let them get away with stupid sh!t, they will attempt more stupid sh!t.  \nThe \xe2\x80\x9cgovernment\xe2\x80\x9d should never \xe2\x80\x9cencourage\xe2\x80\x9d anyone to do anything when it comes to our health.  That is OUR private Primary Care Physician\xe2\x80\x99s job.  Also private info period. https://t.co/se3aEmIcDz'","This is where the problem lies. Let them get away with stupid sh!t, they will attempt more stupid sh!t. The government should never encourage anyone to do anything when it comes to our health. That is OUR private Primary Care Physicians job. Also private info period. $URL$","This is where the problem lies. Let them get away with stupid sh!t, they will attempt more stupid sh!t. The government should never encourage anyone to do anything when it comes to our health. That is OUR private Primary Care Physician s job. Also private info period.",this problem lies let get away stupid attempt stupid the government never encourage anyone anything comes health that our private primary care physician job also private info period,this problem lie let get away stupid attempt stupid the government never encourage anyone anything come health that private primary care physician job also private info period,[],{},{},1,5,[],https://twitter.com/politicsforali/status/1373765725773574149,[],-0.9132
112,2021-03-22,Mon Mar 22 18:07:20 +0000 2021,1374060138148081665,aiotex,Heaven,Not Geo-tagged,"b""@PylonsPC Pretty sure it's ddos that makes it internet die\nAnd doxxing is posting IP and private info but I could be wrong""",$MENTION$ Pretty sure it's ddos that makes it internet die And doxxing is posting IP and private info but I could be wrong,Pretty sure it's ddos that makes it internet die And doxxing is posting IP and private info but I could be wrong,pretty sure ddos makes internet die and doxxing posting ip private info could wrong,pretty sure ddos make internet die and doxxe post ip private info could wrong,[],{},{},0,0,[],,['Pylons'],-0.5927
119,2021-03-22,Mon Mar 22 17:46:52 +0000 2021,1374054987786039297,Allstate,,Not Geo-tagged,"b'@elliiiiih We are sorry to hear this. Please private message us a bit more info, so we can look into this. ^SE https://t.co/vYIVrwsUyL'","$MENTION$ We are sorry to hear this. Please private message us a bit more info, so we can look into this. ^SE $URL$","We are sorry to hear this. Please private message us a bit more info, so we can look into this. ^SE",we sorry hear please private message bit info look se,sorry hear please private message bit info look se,[],{},{},0,0,[],https://twitter.com/messages/compose?recipient_id=14275290,['ˢᶜᵒʳᵖⁱᵒ ᴷⁱⁿᵍ'],0.3237
114,2021-03-22,Mon Mar 22 17:58:37 +0000 2021,1374057945382719493,Allstate,,Not Geo-tagged,"b'@heatherpeno We are sorry to hear this. Please private message us a bit more info, so we can look into this. ^SE https://t.co/vYIVrwsUyL'","$MENTION$ We are sorry to hear this. Please private message us a bit more info, so we can look into this. ^SE $URL$","We are sorry to hear this. Please private message us a bit more info, so we can look into this. ^SE",we sorry hear please private message bit info look se,sorry hear please private message bit info look se,[],{},{},0,0,[],https://twitter.com/messages/compose?recipient_id=14275290,"['“Nicky""']",0.3237
100,2021-03-22,Mon Mar 22 18:56:11 +0000 2021,1374072432428994560,LorelleNot,,Not Geo-tagged,"b'HELLO, my friends and I are going to start a Twitter group chat if you would like to join you must:\n\n1. both of us  following each other\n\n2. NO swearing, dirty language, sending people threats, and asking private info questions \n\n3. Be kind and respectful to all members\n\nThank u!'","HELLO, my friends and I are going to start a Twitter group chat if you would like to join you must: $NUMBER$. both of us following each other $NUMBER$. NO swearing, dirty language, sending people threats, and asking private info questions $NUMBER$. Be kind and respectful to all members Thank u!","HELLO, my friends and I are going to start a Twitter group chat if you would like to join you must . both of us following each other . NO swearing, dirty language, sending people threats, and asking private info questions . Be kind and respectful to all members Thank u!",hello friends going start twitter group chat would like join must us following no swearing dirty language sending people threats asking private info questions be kind respectful members thank,hello friend go start twitter group chat would like join must follow no swear dirty language send people threat ask private info question be kind respectful member thank,[],{},{},3,4,[],,[],0.9393
124,2021-03-22,Mon Mar 22 17:41:27 +0000 2021,1374053626394595332,DxstKiller,,Not Geo-tagged,"b""@s8ns_bby They have filed police reports but for obvious reasons they can't show them since they contain private info.""",$MENTION$ They have filed police reports but for obvious reasons they can't show them since they contain private info.,They have filed police reports but for obvious reasons they ca not show them since they contain private info.,they filed police reports obvious reasons show since contain private info,file police report obvious reason show since contain private info,[],{},{},0,0,[],,['Cuddle bunny'],0.0
117,2021-03-22,Mon Mar 22 17:50:09 +0000 2021,1374055813224951814,SophiaTesfaye,Dub Nation,Not Geo-tagged,b'@brianeharrison Are you suing as a private citizen? Can I ask what standing you claim to have? Is there a link with more info on your lawsuit?',$MENTION$ Are you suing as a private citizen? Can I ask what standing you claim to have? Is there a link with more info on your lawsuit?,Are you suing as a private citizen? Can I ask what standing you claim to have? Is there a link with more info on your lawsuit?,are suing private citizen can ask standing claim is link info lawsuit,be sue private citizen can ask stand claim be link info lawsuit,[],{},{},1,30,[],,['Brian Harrison'],-0.5484
125,2021-03-22,Mon Mar 22 17:39:44 +0000 2021,1374053192292519941,Girasol_Mary,WeaTheMoneyResides,Not Geo-tagged,b'Anyways. I\xe2\x80\x99ll be creating a slack channel for myself for people that want private info.',Anyways. Ill be creating a slack channel for myself for people that want private info.,Anyways. I ll be creating a slack channel for myself for people that want private info.,anyways creating slack channel people want private info,anyways create slack channel people want private info,[],{},{},0,30,[],,[],0.3612
106,2021-03-22,Mon Mar 22 18:35:28 +0000 2021,1374067217239773194,ShayleneNeumann,"Ridgefield, CT",Not Geo-tagged,"b'Majestic Colonial 7,4600 SQ FT home located on 15 gorgeous acres with a gated entrance in South Salem, NY. This stunning home has 5 bedrooms with 5 1/2 bathrooms. $2,950,000. Contact Shaylene Neumann for a private showing 203.948.4655. More info: https://t.co/PRhUo2TMsn https://t.co/OBB8jCTFVv'","Majestic Colonial $NUMBER$ SQ FT home located on $NUMBER$ gorgeous acres with a gated entrance in South Salem, NY. This stunning home has $NUMBER$ bedrooms with $NUMBER$ $NUMBER$/2 bathrooms. $2,950,000. Contact Shaylene Neumann for a private showing $NUMBER$. More info: $URL$ $URL$","Majestic Colonial SQ FT home located on gorgeous acres with a gated entrance in South Salem, NY. This stunning home has bedrooms with /2 bathrooms. $2,950,00. Contact Shaylene Neumann for a private showing . More info",majestic colonial sq ft home located gorgeous acres gated entrance south salem ny this stunning home bedrooms bathrooms contact shaylene neumann private showing more info,majestic colonial sq ft home locate gorgeous acre gate entrance south salem ny this stunning home bedroom bathroom contact shaylene neumann private show more info,[],{},{},0,0,[],https://bit.ly/315DHie,[],0.7906
109,2021-03-22,Mon Mar 22 18:25:59 +0000 2021,1374064832769560581,Figzet,"Lovely Old Hickory Tree Cavity Nest with Endless-Party-Patio in #Acornia, Land of Squirrels & Other Forest Friends",Not Geo-tagged,"b'@adityadickysin &lt;waves her #BearForTheWin! banner&gt;\n\n&gt;""bear was not supposed to fight back so aggressively""\n\n &lt;nods&gt;\n\nBattle Fate Deity @MMMRNG1 works in mysterious (&amp; often annoyin\') ways.\n\n&lt;opens Official PRIVATE #MMM Notebook of PERTINENT INFO and enters PERTINENT BEAR &amp; TIGER INFO&gt;\n\n #2021MMM https://t.co/upqBwSgMYN'","$MENTION$ &lt;waves her $HASHTAG$! banner&gt; &gt;""bear was not supposed to fight back so aggressively"" &lt;nods&gt; Battle Fate Deity $MENTION$ works in mysterious (&amp; often annoyin') ways. &lt;opens Official PRIVATE $HASHTAG$ Notebook of PERTINENT INFO and enters PERTINENT BEAR &amp; TIGER INFO&gt; $HASHTAG$ $URL$","&lt;waves her ! banner&gt; &gt;""bear was not supposed to fight back so aggressively"" &lt;nods&gt; Battle Fate Deity works in mysterious (&amp; often annoyin') ways. &lt;opens Official PRIVATE Notebook of PERTINENT INFO and enters PERTINENT BEAR &amp; TIGER INFO&gt;",waves banner bear supposed fight back aggressively nods battle fate deity works mysterious often annoyin ways opens official private notebook pertinent info enters pertinent bear tiger info,wave banner bear suppose fight back aggressively nod battle fate deity work mysterious often annoyin way open official private notebook pertinent info enter pertinent bear tiger info,[],{},{},0,0,"['BearForTheWin', 'MMM', '2021MMM']",,"['adityadickysingh', 'MMMRNG']",-0.5521
104,2021-03-22,Mon Mar 22 18:40:58 +0000 2021,1374068601775386630,ArkhamSmoke,"Newfoundland and Labrador, Can",Not Geo-tagged,"b'Revisited some pictures from an unexpected urbex trip a few years back. Many personal effects and stories left to be told here. We were able to uncover a little info about the property, but in urbex spirt it will remain private #urbex @buymeacoffee \n\nhttps://t.co/pPyBq1Y6l3'","Revisited some pictures from an unexpected urbex trip a few years back. Many personal effects and stories left to be told here. We were able to uncover a little info about the property, but in urbex spirt it will remain private $HASHTAG$ $MENTION$ $URL$","Revisited some pictures from an unexpected urbex trip a few years back. Many personal effects and stories left to be told here. We were able to uncover a little info about the property, but in urbex spirt it will remain private",revisited pictures unexpected urbex trip years back many personal effects stories left told we able uncover little info property urbex spirt remain private,revisited picture unexpected urbex trip year back many personal effect story leave tell able uncover little info property urbex spirt remain private,[],{},{},0,2,['urbex'],https://www.buymeacoffee.com/arkhamshutter/stories-untold,['Buy Me a Coffee'],0.0
142,2021-03-22,Mon Mar 22 16:57:15 +0000 2021,1374042500722159617,SPSSoCal,Southern California,Not Geo-tagged,b'@SomebodyinSoCal Even a vehicle plate is considered private info now.',$MENTION$ Even a vehicle plate is considered private info now.,Even a vehicle plate is considered private info now.,even vehicle plate considered private info,even vehicle plate consider private info,[],{},{},0,0,[],,['Chester Brown'],0.0
111,2021-03-22,Mon Mar 22 18:09:36 +0000 2021,1374060707352768514,Dkmorris0204,"Washington, USA",Not Geo-tagged,b'@LaurenGruel @BeanK511 Well I don\xe2\x80\x99t eat them anyway but that is just stupid. Does anyone realize no one has the legal right to ask you or get info about your private health without your permission?  People are so stupid.  It\xe2\x80\x99s called the Hippa Laws!   Why not just give them your SS number as well! https://t.co/Jr0o9mNgU7',$MENTION$ $MENTION$ Well I dont eat them anyway but that is just stupid. Does anyone realize no one has the legal right to ask you or get info about your private health without your permission? People are so stupid. Its called the Hippa Laws! Why not just give them your SS number as well! $URL$,Well I don t eat them anyway but that is just stupid. Does anyone realize no one has the legal right to ask you or get info about your private health without your permission? People are so stupid. It s called the Hippa Laws! Why not just give them your SS number as well!,well eat anyway stupid does anyone realize one legal right ask get info private health without permission people stupid it called hippa laws why give ss number well,well eat anyway stupid do anyone realize one legal right ask get info private health without permission people stupid call hippa law why give ss number well,[],{},{},0,0,[],,"['Lauren', 'Kathryn Beank511⚔️']",-0.8918
138,2021-03-22,Mon Mar 22 17:06:31 +0000 2021,1374044832193245186,ugnews24,Kampala - Uganda,Not Geo-tagged,"b'Makerere, private firm sign deal to make anti-tick\xc2\xa0vaccine https://t.co/LuOpC2KuDn'","Makerere, private firm sign deal to make anti-tickvaccine $URL$","Makerere, private firm sign deal to make anti-tick vaccine",makerere private firm sign deal make anti tick vaccine,makerere private firm sign deal make anti tick vaccine,[],{},{},0,0,[],https://ugnews24.info/uganda-news/makerere-private-firm-sign-deal-to-make-anti-tick-vaccine/,[],0.0
120,2021-03-22,Mon Mar 22 17:46:13 +0000 2021,1374054823855861767,nuvonetwork,"Burlington, Ontario",Not Geo-tagged,"b'Tired of WORKING FROM HOME, and sharing WIFI with the family? \n\nCome for a tour of NUVO Network and check out our modern, #privateoffices STARTING AT $800!\n\nASK US how you can get UP TO A MONTH FREE with an #office rental at NUVO.\n\nFor more info:\nhttps://t.co/b0TfmxJZcQ https://t.co/PLSAnBC7xw'","Tired of WORKING FROM HOME, and sharing WIFI with the family? Come for a tour of NUVO Network and check out our modern, $HASHTAG$ STARTING AT $800! ASK US how you can get UP TO A MONTH FREE with an $HASHTAG$ rental at NUVO. For more info: $URL$ $URL$","Tired of WORKING FROM HOME, and sharing WIFI with the family? Come for a tour of NUVO Network and check out our modern, STARTING AT $800! ASK US how you can get UP TO A MONTH FREE with an rental at NUVO. For more info",tired working from home sharing wifi family come tour nuvo network check modern starting at ask us get up to month free rental nuvo for info,tired work from home sharing wifi family come tour nuvo network check modern starting at ask get up to month free rental nuvo for info,[],{},{},0,0,"['privateoffices', 'office']",https://www.nuvonetwork.com/private-offices,[],0.6399
118,2021-03-22,Mon Mar 22 17:50:04 +0000 2021,1374055795000754180,Heavyciviljobs1,"Houston, TX",Not Geo-tagged,"b'Heavy civil project manager position\n\nExperience in grading \n\nChattanooga, TN based company &amp; projects\n\nPrivate and DOT work\n\nSalary, bonus, truck, medical, 401k\n\nContact me for more info'","Heavy civil project manager position Experience in grading Chattanooga, TN based company &amp; projects Private and DOT work Salary, bonus, truck, medical, $NUMBER$k Contact me for more info","Heavy civil project manager position Experience in grading Chattanooga, TN based company &amp; projects Private and DOT work Salary, bonus, truck, medical, k Contact me for more info",heavy civil project manager position experience grading chattanooga tn based company projects private dot work salary bonus truck medical contact info,heavy civil project manager position experience grade chattanooga tn base company project private dot work salary bonus truck medical contact info,[],{},{},0,0,[],,[],0.5423
126,2021-03-22,Mon Mar 22 17:37:39 +0000 2021,1374052667689959424,RafMBatista,"Chicago, USA",Not Geo-tagged,"b""@flesherdan I think the more reasonable argument is that when you host the marketplace AND compete in it you have info on your competitors. Using that private info to compete could lead to inefficient competition or something like that.. but that's not what's being said in this video!""",$MENTION$ I think the more reasonable argument is that when you host the marketplace AND compete in it you have info on your competitors. Using that private info to compete could lead to inefficient competition or something like that.. but that's not what's being said in this video!,I think the more reasonable argument is that when you host the marketplace AND compete in it you have info on your competitors. Using that private info to compete could lead to inefficient competition or something like that.. but that's not what's being said in this video!,think reasonable argument host marketplace and compete info competitors using private info compete could lead inefficient competition something like said video,think reasonable argument host marketplace and compete info competitor use private info compete could lead inefficient competition something like say video,[],{},{},0,0,[],,['Dan Flesher'],-0.1106
122,2021-03-22,Mon Mar 22 17:44:34 +0000 2021,1374054410595135491,KillaArt14,"San Francisco, CA",Not Geo-tagged,"b""@chantellllylace @TrueBlackPower Posting every 10 minutes, can\xe2\x80\x99t go by without updating your status. Posting her every move or revealing info that\xe2\x80\x99s best kept private. It shows she can't stay away from her phone""","$MENTION$ $MENTION$ Posting every $NUMBER$ minutes, cant go by without updating your status. Posting her every move or revealing info thats best kept private. It shows she can't stay away from her phone","Posting every minutes, can t go by without updating your status. Posting her every move or revealing info that s best kept private. It shows she ca not stay away from her phone",posting every minutes without updating status posting every move revealing info best kept private it shows stay away phone,post every minute without update status post every move reveal info well keep private show stay away phone,[],{},{},0,0,[],,"['ChessNotCheckers👑✨', 'Kuwpa']",0.6369
130,2021-03-22,Mon Mar 22 17:30:32 +0000 2021,1374050876424298497,mermaidqueen_98,,Not Geo-tagged,b'He probably didn\xe2\x80\x99t want private info he gave to these people out there but now it is. I felt wrong looking at the video that was meant for a person. And not the whole world.',He probably didnt want private info he gave to these people out there but now it is. I felt wrong looking at the video that was meant for a person. And not the whole world.,He probably didn t want private info he gave to these people out there but now it is. I felt wrong looking at the video that was meant for a person. And not the whole world.,he probably want private info gave people felt wrong looking video meant person and whole world,probably want private info give people feel wrong look video mean person and whole world,[],{},{},0,0,[],,[],-0.6124
115,2021-03-22,Mon Mar 22 17:53:07 +0000 2021,1374056562554179587,hidingfromcra,,Not Geo-tagged,"b""@RobertJudd4 @heraldscotland There could be myriad reasons none of which affecting the course of justice. (Private info/names etc.) Andrew Neil is pouring doubt on an independent investigation so people like YOU will believe it's a lie. Please start thinking for yourself.""",$MENTION$ $MENTION$ There could be myriad reasons none of which affecting the course of justice. (Private info/names etc.) Andrew Neil is pouring doubt on an independent investigation so people like YOU will believe it's a lie. Please start thinking for yourself.,There could be myriad reasons none of which affecting the course of justice. (Private info/names etc.) Andrew Neil is pouring doubt on an independent investigation so people like YOU will believe it's a lie. Please start thinking for yourself.,there could myriad reasons none affecting course justice private info names etc andrew neil pouring doubt independent investigation people like you believe lie please start thinking,there could myriad reason none affect course justice private info name etc andrew neil pour doubt independent investigation people like believe lie please start think,[],{},{},0,0,[],,"['Rufus', 'The Herald']",0.7165
147,2021-03-22,Mon Mar 22 16:42:44 +0000 2021,1374038847676416004,Allstate,,Not Geo-tagged,"b'@ashleigharndt We are sorry to hear this. Please private message us a bit more info, so we can look into this. ^AG https://t.co/vYIVrwsUyL'","$MENTION$ We are sorry to hear this. Please private message us a bit more info, so we can look into this. ^AG $URL$","We are sorry to hear this. Please private message us a bit more info, so we can look into this. ^AG",we sorry hear please private message bit info look ag,sorry hear please private message bit info look ag,[],{},{},0,0,[],https://twitter.com/messages/compose?recipient_id=14275290,['ashleigh'],0.3237
143,2021-03-22,Mon Mar 22 16:56:30 +0000 2021,1374042313350115337,TheHimboF10Y,He/Him,Not Geo-tagged,b'@claymorespears @Jonathan_Bare @Chase_Hend I don\xe2\x80\x99t hear the left saying about private healthcare being evil but if your DM\xe2\x80\x99s are open I\xe2\x80\x99m happy to send you some info and also explain how the NHS works',$MENTION$ $MENTION$ $MENTION$ I dont hear the left saying about private healthcare being evil but if your DMs are open Im happy to send you some info and also explain how the NHS works,I don t hear the left saying about private healthcare being evil but if your DM s are open I m happy to send you some info and also explain how the NHS works,hear left saying private healthcare evil dm open happy send info also explain nhs works,hear leave say private healthcare evil dm open happy send info also explain nhs work,[],{},{},0,0,[],,"['Clay not Clayton', '🌽Saiyan_Roar🌽', 'Chase Hendrickson 🌿']",0.5187
153,2021-03-22,Mon Mar 22 16:33:17 +0000 2021,1374036468495224835,AugustTownez,Denton Texas,Not Geo-tagged,b'@JonJonGamesSTU @Firegamer1su1 @TeamYouTube funny that the fixed those faster than the private info leaks',$MENTION$ $MENTION$ $MENTION$ funny that the fixed those faster than the private info leaks,funny that the fixed those faster than the private info leaks,funny fixed faster private info leaks,funny fixed fast private info leak,[],{},{},0,0,[],,"['Jonathan Morrison', 'Firegamer', 'TeamYouTube']",0.4404
