s_no,date,created_at,id_str,screen_name,user_location,geo-tagged_place,tweet_text,tweet_tokenized,tweet_cleaned,tweet_filtered,tweet_lemmatized,tweet_mentioned_organizations,tweet_tags_classified,tweet_orgs_classified,retweet_count,fav_count,hashtags,urls,mentions,vader_polarity
5,2021-01-30,Sat Jan 30 23:39:37 +0000 2021,1355661978023456772,Chloemcgee00,Missing in action,Not Geo-tagged,b'For real that\xe2\x80\x99s my private info also https://t.co/wsLeruIZUr',For real thats my private info also $URL$,For real that s my private info also,for real private info also,for real private info also,[],{},{},0,0,[],https://twitter.com/coriannamarie_/status/1355074346062995456,[],0.0
2,2021-01-30,Sat Jan 30 23:47:47 +0000 2021,1355664033857331203,notimeforyou80,,Not Geo-tagged,b'@MariekeWalsh They can give out private info to a contracted company?',$MENTION$ They can give out private info to a contracted company?,They can give out private info to a contracted company?,they give private info contracted company,give private info contract company,[],{},{},0,0,[],,['Marieke Walsh'],0.0
28,2021-01-30,Sat Jan 30 21:58:09 +0000 2021,1355636443230556161,Cyclops_Trader,,Not Geo-tagged,b'Pics and info taken from @stockswami private post.',Pics and info taken from $MENTION$ private post.,Pics and info taken from private post.,pics info taken private post,pics info take private post,[],{},{},0,12,[],,['Stock Swami'],0.0
1,2021-01-30,Sat Jan 30 23:48:30 +0000 2021,1355664212857643014,munikxD,any prns carrd byf,Not Geo-tagged,b'@akutsuke i mean its not like it has someones Private private info its just like age prns and their name',$MENTION$ i mean its not like it has someones Private private info its just like age prns and their name,i mean its not like it has someones Private private info its just like age prns and their name,mean like someones private private info like age prns name,mean like someone private private info like age prn name,[],{},{},0,0,[],,['keiji⁷'],0.1002
12,2021-01-30,Sat Jan 30 23:00:48 +0000 2021,1355652212110872576,MrMass93,,Not Geo-tagged,b'Who\xe2\x80\x99s going to hand over private info/data to social media platforms for them to make even more profit through advertising https://t.co/V6PO0IBQbz',Whos going to hand over private info/data to social media platforms for them to make even more profit through advertising $URL$,Who s going to hand over private info/data to social media platforms for them to make even more profit through advertising,who going hand private info data social media platforms make even profit advertising,who go hand private info data social medium platform make even profit advertising,[],{},{},1,0,[],https://twitter.com/frankirby/status/1355629013398654977,[],0.7501
32,2021-01-30,Sat Jan 30 21:53:48 +0000 2021,1355635349637058563,DonnaFigurski,"Phoenix, AZ area",Not Geo-tagged,"b""@KaitlynLeann17, I sent you a private message because I didn't want to put all this info here. https://t.co/P6adqGTh8A""","$MENTION$, I sent you a private message because I didn't want to put all this info here. $URL$",", I sent you a private message because I did not want to put all this info here.",sent private message want put info,send private message want put info,[],{},{},0,0,[],https://twitter.com/KaitlynLeann17/status/1355634326470356992,['Kaitlyn Leann Sanchez'],-0.0572
7,2021-01-30,Sat Jan 30 23:30:00 +0000 2021,1355659558287532033,TriviaAD,"Bergen County, NJ",Not Geo-tagged,"b'We\xe2\x80\x99re here to host your\xc2\xa0virtual trivia event for your corporate, private, birthday or any other reason for entertainment with your colleagues, friends or family. Reach out to info [at] https://t.co/fXpcVcQabc for more details! https://t.co/P8LkjaUPXk'","Were here to host yourvirtual trivia event for your corporate, private, birthday or any other reason for entertainment with your colleagues, friends or family. Reach out to info [at] $URL$ for more details! $URL$","We re here to host your virtual trivia event for your corporate, private, birthday or any other reason for entertainment with your colleagues, friends or family. Reach out to info [at] for more details!",we host virtual trivia event corporate private birthday reason entertainment colleagues friends family reach info details,host virtual trivium event corporate private birthday reason entertainment colleague friend family reach info detail,[],{},{},0,1,[],http://triviaad.com,[],0.7424
22,2021-01-30,Sat Jan 30 22:24:12 +0000 2021,1355643000328658944,TheAncientWorld,"San Francisco, CA",Not Geo-tagged,b'@sinope61 Currently up for private sale. Info below. https://t.co/LFU62ZHNRm',$MENTION$ Currently up for private sale. Info below. $URL$,Currently up for private sale. Info below.,currently private sale info,currently private sale info,[],{},{},0,0,[],,['Özgür Özaslan'],0.0
21,2021-01-30,Sat Jan 30 22:25:39 +0000 2021,1355643365082230787,HaleyJean_Tho,"Montréal, Québec",Not Geo-tagged,"b'Posting this not just to say THANK YOU to our Nitro Boosters, but I\xe2\x80\x99m also accepting more people into the server. It\xe2\x80\x99s private and only for nice cool people \xf0\x9f\x98\xa4\xf0\x9f\x98\xa4\n\nWe don\xe2\x80\x99t allow edgy jokes and we\xe2\x80\x99re all supportive of one another no matter our follower counts. Dm for info &gt;&gt;&gt;:D https://t.co/IP3Z0xiYxx'","Posting this not just to say THANK YOU to our Nitro Boosters, but Im also accepting more people into the server. Its private and only for nice cool people $EMOJI$$EMOJI$ We dont allow edgy jokes and were all supportive of one another no matter our follower counts. Dm for info &gt;&gt;&gt;:D $URL$","Posting this not just to say THANK YOU to our Nitro Boosters, but I m also accepting more people into the server. It s private and only for nice cool people We don t allow edgy jokes and we re all supportive of one another no matter our follower counts. Dm for info &gt;&gt;&gt; D",posting say thank you nitro boosters also accepting people server it private nice cool people we allow edgy jokes supportive one another matter follower counts dm info ,posting say thank nitro booster also accept people server private nice cool people allow edgy joke supportive one another matter follower count dm info,[],{},{},0,28,[],,[],0.9565
36,2021-01-30,Sat Jan 30 21:32:42 +0000 2021,1355630040973766664,retweetnews2019,,Not Geo-tagged,b'Private investigator Jack Palladino on life support after attempted robbery https://t.co/9QBQBOCwm5 https://t.co/1FxEdSB65X',Private investigator Jack Palladino on life support after attempted robbery $URL$ $URL$,Private investigator Jack Palladino on life support after attempted robbery,private investigator jack palladino life support attempted robbery,private investigator jack palladino life support attempt robbery,[],{},{},0,0,[],https://ift.tt/3pFsyja,[],0.4019
33,2021-01-30,Sat Jan 30 21:42:37 +0000 2021,1355632536072892418,isushitrash,not real - parody - ♡ ノワール ♡,Not Geo-tagged,b'@bitchjoji thank you. that was private info. \xf0\x9f\xa4\xab',$MENTION$ thank you. that was private info.,thank you. that was private info.,thank private info,thank private info,[],{},{},0,0,[],,['ᴺᴼᴵᴿ ☽✧'],0.3612
27,2021-01-30,Sat Jan 30 22:08:41 +0000 2021,1355639095360446465,cereta,"Champaign, IL",Not Geo-tagged,b'Dude. I very rarely support doxxing/sharing private info of people I utterly loathe. WTF? https://t.co/bL1CDfGBk8',Dude. I very rarely support doxxing/sharing private info of people I utterly loathe. WTF? $URL$,Dude. I very rarely support doxxing/sharing private info of people I utterly loathe. WTF?,dude rarely support doxxing sharing private info people utterly loathe wtf,dude rarely support doxxe share private info people utterly loathe wtf,[],{},{},0,3,[],https://twitter.com/parlertakes/status/1355638572347482115,[],-0.8966
4,2021-01-30,Sat Jan 30 23:41:53 +0000 2021,1355662550587875334,geargolem75,Jersey,Not Geo-tagged,"b""@rezzardiP After he outted himself as an anti-vaxxer and tried doxxing that chick and posted her private info, it's time he loses lol""","$MENTION$ After he outted himself as an anti-vaxxer and tried doxxing that chick and posted her private info, it's time he loses lol","After he outted himself as an anti-vaxxer and tried doxxing that chick and posted her private info, it's time he loses lol",after outted anti vaxxer tried doxxing chick posted private info time loses lol,after outte anti vaxxer try doxxe chick post private info time lose lol,[],{},{},0,2,[],,['rizzo'],0.128
13,2021-01-30,Sat Jan 30 22:59:29 +0000 2021,1355651878076506121,MedleyRandall,,Not Geo-tagged,"b'@CoolGaySkeleton Be careful with these. May look harmless, but could give those with nefarious intentions the info they need to guess passwords and private info.'","$MENTION$ Be careful with these. May look harmless, but could give those with nefarious intentions the info they need to guess passwords and private info.","Be careful with these. May look harmless, but could give those with nefarious intentions the info they need to guess passwords and private info.",be careful may look harmless could give nefarious intentions info need guess passwords private info,be careful may look harmless could give nefarious intention info need guess password private info,[],{},{},0,0,[],,['Cool Gay Skeleton \U0001f9cb\U0001f9cb\U0001f9cb'],0.2023
30,2021-01-30,Sat Jan 30 21:54:49 +0000 2021,1355635606693376004,StewardessChick,Los Angeles ,"Los Angeles, CA, US","b'@will_blax If it\xe2\x80\x99s a private issue to where she won\xe2\x80\x99t tell him the details of who was bullying her then it should remain private with the \xe2\x80\x9ccelebrations\xe2\x80\x9d, involving him without disclosing that info is twisted as hell to me.'","$MENTION$ If its a private issue to where she wont tell him the details of who was bullying her then it should remain private with the celebrations, involving him without disclosing that info is twisted as hell to me.","If it s a private issue to where she won t tell him the details of who was bullying her then it should remain private with the celebrations , involving him without disclosing that info is twisted as hell to me.",if private issue tell details bullying remain private celebrations involving without disclosing info twisted hell,if private issue tell detail bully remain private celebration involve without disclose info twist hell,[],{},{},0,0,[],,['Will Blax'],-0.7003
8,2021-01-30,Sat Jan 30 23:27:31 +0000 2021,1355658934879662080,KOSTerru,,Not Geo-tagged,"b'@Homeless_Info @sohoite @BorisJohnson @EddieHughes4WN @JonathanGlanz @twocitiesnickie @CampaignTim @pancho_lewis @KarenPBuckMP @patricklilley @Streetcamper83 Impact of covid 19 on homelessness and the private sector, Eddie couldn\xe2\x80\x99t give any data whatsoever on the number of homeless and those with no recourse to public funds. All he could offer was charities help'","$MENTION$ $MENTION$ $MENTION$ $MENTION$ $MENTION$ $MENTION$ $MENTION$ $MENTION$ $MENTION$ $MENTION$ $MENTION$ Impact of covid $NUMBER$ on homelessness and the private sector, Eddie couldnt give any data whatsoever on the number of homeless and those with no recourse to public funds. All he could offer was charities help","Impact of covid on homelessness and the private sector, Eddie couldn t give any data whatsoever on the number of homeless and those with no recourse to public funds. All he could offer was charities help",impact covid homelessness private sector eddie give data whatsoever number homeless recourse public funds all could offer charities help,impact covid homelessness private sector eddie give datum whatsoever number homeless recourse public fund all could offer charity help,[],{},{},0,0,[],,"['ᒪOᑎᗪOᑎ ᕼOᗰEᒪEᔕᔕ IᑎᖴO', 'Sohoite', 'Boris Johnson', 'Eddie Hughes MP', 'Jonathan Glanz', 'Nickie Aiken MP #TwoCities', 'Cllr Timothy Barnes', 'Pancho Lewis', 'Karen Buck', 'PatrickLilley', 'MartinStreet']",0.6124
40,2021-01-30,Sat Jan 30 21:23:03 +0000 2021,1355627612694056964,Omagus,"Durham, NC",Not Geo-tagged,b'@bexangell Info that you can share on Twitter dot com or is it too private?',$MENTION$ Info that you can share on Twitter dot com or is it too private?,Info that you can share on Twitter dot com or is it too private?,info share twitter dot com private,info share twitter dot com private,[],{},{},0,0,[],,['Rebecca Angell'],0.296
47,2021-01-30,Sat Jan 30 21:00:33 +0000 2021,1355621950715002883,ouratlanticduo,United Kingdom,Not Geo-tagged,b'Private Valentine\xe2\x80\x99s Day/evening gig anyone?! DM/reply to this tweet for more info- available anywhere in the world where zoom works!! https://t.co/oZF6WXYXYb',Private Valentines Day/evening gig anyone?! DM/reply to this tweet for more info- available anywhere in the world where zoom works!! $URL$,Private Valentine s Day/evening gig anyone?! DM/reply to this tweet for more info- available anywhere in the world where zoom works!!,private valentine day evening gig anyone dm reply tweet info available anywhere world zoom works,private valentine day evening gig anyone dm reply tweet info available anywhere world zoom work,[],{},{},0,1,[],,[],0.0
9,2021-01-30,Sat Jan 30 23:26:58 +0000 2021,1355658794311819266,BlueberryForMe,VA by way of ME and PA,Not Geo-tagged,"b'No, this is the last one...I\xe2\x80\x99m done with the photos folks take of their vaccination card, finger covering private info. Done. Off to be a non-petty or jealous person. https://t.co/UYW6urpu9E'","No, this is the last one...Im done with the photos folks take of their vaccination card, finger covering private info. Done. Off to be a non-petty or jealous person. $URL$","No, this is the last one..I m done with the photos folks take of their vaccination card, finger covering private info. Done. Off to be a non-petty or jealous person.",no last one done photos folks take vaccination card finger covering private info done off non petty jealous person,no last one do photo folk take vaccination card finger cover private info do off non petty jealous person,[],{},{},0,0,[],,[],-0.4588
11,2021-01-30,Sat Jan 30 23:11:46 +0000 2021,1355654970016731136,Jeebz07690867,,Not Geo-tagged,"b'@Santiag78758327 @csuwildcat 100%, now who will be smart enough to build a platform that would link us directly to those businesses? I will be the first to onboard that ship. It\xe2\x80\x99s time monetize our private info. Wouldn\xe2\x80\x99t it be cool to receive micropayments as they r using that info until they don\xe2\x80\x99t need it? https://t.co/qGvIPsVYuO'","$MENTION$ $MENTION$ $NUMBER$%, now who will be smart enough to build a platform that would link us directly to those businesses? I will be the first to onboard that ship. Its time monetize our private info. Wouldnt it be cool to receive micropayments as they r using that info until they dont need it? $URL$","%, now who will be smart enough to build a platform that would link us directly to those businesses? I will be the first to onboard that ship. It s time monetize our private info. Wouldn t it be cool to receive micropayments as they r using that info until they don t need it?",smart enough build platform would link directly businesses first onboard ship it time monetize private info wouldn cool receive micropayments using info need,smart enough build platform would link directly business first onboard ship time monetize private info wouldn cool receive micropayment use info need,[],{},{},0,2,[],,"['Santiago Velez', 'Daniel Ƀrrr']",0.6553
16,2021-01-30,Sat Jan 30 22:55:34 +0000 2021,1355650894805803018,NielsenVibeke,,Not Geo-tagged,"b""@Magabumper @BitsButterfly @capitolhunters @RavenDragon2015 @No_Nazis_Please @SeditionHunters @OPSVeracity49th You're right about that. He's in a media network. You can see his network on his Facebook-page on a dinner photo + a link to a private vid with extra info. The name of his fb is the same as his homepage""",$MENTION$ $MENTION$ $MENTION$ $MENTION$ $MENTION$ $MENTION$ $MENTION$ You're right about that. He's in a media network. You can see his network on his Facebook-page on a dinner photo + a link to a private vid with extra info. The name of his fb is the same as his homepage,You're right about that. He's in a media network. You can see his network on his Facebook-page on a dinner photo + a link to a private vid with extra info. The name of his fb is the same as his homepage,you right he media network you see network facebook page dinner photo link private vid extra info the name homepage,right media network see network facebook page dinner photo link private vid extra info the name homepage,[],{},{},0,1,[],,"['Outsizer', 'Butterfly bits', 'capitolhunters', 'Raven', 'nonazisformethanks', '#SeditionHunters', 'Operation Veracity 🔍']",0.0
48,2021-01-30,Sat Jan 30 20:57:32 +0000 2021,1355621191134846982,squirrel_jiji,17; 🇵🇭,Not Geo-tagged,"b""@HON3YRCHA tHANK YOU FOR THIS GA \xf0\x9f\x92\x97\xf0\x9f\x92\x97\xe2\x9c\xa8\n\n(1) MuBeat voting \xe2\x9c\x85 //those are only some of my accts bc the others contain private info//\n(2) Alien \xe2\x9c\x85 \n(3) My Pace \xe2\x9c\x85 - present and prev streaming\n// i don't usually screenshot when i stream so these are only a few snaps//\n\nTYSM ILY \xf0\x9f\x92\x93\xf0\x9f\x92\x93 https://t.co/ON6JDEbkwr""",$MENTION$ tHANK YOU FOR THIS GA $EMOJI$$EMOJI$$EMOJI$ (1) MuBeat voting $EMOJI$ //those are only some of my accts bc the others contain private info// (2) Alien $EMOJI$ (3) My Pace $EMOJI$ - present and prev streaming // i don't usually screenshot when i stream so these are only a few snaps// TYSM ILY $EMOJI$$EMOJI$ $URL$,tHANK YOU FOR THIS GA (1) MuBeat voting //those are only some of my accts bc the others contain private info// (2) Alien (3) My Pace - present and prev streaming // i do not usually screenshot when i stream so these are only a few snaps// TYSM ILY,thank you for this ga mubeat voting accts others contain private info alien my pace present prev streaming usually screenshot stream snaps tysm ily,thank for this ga mubeat voting acct other contain private info alien pace present prev streaming usually screenshot stream snap tysm ily,[],{},{},0,1,[],,['▪︎minchan GOs▪︎'],0.824
26,2021-01-30,Sat Jan 30 22:14:34 +0000 2021,1355640575660318725,SpotifyCares,,Not Geo-tagged,"b""@tylerwakeland1 Hey there, help's here! We'd recommend deleting your tweet as it contains your account's email address, which is your private info. Could you send us a DM instead? We'd love to help /RQ https://t.co/ldFdZRiNAt""","$MENTION$ Hey there, help's here! We'd recommend deleting your tweet as it contains your account's email address, which is your private info. Could you send us a DM instead? We'd love to help /RQ $URL$","Hey there, help's here! We'd recommend deleting your tweet as it contains your account's email address, which is your private info. Could you send us a DM instead? We'd love to help /RQ",hey help we recommend deleting tweet contains account email address private info could send dm instead we love help rq,hey help recommend delete tweet contain account email address private info could send dm instead love help rq,[],{},{},0,0,[],https://twitter.com/messages/compose?recipient_id=497340309,['Tyler Wakeland'],0.8655
20,2021-01-30,Sat Jan 30 22:29:11 +0000 2021,1355644254413058050,onthequays,"New York, USA",Not Geo-tagged,"b'\xf0\x9f\x8e\xb6PRIVATE COACHING\xf0\x9f\x8e\xad\n\nWe\xe2\x80\x99ll bring the classroom to you! For more info, click the link in our bio!\n.\n.\n.\n#onthequays #classes #singing #acting #schoolsinsession #onlinelearning #theatre #theatreclass https://t.co/ZsVjXrBRGw'","$EMOJI$PRIVATE COACHING$EMOJI$ Well bring the classroom to you! For more info, click the link in our bio! . . . $HASHTAG$ $HASHTAG$ $HASHTAG$ $HASHTAG$ $HASHTAG$ $HASHTAG$ $HASHTAG$ $HASHTAG$ $URL$","PRIVATE COACHING We ll bring the classroom to you! For more info, click the link in our bio! . . .",private coaching we bring classroom for info click link bio,private coaching bring classroom for info click link bio,[],{},{},0,4,"['onthequays', 'classes', 'singing', 'acting', 'schoolsinsession', 'onlinelearning', 'theatre', 'theatreclass']",,[],0.0
39,2021-01-30,Sat Jan 30 21:24:32 +0000 2021,1355627983416008705,Macys,,Not Geo-tagged,b'@ferdinanth98 Our team would like to gather more details \xe2\x80\x94 could you please send us this info in a private message? https://t.co/9HJq8Cszhv',$MENTION$ Our team would like to gather more details could you please send us this info in a private message? $URL$,Our team would like to gather more details could you please send us this info in a private message?,our team would like gather details could please send info private message,team would like gather detail could please send info private message,[],{},{},0,0,[],https://twitter.com/messages/compose?recipient_id=50687788,['Ferdinanth freire'],0.5859
6,2021-01-30,Sat Jan 30 23:32:28 +0000 2021,1355660178281033731,SKCALIFORNIAW,ONT*CA USA CALIFORNIA🇺🇲🗺©®™,Not Geo-tagged,b'EIIR ELIZABETH II Regina GET THIS DONE NOW*MY STUFF MY PRIVATE PERSONAL PERSON PERSONAL CONFIDENTIAL CONFIDENTIAL INFORMATION CONFIDENTIAL GROUNDS CONFIDENTIAL CONFIDENTIAL INFO\nPRIVATE PERSON CONFIDENTIAL CONFIDENTIAL INFORMATION CONFIDENTIAL GROUNDS Windsor OF\xe2\x84\xa2\xef\xb8\x8f\nPRIVATE\xe2\x84\xa2\xef\xb8\x8fOTHR\xe2\x84\xa2\xef\xb8\x8f https://t.co/Yubb1s8hC1 https://t.co/OyXNwwA8UQ',EIIR ELIZABETH II Regina GET THIS DONE NOW*MY STUFF MY PRIVATE PERSONAL PERSON PERSONAL CONFIDENTIAL CONFIDENTIAL INFORMATION CONFIDENTIAL GROUNDS CONFIDENTIAL CONFIDENTIAL INFO PRIVATE PERSON CONFIDENTIAL CONFIDENTIAL INFORMATION CONFIDENTIAL GROUNDS Windsor OF PRIVATEOTHR $URL$ $URL$,EIIR ELIZABETH II Regina GET THIS DONE NOW*MY STUFF MY PRIVATE PERSONAL PERSON PERSONAL CONFIDENTIAL CONFIDENTIAL INFORMATION CONFIDENTIAL GROUNDS CONFIDENTIAL CONFIDENTIAL INFO PRIVATE PERSON CONFIDENTIAL CONFIDENTIAL INFORMATION CONFIDENTIAL GROUNDS Windsor OF PRIVATE OTHR,eiir elizabeth ii regina get this done now my stuff my private personal person personal confidential confidential information confidential grounds confidential confidential info private person confidential confidential information confidential grounds windsor of private othr,eiir elizabeth ii regina get this do now stuff private personal person personal confidential confidential information confidential grounds confidential confidential info private person confidential confidential information confidential grounds windsor of private othr,[],{},{},0,0,[],https://twitter.com/SKCALIFORNIAW/status/1355659095563411459,[],0.0
3,2021-01-30,Sat Jan 30 23:46:00 +0000 2021,1355663587725991938,SereneMists,Nachrast,Not Geo-tagged,"b'@TheInfoDealerV you have your direct messages closed, send me a private message for the link and info!!!'","$MENTION$ you have your direct messages closed, send me a private message for the link and info!!!","you have your direct messages closed, send me a private message for the link and info!!",direct messages closed send private message link info,direct message close send private message link info,[],{},{},0,1,[],,['V 👾The Info Dealer👾 404 || 3D MODEL COMMS OPEN!'],0.0
35,2021-01-30,Sat Jan 30 21:33:16 +0000 2021,1355630181491372040,JClawguy,Cambridge NY,Not Geo-tagged,b'@commons96055467 @thomaskaine5 I am counting on the Dems bringing forward this kind of info when they present their prosecution of the private citizen presently living in FL. I do hope that they take whatever time is necessary to put all of the facts out there and that they will be very compelling. Justice!',$MENTION$ $MENTION$ I am counting on the Dems bringing forward this kind of info when they present their prosecution of the private citizen presently living in FL. I do hope that they take whatever time is necessary to put all of the facts out there and that they will be very compelling. Justice!,I am counting on the Dems bringing forward this kind of info when they present their prosecution of the private citizen presently living in FL. I do hope that they take whatever time is necessary to put all of the facts out there and that they will be very compelling. Justice!,counting dems bringing forward kind info present prosecution private citizen presently living fl hope take whatever time necessary put facts compelling justice,count dem bring forward kind info present prosecution private citizen presently live fl hope take whatever time necessary put fact compelling justice,[],{},{},0,1,[],,"['Common Sense 🇺🇸🇦🇫🏳️\u200d🌈', 'Thomas Kaine']",0.7062
