s_no,date,created_at,id_str,screen_name,user_location,geo-tagged_place,tweet_text,tweet_tokenized,tweet_cleaned,tweet_filtered,tweet_lemmatized,tweet_mentioned_organizations,tweet_tags_classified,tweet_orgs_classified,retweet_count,fav_count,hashtags,urls,mentions,vader_polarity
20,2021-03-23,Tue Mar 23 22:37:04 +0000 2021,1374490405438296065,frogharrie,,Not Geo-tagged,b'yup but thats private info https://t.co/xGdm6CVlXw',yup but thats private info $URL$,yup but thats private info,yup thats private info,yup that s private info,[],{},{},0,0,[],https://twitter.com/emmajaneeliza/status/1338722560079491072,[],0.0
6,2021-03-23,Tue Mar 23 23:28:16 +0000 2021,1374503290562482182,iHugFaerais,7teen black genfluid he / neos,Not Geo-tagged,b'@eunhalbs nobody  doxxed  you!  everyone  sharing  info  has  censored  it  and  kept  it  relatively  private  or  to  the  dms.',$MENTION$ nobody doxxed you! everyone sharing info has censored it and kept it relatively private or to the dms.,nobody doxxed you! everyone sharing info has censored it and kept it relatively private or to the dms.,nobody doxxed everyone sharing info censored kept relatively private dms,nobody doxxe everyone share info censor keep relatively private dms,[],{},{},0,28,[],,['lulu'],0.3595
2,2021-03-23,Tue Mar 23 23:50:50 +0000 2021,1374508971352944640,chrispy_kreeme,he/him - minor,Not Geo-tagged,b'@yeahitsJ0sh i was trying to do one of those things where a private company takes all your twitter info in exchange for a quirky graphic and it said my account didn\xe2\x80\x99t exist \xf0\x9f\xa4\xa9',$MENTION$ i was trying to do one of those things where a private company takes all your twitter info in exchange for a quirky graphic and it said my account didnt exist,i was trying to do one of those things where a private company takes all your twitter info in exchange for a quirky graphic and it said my account didn t exist,trying one things private company takes twitter info exchange quirky graphic said account exist,try one thing private company take twitt info exchange quirky graphic say account exist,[],{},{},0,1,[],,['Josh 🦑🧲🇺🇸'],0.0
4,2021-03-23,Tue Mar 23 23:43:27 +0000 2021,1374507111493767177,MediaActive,Melbourne,Not Geo-tagged,b'Both independents @helenhainesindi &amp; @zalisteggall have private member\xe2\x80\x99s bills in train that dove-tail perfectly with #auspol dynamics? And broad electoral sentiments? ICYMI For more info on Haines\xe2\x80\x99 \xe2\x80\x9c#federalICAC\xe2\x80\x9d bill: #PODCAST @transitzonepod https://t.co/vTk8xel8d5',Both independents $MENTION$ &amp; $MENTION$ have private members bills in train that dove-tail perfectly with $HASHTAG$ dynamics? And broad electoral sentiments? ICYMI For more info on Haines $HASHTAG$ bill: $HASHTAG$ $MENTION$ $URL$,Both independents &amp; have private member s bills in train that dove-tail perfectly with dynamics? And broad electoral sentiments? ICYMI For more info on Haines bill,both independents private member bills train dove tail perfectly dynamics and broad electoral sentiments icymi for info haines bill,both independent private member bill train dove tail perfectly dynamic and broad electoral sentiment icymi for info haine bill,[],{},{},0,0,"['auspol', 'federalICAC', 'PODCAST']",https://podcasts.apple.com/au/podcast/transitzone/id1512522030?i=1000497888490,"['Helen Haines MP', '🌏 Zali Steggall MP', '#transitzonepod']",0.7691
15,2021-03-23,Tue Mar 23 22:45:10 +0000 2021,1374492445296095236,Betoburner,,Not Geo-tagged,"b""Why did @SOSRumsfeld @AddisonReFollow @SenatorMoxxie vote against ending the Patriot act ? Easy answer the TTP doesn't care about you they rather obtain and sell your information than protecting your privacy and personal info""",Why did $MENTION$ $MENTION$ $MENTION$ vote against ending the Patriot act ? Easy answer the TTP doesn't care about you they rather obtain and sell your information than protecting your privacy and personal info,Why did vote against ending the Patriot act ? Easy answer the TTP does not care about you they rather obtain and sell your information than protecting your privacy and personal info,why vote ending patriot act easy answer ttp care rather obtain sell information protecting privacy personal info,why vote end patriot act easy answer ttp care rather obtain sell information protect privacy personal info,[],{},{},0,3,[],,"['Secretary of Defense Rumsfeld', 'Addison 🇺🇸✝️🦅 - ReFollow', 'Moxxie']",0.0701
8,2021-03-23,Tue Mar 23 23:19:49 +0000 2021,1374501164960522250,Cashburn_ELE,,Not Geo-tagged,"b'@OzzieDelgadoJr Private business?\n\nThis is the same as the Krispy Kreme thing no?\n\nYou don\xe2\x80\x99t have to disclose any info if you don\xe2\x80\x99t want that product. \n\nIdk, I\xe2\x80\x99m not well versed in this stuff lol'","$MENTION$ Private business? This is the same as the Krispy Kreme thing no? You dont have to disclose any info if you dont want that product. Idk, Im not well versed in this stuff lol","Private business? This is the same as the Krispy Kreme thing no? You don t have to disclose any info if you don t want that product. Idk, I m not well versed in this stuff lol",private business this krispy kreme thing you disclose info want product idk well versed stuff lol,private business this krispy kreme thing disclose info want product idk well versed stuff lol,[],{},{},0,2,[],,"['Ozzie Delgado, Jr.']",0.3063
45,2021-03-23,Tue Mar 23 21:25:58 +0000 2021,1374472514303188995,BigBoysBlast,USA,Not Geo-tagged,"b'Live Private Lending Event In Miami April 18, 19, 20\nNational - #CRE\nhttps://t.co/YewsL0nRVe'","Live Private Lending Event In Miami April $NUMBER$, $NUMBER$, $NUMBER$ National - $HASHTAG$ $URL$","Live Private Lending Event In Miami April , , National -",live private lending event in miami april national,live private lending event in miami april national,[],{},{},0,0,['CRE'],https://www.BigBoysBlast.com/flyer/EBrochure/2/info@pitbullconference.com_16022009.html,[],0.0
43,2021-03-23,Tue Mar 23 21:28:52 +0000 2021,1374473242484776963,G1Lpw,,Not Geo-tagged,b'@Todaysopinionis Info for last 2 posts came from here:\n\nhttps://t.co/xtCroED99H',$MENTION$ Info for last $NUMBER$ posts came from here: $URL$,Info for last posts came from here,info last posts came,info last post come,[],{},{},2,2,[],https://ukhumanrightsblog.com/2021/02/10/vaccination-and-public-private-coercion/,['Tony law'],0.0
18,2021-03-23,Tue Mar 23 22:38:47 +0000 2021,1374490838298886160,totallynotsamii,somewhere in the world?,Not Geo-tagged,"b'@H8E_s @kaceytron ive already said this i dont think anyone deserves death threats, slut shaming comments, and private info leaked im done arguing with you'","$MENTION$ $MENTION$ ive already said this i dont think anyone deserves death threats, slut shaming comments, and private info leaked im done arguing with you","ive already said this i dont think anyone deserves death threats, slut shaming comments, and private info leaked im done arguing with you",ive already said dont think anyone deserves death threats slut shaming comments private info leaked done arguing,have already say do not think anyone deserve death threat slut shaming comment private info leak do arguing,[],{},{},0,0,[],,"['skive', 'kaceytron']",-0.9413
1,2021-03-23,Tue Mar 23 23:51:25 +0000 2021,1374509116245168136,ashestoalex,prominent on the internet • 20,Not Geo-tagged,b'friendly reminder that i have a private twitter @apollonemos where i post nudes* and leak exclusive info about all time low** that i get from alex gaskarth himself***\n\n*photos of me crying\n**post screenshots of songs im listening to\n***spotify',friendly reminder that i have a private twitter $MENTION$ where i post nudes* and leak exclusive info about all time low** that i get from alex gaskarth himself*** *photos of me crying **post screenshots of songs im listening to ***spotify,friendly reminder that i have a private twitter where i post nudes* and leak exclusive info about all time low** that i get from alex gaskarth himself** *photos of me crying **post screenshots of songs im listening to **spotify,friendly reminder private twitter post nudes leak exclusive info time low get alex gaskarth photos crying post screenshots songs listening spotify,friendly reminder private twitter post nude leak exclusive info time low get alex gaskarth photo cry post screenshot song listen spotify,[],{},{},1,1,[],,['scene buttigeg'],-0.4404
16,2021-03-23,Tue Mar 23 22:44:28 +0000 2021,1374492270393651201,thelightmom,Republika ng Pilipinas,Not Geo-tagged,"b""I'm sharing this info so all people will be informed abt the efforts of the govt during the pandemic.\n\nNo denying the PH is a poor country but with the limited resources we have, the govt &amp; certain private individuals have gone far &amp; beyond what is expected of them. Salamat po! https://t.co/5YGJhi1vAz""","I'm sharing this info so all people will be informed abt the efforts of the govt during the pandemic. No denying the PH is a poor country but with the limited resources we have, the govt &amp; certain private individuals have gone far &amp; beyond what is expected of them. Salamat po! $URL$","I'm sharing this info so all people will be informed abt the efforts of the govt during the pandemic. No denying the PH is a poor country but with the limited resources we have, the govt &amp; certain private individuals have gone far &amp; beyond what is expected of them. Salamat po!",sharing info people informed abt efforts govt pandemic no denying ph poor country limited resources govt certain private individuals gone far beyond expected salamat,share info people inform abt effort govt pandemic no deny ph poor country limited resource govt certain private individual go far beyond expect salamat,[],{},{},59,158,[],,[],0.2406
3,2021-03-23,Tue Mar 23 23:48:38 +0000 2021,1374508419265163275,FOnions2,,Not Geo-tagged,"b'Hey, minecraft/Dream stans! Imagine asking the victim OF YOUR FUCKING DOXXING, PRIVATE INFO LEAKING, AND FAKE DM SPREADS TO APOLOGIZE TO MOTHERFUCKING YOU OF ALL PEOPLE. Fucking retarded 10 year olds.'","Hey, minecraft/Dream stans! Imagine asking the victim OF YOUR FUCKING DOXXING, PRIVATE INFO LEAKING, AND FAKE DM SPREADS TO APOLOGIZE TO MOTHERFUCKING YOU OF ALL PEOPLE. Fucking retarded $NUMBER$ year olds.","Hey, minecraft/Dream stans! Imagine asking the victim OF YOUR FUCKING DOXXING, PRIVATE INFO LEAKING, AND FAKE DM SPREADS TO APOLOGIZE TO MOTHERFUCKING YOU OF ALL PEOPLE. Fucking retarded year olds.",hey minecraft dream stans imagine asking victim of your fucking doxxing private info leaking and fake dm spreads to apologize to motherfucking you of all people fucking retarded year olds,hey minecraft dream stan imagine ask victim of fucking doxxe private info leaking and fake dm spread to apologize to motherfucke of all people fuck retarded year old,[],{},{},0,1,[],,[],-0.9276
24,2021-03-23,Tue Mar 23 22:19:05 +0000 2021,1374485882003058691,r_redditmoment,Spez’s bdsm chamber,Not Geo-tagged,b'Big subs going private due to the reddit drama today. More info https://t.co/OAkYoB2Lte',Big subs going private due to the reddit drama today. More info $URL$,Big subs going private due to the reddit drama today. More info,big subs going private due reddit drama today more info,big sub go private due reddit drama today more info,[],{},{},3,6,[],https://www.reddit.com/user/Blank-Cheque/comments/mbmthf/why_is_this_subreddit_private_see_here_for_answers/?utm_source=share&utm_medium=ios_app&utm_name=iossmf,[],0.0
30,2021-03-23,Tue Mar 23 22:03:53 +0000 2021,1374482055573041154,Frenkidejong1,"DKI Jakarta, Indonesia",Not Geo-tagged,b'\xe2\x9c\xa8\xe2\x9c\xab\xe2\x94\x85\xe2\x94\x88\xe2\x80\xa2\xe2\x80\xbb\xc2\xa0\xc2\xa0\xe2\x98\x85\xe2\x97\x8f\xe0\xbc\x86 \xe2\x97\x8f\xe2\x98\x85\xc2\xa0\xc2\xa0\xe2\x80\xbb\xe2\x80\xa2\xe2\x94\x84\xe2\x94\x85\xe2\x9c\xab\xe2\x9c\xa8                                              \n\xf0\x9f\x8c\xb9*\xf0\x9f\x92\x83Paid Private Dating\xf0\x9f\x92\x83*\xf0\x9f\x8c\xb9\n                Info RR Dm  \xf0\x9f\x93\xa9   \n                        \xe2\x98\x9f\xef\xb8\x8e\xef\xb8\x8e\xef\xb8\x8e\n            @naura_chabie\n\xe2\x9c\xa8\xe2\x9c\xab\xe2\x94\x85\xe2\x94\x88\xe2\x80\xa2\xe2\x80\xbb\xc2\xa0\xc2\xa0\xe2\x98\x85\xe2\x97\x8f\xe0\xbc\x86 \xe2\x97\x8f\xe2\x98\x85\xc2\xa0\xc2\xa0\xe2\x80\xbb\xe2\x80\xa2\xe2\x94\x84\xe2\x94\x84\xe2\x94\x85\xe2\x9c\xab\xe2\x9c\xa8 https://t.co/hK5pzisoWh',$EMOJI$$EMOJI$$EMOJI$ $EMOJI$$EMOJI$$EMOJI$ $EMOJI$*$EMOJI$Paid Private Dating$EMOJI$*$EMOJI$ Info RR Dm $EMOJI$ $EMOJI$ $MENTION$ $EMOJI$$EMOJI$$EMOJI$ $EMOJI$$EMOJI$$EMOJI$ $URL$,* Paid Private Dating * Info RR Dm,paid private dating info rr dm,pay private date info rr dm,[],{},{},2,0,[],https://twitter.com/naura_chabie/status/1374469936114896903,['#availsolo NOW!!'],0.0
48,2021-03-23,Tue Mar 23 21:24:26 +0000 2021,1374472129236795393,Lala188383993,"Yogyakarta, Indonesia",Not Geo-tagged,b'avail ya beb\xf0\x9f\x98\x98real pict\xf0\x9f\x91\x99private bo and vcs\xf0\x9f\xa4\x97 info price dm or wa 081275454217\n@Lala188383993\n@lalaaa76493902\n@lalascnd883922\n\n#jogjaincluderoom\n#jogjabirahi\n#readyjogja\n#jogjaopenBO\n#jogjacrot\n#AvailJogja\n#openBOjogja\n#ayamkampusjogja\n#realbojogja \n#kimciljogja \n#BOjogjavip https://t.co/ox4WXVfQFt',avail ya beb$EMOJI$real pict$EMOJI$private bo and vcs info price dm or wa $NUMBER$ $MENTION$ $MENTION$ $MENTION$ $HASHTAG$ $HASHTAG$ $HASHTAG$ $HASHTAG$ $HASHTAG$ $HASHTAG$ $HASHTAG$ $HASHTAG$ $HASHTAG$ $HASHTAG$ $HASHTAG$ $URL$,avail ya beb real pict private bo and vcs info price dm or wa,avail beb real pict private vcs info price,avail beb real pict private vcs info price,[],{},{},0,0,"['jogjaincluderoom', 'jogjabirahi', 'readyjogja', 'jogjaopenBO', 'jogjacrot', 'AvailJogja', 'openBOjogja', 'ayamkampusjogja', 'realbojogja', 'kimciljogja', 'BOjogjavip']",,"['LALA ACC PRIVATE BO || new', '||private bo and vcs jogja area||new acc', 'BO & VCS PRIVATE || LALA FIRS ACC']",0.0
41,2021-03-23,Tue Mar 23 21:35:37 +0000 2021,1374474942289354754,muhdfaisalriba1,,Not Geo-tagged,b'@FUDJigawaNG Us wey get private jet with tint any info to urs\xf0\x9f\x98\x82',$MENTION$ Us wey get private jet with tint any info to urs$EMOJI$,Us wey get private jet with tint any info to urs,us wey get private jet tint info urs,wey get private jet tint info ur,[],{},{},0,1,[],,['Federal University Dutse'],0.0
9,2021-03-23,Tue Mar 23 23:18:55 +0000 2021,1374500938237448192,VerdantGleam,Skyworld,Not Geo-tagged,b'((I get wanting to keep some information private but like . Some accs with no writer info scare the shit out of me. Who Are You. What Are You.))',((I get wanting to keep some information private but like . Some accs with no writer info scare the shit out of me. Who Are You. What Are You.)),((I get wanting to keep some information private but like . Some accs with no writer info scare the shit out of me. Who Are You. What Are You.)),get wanting keep information private like some accs writer info scare shit who are you what are you,get want keep information private like some accs writer info scare shit who be what be,[],{},{},0,2,[],,[],0.3919
5,2021-03-23,Tue Mar 23 23:34:04 +0000 2021,1374504751782535168,smwau2001,,Not Geo-tagged,b'@TheCryptoLark Hey @TheCryptoLark Did you see that the @WSBChairman recently started following Elastos info twitter. Also Feng Han recently announced the 1000BTC war chest from the private sale is still available for developers.',$MENTION$ Hey $MENTION$ Did you see that the $MENTION$ recently started following Elastos info twitter. Also Feng Han recently announced the $NUMBER$BTC war chest from the private sale is still available for developers.,Hey Did you see that the recently started following Elastos info twitter. Also Feng Han recently announced the BTC war chest from the private sale is still available for developers.,hey did see recently started following elastos info twitter also feng han recently announced btc war chest private sale still available developers,hey do see recently start follow elastos info twitter also feng han recently announce btc war chest private sale still available developer,[],{},{},0,0,[],,"['Lark Davis', 'Lark Davis', 'The Chairman']",-0.5994
11,2021-03-23,Tue Mar 23 23:14:42 +0000 2021,1374499877841825797,Delta,Global,Not Geo-tagged,"b'@EndowedEmiNYC Emit, I am so sorry for this trouble getting assistance! Please send your info through the DM link below and I will be able to join you in the Private chat to review and assist. Antoinette https://t.co/6iDGBJRMTU'","$MENTION$ Emit, I am so sorry for this trouble getting assistance! Please send your info through the DM link below and I will be able to join you in the Private chat to review and assist. Antoinette $URL$","Emit, I am so sorry for this trouble getting assistance! Please send your info through the DM link below and I will be able to join you in the Private chat to review and assist. Antoinette",emit sorry trouble getting assistance please send info dm link able join private chat review assist antoinette,emit sorry trouble get assistance please send info dm link able join private chat review assist antoinette,[],{},{},0,0,[],https://twitter.com/messages/compose?recipient_id=5920532,['Emit (Emi) Marv Rosa'],0.0902
34,2021-03-23,Tue Mar 23 21:52:21 +0000 2021,1374479152443576322,EMaxfieldMoen,"Elmwood Park, Il",Not Geo-tagged,"b'@0xDEADBEEFCAFE @patriottakes No, #TheFormerGuy would rather start his own platform and sell the private info himself.'","$MENTION$ $MENTION$ No, $HASHTAG$ would rather start his own platform and sell the private info himself.","No, would rather start his own platform and sell the private info himself.",no would rather start platform sell private info,no would rather start platform sell private info,[],{},{},0,9,['TheFormerGuy'],,"['Ricardo B', 'PatriotTakes 🇺🇸']",0.0
38,2021-03-23,Tue Mar 23 21:46:21 +0000 2021,1374477643039449094,veritastruth4,,Not Geo-tagged,"b""@Yodavader9807 @ChaoEntertain @Oreo_Puddin @CountDankulaTV Aside from the NICS system being terrible, not having updated or correct info, or being offline, there's no access to the system for private sellers to be able to run a check on a buyer even if they wanted to""","$MENTION$ $MENTION$ $MENTION$ $MENTION$ Aside from the NICS system being terrible, not having updated or correct info, or being offline, there's no access to the system for private sellers to be able to run a check on a buyer even if they wanted to","Aside from the NICS system being terrible, not having updated or correct info, or being offline, there's no access to the system for private sellers to be able to run a check on a buyer even if they wanted to",aside nics system terrible updated correct info offline access system private sellers able run check buyer even wanted,aside nic system terrible update correct info offline access system private seller able run check buyer even want,[],{},{},0,0,[],,"[""🏳we are fucked, aren't we?🏳"", 'Chaotic Entertainment', 'Oreo ""Not Cool Enough To Be Banned"" Puddin\'!!', 'Count Dadula🏴\U000e0067\U000e0062\U000e0073\U000e0063\U000e0074\U000e007f🏳️\u200d🌈']",-0.7003
40,2021-03-23,Tue Mar 23 21:36:23 +0000 2021,1374475134300426241,Tashaholz,Essex,Not Geo-tagged,b'Who wants my new naughty bj vid private message me for info',Who wants my new naughty bj vid private message me for info,Who wants my new naughty bj vid private message me for info,who wants new naughty vid private message info,who want new naughty vid private message info,[],{},{},1,19,[],,[],0.0
32,2021-03-23,Tue Mar 23 21:56:41 +0000 2021,1374480243256295431,jslipchi,"Los Angeles, CA",Not Geo-tagged,"b""is it crazy that I want to do this\n\nI can't see the pricing until I put in my email address, I'm sure it's $$$$, but if any of y'all want to do this\n\nuh\n\nwe can split the price?  \n\nI'm serious, who's interested?\n\nhttps://t.co/TGB4CFrvCd""","is it crazy that I want to do this I can't see the pricing until I put in my email address, I'm sure it's $$$$, but if any of y'all want to do this uh we can split the price? I'm serious, who's interested? $URL$","is it crazy that I want to do this I ca not see the pricing until I put in my email address, I'm sure it's $$, but if any of y'all want to do this uh we can split the price? I'm serious, who's interested?",crazy want see pricing put email address sure want split price serious interested,crazy want see price put email address sure want split price serious interested,[],{},{},0,0,[],https://elcapitantheatre.com/film-info/private-screening-raya-and-the-last-dragon,[],0.6136
12,2021-03-23,Tue Mar 23 23:04:29 +0000 2021,1374497305919819776,frankmanzz_,You wouldnt understand ,"Milton, PA, US","b'@PS5restocks_etc SafAri on iPhone private mode Verizon LTE worked the first time, GameStop disk bundle, it told me digital was gone so I got the disk in cart, still had to put shipping and card info, and got it first try today. I didn\xe2\x80\x99t even see the GME IS LIVE tweet till 10 min after as well\xf0\x9f\x99\x8f\xf0\x9f\x8f\xbd'","$MENTION$ SafAri on iPhone private mode Verizon LTE worked the first time, GameStop disk bundle, it told me digital was gone so I got the disk in cart, still had to put shipping and card info, and got it first try today. I didnt even see the GME IS LIVE tweet till $NUMBER$ min after as well$EMOJI$$EMOJI$","SafAri on iPhone private mode Verizon LTE worked the first time, GameStop disk bundle, it told me digital was gone so I got the disk in cart, still had to put shipping and card info, and got it first try today. I didn t even see the GME IS LIVE tweet till min after as well",safari iphone private mode verizon lte worked first time gamestop disk bundle told digital gone got disk cart still put shipping card info got first try today even see gme is live tweet till min well,safari iphone private mode verizon lte work first time gamestop disk bundle tell digital go get disk cart still put shipping card info get first try today even see gme be live tweet till min well,[],{},{},0,0,[],,['PS5 STOCK TRACKER - 24/7 Drop Links & Tips'],0.2732
25,2021-03-23,Tue Mar 23 22:13:36 +0000 2021,1374484503498870784,hermit_wanderer,,Not Geo-tagged,"b""@AruvionRei @GMMTV Some ppl may think actors are commodities. \nIt's not the first time someone shares private moments or info about an actor without his consent, just to gain views and likes.""","$MENTION$ $MENTION$ Some ppl may think actors are commodities. It's not the first time someone shares private moments or info about an actor without his consent, just to gain views and likes.","Some ppl may think actors are commodities. It's not the first time someone shares private moments or info about an actor without his consent, just to gain views and likes.",some ppl may think actors commodities it first time someone shares private moments info actor without consent gain views likes,some ppl may think actor commoditie first time someone share private moment info actor without consent gain view like,[],{},{},0,1,[],,"['Aruvion Rei', 'GMMTV']",0.774
33,2021-03-23,Tue Mar 23 21:56:21 +0000 2021,1374480160091639810,Delta,Global,Not Geo-tagged,"b""@KCubbyMcD Hey there, so sorry for the wait time tonight! Maybe we can help speed things along. Please send your info through the DM link and we'll be able to join you in the Private Chat to discuss Antoinette https://t.co/6iDGBJRMTU""","$MENTION$ Hey there, so sorry for the wait time tonight! Maybe we can help speed things along. Please send your info through the DM link and we'll be able to join you in the Private Chat to discuss Antoinette $URL$","Hey there, so sorry for the wait time tonight! Maybe we can help speed things along. Please send your info through the DM link and we'll be able to join you in the Private Chat to discuss Antoinette",hey sorry wait time tonight maybe help speed things along please send info dm link able join private chat discuss antoinette,hey sorry wait time tonight maybe help speed thing along please send info dm link able join private chat discus antoinette,[],{},{},0,0,[],https://twitter.com/messages/compose?recipient_id=5920532,['kbmcd'],0.6957
35,2021-03-23,Tue Mar 23 21:49:59 +0000 2021,1374478558970585092,Stoozed,,Not Geo-tagged,"b'Interested, who would want me to make a private twitter JUST for ideas/set-ups.\n\nCreating it tonight. Message me for info.'","Interested, who would want me to make a private twitter JUST for ideas/set-ups. Creating it tonight. Message me for info.","Interested, who would want me to make a private twitter JUST for ideas/set-ups. Creating it tonight. Message me for info.",interested would want make private twitter just ideas set ups creating tonight message info,interested would want make private twitter just idea set up create tonight message info,[],{},{},1,66,[],,[],0.6369
44,2021-03-23,Tue Mar 23 21:28:24 +0000 2021,1374473126197690369,living48re,"Tempe, AZ",Not Geo-tagged,b'https://t.co/5yljbGmLuq\n\nCheck out this video walkthrough of our beautiful new listing! Want more info or schedule a private showing? Contact Katie Evans at (480) 415-1341 or at katie@living48re.com. \n\n#living48re #living48realestate #mesahomeforsale #azrealestate #azhomeforsale',$URL$ Check out this video walkthrough of our beautiful new listing! Want more info or schedule a private showing? Contact Katie Evans at (480) $NUMBER$-1341 or at katie$MENTION$.com. $HASHTAG$ $HASHTAG$ $HASHTAG$ $HASHTAG$ $HASHTAG$,Check out this video walkthrough of our beautiful new listing! Want more info or schedule a private showing? Contact Katie Evans at (480) -1341 or at katie.com.,check video walkthrough beautiful new listing want info schedule private showing contact katie evans katie com,check video walkthrough beautiful new listing want info schedule private show contact katie evans katie com,[],{},{},0,0,"['living48re', 'living48realestate', 'mesahomeforsale', 'azrealestate', 'azhomeforsale']",https://youtu.be/a8r1KqAk5sU,[],0.6696
