s_no,date,created_at,id_str,screen_name,user_location,geo-tagged_place,tweet_text,tweet_tokenized,tweet_cleaned,tweet_filtered,tweet_lemmatized,tweet_mentioned_organizations,tweet_tags_classified,tweet_orgs_classified,retweet_count,fav_count,hashtags,urls,mentions,vader_polarity
231,2021-03-09,Tue Mar 09 13:16:32 +0000 2021,1369275913893015553,MissDaisyBunny,🌸 Daisy Bunny Kingdom 🌸,Not Geo-tagged,"b""@catlover3844 @roblox_4_lifey @SonaDrawzStuff @KonekoKittenYT @SharkBloxYT @haslizzle No, I support someone who doesn't need their private info leaked on the internet since you did that. How can you expect her to pay you if you leaked her personal info behind your back and betrayed her trust?""","$MENTION$ $MENTION$ $MENTION$ $MENTION$ $MENTION$ $MENTION$ No, I support someone who doesn't need their private info leaked on the internet since you did that. How can you expect her to pay you if you leaked her personal info behind your back and betrayed her trust?","No, I support someone who does not need their private info leaked on the internet since you did that. How can you expect her to pay you if you leaked her personal info behind your back and betrayed her trust?",no support someone need private info leaked internet since how expect pay leaked personal info behind back betrayed trust,no support someone need private info leak internet since how expect pay leak personal info behind back betray trust,[],{},{},0,1,[],,"['⭐𝐂𝐚𝐦⭐', '\U0001fad0 roblox4lifey \U0001fad0', 'SonaPoopzStuff', 'Kitten✨', 'SharkBlox🦈', '💖🍩 𝐇𝐚𝐥𝐢𝐳𝐳𝐥𝐞 🍩💖 (Comms Closed)']",-0.4588
226,2021-03-09,Tue Mar 09 13:36:56 +0000 2021,1369281047729422339,CHISUprogram,"Arlington, VA",Not Geo-tagged,"b""Register for CHISU's #webinar on March 17 at 8am ET. The discussion will feature experts, practitioners &amp; advocates from the donor, multilateral, NGO and private sector to discuss topics in #healthinformationsystems. More info on registration page. https://t.co/ccBiltasiL https://t.co/i3vqNnF8w6""","Register for CHISU's $HASHTAG$ on March $NUMBER$ at $NUMBER$am ET. The discussion will feature experts, practitioners &amp; advocates from the donor, multilateral, NGO and private sector to discuss topics in $HASHTAG$. More info on registration page. $URL$ $URL$","Register for CHISU's on March at am ET. The discussion will feature experts, practitioners &amp; advocates from the donor, multilateral, NGO and private sector to discuss topics in . More info on registration page.",register chisu march et the discussion feature experts practitioners advocates donor multilateral ngo private sector discuss topics more info registration page,register chisu march et the discussion feature expert practitioner advocate donor multilateral ngo private sector discuss topic more info registration page,[],{},{},2,4,"['webinar', 'healthinformationsystems']",https://lnkd.in/g2Q5P7Y,[],0.0
229,2021-03-09,Tue Mar 09 13:29:26 +0000 2021,1369279161487986691,Miami_High_Ly,Somewhere HIGH ,Not Geo-tagged,"b""$GME Heads up guys! Im going private at 2k followers. When It's public I can't share major info. Plus I want to help my day ones get a 50X or 60X something life changing...""",$GME Heads up guys! Im going private at $NUMBER$k followers. When It's public I can't share major info. Plus I want to help my day ones get a $NUMBER$X or $NUMBER$X something life changing...,$GME Heads up guys! Im going private at k followers. When It's public I ca not share major info. Plus I want to help my day ones get a X or X something life changing..,gme heads guys im going private followers when it public share major info plus want help day ones get x something life changing,gme heads guy be go private follower when public share major info plus want help day one get x something life change,[],{},{},0,0,[],,[],0.3408
236,2021-03-09,Tue Mar 09 12:57:06 +0000 2021,1369271024752164865,RexsRobloxNews1,,Not Geo-tagged,"b'Hello everybody so there is a new hacker called : QZXVXZQ, so when he hacks people he gets their location and private info so @Roblox if you see this tweet please ban him.\n\nLink :https://t.co/bUBVO2tSSZ'","Hello everybody so there is a new hacker called : QZXVXZQ, so when he hacks people he gets their location and private info so $MENTION$ if you see this tweet please ban him. Link :$URL$","Hello everybody so there is a new hacker called QZXVXZQ, so when he hacks people he gets their location and private info so if you see this tweet please ban him. Link",hello everybody new hacker called qzxvxzq hacks people gets location private info see tweet please ban link,hello everybody new hacker call qzxvxzq hack people get location private info see tweet please ban link,[],{},{},0,1,[],https://www.roblox.com/users/2422029818/profile,['Roblox'],-0.3182
243,2021-03-09,Tue Mar 09 12:20:53 +0000 2021,1369261908256243715,GooglePayIndia,India,Not Geo-tagged,"b""@ManishD78871124 Regret the inconvenience, Manish. Without revealing any private info, could you share more details about your query? We'll do our best to help.""","$MENTION$ Regret the inconvenience, Manish. Without revealing any private info, could you share more details about your query? We'll do our best to help.","Regret the inconvenience, Manish. Without revealing any private info, could you share more details about your query? We'll do our best to help.",regret inconvenience manish without revealing private info could share details query we best help,regret inconvenience manish without reveal private info could share detail query well help,[],{},{},0,0,[],,['Manish Das'],0.5859
233,2021-03-09,Tue Mar 09 13:12:00 +0000 2021,1369274774485164039,MaternityAction,UK,Not Geo-tagged,b'Want to post in our free online legal clinic but worried about your privacy? You can send confidential info by *private message* to @MaternityActionfreeadvice so our volunteer lawyers can do a conflict of interest check and protect your privacy. \n\nhttps://t.co/kh7321e8Rk',Want to post in our free online legal clinic but worried about your privacy? You can send confidential info by *private message* to $MENTION$ so our volunteer lawyers can do a conflict of interest check and protect your privacy. $URL$,Want to post in our free online legal clinic but worried about your privacy? You can send confidential info by *private message* to so our volunteer lawyers can do a conflict of interest check and protect your privacy.,want post free online legal clinic worried privacy you send confidential info private message volunteer lawyers conflict interest check protect privacy,want post free online legal clinic worry privacy send confidential info private message volunteer lawyer conflict interest check protect privacy,[],{},{},0,0,[],http://ow.ly/ErzP50DU2xu,[],0.6369
255,2021-03-09,Tue Mar 09 11:56:51 +0000 2021,1369255859793051654,saveyrtearz,time heals,Not Geo-tagged,b'also more but its private info im not comfy sharing but yee',also more but its private info im not comfy sharing but yee,also more but its private info im not comfy sharing but yee,also private info comfy sharing yee,also private info comfy sharing yee,[],{},{},0,0,[],,[],-0.4585
234,2021-03-09,Tue Mar 09 13:10:00 +0000 2021,1369274268501106695,MissDaisyBunny,🌸 Daisy Bunny Kingdom 🌸,Not Geo-tagged,"b'@itspancake_yt @haslizzle Look deeper into the situation: Cam leaked private info about Hales and betrayed her trust, which is very rude, and that\'s why Cam didn\'t get payed. She used at alt to dm Hales and then later claimed it got ""hacked.""'","$MENTION$ $MENTION$ Look deeper into the situation: Cam leaked private info about Hales and betrayed her trust, which is very rude, and that's why Cam didn't get payed. She used at alt to dm Hales and then later claimed it got ""hacked.""","Look deeper into the situation Cam leaked private info about Hales and betrayed her trust, which is very rude, and that's why Cam did not get payed. She used at alt to dm Hales and then later claimed it got ""hacked.""",look deeper situation cam leaked private info hales betrayed trust rude cam get payed she used alt dm hales later claimed got hacked,look deep situation cam leak private info hale betray trust rude cam get pay use alt dm hales later claim get hack,[],{},{},0,1,[],,"['itspancake', '💖🍩 𝐇𝐚𝐥𝐢𝐳𝐳𝐥𝐞 🍩💖 (Comms Closed)']",-0.8399
251,2021-03-09,Tue Mar 09 11:59:58 +0000 2021,1369256647542136839,Rbjacobs,South Africa ,Not Geo-tagged,"b'@NtajaGP Hi! For eBucks Lifestyle queries, please contact the team directly on 087 320 3200 so that they can address your concerns. You can also visit https://t.co/XwBm2z9ySR for more info. RB'","$MENTION$ Hi! For eBucks Lifestyle queries, please contact the team directly on $NUMBER$ $NUMBER$ $NUMBER$ so that they can address your concerns. You can also visit $URL$ for more info. RB","Hi! For eBucks Lifestyle queries, please contact the team directly on so that they can address your concerns. You can also visit for more info. RB",hi for ebucks lifestyle queries please contact team directly address concerns you also visit info rb,hi for ebuck lifestyle query please contact team directly address concern also visit info rb,[],{},{},0,0,[],https://www.fnb.co.za/private-banking/private-clients/rewards/lifestyle.html,['Ntaja'],0.3802
235,2021-03-09,Tue Mar 09 13:00:01 +0000 2021,1369271759007084550,TfLTPH,"London, England",Not Geo-tagged,"b'Bus strike: It is expected that bus strikes will take place on 10 March, affecting routes in north west London. There may be an increased demand for taxi and private hire services in the area. Info on affected routes here: https://t.co/TJXYIQke9d'","Bus strike: It is expected that bus strikes will take place on $NUMBER$ March, affecting routes in north west London. There may be an increased demand for taxi and private hire services in the area. Info on affected routes here: $URL$","Bus strike It is expected that bus strikes will take place on March, affecting routes in north west London. There may be an increased demand for taxi and private hire services in the area. Info on affected routes here",bus strike it expected bus strikes take place march affecting routes north west london there may increased demand taxi private hire services area info affected routes,bus strike expect bus strike take place march affect route north west london there may increase demand taxi private hire service area info affect route,[],{},{},0,1,[],http://tfl.gov.uk/bus-strike,[],-0.4588
240,2021-03-09,Tue Mar 09 12:33:51 +0000 2021,1369265172595027972,TeamYouTube,"San Bruno, CA",Not Geo-tagged,"b""@m_a_h_a_s_h_a_y Hmm \xe2\x80\x93 if your video will be stuck during an upload for more than 8 hours, we recommend deleting and reuploading it. Here's more info: https://t.co/PndnA3lf59. You can also upload your content as private/unlisted in low resolution for faster processing: https://t.co/pO7qQXk6u9""","$MENTION$ Hmm if your video will be stuck during an upload for more than $NUMBER$ hours, we recommend deleting and reuploading it. Here's more info: $URL$. You can also upload your content as private/unlisted in low resolution for faster processing: $URL$","Hmm if your video will be stuck during an upload for more than hours, we recommend deleting and reuploading it. Here's more info . You can also upload your content as private/unlisted in low resolution for faster processing",hmm video stuck upload hours recommend deleting reuploading here info you also upload content private unlisted low resolution faster processing,hmm video stick upload hour recommend deleting reuploade here info also upload content private unlisted low resolution fast processing,[],{},{},0,2,[],"https://yt.be/help/mqko, https://yt.be/help/3QZ9",['माहाshay'],-0.1531
204,2021-03-09,Tue Mar 09 14:49:01 +0000 2021,1369299187305750528,gettysburgaddr2,,Not Geo-tagged,"b'@rural_wisdom @Annakhait Biden and Congress had nothing to do with the Seuss Estate\xe2\x80\x99s decision to stop publishing six books, a decision that this private company is allowed to make freely in a capitalist system. \nPositive COVID folks should quarantine, per CDC guidelines. Where are u getting ur info?'","$MENTION$ $MENTION$ Biden and Congress had nothing to do with the Seuss Estates decision to stop publishing six books, a decision that this private company is allowed to make freely in a capitalist system. Positive COVID folks should quarantine, per CDC guidelines. Where are u getting ur info?","Biden and Congress had nothing to do with the Seuss Estate s decision to stop publishing six books, a decision that this private company is allowed to make freely in a capitalist system. Positive COVID folks should quarantine, per CDC guidelines. Where are u getting ur info?",biden congress nothing seuss estate decision stop publishing six books decision private company allowed make freely capitalist system positive covid folks quarantine per cdc guidelines where getting info,biden congress nothing seuss estate decision stop publish six book decision private company allow make freely capitalist system positive covid folk quarantine per cdc guideline where get info,[],{},{},0,0,[],,"['The Rural Wisdom', 'Anna Khait']",0.6486
223,2021-03-09,Tue Mar 09 13:46:24 +0000 2021,1369283432308736000,GooglePayIndia,India,Not Geo-tagged,"b""@deepHimalayan Sorry to hear that, Deepak. Without revealing any private info, could you let us know if you're seeing any error message? We'll do our best to help.""","$MENTION$ Sorry to hear that, Deepak. Without revealing any private info, could you let us know if you're seeing any error message? We'll do our best to help.","Sorry to hear that, Deepak. Without revealing any private info, could you let us know if you're seeing any error message? We'll do our best to help.",sorry hear deepak without revealing private info could let know seeing error message we best help,sorry hear deepak without reveal private info could let know see error message well help,[],{},{},0,0,[],,['deepak kumar bhoi'],0.5994
245,2021-03-09,Tue Mar 09 12:13:16 +0000 2021,1369259991991980036,Healthshare_UK,UK,Not Geo-tagged,"b'Dr Maxwell Asante is a private #Consultant #Gastroenterologist at our #Orpington #Endoscopy Centre.\n\nFor more info, visit - https://t.co/olR9MelgwI. To book an appointment, contact his secretary on 07904 418362 or email asante.manager@gmail.com. https://t.co/5zZne7xtHo'","Dr Maxwell Asante is a private $HASHTAG$ $HASHTAG$ at our $HASHTAG$ $HASHTAG$ Centre. For more info, visit - $URL$. To book an appointment, contact his secretary on $NUMBER$ $NUMBER$ or email asante.manager$MENTION$.com. $URL$","Dr Maxwell Asante is a private at our Centre. For more info, visit - . To book an appointment, contact his secretary on or email asante.manager.com.",dr maxwell asante private centre for info visit to book appointment contact secretary email asante manager com,dr maxwell asante private centre for info visit to book appointment contact secretary email asante manager com,[],{},{},0,0,"['Consultant', 'Gastroenterologist', 'Orpington', 'Endoscopy']",https://orpingtonendoscopy.org.uk/,[],0.0
232,2021-03-09,Tue Mar 09 13:15:12 +0000 2021,1369275577585254400,mutualground,"Aurora, IL",Not Geo-tagged,"b'Join the Mutual Ground Meal Train! Coordinate a group to order a dinner from an area restaurant for our shelter residents. Please note, we are NOT able to accept homemade food from private homes at this time.\n\nFor more info or to sign-up: https://t.co/cgimprW51G https://t.co/hXB2GItGR6'","Join the Mutual Ground Meal Train! Coordinate a group to order a dinner from an area restaurant for our shelter residents. Please note, we are NOT able to accept homemade food from private homes at this time. For more info or to sign-up: $URL$ $URL$","Join the Mutual Ground Meal Train! Coordinate a group to order a dinner from an area restaurant for our shelter residents. Please note, we are NOT able to accept homemade food from private homes at this time. For more info or to sign-up",join mutual ground meal train coordinate group order dinner area restaurant shelter residents please note not able accept homemade food private homes time for info sign,join mutual ground meal train coordinate group order dinner area restaurant shelter resident please note not able accept homemade food private home time for info sign,[],{},{},0,2,[],https://mealtrain.com/q43zk8,[],0.3834
249,2021-03-09,Tue Mar 09 12:00:17 +0000 2021,1369256724587249665,TobyChilliShow,"Washington, DC",Not Geo-tagged,b'A new report by the website Privacy Affairs looked at hundreds of pieces of data being sold on the Dark Web to determine just how much a person\xe2\x80\x99s info is worth and the results may be surprising.\nhttps://t.co/CanBbrTWiB',A new report by the website Privacy Affairs looked at hundreds of pieces of data being sold on the Dark Web to determine just how much a persons info is worth and the results may be surprising. $URL$,A new report by the website Privacy Affairs looked at hundreds of pieces of data being sold on the Dark Web to determine just how much a person s info is worth and the results may be surprising., new report website privacy affairs looked hundreds pieces data sold dark web determine much person info worth results may surprising,  new report website privacy affair look hundred piece datum sell dark web determine much person info worth result may surprising,[],{},{},0,0,[],http://ow.ly/7aO750DTU4T,[],0.4588
260,2021-03-09,Tue Mar 09 11:45:11 +0000 2021,1369252926926053377,palembang_real,,Not Geo-tagged,b'Ready slot \n-Booking private\n-vcs\n-massage\nInfo lebih lanjut Dm\xf0\x9f\x92\x8c/ https://t.co/t5W3elCMVK\n\n#Bispakpalembang\n#openbopalembang #availpalembang #bopalembang\n#lendirpalembang #bisyarpalembang #vcsbugil\n#sangeberat #RealAccount #vcscolmek #vcsberbayar #vcscroot #vcsyuk \n#vcs https://t.co/FGTRSJErbI',Ready slot -Booking private -vcs -massage Info lebih lanjut Dm$EMOJI$/ $URL$ $HASHTAG$ $HASHTAG$ $HASHTAG$ $HASHTAG$ $HASHTAG$ $HASHTAG$ $HASHTAG$ $HASHTAG$ $HASHTAG$ $HASHTAG$ $HASHTAG$ $HASHTAG$ $HASHTAG$ $HASHTAG$ $URL$,Ready slot -Booking private -vcs -massage Info lebih lanjut Dm /,ready slot booking private vcs massage info lebih lanjut dm,ready slot book private vcs massage info lebih lanjut dm,[],{},{},0,0,"['Bispakpalembang', 'openbopalembang', 'availpalembang', 'bopalembang', 'lendirpalembang', 'bisyarpalembang', 'vcsbugil', 'sangeberat', 'RealAccount', 'vcscolmek', 'vcsberbayar', 'vcscroot', 'vcsyuk', 'vcs']",http://wa.me/+62814145715,[],0.3612
237,2021-03-09,Tue Mar 09 12:56:36 +0000 2021,1369270895844397056,Based_Tejada,New York,Not Geo-tagged,b'@RFC1872II @BoiBrat @pasta_mansta @Camellia_Alexan Bingo IE consenting to the situation at hand and not withholding information the other would deem \xe2\x80\x9cimportant\xe2\x80\x9d should people with STDs not diclose that info to a new potential partner because it\xe2\x80\x99s none of their \xe2\x80\x9cbuisness\xe2\x80\x9d  just so they can keep their privacy.. cmon that\xe2\x80\x99s cold',$MENTION$ $MENTION$ $MENTION$ $MENTION$ Bingo IE consenting to the situation at hand and not withholding information the other would deem important should people with STDs not diclose that info to a new potential partner because its none of their buisness just so they can keep their privacy.. cmon thats cold,Bingo IE consenting to the situation at hand and not withholding information the other would deem important should people with STDs not diclose that info to a new potential partner because it s none of their buisness just so they can keep their privacy.. cmon that s cold,bingo ie consenting situation hand withholding information would deem important people stds diclose info new potential partner none buisness keep privacy cmon cold,bingo ie consent situation hand withholding information would deem important people stds diclose info new potential partner none buisness keep privacy cmon cold,[],{},{},0,0,[],,"['.', 'Dumb Bitch Psychologist', 'Morgan Bradley', 'Camellia 🎨']",0.6124
252,2021-03-09,Tue Mar 09 11:59:38 +0000 2021,1369256561990766593,apnamartshop,India,Not Geo-tagged,b'We are now hiring fresh talents.\nJoin Us Today - Call us for more info: +91-9153149535 | Apna Mart Shop And Earn Private Limited\n\n #job #work #jobs #jobsearch #career #recruitment #employment #working #jobfair #nowhiring #jobseeker #fulltimejob #apnamartshopandearn https://t.co/VLGUa7krMf',We are now hiring fresh talents. Join Us Today - Call us for more info: +91-9153149535 | Apna Mart Shop And Earn Private Limited $HASHTAG$ $HASHTAG$ $HASHTAG$ $HASHTAG$ $HASHTAG$ $HASHTAG$ $HASHTAG$ $HASHTAG$ $HASHTAG$ $HASHTAG$ $HASHTAG$ $HASHTAG$ $HASHTAG$ $URL$,We are now hiring fresh talents. Join Us Today - Call us for more info +91-9153149535 | Apna Mart Shop And Earn Private Limited,we hiring fresh talents join us today call info apna mart shop and earn private limited,hire fresh talent join today call info apna mart shop and earn private limited,[],{},{},0,0,"['job', 'work', 'jobs', 'jobsearch', 'career', 'recruitment', 'employment', 'working', 'jobfair', 'nowhiring', 'jobseeker', 'fulltimejob', 'apnamartshopandearn']",,[],0.6808
248,2021-03-09,Tue Mar 09 12:00:58 +0000 2021,1369256896176197638,MarketProHomes,"Maryland, USA",Not Geo-tagged,"b""Think you'll find your perfect buyer at an open house? Open houses are exciting, but don't expect this to be the place to find buyers. Serious homebuyers like us will request a private one-on-one showing instead! Visit https://t.co/Jyy3l578X1 for more info. https://t.co/7svYZO5gyk""","Think you'll find your perfect buyer at an open house? Open houses are exciting, but don't expect this to be the place to find buyers. Serious homebuyers like us will request a private one-on-one showing instead! Visit $URL$ for more info. $URL$","Think you'll find your perfect buyer at an open house? Open houses are exciting, but do not expect this to be the place to find buyers. Serious homebuyers like us will request a private one-on-one showing instead! Visit for more info.",think find perfect buyer open house open houses exciting expect place find buyers serious homebuyers like request private one one showing instead visit info,think find perfect buyer open house open house exciting expect place find buyer serious homebuyer like request private one one show instead visit info,[],{},{},0,1,[],https://www.marketprohomebuyers.com/,[],0.7609
259,2021-03-09,Tue Mar 09 11:45:32 +0000 2021,1369253014410821637,Sharpes_Estates,"Merton, London",Not Geo-tagged,"b'We are proud to present our new Victorian Cottage in Putney priced at only \xc2\xa32250! 2 Bed, Private Roof Terrace, Private Rear Garden. Give us a call on 0208 286 4073 for more info! https://t.co/LcqxarZNxY https://t.co/2fy6uyoxlQ'","We are proud to present our new Victorian Cottage in Putney priced at only $NUMBER$! $NUMBER$ Bed, Private Roof Terrace, Private Rear Garden. Give us a call on $NUMBER$ $NUMBER$ $NUMBER$ for more info! $URL$ $URL$","We are proud to present our new Victorian Cottage in Putney priced at only 2250! Bed, Private Roof Terrace, Private Rear Garden. Give us a call on for more info!",we proud present new victorian cottage putney priced bed private roof terrace private rear garden give call info,proud present new victorian cottage putney price bed private roof terrace private rear garden give call info,[],{},{},0,0,[],https://www.sharpesestates.com/rentals/propEs1614685460614,[],0.5696
247,2021-03-09,Tue Mar 09 12:02:33 +0000 2021,1369257296245776384,VaniPvtltd,"Seshadripuram, banglore-20",Not Geo-tagged,b'Vani Pvt Ltd - 3M VHB Washing Machine Panel https://t.co/L7HGkZa2Gh via @YouTube \n3M Authorized Distributor - Vani Private Limited \nVisit us for more info https://t.co/KYMddRwver\n#Call to order +91-9632004495\n3M Appliance Design: 3M\xe2\x84\xa2 VHB\xe2\x84\xa2 Tape Washing Machine Panel Bonding',Vani Pvt Ltd - $NUMBER$M VHB Washing Machine Panel $URL$ via $MENTION$ $NUMBER$M Authorized Distributor - Vani Private Limited Visit us for more info $URL$ $HASHTAG$ to order +91-9632004495 $NUMBER$M Appliance Design: $NUMBER$M VHB Tape Washing Machine Panel Bonding,Vani Pvt Ltd - M VHB Washing Machine Panel via M Authorized Distributor - Vani Private Limited Visit us for more info to order +91-9632004495 M Appliance Design M VHB Tape Washing Machine Panel Bonding,vani pvt ltd vhb washing machine panel via authorized distributor vani private limited visit info order appliance design vhb tape washing machine panel bonding,vani pvt ltd vhb washing machine panel via authorized distributor vani private limited visit info order appliance design vhb tape washing machine panel bonding,[],{},{},0,0,['Call'],"https://youtu.be/691eRBr6YYQ, http://vani.co.in/",['YouTube'],-0.2263
253,2021-03-09,Tue Mar 09 11:58:00 +0000 2021,1369256150366060551,washfm,"Washington, DC",Not Geo-tagged,b'A new report by the website Privacy Affairs looked at hundreds of pieces of data being sold on the Dark Web to determine just how much a person\xe2\x80\x99s info is worth and the results may be surprising. https://t.co/t3P79O1B8r',A new report by the website Privacy Affairs looked at hundreds of pieces of data being sold on the Dark Web to determine just how much a persons info is worth and the results may be surprising. $URL$,A new report by the website Privacy Affairs looked at hundreds of pieces of data being sold on the Dark Web to determine just how much a person s info is worth and the results may be surprising., new report website privacy affairs looked hundreds pieces data sold dark web determine much person info worth results may surprising,  new report website privacy affair look hundred piece datum sell dark web determine much person info worth result may surprising,[],{},{},0,0,[],http://ihe.art/QopdsRM,[],0.4588
