s_no,date,created_at,id_str,screen_name,user_location,geo-tagged_place,tweet_text,tweet_tokenized,tweet_cleaned,tweet_filtered,tweet_lemmatized,tweet_mentioned_organizations,tweet_tags_classified,tweet_orgs_classified,retweet_count,fav_count,hashtags,urls,mentions,vader_polarity
378,2021-03-10,Wed Mar 10 04:21:31 +0000 2021,1369503662058344449,EOXON_INFO,"Kerala, India",Not Geo-tagged,"b'PowerApps Developer\nQuiits Technologies Private Limited\n\nClosing on:\n13/03/2021\n\nContact email:\ncareers@quiits.com\n\nQualification : Any graduation\nExperience : 1-2 years\nJob Description\n\nSBC Module No 7, 3rd Floor, Ashtamudi Tower, Technopark, Kollam https://t.co/Sr848uM6d5'","PowerApps Developer Quiits Technologies Private Limited Closing on: $NUMBER$/03/2021 Contact email: careers$MENTION$.com Qualification : Any graduation Experience : $NUMBER$-2 years Job Description SBC Module No $NUMBER$, $NUMBER$rd Floor, Ashtamudi Tower, Technopark, Kollam $URL$","PowerApps Developer Quiits Technologies Private Limited Closing on /03/2021 Contact email careers.com Qualification Any graduation Experience -2 years Job Description SBC Module No , rd Floor, Ashtamudi Tower, Technopark, Kollam",powerapps developer quiits technologies private limited closing contact email careers com qualification any graduation experience years job description sbc module no floor ashtamudi tower technopark kollam,powerapps developer quiit technologie private limited closing contact email career com qualification any graduation experience year job description sbc module no floor ashtamudi tower technopark kollam,[],{},{},0,0,[],,[],-0.4767
387,2021-03-10,Wed Mar 10 04:00:29 +0000 2021,1369498369022775297,sheila_seattle,,Not Geo-tagged,b'@SachaBaronCohen Do you people not realize that FB is not a news editor. They are NOT responsible for news people post. \n\nDo you blame AT&amp;T for conversations people have on their phone. \n\nExpecting a private company to censor info without any accountability is a disaster!!',$MENTION$ Do you people not realize that FB is not a news editor. They are NOT responsible for news people post. Do you blame AT&amp;T for conversations people have on their phone. Expecting a private company to censor info without any accountability is a disaster!!,Do you people not realize that FB is not a news editor. They are NOT responsible for news people post. Do you blame AT&amp;T for conversations people have on their phone. Expecting a private company to censor info without any accountability is a disaster!!,do people realize fb news editor they not responsible news people post do blame at conversations people phone expecting private company censor info without accountability disaster,do people realize fb news editor not responsible news people post do blame at conversation people phone expect private company censor info without accountability disaster,[],{},{},0,1,[],,['Sacha Baron Cohen'],-0.901
386,2021-03-10,Wed Mar 10 04:01:37 +0000 2021,1369498651274469380,MoonTonight6_13,,Not Geo-tagged,"b'@BigHitEnt Excuse me but where are you at right now? Your biggest boy group account on TT has been hacked and you\'re not helping. You\'re supposed to ""fix"" that mistakes and secure your artists privacy, specially when a person hack their account that could possibly contain private info'","$MENTION$ Excuse me but where are you at right now? Your biggest boy group account on TT has been hacked and you're not helping. You're supposed to ""fix"" that mistakes and secure your artists privacy, specially when a person hack their account that could possibly contain private info","Excuse me but where are you at right now? Your biggest boy group account on TT has been hacked and you're not helping. You're supposed to ""fix"" that mistakes and secure your artists privacy, specially when a person hack their account that could possibly contain private info",excuse right your biggest boy group account tt hacked helping you supposed fix mistakes secure artists privacy specially person hack account could possibly contain private info,excuse right big boy group account tt hack help suppose fix mistake secure artist privacy specially person hack account could possibly contain private info,[],{},{},0,2,[],,['BigHit Entertainment'],-0.7079
390,2021-03-10,Wed Mar 10 03:54:33 +0000 2021,1369496874286264320,sparklightcares,,Not Geo-tagged,"b""@AlbertVarzari We are truly sorry to hear you feel this way. If there is anything we can do to improve your experience with us, we'd love to hear from you. Please feel free to send us a private message with your contact info. Thanks.""","$MENTION$ We are truly sorry to hear you feel this way. If there is anything we can do to improve your experience with us, we'd love to hear from you. Please feel free to send us a private message with your contact info. Thanks.","We are truly sorry to hear you feel this way. If there is anything we can do to improve your experience with us, we'd love to hear from you. Please feel free to send us a private message with your contact info. Thanks.",we truly sorry hear feel way if anything improve experience love hear please feel free send private message contact info thanks,truly sorry hear feel way if anything improve experience love hear please feel free send private message contact info thank,[],{},{},0,0,[],,['Blaise Hazzard'],0.9531
385,2021-03-10,Wed Mar 10 04:01:48 +0000 2021,1369498700280569857,heidySeokJin,"Mexicali, Baja California",Not Geo-tagged,"b'@BigHitEnt Excuse me but where are you at right now? Your biggest boy group account on TT has been hacked and you\'re not helping. You\'re supposed to ""fix"" that mistakes and secure your artists privacy, specially when a person hack their account that could possibly contain private info'","$MENTION$ Excuse me but where are you at right now? Your biggest boy group account on TT has been hacked and you're not helping. You're supposed to ""fix"" that mistakes and secure your artists privacy, specially when a person hack their account that could possibly contain private info","Excuse me but where are you at right now? Your biggest boy group account on TT has been hacked and you're not helping. You're supposed to ""fix"" that mistakes and secure your artists privacy, specially when a person hack their account that could possibly contain private info",excuse right your biggest boy group account tt hacked helping you supposed fix mistakes secure artists privacy specially person hack account could possibly contain private info,excuse right big boy group account tt hack help suppose fix mistake secure artist privacy specially person hack account could possibly contain private info,[],{},{},0,0,[],,['BigHit Entertainment'],-0.7079
389,2021-03-10,Wed Mar 10 03:55:57 +0000 2021,1369497224720355340,Killyng013,,Not Geo-tagged,"b'@BigHitEnt Excuse me but where are you at right now? Your biggest boy group account on TT has been hacked and you\'re not helping. You\'re supposed to ""fix"" that mistakes and secure your artists privacy, specially when a person hack their account that could possibly contain private info'","$MENTION$ Excuse me but where are you at right now? Your biggest boy group account on TT has been hacked and you're not helping. You're supposed to ""fix"" that mistakes and secure your artists privacy, specially when a person hack their account that could possibly contain private info","Excuse me but where are you at right now? Your biggest boy group account on TT has been hacked and you're not helping. You're supposed to ""fix"" that mistakes and secure your artists privacy, specially when a person hack their account that could possibly contain private info",excuse right your biggest boy group account tt hacked helping you supposed fix mistakes secure artists privacy specially person hack account could possibly contain private info,excuse right big boy group account tt hack help suppose fix mistake secure artist privacy specially person hack account could possibly contain private info,[],{},{},0,0,[],,['BigHit Entertainment'],-0.7079
380,2021-03-10,Wed Mar 10 04:13:01 +0000 2021,1369501521734365188,EnergiaPublica,"Vancouver/ Calgary, Canada",Not Geo-tagged,"b'@detroit_Ro @MatthewGellert @LEBassett @theandrearomano My experience was in a crown corp/ gov\xe2\x80\x99t monopoly. We worked in env. mgmt, which was well managed at the firm. Nothing controversial or confidential, most information publicly available. At same time, knew ppl given months notice at private co.s w/ $millions of confidential info'","$MENTION$ $MENTION$ $MENTION$ $MENTION$ My experience was in a crown corp/ govt monopoly. We worked in env. mgmt, which was well managed at the firm. Nothing controversial or confidential, most information publicly available. At same time, knew ppl given months notice at private co.s w/ $millions of confidential info","My experience was in a crown corp/ gov t monopoly. We worked in env. mgmt, which was well managed at the firm. Nothing controversial or confidential, most information publicly available. At same time, knew ppl given months notice at private co.s w/ $millions of confidential info",my experience crown corp gov monopoly we worked env mgmt well managed firm nothing controversial confidential information publicly available at time knew ppl given months notice private millions confidential info,experience crown corp gov monopoly work env mgmt well manage firm nothing controversial confidential information publicly available at time know ppl give month notice private million confidential info,[],{},{},0,1,[],,"['Ro', 'Matthew Gellert', 'Laura Bassett', 'Andrea Romano']",0.4003
388,2021-03-10,Wed Mar 10 03:55:57 +0000 2021,1369497228285534213,RAS3535,"Boston, MA",Not Geo-tagged,b'We haven\xe2\x80\x99t let many in to our Private Group. #1 would cost to much money for members unless u bet very big. #2 we don\xe2\x80\x99t want lines moving like crazy or info getting out. But I\xe2\x80\x99m in a giving mood and haven\xe2\x80\x99t decided if we want to let in like 2 or 5 members maybe 8-10. Continue',We havent let many in to our Private Group. $HASHTAG$ would cost to much money for members unless u bet very big. $HASHTAG$ we dont want lines moving like crazy or info getting out. But Im in a giving mood and havent decided if we want to let in like $NUMBER$ or $NUMBER$ members maybe $NUMBER$-10. Continue,We haven t let many in to our Private Group. would cost to much money for members unless u bet very big. we don t want lines moving like crazy or info getting out. But I m in a giving mood and haven t decided if we want to let in like or members maybe -10. Continue,we let many private group would cost much money members unless bet big want lines moving like crazy info getting but giving mood decided want let like members maybe continue,let many private group would cost much money member unless bet big want line move like crazy info get but give mood decide want let like member maybe continue,[],{},{},0,0,[],,[],0.7906
382,2021-03-10,Wed Mar 10 04:07:36 +0000 2021,1369500159680389123,UN_CTED,"United Nations, New York",Not Geo-tagged,"b'At the 14th @CrimeCongressUN event, Managing e-evidence across borders in CT &amp; transnational organized crime cases, ASG Coninsx, ED @UN_CTED said criminal-justice authorities are increasingly relying on info held by private companies to investigate &amp; prosecute terrorism crimes. https://t.co/P2ssMOhtqW'","At the $NUMBER$th $MENTION$ event, Managing e-evidence across borders in CT &amp; transnational organized crime cases, ASG Coninsx, ED $MENTION$ said criminal-justice authorities are increasingly relying on info held by private companies to investigate &amp; prosecute terrorism crimes. $URL$","At the th event, Managing e-evidence across borders in CT &amp; transnational organized crime cases, ASG Coninsx, ED said criminal-justice authorities are increasingly relying on info held by private companies to investigate &amp; prosecute terrorism crimes.",at event managing evidence across borders ct transnational organized crime cases asg coninsx ed said criminal justice authorities increasingly relying info held private companies investigate prosecute terrorism crimes,at event manage evidence across border ct transnational organize crime case asg coninsx ed say criminal justice authority increasingly rely info hold private company investigate prosecute terrorism crime,[],{},{},11,18,[],,"['UN Crime Congress', 'United Nations CTED']",-0.8957
396,2021-03-10,Wed Mar 10 03:37:36 +0000 2021,1369492609790398465,80Z80NY,Hawaii 🌺,Not Geo-tagged,"b'we need to form a core group of reliable streamers but ideally it needs to be 2-3K ppl \xf0\x9f\x98\xad if you make info or resources (like free links) private, it TREMENDOUSLY restricts the reach when we already are struggling to get the reach we need when everything is public'","we need to form a core group of reliable streamers but ideally it needs to be $NUMBER$-3K ppl $EMOJI$ if you make info or resources (like free links) private, it TREMENDOUSLY restricts the reach when we already are struggling to get the reach we need when everything is public","we need to form a core group of reliable streamers but ideally it needs to be -3K ppl if you make info or resources (like free links) private, it TREMENDOUSLY restricts the reach when we already are struggling to get the reach we need when everything is public",need form core group reliable streamers ideally needs ppl make info resources like free links private tremendously restricts reach already struggling get reach need everything public,need form core group reliable streamer ideally need ppl make info resource like free link private tremendously restrict reach already struggle get reach need everything public,[],{},{},66,70,[],,[],0.7092
393,2021-03-10,Wed Mar 10 03:47:01 +0000 2021,1369494978574118916,susanotr,,Not Geo-tagged,"b'@TrackingCovid @VanderbiltU @JohnCooper4Nash No one, vaccinated or not, covid test neg or not, should be willing to give up their private medical info to attend an event. You don\xe2\x80\x99t honestly think it will stop there, do you? It\xe2\x80\x99s been so bad, we\xe2\x80\x99re willing to go to this length to get back what seems like freedom. It\xe2\x80\x99s not.'","$MENTION$ $MENTION$ $MENTION$ No one, vaccinated or not, covid test neg or not, should be willing to give up their private medical info to attend an event. You dont honestly think it will stop there, do you? Its been so bad, were willing to go to this length to get back what seems like freedom. Its not.","No one, vaccinated or not, covid test neg or not, should be willing to give up their private medical info to attend an event. You don t honestly think it will stop there, do you? It s been so bad, we re willing to go to this length to get back what seems like freedom. It s not.",no one vaccinated covid test neg willing give private medical info attend event you honestly think stop it bad willing go length get back seems like freedom it,no one vaccinate covid test neg willing give private medical info attend event honestly think stop bad willing go length get back seem like freedom,[],{},{},6,24,[],,"['Tennessee Stands - Covid Data & Research', 'Vanderbilt University', 'Mayor John Cooper']",0.2044
392,2021-03-10,Wed Mar 10 03:49:21 +0000 2021,1369495565109760003,VeroniqueKambaG,,Not Geo-tagged,"b""@MIMIUSAEU @AgathedeLili Christian Jones(whose partner got paid for info to Dan Wooton) left KP to move on to private practice. Jason Knauf he's still head of the Cambridges Foundation.""",$MENTION$ $MENTION$ Christian Jones(whose partner got paid for info to Dan Wooton) left KP to move on to private practice. Jason Knauf he's still head of the Cambridges Foundation.,Christian Jones(whose partner got paid for info to Dan Wooton) left KP to move on to private practice. Jason Knauf he's still head of the Cambridges Foundation.,christian jones whose partner got paid info dan wooton left kp move private practice jason knauf still head cambridges foundation,christian jones whose partner get pay info dan wooton leave kp move private practice jason knauf still head cambridge foundation,[],{},{},0,4,[],,"['mimi♥️🎵☯️🌅🏝🗽⚓️✈️🎷🎭🏊\u200d♀️🍷🥂🍰🌈🎓💍💋', 'Agathe de Lili']",0.0
391,2021-03-10,Wed Mar 10 03:53:09 +0000 2021,1369496520106663943,Macys,,Not Geo-tagged,"b""@YlsewL Hi, we're sorry to hear you received the wrong hat. Could you please send us a private message and include you order number, the Web ID of the hat you need, your full name, and contact info, so that we can try to help? Thanks! https://t.co/9HJq8Cszhv""","$MENTION$ Hi, we're sorry to hear you received the wrong hat. Could you please send us a private message and include you order number, the Web ID of the hat you need, your full name, and contact info, so that we can try to help? Thanks! $URL$","Hi, we're sorry to hear you received the wrong hat. Could you please send us a private message and include you order number, the Web ID of the hat you need, your full name, and contact info, so that we can try to help? Thanks!",hi sorry hear received wrong hat could please send private message include order number web id hat need full name contact info try help thanks,hi sorry hear receive wrong hat could please send private message include order number web d hat need full name contact info try help thank,[],{},{},0,1,[],https://twitter.com/messages/compose?recipient_id=50687788,['Ylsew laurent'],0.6239
384,2021-03-10,Wed Mar 10 04:02:57 +0000 2021,1369498989184290819,crowofarooster,Genshin Impact Hell,Not Geo-tagged,"b'minors need to realise the internet isnt safe lol\nthey need to smarten up, not post so much private info, and stop harassin ppl\n\nesp cuz now your online life cant ever be deleted, you fuck up once, its there forever\nu think theyll hire someone who harassed an artist to death lol'","minors need to realise the internet isnt safe lol they need to smarten up, not post so much private info, and stop harassin ppl esp cuz now your online life cant ever be deleted, you fuck up once, its there forever u think theyll hire someone who harassed an artist to death lol","minors need to realise the internet isnt safe lol they need to smarten up, not post so much private info, and stop harassin ppl esp cuz now your online life cant ever be deleted, you fuck up once, its there forever u think theyll hire someone who harassed an artist to death lol",minors need realise internet isnt safe lol need smarten post much private info stop harassin ppl esp cuz online life cant ever deleted fuck forever think theyll hire someone harassed artist death lol,minor need realise internet be not safe lol need smarten post much private info stop harassin ppl esp cuz online life can not ever delete fuck forever think will hire someone harass artist death lol,[],{},{},1,1,[],,[],-0.903
360,2021-03-10,Wed Mar 10 05:09:20 +0000 2021,1369515695835213827,LAflyr,SoCal,Not Geo-tagged,"b'@AirlineFlyer @WandrMe Why would govt supply or even have your health data? Health care in U.S. is provided by private vendors be it large HMOs or smaller providers.  If @iata or anyone else wants to create app, then let folks opt-in and upload their own data, not get govt in biz of maintaining info.'","$MENTION$ $MENTION$ Why would govt supply or even have your health data? Health care in U.S. is provided by private vendors be it large HMOs or smaller providers. If $MENTION$ or anyone else wants to create app, then let folks opt-in and upload their own data, not get govt in biz of maintaining info.","Why would govt supply or even have your health data? Health care in U.S. is provided by private vendors be it large HMOs or smaller providers. If or anyone else wants to create app, then let folks opt-in and upload their own data, not get govt in biz of maintaining info.",why would govt supply even health data health care s provided private vendors large hmos smaller providers if anyone else wants create app let folks opt upload data get govt biz maintaining info,why would govt supply even health datum health care s provide private vendor large hmo small provider if anyone else want create app let folk opt upload datum get govt biz maintaining info,[],{},{},0,1,[],,"['Jason Rabinowitz', 'Seth Miller', 'IATA']",0.6486
401,2021-03-10,Wed Mar 10 03:31:12 +0000 2021,1369490997172965376,Luzywab7,Blue&Grey,Not Geo-tagged,"b'@BigHitEnt Excuse me but where are you at right now? Your biggest boy group account on TT has been hacked and you\'re not helping. You\'re supposed to ""fix"" that mistakes and secure your artists privacy, specially when a person hack their account that could possibly contain private info'","$MENTION$ Excuse me but where are you at right now? Your biggest boy group account on TT has been hacked and you're not helping. You're supposed to ""fix"" that mistakes and secure your artists privacy, specially when a person hack their account that could possibly contain private info","Excuse me but where are you at right now? Your biggest boy group account on TT has been hacked and you're not helping. You're supposed to ""fix"" that mistakes and secure your artists privacy, specially when a person hack their account that could possibly contain private info",excuse right your biggest boy group account tt hacked helping you supposed fix mistakes secure artists privacy specially person hack account could possibly contain private info,excuse right big boy group account tt hack help suppose fix mistake secure artist privacy specially person hack account could possibly contain private info,[],{},{},0,0,[],,['BigHit Entertainment'],-0.7079
402,2021-03-10,Wed Mar 10 03:30:03 +0000 2021,1369490708005068801,minimochiyeon,,Not Geo-tagged,"b'@BigHitEnt Excuse me but where are you at right now? Your biggest boy group account on TT has been hacked and you\'re not helping. You\'re supposed to ""fix"" that mistakes and secure your artists privacy, specially when a person hack their account that could possibly contain private info'","$MENTION$ Excuse me but where are you at right now? Your biggest boy group account on TT has been hacked and you're not helping. You're supposed to ""fix"" that mistakes and secure your artists privacy, specially when a person hack their account that could possibly contain private info","Excuse me but where are you at right now? Your biggest boy group account on TT has been hacked and you're not helping. You're supposed to ""fix"" that mistakes and secure your artists privacy, specially when a person hack their account that could possibly contain private info",excuse right your biggest boy group account tt hacked helping you supposed fix mistakes secure artists privacy specially person hack account could possibly contain private info,excuse right big boy group account tt hack help suppose fix mistake secure artist privacy specially person hack account could possibly contain private info,[],{},{},0,0,[],,['BigHit Entertainment'],-0.7079
398,2021-03-10,Wed Mar 10 03:33:44 +0000 2021,1369491637601267713,EvelynAgil,,Not Geo-tagged,"b'@BigHitEnt Excuse me but where are you at right now? Your biggest boy group account on TT has been hacked and you\'re not helping. You\'re supposed to ""fix"" that mistakes and secure your artists privacy, specially when a person hack their account that could possibly contain private info'","$MENTION$ Excuse me but where are you at right now? Your biggest boy group account on TT has been hacked and you're not helping. You're supposed to ""fix"" that mistakes and secure your artists privacy, specially when a person hack their account that could possibly contain private info","Excuse me but where are you at right now? Your biggest boy group account on TT has been hacked and you're not helping. You're supposed to ""fix"" that mistakes and secure your artists privacy, specially when a person hack their account that could possibly contain private info",excuse right your biggest boy group account tt hacked helping you supposed fix mistakes secure artists privacy specially person hack account could possibly contain private info,excuse right big boy group account tt hack help suppose fix mistake secure artist privacy specially person hack account could possibly contain private info,[],{},{},0,0,[],,['BigHit Entertainment'],-0.7079
404,2021-03-10,Wed Mar 10 03:29:08 +0000 2021,1369490477700034562,Daniela18977517,BTSPOP 💎,Not Geo-tagged,"b'@BigHitEnt Excuse me but where are you at right now? Your biggest boy group account on TT has been hacked and you\'re not helping. You\'re supposed to ""fix"" that mistakes and secure your artists privacy, specially when a person hack their account that could possibly contain private info'","$MENTION$ Excuse me but where are you at right now? Your biggest boy group account on TT has been hacked and you're not helping. You're supposed to ""fix"" that mistakes and secure your artists privacy, specially when a person hack their account that could possibly contain private info","Excuse me but where are you at right now? Your biggest boy group account on TT has been hacked and you're not helping. You're supposed to ""fix"" that mistakes and secure your artists privacy, specially when a person hack their account that could possibly contain private info",excuse right your biggest boy group account tt hacked helping you supposed fix mistakes secure artists privacy specially person hack account could possibly contain private info,excuse right big boy group account tt hack help suppose fix mistake secure artist privacy specially person hack account could possibly contain private info,[],{},{},0,0,[],,['BigHit Entertainment'],-0.7079
