s_no,date,created_at,id_str,screen_name,user_location,geo-tagged_place,tweet_text,tweet_tokenized,tweet_cleaned,tweet_filtered,tweet_lemmatized,tweet_mentioned_organizations,tweet_tags_classified,tweet_orgs_classified,retweet_count,fav_count,hashtags,urls,mentions,vader_polarity
391,2021-03-15,Mon Mar 15 08:55:39 +0000 2021,1371384587608285184,hitng_info,Nigeria,Not Geo-tagged,b'BUSTED!! Pastor Arrested For Applying Anointing Oil On Pregnant Woman\xe2\x80\x99s Private\xc2\xa0Part https://t.co/JE0HNnjdzG',BUSTED!! Pastor Arrested For Applying Anointing Oil On Pregnant Womans PrivatePart $URL$,BUSTED!! Pastor Arrested For Applying Anointing Oil On Pregnant Woman s Private Part,busted pastor arrested for applying anointing oil on pregnant woman private part,busted pastor arrest for apply anoint oil on pregnant woman private part,[],{},{},0,0,[],https://www.hitng.info/busted-pastor-arrested-for-applying-anointing-oil-on-pregnant-womans-private-part/,[],-0.5696
400,2021-03-15,Mon Mar 15 08:13:43 +0000 2021,1371374033447444481,bernaphoebs_rr,She,Not Geo-tagged,b'Pls stop treating twitter as ur online diary unless its private. Like thats so dangerous ur literally sharing personal info on the internet.',Pls stop treating twitter as ur online diary unless its private. Like thats so dangerous ur literally sharing personal info on the internet.,Pls stop treating twitter as ur online diary unless its private. Like thats so dangerous ur literally sharing personal info on the internet.,pls stop treating twitter ur online diary unless private like thats dangerous literally sharing personal info internet,pls stop treat twitter ur online diary unless private like that s dangerous literally share personal info internet,[],{},{},0,0,[],,[],0.0018
403,2021-03-15,Mon Mar 15 08:00:01 +0000 2021,1371370587336097793,MiskawaanVillas,Koh Samui Thailand,Not Geo-tagged,b'Miskawaan Residence is blessed with an abundance of space\xe2\x80\x94take it all in as you lounge by the private pool on an ocean-facing day bed. \n\nFor more info: https://t.co/916D7hr8Qa \nWhatsapp us : +66 (0) 833902992\n\n#Miskawaan #KohSamui #Thailand #Beachluxe https://t.co/EkjxFBhq8G',Miskawaan Residence is blessed with an abundance of spacetake it all in as you lounge by the private pool on an ocean-facing day bed. For more info: $URL$ Whatsapp us : +66 (0) $NUMBER$ $HASHTAG$ $HASHTAG$ $HASHTAG$ $HASHTAG$ $URL$,Miskawaan Residence is blessed with an abundance of space take it all in as you lounge by the private pool on an ocean-facing day bed. For more info Whatsapp us +66 (0),miskawaan residence blessed abundance space take lounge private pool ocean facing day bed for info whatsapp,miskawaan residence bless abundance space take lounge private pool ocean face day bed for info whatsapp,[],{},{},0,1,"['Miskawaan', 'KohSamui', 'Thailand', 'Beachluxe']",https://bit.ly/Miskawaan-Website,[],0.5994
393,2021-03-15,Mon Mar 15 08:53:01 +0000 2021,1371383927194157056,TeamYouTube,"San Bruno, CA",Not Geo-tagged,"b""@TheStateOfCryp1 We'll share this with the team for further investigation. We'll get back to you as soon as we have an update. We also recommend deleting your tweet as it includes your private/sensitive info (email address) that's shared publicly. Appreciate your patience in the meantime.""",$MENTION$ We'll share this with the team for further investigation. We'll get back to you as soon as we have an update. We also recommend deleting your tweet as it includes your private/sensitive info (email address) that's shared publicly. Appreciate your patience in the meantime.,We'll share this with the team for further investigation. We'll get back to you as soon as we have an update. We also recommend deleting your tweet as it includes your private/sensitive info (email address) that's shared publicly. Appreciate your patience in the meantime.,we share team investigation we get back soon update we also recommend deleting tweet includes private sensitive info email address shared publicly appreciate patience meantime,share team investigation get back soon update also recommend delete tweet include private sensitive info email address share publicly appreciate patience meantime,[],{},{},0,0,[],,['The State Of Crypto'],0.8316
399,2021-03-15,Mon Mar 15 08:29:10 +0000 2021,1371377925191315457,probate_network,England and Wales,Not Geo-tagged,"b'What happens to shares owned in a private company when the shareholder dies depends on a number of factors. It can be a very complex subject and careful estate planning, as well as specialist advice, is critical. More info: https://t.co/Q0MjHc5hfK\n\n#probate #probateadvice https://t.co/26dxy2yGIK'","What happens to shares owned in a private company when the shareholder dies depends on a number of factors. It can be a very complex subject and careful estate planning, as well as specialist advice, is critical. More info: $URL$ $HASHTAG$ $HASHTAG$ $URL$","What happens to shares owned in a private company when the shareholder dies depends on a number of factors. It can be a very complex subject and careful estate planning, as well as specialist advice, is critical. More info",what happens shares owned private company shareholder dies depends number factors it complex subject careful estate planning well specialist advice critical more info,what happen share own private company shareholder die depend number factor complex subject careful estate planning well specialist advice critical more info,[],{},{},1,0,"['probate', 'probateadvice']",https://bit.ly/2MoTbtJ,[],0.4404
389,2021-03-15,Mon Mar 15 09:01:07 +0000 2021,1371385964787068928,thyroiduk_org,Essex,Not Geo-tagged,"b'Phoenix Pathology\xc2\xa0is now working with Thyroid UK providing Thyroid and nutritional tests at affordable prices.\xc2\xa0\xc2\xa0Phoenix Pathology laboratory is located at the luxurious 25 Harley Street clinic in Marylebone, London.\xc2\xa0For more information: https://t.co/LT1B9Y6zjE https://t.co/wXAYtLYPF5'","Phoenix Pathologyis now working with Thyroid UK providing Thyroid and nutritional tests at affordable prices.Phoenix Pathology laboratory is located at the luxurious $NUMBER$ Harley Street clinic in Marylebone, London.For more information: $URL$ $URL$","Phoenix Pathology is now working with Thyroid UK providing Thyroid and nutritional tests at affordable prices. Phoenix Pathology laboratory is located at the luxurious Harley Street clinic in Marylebone, London. For more information",phoenix pathology working thyroid uk providing thyroid nutritional tests affordable prices phoenix pathology laboratory located luxurious harley street clinic marylebone london for information,phoenix pathology work thyroid uk provide thyroid nutritional test affordable price phoenix pathology laboratory locate luxurious harley street clinic marylebone london for information,[],{},{},0,0,[],http://thyroiduk.org/getting-a-diagnosis/thyroid-testing-info/private-testing/phoenix-pathology/,[],0.0
402,2021-03-15,Mon Mar 15 08:00:54 +0000 2021,1371370809701371904,ProPropertyG,"Leederville, Perth (WA)",Not Geo-tagged,"b'\xf0\x9f\x94\xa5NOW SELLING\n3/369 Main Street, BALCATTA\n\nWELL PRESENTED PRIVATE VILLA!\n\nA cosy, neat as pin, easy care 3-bedroom villa, positioned to offer privacy &amp; security, with nothing to spend!\n\nBe very fast to arrange a viewing. \n\nMore Info: https://t.co/N5PNtXRjK6 https://t.co/SQqqOEZbVU'","$EMOJI$NOW SELLING $NUMBER$/369 Main Street, BALCATTA WELL PRESENTED PRIVATE VILLA! A cosy, neat as pin, easy care $NUMBER$-bedroom villa, positioned to offer privacy &amp; security, with nothing to spend! Be very fast to arrange a viewing. More Info: $URL$ $URL$","NOW SELLING /369 Main Street, BALCATTA WELL PRESENTED PRIVATE VILLA! A cosy, neat as pin, easy care -bedroom villa, positioned to offer privacy &amp; security, with nothing to spend! Be very fast to arrange a viewing. More Info",now selling main street balcatta well presented private villa cosy neat pin easy care bedroom villa positioned offer privacy security nothing spend be fast arrange viewing more info,now sell main street balcatta well present private villa cosy neat pin easy care bedroom villa position offer privacy security nothing spend be fast arrange view more info,[],{},{},0,0,[],http://ow.ly/NiTw50DYFbx,[],0.9315
354,2021-03-15,Mon Mar 15 11:11:04 +0000 2021,1371418664730263556,JosieGrillasSTL,St. Louis City,Not Geo-tagged,"b""The @STLYoungDems are hosting a forum on Tuesday, 3/16 for @SLPS_INFO School Board candidates: https://t.co/4FJJadSwDO.\n\nFollow @SolidaritySLPS to keep up w special interests' attempts to use our public schools for private profit.\n\nSample Ballot for 4/6: https://t.co/yma66PSS52 https://t.co/Y432o4CTHW""","The $MENTION$ are hosting a forum on Tuesday, $NUMBER$/16 for $MENTION$ School Board candidates: $URL$. Follow $MENTION$ to keep up w special interests' attempts to use our public schools for private profit. Sample Ballot for $NUMBER$/6: $URL$ $URL$","The are hosting a forum on Tuesday, /16 for School Board candidates . Follow to keep up w special interests' attempts to use our public schools for private profit. Sample Ballot for /6",the hosting forum tuesday school board candidates follow keep special interests attempts use public schools private profit sample ballot,the host forum tuesday school board candidate follow keep special interest attempt use public school private profit sample ballot,[],{},{},1,1,[],"https://twitter.com/SolidaritySLPS/status/1371185137057206276?s=20, https://www.stlouis-mo.gov/government/departments/board-election-commissioners/documents/upload/Apr21-All-Races-Ballot.pdf","['STL Young Dems', 'SLPS INFO', 'Solidarity with SLPS']",0.765
397,2021-03-15,Mon Mar 15 08:40:04 +0000 2021,1371380667586580480,Acer,,Not Geo-tagged,b'@karthickkumar Please remove the tweet containing your personal information and send your info via DM so your details can stay private. \n\n- Abby',$MENTION$ Please remove the tweet containing your personal information and send your info via DM so your details can stay private. - Abby,Please remove the tweet containing your personal information and send your info via DM so your details can stay private. - Abby,please remove tweet containing personal information send info via dm details stay private abby,please remove tweet contain personal information send info via dm detail stay private abby,[],{},{},0,0,[],,['karthickkumar'],0.3182
395,2021-03-15,Mon Mar 15 08:49:06 +0000 2021,1371382941549477889,Carolyn49357947,,Not Geo-tagged,"b""@Black_Action Social media have it pro &amp; con\nYou put on social media things you don't mind others knowing like your rejection to misinformation from people and the govt \nBut private info shouldn't be exposed \nSome people tell to much info\nDon't tell all your business""",$MENTION$ Social media have it pro &amp; con You put on social media things you don't mind others knowing like your rejection to misinformation from people and the govt But private info shouldn't be exposed Some people tell to much info Don't tell all your business,Social media have it pro &amp; con You put on social media things you do not mind others knowing like your rejection to misinformation from people and the govt But private info should not be exposed Some people tell to much info Do not tell all your business,social media pro con you put social media things mind others knowing like rejection misinformation people govt but private info exposed some people tell much info do tell business,social medium pro con put social medium thing mind other know like rejection misinformation people govt but private info expose some people tell much info do tell business,[],{},{},0,1,[],,['DAP/ADOS TRIBE🇺🇸'],-0.2064
412,2021-03-15,Mon Mar 15 07:35:43 +0000 2021,1371364470182711302,cringy_bear,Legit Behind You,Not Geo-tagged,"b""@Musafairyisdd @KoolLogos @panther_rblx @RuckyRucku Stop giving pics of ur home, don't reveal private info""","$MENTION$ $MENTION$ $MENTION$ $MENTION$ Stop giving pics of ur home, don't reveal private info","Stop giving pics of ur home, do not reveal private info",stop giving pics ur home reveal private info,stop give pic ur home reveal private info,[],{},{},0,1,[],,"['Musafairy', 'kool', 'Panther (Art Contest+Comms📌)', 'Rucku']",0.0516
398,2021-03-15,Mon Mar 15 08:35:58 +0000 2021,1371379635842396162,Uber_Support,,Not Geo-tagged,"b""@Shubham50212433 Our team has located your information and will be in touch shortly via email. We appreciate your patience. In order to protect your privacy, we don't encourage users to provide their account information through social media, please delete your post containing this info.""","$MENTION$ Our team has located your information and will be in touch shortly via email. We appreciate your patience. In order to protect your privacy, we don't encourage users to provide their account information through social media, please delete your post containing this info.","Our team has located your information and will be in touch shortly via email. We appreciate your patience. In order to protect your privacy, we do not encourage users to provide their account information through social media, please delete your post containing this info.",our team located information touch shortly via email we appreciate patience in order protect privacy encourage users provide account information social media please delete post containing info,team locate information touch shortly via email appreciate patience in order protect privacy encourage user provide account information social medium please delete post contain info,[],{},{},0,0,[],,['Shubham Tyagi'],0.5991
415,2021-03-15,Mon Mar 15 07:31:58 +0000 2021,1371363529287032836,RoyalCrown___,,Not Geo-tagged,b'@Kitsilano65 @chrisshipitv It\xe2\x80\x99s an \xe2\x80\x9cornamental island\xe2\x80\x9d apparently so it\xe2\x80\x99s possible the coffin was actually buried &amp; not interred in a vault etc. There\xe2\x80\x99s not a lot of information as her grave is private &amp; not open to visitors. Some info here though&gt; https://t.co/Dvd2fHSjTi',$MENTION$ $MENTION$ Its an ornamental island apparently so its possible the coffin was actually buried &amp; not interred in a vault etc. Theres not a lot of information as her grave is private &amp; not open to visitors. Some info here though&gt; $URL$,It s an ornamental island apparently so it s possible the coffin was actually buried &amp; not interred in a vault etc. There s not a lot of information as her grave is private &amp; not open to visitors. Some info here though&gt;,it ornamental island apparently possible coffin actually buried interred vault etc there lot information grave private open visitors some info though,ornamental island apparently possible coffin actually bury interred vault etc there lot information grave private open visitor some info though,[],{},{},0,1,[],https://www.independent.co.uk/news/diana-last-resting-place-lake-island-grave-splendid-isolation-1237637.html,"['Christine March', 'Chris Ship']",-0.3818
392,2021-03-15,Mon Mar 15 08:54:47 +0000 2021,1371384370376757255,henryjo06676203,,Not Geo-tagged,"b'Elector is just one of the election day apps used in Israel. A review reveals how it is used by Likud to get private info. Meanwhile, a data leak from a competing app and party shows how risky election tech can be\n\nhttps://t.co/YcbIAwbhEG'","Elector is just one of the election day apps used in Israel. A review reveals how it is used by Likud to get private info. Meanwhile, a data leak from a competing app and party shows how risky election tech can be $URL$","Elector is just one of the election day apps used in Israel. A review reveals how it is used by Likud to get private info. Meanwhile, a data leak from a competing app and party shows how risky election tech can be",elector one election day apps used israel review reveals used likud get private info meanwhile data leak competing app party shows risky election tech,elector one election day app use israel review reveal use likud get private info meanwhile datum leak compete app party show risky election tech,[],{},{},0,0,[],https://www.haaretz.com/israel-news/elections/.premium-leaked-voter-info-zero-privacy-inside-netanyahu-s-election-app-1.9611603,[],-0.128
369,2021-03-15,Mon Mar 15 10:40:54 +0000 2021,1371411076592455685,yonemins,she/her || 19,Not Geo-tagged,"b""idk any kr but upon looking into their acc auto trans was saying they're selling private info of some sorts....be careful on what you see yall https://t.co/3RGesAGes0""",idk any kr but upon looking into their acc auto trans was saying they're selling private info of some sorts....be careful on what you see yall $URL$,idk any kr but upon looking into their acc auto trans was saying they're selling private info of some sorts..be careful on what you see yall,idk upon looking acc auto trans saying selling private info sorts careful see yall,idk upon looking acc auto trans say sell private info sort careful see all,[],{},{},3,3,[],https://twitter.com/yonemins/status/1371410301438988289,[],0.1779
407,2021-03-15,Mon Mar 15 07:47:15 +0000 2021,1371367375623364608,ScottishWidows,United Kingdom,Not Geo-tagged,"b'@00227ffaee79403 Please private message your name, date of birth, postcode and telephone number so I can locate your policy and arrange the callback. We will typically be in touch within 48hrs.\nPlease don\xe2\x80\x99t disclose any account info such as PINs, passwords or account numbers. \nRegards, Ian.'","$MENTION$ Please private message your name, date of birth, postcode and telephone number so I can locate your policy and arrange the callback. We will typically be in touch within $NUMBER$hrs. Please dont disclose any account info such as PINs, passwords or account numbers. Regards, Ian.","Please private message your name, date of birth, postcode and telephone number so I can locate your policy and arrange the callback. We will typically be in touch within hrs. Please don t disclose any account info such as PINs, passwords or account numbers. Regards, Ian.",please private message name date birth postcode telephone number locate policy arrange callback we typically touch within hrs please disclose account info pins passwords account numbers regards ian,please private message name date birth postcode telephone number locate policy arrange callback typically touch within hrs please disclose account info pin password account number regard ian,[],{},{},0,0,[],,['Anoju Devi'],0.5994
417,2021-03-15,Mon Mar 15 07:16:07 +0000 2021,1371359541078687745,dragonballdad,"England, United Kingdom",Not Geo-tagged,b'@thehopelessdm Yes fully someone asked were is elvis from I responded Memphis I was immediately banned for leaking private  info without permission lmao',$MENTION$ Yes fully someone asked were is elvis from I responded Memphis I was immediately banned for leaking private info without permission lmao,Yes fully someone asked were is elvis from I responded Memphis I was immediately banned for leaking private info without permission lmao,yes fully someone asked elvis responded memphis immediately banned leaking private info without permission lmao,yes fully someone ask elvis respond memphis immediately ban leak private info without permission lmao,[],{},{},0,1,[],,['Bryan/TheHopelessDM'],-0.534
425,2021-03-15,Mon Mar 15 06:06:26 +0000 2021,1371342001568907266,cmstephens98,,Not Geo-tagged,"b'@scarletdeth Also, I got temporarily banned for that tweet. It somehow fell under ""private information,"" when the info I gave isn\'t even close to private.'","$MENTION$ Also, I got temporarily banned for that tweet. It somehow fell under ""private information,"" when the info I gave isn't even close to private.","Also, I got temporarily banned for that tweet. It somehow fell under ""private information,"" when the info I gave is not even close to private.",also got temporarily banned tweet it somehow fell private information info gave even close private,also get temporarily ban tweet somehow fall private information info give even close private,[],{},{},0,0,[],,['Scarlet Death'],-0.4588
416,2021-03-15,Mon Mar 15 07:20:32 +0000 2021,1371360652514656263,Olivee95_,"Bandar Lampung, Lampung",Not Geo-tagged,b'\xf0\x9f\x92\x95Real ready #sexlampung\xf0\x9f\x98\x98\nInclude &amp; exclude private Info DM\xe2\x9c\x89\xef\xb8\x8f\n#availopenbolampung\n#expobolampung #openbolampung #wplampung\n#bokinglampung #expolampung #bolampung #Readyopenbolampung #availboanglelampung #rekomendedopenbolampung @masnalampung https://t.co/N2i6mEOXYL',$EMOJI$Real ready $HASHTAG$$EMOJI$ Include &amp; exclude private Info DM$EMOJI$ $HASHTAG$ $HASHTAG$ $HASHTAG$ $HASHTAG$ $HASHTAG$ $HASHTAG$ $HASHTAG$ $HASHTAG$ $HASHTAG$ $HASHTAG$ $MENTION$ $URL$,Real ready Include &amp; exclude private Info DM,real ready include exclude private info dm,real ready include exclude private info dm,[],{},{},0,0,"['sexlampung', 'availopenbolampung', 'expobolampung', 'openbolampung', 'wplampung', 'bokinglampung', 'expolampung', 'bolampung', 'Readyopenbolampung', 'availboanglelampung', 'rekomendedopenbolampung']",,['Masna openbo Lampung'],0.1531
430,2021-03-15,Mon Mar 15 05:27:12 +0000 2021,1371332131692052484,BeermenTroll,matthew/matteo ,Not Geo-tagged,b'@Gallo2NYY @BuehlerTroll Mass reporting you wow stop sharing private info',$MENTION$ $MENTION$ Mass reporting you wow stop sharing private info,Mass reporting you wow stop sharing private info,mass reporting wow stop sharing private info,mass report wow stop share private info,[],{},{},0,1,[],,"['Jack (Relevnt Enjoyer)', '₂₁🌵']",0.6597
411,2021-03-15,Mon Mar 15 07:36:50 +0000 2021,1371364753021407234,PlayColdFrame,Los Angeles ,Not Geo-tagged,"b'(13/?) And then in June 2026, a vaccine was developed, leading to huge social media backlash regarding the allocation plan for the vaccinations. This scenario imagines a much more intensive overreach of tech into private info, but the damage from controversy is the same. https://t.co/EeuaioKx25'","(13/?) And then in June $NUMBER$, a vaccine was developed, leading to huge social media backlash regarding the allocation plan for the vaccinations. This scenario imagines a much more intensive overreach of tech into private info, but the damage from controversy is the same. $URL$","(13/?) And then in June , a vaccine was developed, leading to huge social media backlash regarding the allocation plan for the vaccinations. This scenario imagines a much more intensive overreach of tech into private info, but the damage from controversy is the same.",and june vaccine developed leading huge social media backlash regarding allocation plan vaccinations this scenario imagines much intensive overreach tech private info damage controversy,and june vaccine develop lead huge social medium backlash regard allocation plan vaccination this scenario imagine much intensive overreach tech private info damage controversy,[],{},{},0,7,[],,[],-0.5647
422,2021-03-15,Mon Mar 15 06:20:48 +0000 2021,1371345620116459524,AlakhMittal,Out in Space,Not Geo-tagged,"b""Isn't it great? @HyperJumpBSC got #BSC Charts with @ChartExPro \xf0\x9f\x91\x80 and fully synced their private nodes for HyperSpeed. (check out at https://t.co/v6Wac6gVmt)\nAnd @PancakeSwap was in talks with people to have Charts on BSC. (Might have after syncing their nodes)\n\n#BSC is growing\xe2\x9a\xa1""",Isn't it great? $MENTION$ got $HASHTAG$ Charts with $MENTION$ $EMOJI$ and fully synced their private nodes for HyperSpeed. (check out at $URL$) And $MENTION$ was in talks with people to have Charts on BSC. (Might have after syncing their nodes) $HASHTAG$ is growing$EMOJI$,Is not it great? got Charts with and fully synced their private nodes for HyperSpeed. (check out at ) And was in talks with people to have Charts on BSC. (Might have after syncing their nodes) is growing,is great got charts fully synced private nodes hyperspeed check and talks people charts bsc might syncing nodes growing,be great get chart fully sync private node hyperspeed check and talk people chart bsc may sync node grow,[],{},{},14,28,"['BSC', 'BSC']",http://info.hyperjump.fi,"['HyperJump', 'ChartEx', 'PancakeSwap 🥞 #BSC']",-0.3806
409,2021-03-15,Mon Mar 15 07:43:52 +0000 2021,1371366523231686665,ScottishWidows,United Kingdom,Not Geo-tagged,"b""@nobodys273 Please private message your name, date of birth, postcode and phone number so I can locate your policy and arrange the callback. Typically, we'll complete the callback within 48hrs.\nPlease don\xe2\x80\x99t disclose any account info such as PINs, passwords or account numbers. \nRegards, Ian.""","$MENTION$ Please private message your name, date of birth, postcode and phone number so I can locate your policy and arrange the callback. Typically, we'll complete the callback within $NUMBER$hrs. Please dont disclose any account info such as PINs, passwords or account numbers. Regards, Ian.","Please private message your name, date of birth, postcode and phone number so I can locate your policy and arrange the callback. Typically, we'll complete the callback within hrs. Please don t disclose any account info such as PINs, passwords or account numbers. Regards, Ian.",please private message name date birth postcode phone number locate policy arrange callback typically complete callback within hrs please disclose account info pins passwords account numbers regards ian,please private message name date birth postcode phone number locate policy arrange callback typically complete callback within hrs please disclose account info pin password account number regard ian,[],{},{},0,1,[],,['principlesfirst'],0.5994
