s_no,date,created_at,id_str,screen_name,user_location,geo-tagged_place,tweet_text,tweet_tokenized,tweet_cleaned,tweet_filtered,tweet_lemmatized,tweet_mentioned_organizations,tweet_tags_classified,tweet_orgs_classified,retweet_count,fav_count,hashtags,urls,mentions,vader_polarity
76,2021-03-09,Tue Mar 09 20:00:12 +0000 2021,1369377501605203973,JillCastilla,"Edmond, Oklahoma","Edmond, OK, US","b'Fraud alert! Do not provide private info to anyone representing your bank. @CitizensEdmond will NEVER ask for your ID, password or debit card pin information. Do not provide this info even if a call or email appears to be from your bank. We are seeing attempts - be viligant!'","Fraud alert! Do not provide private info to anyone representing your bank. $MENTION$ will NEVER ask for your ID, password or debit card pin information. Do not provide this info even if a call or email appears to be from your bank. We are seeing attempts - be viligant!","Fraud alert! Do not provide private info to anyone representing your bank. will NEVER ask for your ID, password or debit card pin information. Do not provide this info even if a call or email appears to be from your bank. We are seeing attempts - be viligant!",fraud alert do provide private info anyone representing bank never ask id password debit card pin information do provide info even call email appears bank we seeing attempts viligant,fraud alert do provide private info anyone represent bank never ask d password debit card pin information do provide info even call email appear bank see attempt viligant,[],{},{},7,27,[],,['Citizens Bank'],-0.4912
92,2021-03-09,Tue Mar 09 19:08:06 +0000 2021,1369364389049032704,mullerweb,UK,Not Geo-tagged,"b""@piersmorgan Likely being in possession of private info on people empowers you &amp; you've used it to generate content, media product, ratings, advertising rev &amp; bonuses for yourself. At a time when mental health has pressing import, you've been a danger to the public!""","$MENTION$ Likely being in possession of private info on people empowers you &amp; you've used it to generate content, media product, ratings, advertising rev &amp; bonuses for yourself. At a time when mental health has pressing import, you've been a danger to the public!","Likely being in possession of private info on people empowers you &amp; you've used it to generate content, media product, ratings, advertising rev &amp; bonuses for yourself. At a time when mental health has pressing import, you've been a danger to the public!",likely possession private info people empowers used generate content media product ratings advertising rev bonuses at time mental health pressing import danger public,likely possession private info people empower use generate content medium product rating advertising rev bonus at time mental health press import danger public,[],{},{},0,0,[],,['Piers Morgan'],0.126
90,2021-03-09,Tue Mar 09 19:10:53 +0000 2021,1369365091167178755,DonRoza2,,Not Geo-tagged,b'Do you have any books or websites with info or do private calls or emails.  I would be happy to pay for advice or information.  I have the weight training part down (although he is being overtrained in his weight lifting class at school).  The whole situation is alot to tweet. https://t.co/RzgGOBK4fg',Do you have any books or websites with info or do private calls or emails. I would be happy to pay for advice or information. I have the weight training part down (although he is being overtrained in his weight lifting class at school). The whole situation is alot to tweet. $URL$,Do you have any books or websites with info or do private calls or emails. I would be happy to pay for advice or information. I have the weight training part down (although he is being overtrained in his weight lifting class at school). The whole situation is alot to tweet.,do books websites info private calls emails would happy pay advice information weight training part although overtrained weight lifting class school the whole situation alot tweet,do book website info private call email would happy pay advice information weight training part although overtrained weight lifting class school the whole situation alot tweet,[],{},{},0,1,[],https://twitter.com/VinnieTortorich/status/1369362234233659392,[],0.5106
104,2021-03-09,Tue Mar 09 18:29:03 +0000 2021,1369354562553921554,HjgTweet,,Not Geo-tagged,"b""@HammSanchez @ProfEmilyOster @justinmkrebs @NYCSchools I'd love if you could ask Professor Oster about data on what's working and what's not in private schools this year. That info would be invaluable to DOE, if they'd step out of the box they've painted themselves into. I'm thinking, stuff like distancing, handling mealtime, and""","$MENTION$ $MENTION$ $MENTION$ $MENTION$ I'd love if you could ask Professor Oster about data on what's working and what's not in private schools this year. That info would be invaluable to DOE, if they'd step out of the box they've painted themselves into. I'm thinking, stuff like distancing, handling mealtime, and","I'd love if you could ask Professor Oster about data on what's working and what's not in private schools this year. That info would be invaluable to DOE, if they'd step out of the box they've painted themselves into. I'm thinking, stuff like distancing, handling mealtime, and",love could ask professor oster data working private schools year that info would invaluable doe step box painted thinking stuff like distancing handling mealtime,love could ask professor oster datum work private school year that info would invaluable doe step box paint think stuff like distance handle mealtime,[],{},{},0,3,[],,"['Diego Sanchez', 'ProfEmilyOster', 'Justin Krebs', 'NYC Public Schools']",0.7717
107,2021-03-09,Tue Mar 09 18:23:39 +0000 2021,1369353202047541254,sammychli,"Birmingham, England",Not Geo-tagged,b'@Census2021 will ask about personal diversity info which will provide important population data for tackling inequalities in \xf0\x9f\x8f\xb4\xf3\xa0\x81\xa7\xf3\xa0\x81\xa2\xf3\xa0\x81\xa5\xf3\xa0\x81\xae\xf3\xa0\x81\xa7\xf3\xa0\x81\xbf\xf0\x9f\x8f\xb4\xf3\xa0\x81\xa7\xf3\xa0\x81\xa2\xf3\xa0\x81\xb7\xf3\xa0\x81\xac\xf3\xa0\x81\xb3\xf3\xa0\x81\xbf. Anyone who wishes their census details to remain private from housemates could request an individual access code. https://t.co/ycZLt1Ifqd',$MENTION$ will ask about personal diversity info which will provide important population data for tackling inequalities in $EMOJI$$EMOJI$. Anyone who wishes their census details to remain private from housemates could request an individual access code. $URL$,will ask about personal diversity info which will provide important population data for tackling inequalities in . Anyone who wishes their census details to remain private from housemates could request an individual access code.,ask personal diversity info provide important population data tackling inequalities anyone wishes census details remain private housemates could request individual access code,ask personal diversity info provide important population datum tackling inequality anyone wish census detail remain private housemate could request individual access code,[],{},{},1,1,[],https://census.gov.uk/en/request/access-code/individual/,['Census 2021 - England & Wales'],0.34
105,2021-03-09,Tue Mar 09 18:28:48 +0000 2021,1369354500213997570,CEGA_UC,"Berkeley, CA",Not Geo-tagged,"b'@paul_gertler 3/ Research by affiliated profs @adejanvry &amp; Elisabeth Sadoulet &amp; coauthors suggests info interventions targeting private input suppliers instead of farmers increases tech adoption by 50+%, partly due to input suppliers\xe2\x80\x99 interest in reputation building https://t.co/EOSoumlda5 https://t.co/ity0FcwwUx'","$MENTION$ $NUMBER$/ Research by affiliated profs $MENTION$ &amp; Elisabeth Sadoulet &amp; coauthors suggests info interventions targeting private input suppliers instead of farmers increases tech adoption by $NUMBER$+%, partly due to input suppliers interest in reputation building $URL$ $URL$","/ Research by affiliated profs &amp; Elisabeth Sadoulet &amp; coauthors suggests info interventions targeting private input suppliers instead of farmers increases tech adoption by +%, partly due to input suppliers interest in reputation building",research affiliated profs elisabeth sadoulet coauthors suggests info interventions targeting private input suppliers instead farmers increases tech adoption partly due input suppliers interest reputation building,research affiliate profs elisabeth sadoulet coauthor suggest info intervention target private input supplier instead farmer increase tech adoption partly due input supplier interest reputation building,[],{},{},0,0,[],https://buff.ly/3brZ7Mz,"['Paul Gertler', 'Alain de Janvry']",0.4588
97,2021-03-09,Tue Mar 09 18:51:34 +0000 2021,1369360226860732416,Christophechoo,"Beverly Hills, CA","Bel Air Crest, US","b'Relax and unwind by your private pool \xf0\x9f\x8f\x8a\xf0\x9f\x8f\xbb\xe2\x80\x8d\xe2\x99\x80\xef\xb8\x8f with separate fire pit lounge area, barbecue area, contemplative fountain and putting green \xf0\x9f\x8f\x8c\xf0\x9f\x8f\xbb\xe2\x80\x8d\xe2\x99\x82\xef\xb8\x8f Located in the 24-hour guard gated community of Bel Air Crest listed for $5.5 million. https://t.co/KnhomwI9tZ https://t.co/6kDkWg73Qv'","Relax and unwind by your private pool $EMOJI$$EMOJI$$EMOJI$ with separate fire pit lounge area, barbecue area, contemplative fountain and putting green $EMOJI$$EMOJI$$EMOJI$ Located in the $NUMBER$-hour guard gated community of Bel Air Crest listed for $5.5 million. $URL$ $URL$","Relax and unwind by your private pool with separate fire pit lounge area, barbecue area, contemplative fountain and putting green Located in the -hour guard gated community of Bel Air Crest listed for $5.5 million.",relax unwind private pool separate fire pit lounge area barbecue area contemplative fountain putting green located hour guard gated community bel air crest listed million,relax unwind private pool separate fire pit lounge area barbecue area contemplative fountain put green locate hour guard gate community bel air crest list million,[],{},{},1,5,[],http://www.BelAirCrestVilla.com,[],0.128
98,2021-03-09,Tue Mar 09 18:45:43 +0000 2021,1369358755666747393,retrbolt,"BLM; ACAB | Hampshire, England",Not Geo-tagged,"b""@ LRT: i would like to add that its okay to have some of your triggers listed here and there, just don't go pouring out your life traumas on the internet. I, myself, list a few in my private space info etc, but I will never put it on my public art account bios.""","$MENTION$ LRT: i would like to add that its okay to have some of your triggers listed here and there, just don't go pouring out your life traumas on the internet. I, myself, list a few in my private space info etc, but I will never put it on my public art account bios.","LRT i would like to add that its okay to have some of your triggers listed here and there, just do not go pouring out your life traumas on the internet. I, myself, list a few in my private space info etc, but I will never put it on my public art account bios.",lrt would like add okay triggers listed pouring life traumas internet list private space info etc never put public art account bios,lrt would like add okay trigger list pour life trauma internet list private space info etc never put public art account bio,[],{},{},0,4,[],,[],0.0258
109,2021-03-09,Tue Mar 09 18:19:42 +0000 2021,1369352206617620485,MoffittNews,"Tampa, Fla.",Not Geo-tagged,"b""@carterja651 Hi James, we are so sorry to hear this. We'd like to make sure our Patient Relations team is aware of this incident. Can you please send us a private message with your contact info so we can share it with them? Thank you!""","$MENTION$ Hi James, we are so sorry to hear this. We'd like to make sure our Patient Relations team is aware of this incident. Can you please send us a private message with your contact info so we can share it with them? Thank you!","Hi James, we are so sorry to hear this. We'd like to make sure our Patient Relations team is aware of this incident. Can you please send us a private message with your contact info so we can share it with them? Thank you!",hi james sorry hear we like make sure patient relations team aware incident can please send private message contact info share thank,hi james sorry hear like make sure patient relation team aware incident can please send private message contact info share thank,[],{},{},0,0,[],,['James Carter'],0.863
102,2021-03-09,Tue Mar 09 18:34:05 +0000 2021,1369355827090354176,DropTheBelt,"Las Vegas, NV",Not Geo-tagged,b'Join Now!\nThe New AEW #FantasyWrestling\xf0\x9f\xa4\xbc\xe2\x80\x8d\xe2\x99\x82\xef\xb8\x8f Season Starts 3/17\n\nMore info: https://t.co/kNj8OXISkG\n\nTime to join Matchmaking leagues.\nGather your friends and start your own Private league.\nPlay all year long. Live scoring.\n\n#ProWrestling #FantasySports #AEWDynamite #AEWonTNT #AEW',Join Now! The New AEW $HASHTAG$$EMOJI$ Season Starts $NUMBER$/17 More info: $URL$ Time to join Matchmaking leagues. Gather your friends and start your own Private league. Play all year long. Live scoring. $HASHTAG$ $HASHTAG$ $HASHTAG$ $HASHTAG$ $HASHTAG$,Join Now! The New AEW Season Starts /17 More info Time to join Matchmaking leagues. Gather your friends and start your own Private league. Play all year long. Live scoring.,join now the new aew season starts more info time join matchmaking leagues gather friends start private league play year long live scoring,join now the new aew season start more info time join matchmaking league gather friend start private league play year long live score,[],{},{},2,4,"['FantasyWrestling', 'ProWrestling', 'FantasySports', 'AEWDynamite', 'AEWonTNT', 'AEW']",http://dropthebelt.com/fantasysports,[],0.8478
113,2021-03-09,Tue Mar 09 18:10:06 +0000 2021,1369349793806483466,techjunkiejh,,Not Geo-tagged,b'Hacker publishes private info of 2.3MILLION dating app users online https://t.co/YVVsQlnNF9 #databreach #CyberSecurity #TechJunkieNews https://t.co/FfYJUeWIzE',Hacker publishes private info of $NUMBER$MILLION dating app users online $URL$ $HASHTAG$ $HASHTAG$ $HASHTAG$ $URL$,Hacker publishes private info of MILLION dating app users online,hacker publishes private info million dating app users online,hacker publish private info million date app user online,[],{},{},1,0,"['databreach', 'CyberSecurity', 'TechJunkieNews']",https://bit.ly/3trWCkk,[],0.0
117,2021-03-09,Tue Mar 09 18:00:02 +0000 2021,1369347259008233472,IWCare,Ireland,Not Geo-tagged,"b'#DYK if you\xe2\x80\x99re experiencing a blockage on the public mains, we can certainly help. If the blockage is on the private side pipework leading up to the public sewer mains, this will have to be resolved privately. For more info on pipe responsibility, see https://t.co/DTBDZ2P2gs.'","$HASHTAG$ if youre experiencing a blockage on the public mains, we can certainly help. If the blockage is on the private side pipework leading up to the public sewer mains, this will have to be resolved privately. For more info on pipe responsibility, see $URL$.","if you re experiencing a blockage on the public mains, we can certainly help. If the blockage is on the private side pipework leading up to the public sewer mains, this will have to be resolved privately. For more info on pipe responsibility, see .",experiencing blockage public mains certainly help if blockage private side pipework leading public sewer mains resolved privately for info pipe responsibility see,experience blockage public main certainly help if blockage private side pipework lead public sewer main resolve privately for info pipe responsibility see,[],{},{},0,1,['DYK'],https://www.water.ie/docs/Pipe-Maintenance-Responsibility-May18.pdf,[],0.7003
118,2021-03-09,Tue Mar 09 17:58:48 +0000 2021,1369346947405017099,Tititomi21,,Not Geo-tagged,"b'@GregAbbott_TX @GovRonDeSantis stop using social media since you both have issues w/ how they handle their private business. Go back to faxing, carrying beepers, public phones, landlines &amp; sending letters &amp; info via snail mail. @ProjectLincoln\nhttps://t.co/7NCO8VPBVz'","$MENTION$ $MENTION$ stop using social media since you both have issues w/ how they handle their private business. Go back to faxing, carrying beepers, public phones, landlines &amp; sending letters &amp; info via snail mail. $MENTION$ $URL$","stop using social media since you both have issues w/ how they handle their private business. Go back to faxing, carrying beepers, public phones, landlines &amp; sending letters &amp; info via snail mail.",stop using social media since issues handle private business go back faxing carrying beepers public phones landlines sending letters info via snail mail,stop use social medium since issue handle private business go back fax carry beeper public phone landline send letter info via snail mail,[],{},{},0,0,[],https://www.cbsnews.com/news/texas-greg-abbott-social-media-conservative-bias-censorship-law/,"['Greg Abbott', 'Ron DeSantis', 'The Lincoln Project']",-0.296
124,2021-03-09,Tue Mar 09 17:40:56 +0000 2021,1369342454575620102,goIdenwaII,,Not Geo-tagged,b'I dont want to say private info and I don\xe2\x80\x99t care who follows me if I see something I don\xe2\x80\x99t like unfollow/block I don\xe2\x80\x99t feel the need for carrds? https://t.co/jwe6ET7q2O',I dont want to say private info and I dont care who follows me if I see something I dont like unfollow/block I dont feel the need for carrds? $URL$,I dont want to say private info and I don t care who follows me if I see something I don t like unfollow/block I don t feel the need for carrds?,dont want say private info care follows see something like unfollow block feel need carrds,do not want say private info care follow see something like unfollow block feel need carrd,[],{},{},0,0,[],https://twitter.com/halosricochet/status/1368980122439540736,[],0.6681
131,2021-03-09,Tue Mar 09 17:34:45 +0000 2021,1369340897096327178,Allstate,,Not Geo-tagged,"b'@stephbelt_ We are sorry to hear this. Please private message us a bit more info, so we can look into this. ^SE https://t.co/vYIVrwsUyL'","$MENTION$ We are sorry to hear this. Please private message us a bit more info, so we can look into this. ^SE $URL$","We are sorry to hear this. Please private message us a bit more info, so we can look into this. ^SE",we sorry hear please private message bit info look se,sorry hear please private message bit info look se,[],{},{},0,0,[],https://twitter.com/messages/compose?recipient_id=14275290,['stephanie 🌻'],0.3237
112,2021-03-09,Tue Mar 09 18:17:28 +0000 2021,1369351644618571783,TeamYouTube,"San Bruno, CA",Not Geo-tagged,"b""@LifeWithShan4 Mind sharing more info about your concern? If you'r referring to the Monetization page, note that it shows public watch hours only and doesn't include private/unlisted ones. Also, views from short videos don't count toward YPP eligibility. Hope this helps clarify.""","$MENTION$ Mind sharing more info about your concern? If you'r referring to the Monetization page, note that it shows public watch hours only and doesn't include private/unlisted ones. Also, views from short videos don't count toward YPP eligibility. Hope this helps clarify.","Mind sharing more info about your concern? If you'r referring to the Monetization page, note that it shows public watch hours only and does not include private/unlisted ones. Also, views from short videos do not count toward YPP eligibility. Hope this helps clarify.",mind sharing info concern if referring monetization page note shows public watch hours include private unlisted ones also views short videos count toward ypp eligibility hope helps clarify,mind share info concern if refer monetization page note show public watch hour include private unlisted one also view short video count toward ypp eligibility hope help clarify,[],{},{},0,0,[],,['Life With Shan'],0.8271
133,2021-03-09,Tue Mar 09 17:29:00 +0000 2021,1369339448337530881,SixbytesApp,,Not Geo-tagged,b'How many time someone view your #sensitive #Photos and #Videos? Keep #private #safe and #secure with Safety Photo #app #ios #apple #android #flutterdev  \nMore info https://t.co/dswj2LVuuP \n\n@AppStore download\nhttps://t.co/ODSS95JfVK\n\n@GooglePlay download\nhttps://t.co/wpSsxtqilH https://t.co/NZlMOXdgL7',How many time someone view your $HASHTAG$ $HASHTAG$ and $HASHTAG$? Keep $HASHTAG$ $HASHTAG$ and $HASHTAG$ with Safety Photo $HASHTAG$ $HASHTAG$ $HASHTAG$ $HASHTAG$ $HASHTAG$ More info $URL$ $MENTION$ download $URL$ $MENTION$ download $URL$ $URL$,How many time someone view your and ? Keep and with Safety Photo More info download download,how many time someone view keep safety photo more info download download,how many time someone view keep safety photo more info download download,[],{},{},1,1,"['sensitive', 'Photos', 'Videos', 'private', 'safe', 'secure', 'app', 'ios', 'apple', 'android', 'flutterdev']","https://sixbytes.io, https://apps.apple.com/us/app/safety-photo-video/id464247997, https://play.google.com/store/apps/details?id=com.eightythree.safetyphotofree","['App Store', 'Google Play']",0.4215
125,2021-03-09,Tue Mar 09 17:40:56 +0000 2021,1369342450825900046,RaviSaiIyer,"Puttaparthi, AP, India",Not Geo-tagged,b'Some info. about World Wide Web and web browser early history; My exposure to private Videotex that worked over telephone lines before web https://t.co/FnjdWkNMcJ',Some info. about World Wide Web and web browser early history; My exposure to private Videotex that worked over telephone lines before web $URL$,Some info. about World Wide Web and web browser early history; My exposure to private Videotex that worked over telephone lines before web,some info world wide web web browser early history my exposure private videotex worked telephone lines web,some info world wide web web browser early history exposure private videotex work telephone line web,[],{},{},0,0,[],https://ravisiyermisc.blogspot.com/2021/03/some-info-about-world-wide-web-and-web.html,[],0.0
129,2021-03-09,Tue Mar 09 17:36:57 +0000 2021,1369341450572492800,small_exchange,"Chicago, IL",Not Geo-tagged,"b""@KWF After checking with our tech team, I've been told that this info is currently private...so sorry! Wish I could help you out with whatever these words mean.""","$MENTION$ After checking with our tech team, I've been told that this info is currently private...so sorry! Wish I could help you out with whatever these words mean.","After checking with our tech team, I've been told that this info is currently private..so sorry! Wish I could help you out with whatever these words mean.",after checking tech team told info currently private sorry wish could help whatever words mean,after check tech team tell info currently private sorry wish could help whatever word mean,[],{},{},0,0,[],,['Kenneth Finnegan'],0.6588
106,2021-03-09,Tue Mar 09 18:23:39 +0000 2021,1369353202689310724,TheBerks100,Pale Blue Dot,Not Geo-tagged,"b'@devyansh_exe @IndoPac_Info Telecom is a strategic sector. Govt or Private, Chinese cos should have been denied entry into it. You say like you would have been okay if instead of China, a company from Pakistan would have won the deal. Remember. Both are our enemies. No entry in India!'","$MENTION$ $MENTION$ Telecom is a strategic sector. Govt or Private, Chinese cos should have been denied entry into it. You say like you would have been okay if instead of China, a company from Pakistan would have won the deal. Remember. Both are our enemies. No entry in India!","Telecom is a strategic sector. Govt or Private, Chinese cos should have been denied entry into it. You say like you would have been okay if instead of China, a company from Pakistan would have won the deal. Remember. Both are our enemies. No entry in India!",telecom strategic sector govt private chinese cos denied entry you say like would okay instead china company pakistan would deal remember both enemies no entry india,telecom strategic sector govt private chinese cos deny entry say like would okay instead china company pakistan would deal remember both enemy no entry india,[],{},{},0,0,[],,"['Devyansh', 'Indo-Pacific News - Watching the CCP-China Threat']",-0.126
135,2021-03-09,Tue Mar 09 17:27:55 +0000 2021,1369339177322614789,TeamYouTube,"San Bruno, CA",Not Geo-tagged,b'@NateJam42747396 Thanks for reaching out \xe2\x80\x93 are you referring to your videos being automatically set to private? This usually happens if there are unrelated or misleading tags from the \xe2\x80\x9cdescription\xe2\x80\x9d and \xe2\x80\x9ctag\xe2\x80\x9d sections. Here\xe2\x80\x99s more info: https://t.co/mFl16TdW8n',$MENTION$ Thanks for reaching out are you referring to your videos being automatically set to private? This usually happens if there are unrelated or misleading tags from the description and tag sections. Heres more info: $URL$,Thanks for reaching out are you referring to your videos being automatically set to private? This usually happens if there are unrelated or misleading tags from the description and tag sections. Here s more info,thanks reaching referring videos automatically set private this usually happens unrelated misleading tags description tag sections here info,thank reach refer video automatically set private this usually happen unrelated misleading tag description tag section here info,[],{},{},0,0,[],https://yt.be/help/6Xrf,['NateJames'],0.25
148,2021-03-09,Tue Mar 09 17:00:54 +0000 2021,1369332377286246406,SofiaVoloWine,"Baltimore, MD",Not Geo-tagged,b'Host a Private #Wine Tasting in your home. We make it easy! More Info: https://t.co/R7PZdjWB15 #Baltimore #MDwine',Host a Private $HASHTAG$ Tasting in your home. We make it easy! More Info: $URL$ $HASHTAG$ $HASHTAG$,Host a Private Tasting in your home. We make it easy! More Info,host private tasting home we make easy more info,host private tasting home make easy more info,[],{},{},0,0,"['Wine', 'Baltimore', 'MDwine']",http://goo.gl/fRWhQz,[],0.4926
