s_no,date,created_at,id_str,screen_name,user_location,geo-tagged_place,tweet_text,tweet_tokenized,tweet_cleaned,tweet_filtered,tweet_lemmatized,tweet_mentioned_organizations,tweet_tags_classified,tweet_orgs_classified,retweet_count,fav_count,hashtags,urls,mentions,vader_polarity
1,2021-03-09,Tue Mar 09 23:55:18 +0000 2021,1369436666742603780,shelbyKLS,"Charlotte, NC",Not Geo-tagged,"b'@rosybj3 @kenolin1 @Oprah Airing personal and private family info is not a good look. Royal, or otherwise. Surprising...'","$MENTION$ $MENTION$ $MENTION$ Airing personal and private family info is not a good look. Royal, or otherwise. Surprising...","Airing personal and private family info is not a good look. Royal, or otherwise. Surprising..",airing personal private family info good look royal otherwise surprising,air personal private family info good look royal otherwise surprising,[],{},{},0,0,[],,"['B_Rose🌹', 'ken olin💙', 'Oprah Winfrey']",-0.0788
15,2021-03-09,Tue Mar 09 23:01:35 +0000 2021,1369423145493528584,vpatrickgroup,"123 E Court Street, Urbana, OH",Not Geo-tagged,b'\xf0\x9f\x93\xb2 Call Us Today for your private showing of this home! \xf0\x9f\x8f\xa1\n\xf0\x9f\x96\xa5\xef\xb8\x8f More Info: https://t.co/LvEOHwESc8 https://t.co/dCkStFDqyH https://t.co/ztW22V0IgF',$EMOJI$ Call Us Today for your private showing of this home! $EMOJI$ $EMOJI$ More Info: $URL$ $URL$ $URL$,Call Us Today for your private showing of this home! More Info,call us today private showing home more info,call today private show home more info,[],{},{},0,0,[],"https://7455EUsHighway36.auto.remax.com/, http://www.facebook.com/213721108678615_4008424645874890",[],0.0
22,2021-03-09,Tue Mar 09 22:49:29 +0000 2021,1369420102572072960,gIambotrry,nsfw(?) minor,Not Geo-tagged,b'it\xe2\x80\x99s called private info for a reason',its called private info for a reason,it s called private info for a reason,called private info reason,call private info reason,[],{},{},0,1,[],,[],0.0
36,2021-03-09,Tue Mar 09 21:54:14 +0000 2021,1369406198362079232,yutheweeb,꒰ she/her ꒱,Not Geo-tagged,b'30) Private info for now !!',$NUMBER$) Private info for now !!,) Private info for now !!,private info,private info,[],{},{},0,0,[],,[],0.0
17,2021-03-09,Tue Mar 09 22:59:51 +0000 2021,1369422711919939592,DADDYL0UIST,minor,Not Geo-tagged,b'so what i\xe2\x80\x99ve gathered from this very messy experience is please don\xe2\x80\x99t leak someone\xe2\x80\x99s private info if they trust you with it.',so what ive gathered from this very messy experience is please dont leak someones private info if they trust you with it.,so what i ve gathered from this very messy experience is please don t leak someone s private info if they trust you with it.,gathered messy experience please leak someone private info trust,gather messy experience please leak someone private info trust,[],{},{},3,11,[],,[],0.1045
3,2021-03-09,Tue Mar 09 23:42:33 +0000 2021,1369433454425817097,palembang_real,,Not Geo-tagged,b'Ready slot \n-Booking private\n-vcs\n-massage\nInfo lebih lanjut Dm\xf0\x9f\x92\x8c/ https://t.co/t5W3elCMVK\n\n#Bispakpalembang\n#openbopalembang #availpalembang #bopalembang\n#lendirpalembang #bisyarpalembang #vcsbugil\n#sangeberat #RealAccount #vcscolmek #vcsberbayar #vcscroot #vcsyuk \n#vcs https://t.co/V7aZZNEOAE',Ready slot -Booking private -vcs -massage Info lebih lanjut Dm$EMOJI$/ $URL$ $HASHTAG$ $HASHTAG$ $HASHTAG$ $HASHTAG$ $HASHTAG$ $HASHTAG$ $HASHTAG$ $HASHTAG$ $HASHTAG$ $HASHTAG$ $HASHTAG$ $HASHTAG$ $HASHTAG$ $HASHTAG$ $URL$,Ready slot -Booking private -vcs -massage Info lebih lanjut Dm /,ready slot booking private vcs massage info lebih lanjut dm,ready slot book private vcs massage info lebih lanjut dm,[],{},{},1,0,"['Bispakpalembang', 'openbopalembang', 'availpalembang', 'bopalembang', 'lendirpalembang', 'bisyarpalembang', 'vcsbugil', 'sangeberat', 'RealAccount', 'vcscolmek', 'vcsberbayar', 'vcscroot', 'vcsyuk', 'vcs']",http://wa.me/+62814145715,[],0.3612
4,2021-03-09,Tue Mar 09 23:37:17 +0000 2021,1369432129348788232,Accountancytut1,,Not Geo-tagged,b'We provide private tutoring for aspiring accountants to achieve professional qualifications! Get in touch for further info.  #Accountancy #tutors https://t.co/fynlCuAyJR',We provide private tutoring for aspiring accountants to achieve professional qualifications! Get in touch for further info. $HASHTAG$ $HASHTAG$ $URL$,We provide private tutoring for aspiring accountants to achieve professional qualifications! Get in touch for further info.,we provide private tutoring aspiring accountants achieve professional qualifications get touch info,provide private tutoring aspire accountant achieve professional qualification get touch info,[],{},{},0,0,"['Accountancy', 'tutors']",,[],0.0
8,2021-03-09,Tue Mar 09 23:27:29 +0000 2021,1369429662863069191,BayArea4Bernie,"San Francisco, CA",Not Geo-tagged,"b'Normally we wouldn\xe2\x80\x99t advice giving personal information (particularly medical info) to a private company, but we\xe2\x80\x99re willing to give https://t.co/WrsaY6vTK5 a shot. Sign up is free for patients &amp; for providers. #GetVaccinated https://t.co/AJFjn2Qe61'","Normally we wouldnt advice giving personal information (particularly medical info) to a private company, but were willing to give $URL$ a shot. Sign up is free for patients &amp; for providers. $HASHTAG$ $URL$","Normally we wouldn t advice giving personal information (particularly medical info) to a private company, but we re willing to give a shot. Sign up is free for patients &amp; for providers.",normally advice giving personal information particularly medical info private company willing give shot sign free patients providers,normally advice give personal information particularly medical info private company willing give shot sign free patient provider,[],{},{},0,0,['GetVaccinated'],"http://HiDrB.com, https://twitter.com/nytimes/status/1369324667236999173",[],0.7311
6,2021-03-09,Tue Mar 09 23:33:59 +0000 2021,1369431299908374531,shimp_jr,,Not Geo-tagged,"b""@Activision @ATVIAssist @ATVI_AB \nIt's now been 38 days since I've been able to play Zombies private[Cold War] and I believe 31 days since you've asked me for my info to help 'fix' my issue; I've been ghosted completely and am completely unsatisfied with your company as a whole.""",$MENTION$ $MENTION$ $MENTION$ It's now been $NUMBER$ days since I've been able to play Zombies private[Cold War] and I believe $NUMBER$ days since you've asked me for my info to help 'fix' my issue; I've been ghosted completely and am completely unsatisfied with your company as a whole.,It's now been days since I've been able to play Zombies private[Cold War] and I believe days since you've asked me for my info to help 'fix' my issue; I've been ghosted completely and am completely unsatisfied with your company as a whole.,it days since able play zombies private cold war believe days since asked info help fix issue ghosted completely completely unsatisfied company whole,day since able play zombie private cold war believe day since ask info help fix issue ghost completely completely unsatisfied company whole,[],{},{},0,0,[],,"['Activision', 'Activision Support', 'Activision Blizzard']",-0.4201
2,2021-03-09,Tue Mar 09 23:51:57 +0000 2021,1369435822697705474,oldenoughtosay,"London, England",Not Geo-tagged,"b'HEY are you in the UK and queer and not out to your household? you can request a private access census code to overwrite your data. nobody will know and you can record your info accurately, which is good for lots of reasons.\nhttps://t.co/otWHfJu5NJ'","HEY are you in the UK and queer and not out to your household? you can request a private access census code to overwrite your data. nobody will know and you can record your info accurately, which is good for lots of reasons. $URL$","HEY are you in the UK and queer and not out to your household? you can request a private access census code to overwrite your data. nobody will know and you can record your info accurately, which is good for lots of reasons.",hey uk queer household request private access census code overwrite data nobody know record info accurately good lots reasons,hey uk queer household request private access census code overwrite data nobody know record info accurately good lot reason,[],{},{},107,94,[],https://census.gov.uk/en/request/access-code/individual/,[],0.4404
26,2021-03-09,Tue Mar 09 22:32:13 +0000 2021,1369415757197684745,Gaytheist4,"Baltimore, MD",Not Geo-tagged,"b'@dbm3000 @tomottoman134 @NBCNews Signature matching, address/private info verification, etc. Plenty of states have secure elections without voter ID laws.'","$MENTION$ $MENTION$ $MENTION$ Signature matching, address/private info verification, etc. Plenty of states have secure elections without voter ID laws.","Signature matching, address/private info verification, etc. Plenty of states have secure elections without voter ID laws.",signature matching address private info verification etc plenty states secure elections without voter id laws,signature match address private info verification etc plenty state secure election without voter d law,[],{},{},0,0,[],,"['Conservatism = Common Sense', 'mehmuhname', 'NBC News']",0.34
35,2021-03-09,Tue Mar 09 21:59:26 +0000 2021,1369407507496583182,giles75,South East London,Not Geo-tagged,b'Important for anyone who wants to  keep any census info private from the rest of their household https://t.co/X8D3CaowFA',Important for anyone who wants to keep any census info private from the rest of their household $URL$,Important for anyone who wants to keep any census info private from the rest of their household,important anyone wants keep census info private rest household,important anyone want keep census info private rest household,[],{},{},3,2,[],https://twitter.com/hurleyb0b/status/1368844441453215745,[],0.2023
29,2021-03-09,Tue Mar 09 22:15:43 +0000 2021,1369411605281320970,hashimotoryos, 21 • she/they • greece,Not Geo-tagged,b'-Random citizen that did nothing gets beat up by cops and becomes a viral video\n-politician spreads the victims private info\n-Goverment: I sleep\n-riots\n-cop: gets beat up\n-prime minister: threatens us',-Random citizen that did nothing gets beat up by cops and becomes a viral video -politician spreads the victims private info -Goverment: I sleep -riots -cop: gets beat up -prime minister: threatens us,-Random citizen that did nothing gets beat up by cops and becomes a viral video -politician spreads the victims private info -Goverment I sleep -riots -cop gets beat up -prime minister threatens us,random citizen nothing gets beat cops becomes viral video politician spreads victims private info goverment sleep riots cop gets beat prime minister threatens,random citizen nothing get beat cop become viral video politician spread victim private info goverment sleep riot cop get beat prime minister threaten,[],{},{},0,0,[],,[],-0.802
12,2021-03-09,Tue Mar 09 23:06:04 +0000 2021,1369424274675601417,pizzahut,United States,Not Geo-tagged,"b""@theDribblee We're sorry we let you down. Mind sending us a private message with your contact info and store address so that we can look into this further? https://t.co/PQtSXj88CY""",$MENTION$ We're sorry we let you down. Mind sending us a private message with your contact info and store address so that we can look into this further? $URL$,We're sorry we let you down. Mind sending us a private message with your contact info and store address so that we can look into this further?,we sorry let mind sending private message contact info store address look,sorry let mind send private message contact info store address look,[],{},{},0,0,[],https://twitter.com/messages/compose?recipient_id=11018442,['Jennilee'],-0.0772
30,2021-03-09,Tue Mar 09 22:07:22 +0000 2021,1369409500860604424,Fannkel,"Dublin City, Ireland",Not Geo-tagged,b'@OisinO_Connell @IverHanrahanGP This was a response I got from the HSE today after I told them I contacted both a private and public/acute hospital I\xe2\x80\x99m under re vax and they have heard nothing about the onus being on them to identify patients. In fact I gave them both the link to the HSE document for info https://t.co/wznC5fSP4C',$MENTION$ $MENTION$ This was a response I got from the HSE today after I told them I contacted both a private and public/acute hospital Im under re vax and they have heard nothing about the onus being on them to identify patients. In fact I gave them both the link to the HSE document for info $URL$,This was a response I got from the HSE today after I told them I contacted both a private and public/acute hospital I m under re vax and they have heard nothing about the onus being on them to identify patients. In fact I gave them both the link to the HSE document for info,this response got hse today told contacted private public acute hospital vax heard nothing onus identify patients in fact gave link hse document info,this response get hse today tell contact private public acute hospital vax hear nothing onus identify patient in fact give link hse document info,[],{},{},0,0,[],,"[""Dr Oisin O'Connell, FRCPI, MD"", 'Iver Hanrahan']",0.0
5,2021-03-09,Tue Mar 09 23:34:15 +0000 2021,1369431366794874883,DavidWa59907969,,Not Geo-tagged,"b""@TalkerTeacher @Bernardo1130 @tsawyer87701002 @Fraserhealth @NEWS1130 @LizaYuzda @bctf Unpaid, doing it on their spare time while trying to raise a family and deal with all the negative effects of 'live with it' nonsense.\n\nAnd communicating with thousands of parents, keeping their info private.\n\nI can't say enough about those two wonderful people.""","$MENTION$ $MENTION$ $MENTION$ $MENTION$ $MENTION$ $MENTION$ $MENTION$ Unpaid, doing it on their spare time while trying to raise a family and deal with all the negative effects of 'live with it' nonsense. And communicating with thousands of parents, keeping their info private. I can't say enough about those two wonderful people.","Unpaid, doing it on their spare time while trying to raise a family and deal with all the negative effects of 'live with it' nonsense. And communicating with thousands of parents, keeping their info private. I ca not say enough about those two wonderful people.",unpaid spare time trying raise family deal negative effects live nonsense and communicating thousands parents keeping info private say enough two wonderful people,unpaid spare time try raise family deal negative effect live nonsense and communicate thousand parent keep info private say enough two wonderful people,[],{},{},2,5,[],,"['Teacher Talker', 'Marcella Bernardo', 'hystericaleducator', 'Fraser Health', 'NEWS 1130', 'LizaYuzda', 'BCTF']",-0.4019
21,2021-03-09,Tue Mar 09 22:50:32 +0000 2021,1369420364216999940,dbtheaven,,Not Geo-tagged,b'@suzhorton @Debyaks @chrisshipitv @PeterAdamSmith It was always a private family matter......whilst for 4 years members of the firm were leaking damaging info on H&amp;M to the press and making it a very public family matter???? GTHOH',$MENTION$ $MENTION$ $MENTION$ $MENTION$ It was always a private family matter......whilst for $NUMBER$ years members of the firm were leaking damaging info on H&amp;M to the press and making it a very public family matter???? GTHOH,It was always a private family matter..whilst for years members of the firm were leaking damaging info on H&amp;M to the press and making it a very public family matter?? GTHOH,it always private family matter whilst years members firm leaking damaging info m press making public family matter gthoh,always private family matter whilst year member firm leak damage info m press make public family matter gthoh,[],{},{},0,0,[],,"['Suzanne Horton', 'Debbie Akroyd', 'Chris Ship', 'Peter A Smith']",-0.51
47,2021-03-09,Tue Mar 09 21:17:50 +0000 2021,1369397036664160262,crowdspring,,Not Geo-tagged,b'@pramskiii We don\xe2\x80\x99t discuss private account info in a public forum. Please contact our support team if you haven\xe2\x80\x99t done so already: https://t.co/U4XsF11lbe',$MENTION$ We dont discuss private account info in a public forum. Please contact our support team if you havent done so already: $URL$,We don t discuss private account info in a public forum. Please contact our support team if you haven t done so already,we discuss private account info public forum please contact support team done already,discuss private account info public forum please contact support team do already,[],{},{},0,0,[],http://crowdspring.com/help/contact/,['Pramudita Adi'],0.6124
28,2021-03-09,Tue Mar 09 22:17:10 +0000 2021,1369411970512916484,PortalBrightWin,IG | YT: PortalBrightWin,Not Geo-tagged,b'[#INFO] Agenda BrightWin\n\n\xe2\x80\xa2 Cathy Doll Nude Matte Summer Private Cruise with Bright-Win\n\n\xf0\x9f\x97\x93\xef\xb8\x8f 10.03.21\n\xe2\x8f\xb0 7h da manh\xc3\xa3 (\xf0\x9f\x87\xa7\xf0\x9f\x87\xb7) \n\xf0\x9f\x93\x8d Evento privado \n#\xef\xb8\x8f\xe2\x83\xa3 \xe0\xb8\xa5\xe0\xb9\x88\xe0\xb8\xad\xe0\xb8\x87\xe0\xb9\x80\xe0\xb8\xa3\xe0\xb8\xb7\xe0\xb8\xad\xe0\xb8\xaa\xe0\xb8\xb8\xe0\xb8\x94\xe0\xb8\xab\xe0\xb8\xa3\xe0\xb8\xb9\xe0\xb8\x81\xe0\xb8\xb1\xe0\xb8\x9a\xe0\xb9\x84\xe0\xb8\x9a\xe0\xb8\xa3\xe0\xb9\x8c\xe0\xb8\x97\xe0\xb8\xa7\xe0\xb8\xb4\xe0\xb8\x99\n\n#\xe0\xb9\x84\xe0\xb8\x9a\xe0\xb8\xa3\xe0\xb9\x8c\xe0\xb8\x97\xe0\xb8\xa7\xe0\xb8\xb4\xe0\xb8\x99 #bbrightvc #winmetawin | \xf0\x9f\x90\x9d https://t.co/AikiOQRReV',[$HASHTAG$] Agenda BrightWin Cathy Doll Nude Matte Summer Private Cruise with Bright-Win $EMOJI$ $NUMBER$ $NUMBER$h da manh () $EMOJI$ Evento privado $HASHTAG$ $HASHTAG$ $HASHTAG$ $HASHTAG$ | $EMOJI$ $URL$,[] Agenda BrightWin Cathy Doll Nude Matte Summer Private Cruise with Bright-Win h da manh ( ) Evento privado |,agenda brightwin cathy doll nude matte summer private cruise bright win manh evento privado,agenda brightwin cathy doll nude matte summer private cruise bright win manh evento privado,[],{},{},7,37,"['INFO', 'ไบร์ทวิน', 'bbrightvc', 'winmetawin']",,[],0.0
42,2021-03-09,Tue Mar 09 21:28:06 +0000 2021,1369399618858065924,BullMarketNews1,,Not Geo-tagged,b'New post: ONE WORLD LITHIUM ANNOUNCES CLOSING OF OVERSUBSCRIBED NON-BROKERED PRIVATE PLACEMENT https://t.co/7aBAL9O18w',New post: ONE WORLD LITHIUM ANNOUNCES CLOSING OF OVERSUBSCRIBED NON-BROKERED PRIVATE PLACEMENT $URL$,New post ONE WORLD LITHIUM ANNOUNCES CLOSING OF OVERSUBSCRIBED NON-BROKERED PRIVATE PLACEMENT,new post one world lithium announces closing of oversubscribed non brokered private placement,new post one world lithium announce close of oversubscribed non brokered private placement,[],{},{},0,0,[],http://bullmarketnews.info/one-world-lithium-announces-closing-of-oversubscribed-non-brokered-private-placement-2/,[],0.0
23,2021-03-09,Tue Mar 09 22:44:28 +0000 2021,1369418838723473410,AJhapamochi,United States,Not Geo-tagged,"b'+\n#BTSARMY ami, this is a super easy way to request @BTS_twt #Dynamite on ~*500* radio stations *AND* potentially win a BE Deluxe + Musicares Ticket!\nPlease use incognito/private mode, unlimited\xf0\x9f\x97\xb3.\nSee tweet below for info on requesting &amp; voting for AT40 countdown &amp; GA rules\xf0\x9f\x91\x87 https://t.co/peeD4pCWoD'","+ $HASHTAG$ ami, this is a super easy way to request $MENTION$ $HASHTAG$ on ~*500* radio stations *AND* potentially win a BE Deluxe + Musicares Ticket! Please use incognito/private mode, unlimited$EMOJI$. See tweet below for info on requesting &amp; voting for AT40 countdown &amp; GA rules$EMOJI$ $URL$","+ ami, this is a super easy way to request on ~*500* radio stations *AND* potentially win a BE Deluxe + Musicares Ticket! Please use incognito/private mode, unlimited . See tweet below for info on requesting &amp; voting for AT40 countdown &amp; GA rules",ami super easy way request radio stations and potentially win be deluxe musicares ticket please use incognito private mode unlimited see tweet info requesting voting at countdown ga rules,ami sup easy way request radio station and potentially win be deluxe musicare ticket please use incognito private mode unlimited see tweet info request voting at countdown ga rule,[],{},{},0,0,"['BTSARMY', 'Dynamite']",https://twitter.com/borahaefunds/status/1368683274764234763,['방탄소년단'],0.9215
11,2021-03-09,Tue Mar 09 23:06:29 +0000 2021,1369424381009682432,epchihuahuas,"El Paso, TX",Not Geo-tagged,"b""Our Fiesta Patio and Outdoor Patio Suites 206 &amp; 211 are great ways to enjoy a Chihuahuas' game this summer in a private area with family and friends \n\nMore Info:\n\nFiesta Patio: https://t.co/JFpqyyT0KD\n\nOutdoor Patio Suites: https://t.co/2eBxIOMWIn\n\nOr Call/Text (915) 533-BASE https://t.co/twEfbnb1iX""",Our Fiesta Patio and Outdoor Patio Suites $NUMBER$ &amp; $NUMBER$ are great ways to enjoy a Chihuahuas' game this summer in a private area with family and friends More Info: Fiesta Patio: $URL$ Outdoor Patio Suites: $URL$ Or Call/Text (915) $NUMBER$-BASE $URL$,Our Fiesta Patio and Outdoor Patio Suites &amp; are great ways to enjoy a Chihuahuas' game this summer in a private area with family and friends More Info Fiesta Patio Outdoor Patio Suites Or Call/Text (915) -BASE,our fiesta patio outdoor patio suites great ways enjoy chihuahuas game summer private area family friends more info fiesta patio outdoor patio suites or call text base,fiesta patio outdoor patio suit great way enjoy chihuahuas game summer private area family friend more info fiesta patio outdoor patio suite or call text base,[],{},{},1,3,[],"https://www.milb.com/el-paso/tickets/hospitality, https://www.milb.com/el-paso/tickets/suites",[],0.9507
27,2021-03-09,Tue Mar 09 22:26:36 +0000 2021,1369414341569765379,SouthernWitch28,,Not Geo-tagged,"b'if you\xe2\x80\x99re using the #thetruthaboutrwf tag, this is a reminder to protect yourself, don\xe2\x80\x99t give your real name and try as hard as possible to keep your personal info private. these people are doxers.'","if youre using the $HASHTAG$ tag, this is a reminder to protect yourself, dont give your real name and try as hard as possible to keep your personal info private. these people are doxers.","if you re using the tag, this is a reminder to protect yourself, don t give your real name and try as hard as possible to keep your personal info private. these people are doxers.",using tag reminder protect give real name try hard possible keep personal info private people doxers,use tag reminder protect give real name try hard possible keep personal info private people doxer,[],{},{},6,13,['thetruthaboutrwf'],,[],0.296
49,2021-03-09,Tue Mar 09 21:15:36 +0000 2021,1369396473809534981,JimMontgomeryOt,"Ottawa, ON, Canada",Not Geo-tagged,b'@EMAP_US is an international standard applicable to all private / public emergency management programs and a great partner of @iaem For now info: https://t.co/wTA3O3CKOV https://t.co/QSWdYW3JFE',$MENTION$ is an international standard applicable to all private / public emergency management programs and a great partner of $MENTION$ For now info: $URL$ $URL$,is an international standard applicable to all private / public emergency management programs and a great partner of For now info,international standard applicable private public emergency management programs great partner for info,international standard applicable private public emergency management program great partner for info,[],{},{},0,0,[],"http://www.EMAP.org, https://twitter.com/emap_us/status/1369361232189329412","['EMAP', 'IAEM']",0.3612
9,2021-03-09,Tue Mar 09 23:12:10 +0000 2021,1369425811854532612,dr_bowerbird,,Not Geo-tagged,b'@LucyTurnbull_AO Also company sold patient info to private health insurance brokers and paid 2.9 million in penalties as ordered by federal court after ACCC investigation/ legal proceedings',$MENTION$ Also company sold patient info to private health insurance brokers and paid $NUMBER$ million in penalties as ordered by federal court after ACCC investigation/ legal proceedings,Also company sold patient info to private health insurance brokers and paid million in penalties as ordered by federal court after ACC investigation/ legal proceedings,also company sold patient info private health insurance brokers paid million penalties ordered federal court acc investigation legal proceedings,also company sell patient info private health insurance broker pay million penalty order federal court acc investigation legal proceeding,[],{},{},0,0,[],,['Lucy Turnbull AO'],0.128
51,2021-03-09,Tue Mar 09 21:09:19 +0000 2021,1369394893429366787,OriolesFanProbz,Birdland,Not Geo-tagged,b'@_huston_zack19 Anybody can find her page. The info on it is still private. Relax',$MENTION$ Anybody can find her page. The info on it is still private. Relax,Anybody can find her page. The info on it is still private. Relax,anybody find page the info still private relax,anybody find page the info still private relax,[],{},{},0,0,[],,['Zack'],0.4404
