s_no,date,created_at,id_str,screen_name,user_location,geo-tagged_place,tweet_text,tweet_tokenized,tweet_cleaned,tweet_filtered,tweet_lemmatized,tweet_mentioned_organizations,tweet_tags_classified,tweet_orgs_classified,retweet_count,fav_count,hashtags,urls,mentions,vader_polarity
129,2021-03-15,Mon Mar 15 18:06:07 +0000 2021,1371523119400296455,digiphile,"Washington, DC",Not Geo-tagged,"b""@FCC Great to see another federal agency tweeting about #SunshineWeek! It would be terrific if you could walk us through all of the ways we can access info, from\n#opengov: https://t.co/i37APbvNoC &amp; #opendata to\nsocial media to what's in your FOIA reading room: https://t.co/h2LllDWFG1""","$MENTION$ Great to see another federal agency tweeting about $HASHTAG$! It would be terrific if you could walk us through all of the ways we can access info, from $HASHTAG$: $URL$ &amp; $HASHTAG$ to social media to what's in your FOIA reading room: $URL$","Great to see another federal agency tweeting about ! It would be terrific if you could walk us through all of the ways we can access info, from &amp; to social media to what's in your FOIA reading room",great see another federal agency tweeting it would terrific could walk ways access info social media foia reading room,great see another federal agency tweet would terrific could walk way access info social medium foia reading room,[],{},{},1,4,"['SunshineWeek', 'opengov', 'opendata']","https://fcc.gov/open, https://www.fcc.gov/general/freedom-information-act-electronic-reading-room",['The FCC'],0.8172
118,2021-03-15,Mon Mar 15 18:43:11 +0000 2021,1371532444348809216,AlunaSocial,,Not Geo-tagged,"b'Got #Aluna?\n\nIf you #HODL at least 1337 $ALN on MetaMask, join other Alunauts in our Private Groups on:\n- Telegram: https://t.co/UaQRym5uQU\n- Discord: https://t.co/Bieyd36XZz (type !join)\n\nMore info: https://t.co/q6tIIqOJZi\n\nBuy $ALN on Uniswap: https://t.co/XoDmm2hDIe https://t.co/lyMp6rmtOI'","Got $HASHTAG$? If you $HASHTAG$ at least $NUMBER$ $ALN on MetaMask, join other Alunauts in our Private Groups on: - Telegram: $URL$ - Discord: $URL$ (type !join) More info: $URL$ Buy $ALN on Uniswap: $URL$ $URL$","Got ? If you at least $ALN on MetaMask, join other Alunauts in our Private Groups on - Telegram - Discord (type !join) More info Buy $ALN on Uniswap",got if least aln metamask join alunauts private groups telegram discord type join more info buy aln uniswap,get if least aln metamask join alunaut private group telegram discord type join more info buy aln uniswap,[],{},{},16,65,"['Aluna', 'HODL']","https://bit.ly/3vATF2f, https://discord.gg/hsadykv, https://aluna.medium.com/introducing-alunas-token-permissioned-chat-group-for-crypto-traders-52004a4f5efe, https://app.uniswap.org/#/swap?inputCurrency=ETH&outputCurrency=0x8185bc4757572da2a610f887561c32298f1a5748",[],0.2481
126,2021-03-15,Mon Mar 15 18:12:12 +0000 2021,1371524646600904705,Homeless_Info,London + 42 other locations 👇,Not Geo-tagged,b'@HJAHousingLaw Homeless people rehoused in private rented always ends in disaster because the rent is not covered by housing benefit &amp; they have to spend half their benefits on rent\nPlus antisocial behaviour from neighbours &amp; disrepair\nEvicted due to rent arrears or walk out back to the streets',$MENTION$ Homeless people rehoused in private rented always ends in disaster because the rent is not covered by housing benefit &amp; they have to spend half their benefits on rent Plus antisocial behaviour from neighbours &amp; disrepair Evicted due to rent arrears or walk out back to the streets,Homeless people rehoused in private rented always ends in disaster because the rent is not covered by housing benefit &amp; they have to spend half their benefits on rent Plus antisocial behaviour from neighbours &amp; disrepair Evicted due to rent arrears or walk out back to the streets,homeless people rehoused private rented always ends disaster rent covered housing benefit spend half benefits rent plus antisocial behaviour neighbours disrepair evicted due rent arrears walk back streets,homeless people rehouse private rent always end disaster rent cover housing benefit spend half benefit rent plus antisocial behaviour neighbour disrepair evict due rent arrear walk back street,[],{},{},0,0,[],,['HJA Housing Law'],0.128
104,2021-03-15,Mon Mar 15 19:09:42 +0000 2021,1371539118656733190,TimeForChores,"Texas, USA",Not Geo-tagged,"b'@AdairaLandryMD @MDaware I have a coworker who does not understand that everyone has things going on in their lives. Many people don\xe2\x80\x99t tell their coworkers all of their private info. I guess because they don\xe2\x80\x99t, she thinks she is the only person dealing with life (she does not have children BTW).'","$MENTION$ $MENTION$ I have a coworker who does not understand that everyone has things going on in their lives. Many people dont tell their coworkers all of their private info. I guess because they dont, she thinks she is the only person dealing with life (she does not have children BTW).","I have a coworker who does not understand that everyone has things going on in their lives. Many people don t tell their coworkers all of their private info. I guess because they don t, she thinks she is the only person dealing with life (she does not have children BTW).",coworker understand everyone things going lives many people tell coworkers private info guess thinks person dealing life children btw,coworker understand everyone thing go live many people tell coworker private info guess think person deal life child btw,['coworker'],{'Coworking|Coworking spaces': ['coworker']},{'coworker': ['Coworking|Coworking spaces']},0,9,[],,"['Adaira Landry, MD MEd', 'Seth Trueger']",0.0
125,2021-03-15,Mon Mar 15 18:18:31 +0000 2021,1371526239987568645,thamcosplays,Edge Knot City,Not Geo-tagged,b'@sharkpunchinist @AZUREDOKUGANRYU deleted my tweet bc i dont need my private info on my public twitter but yeah. born and raised in charleston so i feel this pain deeply',$MENTION$ $MENTION$ deleted my tweet bc i dont need my private info on my public twitter but yeah. born and raised in charleston so i feel this pain deeply,deleted my tweet bc i dont need my private info on my public twitter but yeah. born and raised in charleston so i feel this pain deeply,deleted tweet dont need private info public twitter yeah born raised charleston feel pain deeply,delete tweet do not need private info public twitter yeah bear raise charleston feel pain deeply,[],{},{},0,1,[],,"['Sharkpuncher!', 'Burry Kaw']",-0.5442
115,2021-03-15,Mon Mar 15 18:50:58 +0000 2021,1371534404892327937,annvsungie,,Not Geo-tagged,"b'@PBBAEG Funny how you think you can come in with that energy tweeting like you did something. This is not even bad if this tweet got in the hands of hardcore yoongi stans your  private info, name, birthdate, and address would be out faster than you can say lady Gaga bitch'","$MENTION$ Funny how you think you can come in with that energy tweeting like you did something. This is not even bad if this tweet got in the hands of hardcore yoongi stans your private info, name, birthdate, and address would be out faster than you can say lady Gaga bitch","Funny how you think you can come in with that energy tweeting like you did something. This is not even bad if this tweet got in the hands of hardcore yoongi stans your private info, name, birthdate, and address would be out faster than you can say lady Gaga bitch",funny think come energy tweeting like something this even bad tweet got hands hardcore yoongi stans private info name birthdate address would faster say lady gaga bitch,funny think come energy tweet like something this even bad tweet get hand hardcore yoongi stans private info name birthdate address would fast say lady gaga bitch,[],{},{},0,3,[],,['Hehe'],0.6757
135,2021-03-15,Mon Mar 15 17:52:43 +0000 2021,1371519743551795201,Delta,Global,Not Geo-tagged,"b'@aminatlyn Aminat, I am so sorry for the wait getting assistance today. Let me see if I can help speed that along for you. Please send your info through the DM link and I will meet you in that Private Chat to review Antoinette https://t.co/6iDGBJAc2m'","$MENTION$ Aminat, I am so sorry for the wait getting assistance today. Let me see if I can help speed that along for you. Please send your info through the DM link and I will meet you in that Private Chat to review Antoinette $URL$","Aminat, I am so sorry for the wait getting assistance today. Let me see if I can help speed that along for you. Please send your info through the DM link and I will meet you in that Private Chat to review Antoinette",aminat sorry wait getting assistance today let see help speed along please send info dm link meet private chat review antoinette,aminat sorry wait get assistance today let see help speed along please send info dm link meet private chat review antoinette,[],{},{},0,1,[],https://twitter.com/messages/compose?recipient_id=5920532,['Aminat💎'],0.5038
122,2021-03-15,Mon Mar 15 18:30:02 +0000 2021,1371529137849008129,gigioconnell,"Washington, D.C.",Not Geo-tagged,"b""What's next on beneficial ownership: Treasury has to write the regs by the end of 2021 to tell the private sector how to report beneficial ownership info. @JoshRudes""",What's next on beneficial ownership: Treasury has to write the regs by the end of $NUMBER$ to tell the private sector how to report beneficial ownership info. $MENTION$,What's next on beneficial ownership Treasury has to write the regs by the end of to tell the private sector how to report beneficial ownership info.,what next beneficial ownership treasury write regs end tell private sector report beneficial ownership info,what next beneficial ownership treasury write reg end tell private sector report beneficial ownership info,[],{},{},0,0,[],,['Josh Rudolph'],0.765
132,2021-03-15,Mon Mar 15 17:56:24 +0000 2021,1371520673768730630,CryptoArtEvent,UK & Virtual,Not Geo-tagged,"b'""A Puzzling #NFT"" - https://t.co/CVHGNzzXoL - This isn\'t an easy challenge!\n\nCrack the code, sweep the private key and claim the tokens, artwork and funds stored at the ETH address!\n\nMore info: https://t.co/ht7B1Atj9Q\n\nPRIZE FUND CURRENTLY SITS AT 0.34ETH!'","""A Puzzling $HASHTAG$"" - $URL$ - This isn't an easy challenge! Crack the code, sweep the private key and claim the tokens, artwork and funds stored at the ETH address! More info: $URL$ PRIZE FUND CURRENTLY SITS AT $NUMBER$ETH!","""A Puzzling "" - - This is not an easy challenge! Crack the code, sweep the private key and claim the tokens, artwork and funds stored at the ETH address! More info PRIZE FUND CURRENTLY SITS AT ETH!", puzzling this easy challenge crack code sweep private key claim tokens artwork funds stored eth address more info prize fund currently sits at eth,  puzzle this easy challenge crack code sweep private key claim token artwork fund store eth address more info prize fund currently sit at eth,[],{},{},2,1,['NFT'],"https://app.rarible.com/token/0xd07dc4262bcdbf85190c01c996b4c06a461d2430:38327, https://cryptobatesgroup.co.uk/puzzling/index.html",[],0.5513
141,2021-03-15,Mon Mar 15 17:39:16 +0000 2021,1371516359910305799,ancillb,"South West, England",Not Geo-tagged,b'@SamanthaMalin Thanks for reply. Help could include a small financial contribution. I can give more info via a private DM. You could always unfollow me again if you turn out not to be interested.',$MENTION$ Thanks for reply. Help could include a small financial contribution. I can give more info via a private DM. You could always unfollow me again if you turn out not to be interested.,Thanks for reply. Help could include a small financial contribution. I can give more info via a private DM. You could always unfollow me again if you turn out not to be interested.,thanks reply help could include small financial contribution give info via private dm you could always unfollow turn interested,thank reply help could include small financial contribution give info via private dm could always unfollow turn interested,[],{},{},0,0,[],,['Sam Malin and the boy cat Lucy'],0.5175
145,2021-03-15,Mon Mar 15 17:26:12 +0000 2021,1371513071630491649,NetworkFlash,,Not Geo-tagged,"b'Calling all members to join our #2021JMM on 7-10 June covering topics such as the role of the #ESG requirements in driving scale in #InclusiveInsurance, #FinancialInclusion &amp; the private sector in #Luxembourg, virtual #networking &amp; more! Register now: https://t.co/4IA4hXdA6T https://t.co/qBItuDtLTb'","Calling all members to join our $HASHTAG$ on $NUMBER$-10 June covering topics such as the role of the $HASHTAG$ requirements in driving scale in $HASHTAG$, $HASHTAG$ &amp; the private sector in $HASHTAG$, virtual $HASHTAG$ &amp; more! Register now: $URL$ $URL$","Calling all members to join our on -10 June covering topics such as the role of the requirements in driving scale in , &amp; the private sector in , virtual &amp; more! Register now",calling members join june covering topics role requirements driving scale private sector virtual register,call member join june cover topic role requirement drive scale private sector virtual register,[],{},{},1,2,"['2021JMM', 'ESG', 'InclusiveInsurance', 'FinancialInclusion', 'Luxembourg', 'networking']",https://microinsurancenetwork.org/civicrm/event/info?reset=1&id=267,[],0.3595
136,2021-03-15,Mon Mar 15 17:50:23 +0000 2021,1371519159000006666,VodafoneIreland,Ireland,Not Geo-tagged,"b""@veloreds Hi, \n\nThanks for reaching us here, if you private message the below info, I'll do my best to assist: \n\n- Full Name \n- Account number\n- Security PIN (or, if you don't have this, your address and date of birth) \n\nThanks,\nYugien""","$MENTION$ Hi, Thanks for reaching us here, if you private message the below info, I'll do my best to assist: - Full Name - Account number - Security PIN (or, if you don't have this, your address and date of birth) Thanks, Yugien","Hi, Thanks for reaching us here, if you private message the below info, I'll do my best to assist - Full Name - Account number - Security PIN (or, if you do not have this, your address and date of birth) Thanks, Yugien",hi thanks reaching private message info best assist full name account number security pin address date birth thanks yugien,hi thank reach private message info good assist full name account number security pin address date birth thank yugien,[],{},{},0,0,[],,['Ian Redmond ( Reds)🏳️\u200d🌈'],0.926
134,2021-03-15,Mon Mar 15 17:53:38 +0000 2021,1371519975119331330,TheTLCGroup2,,Not Geo-tagged,"b""Last chance to take our Privacy Commissioner endorsed, certified PIPA Privacy Officer course in 2021. Gain the knowledge and skills to fulfil the PO role under Bermuda's Personal Information Protection Act. #privacy #compliance Register today https://t.co/3XNuyY02VA https://t.co/OMcneOKI7Q""","Last chance to take our Privacy Commissioner endorsed, certified PIPA Privacy Officer course in $NUMBER$. Gain the knowledge and skills to fulfil the PO role under Bermuda's Personal Information Protection Act. $HASHTAG$ $HASHTAG$ Register today $URL$ $URL$","Last chance to take our Privacy Commissioner endorsed, certified PIPA Privacy Officer course in . Gain the knowledge and skills to fulfil the PO role under Bermuda's Personal Information Protection Act. Register today",last chance take privacy commissioner endorsed certified pipa privacy officer course gain knowledge skills fulfil po role bermuda personal information protection act register today,last chance take privacy commissioner endorse certify pipa privacy officer course gain knowledge skill fulfil po role bermuda personal information protection act register today,[],{},{},0,0,"['privacy', 'compliance']",https://thetlcgroup.talentlms.com/catalog/info/id:224,[],0.2656
150,2021-03-15,Mon Mar 15 17:20:19 +0000 2021,1371511592609837062,quacklovr,he/him 18,Not Geo-tagged,b'sapnap may not give alot of info about his private life but he will tell us whenever he needs to shit',sapnap may not give alot of info about his private life but he will tell us whenever he needs to shit,sapnap may not give alot of info about his private life but he will tell us whenever he needs to shit,sapnap may give alot info private life tell whenever needs shit,sapnap may give alot info private life tell whenever need shit,[],{},{},0,1,[],,[],-0.7096
147,2021-03-15,Mon Mar 15 17:24:44 +0000 2021,1371512704163282948,Allstate,,Not Geo-tagged,"b'@drdavecares We are sorry to hear this. Please private message us a bit more info, so we can look into this. ^AG https://t.co/vYIVrwsUyL'","$MENTION$ We are sorry to hear this. Please private message us a bit more info, so we can look into this. ^AG $URL$","We are sorry to hear this. Please private message us a bit more info, so we can look into this. ^AG",we sorry hear please private message bit info look ag,sorry hear please private message bit info look ag,[],{},{},0,0,[],https://twitter.com/messages/compose?recipient_id=14275290,['Dr Dave Babbs stay tuned 2022'],0.3237
138,2021-03-15,Mon Mar 15 17:47:28 +0000 2021,1371518422887043072,gletham,the Left Coast,Not Geo-tagged,"b'Now that there is mandatory PCR testing required for air travel there appears to be just ONE place to get this done in Victoria... yup, One place for a Vancouver Island, more than 850,000 people! \nPrivate testing/ Testing for Travel according to @CDCofBC \nhttps://t.co/muNiOGQHKV'","Now that there is mandatory PCR testing required for air travel there appears to be just ONE place to get this done in Victoria... yup, One place for a Vancouver Island, more than $NUMBER$ people! Private testing/ Testing for Travel according to $MENTION$ $URL$","Now that there is mandatory PCR testing required for air travel there appears to be just ONE place to get this done in Victoria.. yup, One place for a Vancouver Island, more than people! Private testing/ Testing for Travel according to",now mandatory pcr testing required air travel appears one place get done victoria yup one place vancouver island people private testing testing travel according,now mandatory pcr test require air travel appear one place get do victoria yup one place vancouver island people private testing testing travel accord,[],{},{},0,1,[],https://bit.ly/3lkkLpB,['BCCDC'],0.1511
137,2021-03-15,Mon Mar 15 17:48:47 +0000 2021,1371518756443332609,UN5Q7CNo5NliZAI,,Not Geo-tagged,"b""@GooglePayIndia Sorry for the delayed response. We noticed that you've shared a screenshot with the transaction details to help with your issue. Since these are often considered as private information we'd recommend deleting the tweet and not to share such info over social media in the future.""",$MENTION$ Sorry for the delayed response. We noticed that you've shared a screenshot with the transaction details to help with your issue. Since these are often considered as private information we'd recommend deleting the tweet and not to share such info over social media in the future.,Sorry for the delayed response. We noticed that you've shared a screenshot with the transaction details to help with your issue. Since these are often considered as private information we'd recommend deleting the tweet and not to share such info over social media in the future.,sorry delayed response we noticed shared screenshot transaction details help issue since often considered private information recommend deleting tweet share info social media future,sorry delay response notice share screenshot transaction detail help issue since often consider private information recommend delete tweet share info social medium future,[],{},{},0,0,[],,['Google Pay India'],0.5442
143,2021-03-15,Mon Mar 15 17:34:00 +0000 2021,1371515036141678594,srinjoyeesaha,,Not Geo-tagged,"b'*private info*\n*extremely personal info*\nimma high on youtube povs on wattpad boys, raspy male voices and mafia sons.\n*peeps*'","*private info* *extremely personal info* imma high on youtube povs on wattpad boys, raspy male voices and mafia sons. *peeps*","*private info* *extremely personal info* imma high on youtube povs on wattpad boys, raspy male voices and mafia sons. *peeps*",private info extremely personal info imma high youtube povs wattpad boys raspy male voices mafia sons peeps,private info extremely personal info imma high youtube povs wattpad boy raspy male voices mafia son peep,[],{},{},0,0,[],,[],0.0
146,2021-03-15,Mon Mar 15 17:25:29 +0000 2021,1371512892739125252,ItsAllChoice,☥TERRA FIRMA☥ Erthe ☥ Eorthe☥,Not Geo-tagged,"b'@criptoluis @DuckDuckGo How does it suck?\nIt indexes pages and when you query what you are looking for on https://t.co/sX4zx5Fua8 it returns results.\n\nWhat do you miss, the fact that oogle is oogling ur private info and using that to try to cheat at searches for you?'","$MENTION$ $MENTION$ How does it suck? It indexes pages and when you query what you are looking for on $URL$ it returns results. What do you miss, the fact that oogle is oogling ur private info and using that to try to cheat at searches for you?","How does it suck? It indexes pages and when you query what you are looking for on it returns results. What do you miss, the fact that oogle is oogling ur private info and using that to try to cheat at searches for you?",how suck it indexes pages query looking returns results what miss fact oogle oogling private info using try cheat searches,how suck index page query look return result what miss fact oogle oogle private info use try cheat search,[],{},{},0,0,[],http://ddg.com,"['𝐋𝐮𝐢𝐬 𝐃𝐚𝐯𝐢𝐝 𝐄𝐬𝐩𝐚𝐫𝐫𝐚𝐠𝐨𝐳𝐚', 'DuckDuckGo']",-0.782
142,2021-03-15,Mon Mar 15 17:39:15 +0000 2021,1371516354201755649,yieldwatch,"Malibu Beach, CA",Not Geo-tagged,b'@info_airdrop1 @HyperJumpBSC sure:) You are just monitoring &amp; not interacting with a contract besides signing a message on https://t.co/vqIFFbwS2i\n\nStay safe and never share your private key or enter your private passphrase!',$MENTION$ $MENTION$ sure:) You are just monitoring &amp; not interacting with a contract besides signing a message on $URL$ Stay safe and never share your private key or enter your private passphrase!,sure ) You are just monitoring &amp; not interacting with a contract besides signing a message on Stay safe and never share your private key or enter your private passphrase!,sure you monitoring interacting contract besides signing message stay safe never share private key enter private passphrase,sure monitor interact contract besides sign message stay safe never share private key enter private passphrase,[],{},{},0,1,[],http://yieldwatch.net,"['purwanto', 'HyperJump']",0.558
148,2021-03-15,Mon Mar 15 17:22:27 +0000 2021,1371512126515376129,Allstate,,Not Geo-tagged,"b'@LexiUpegui We are sorry to hear this. Please private message us a bit more info, so we can look into this. ^AG https://t.co/vYIVrwsUyL'","$MENTION$ We are sorry to hear this. Please private message us a bit more info, so we can look into this. ^AG $URL$","We are sorry to hear this. Please private message us a bit more info, so we can look into this. ^AG",we sorry hear please private message bit info look ag,sorry hear please private message bit info look ag,[],{},{},0,0,[],https://twitter.com/messages/compose?recipient_id=14275290,['lexi_upegui'],0.3237
140,2021-03-15,Mon Mar 15 17:40:56 +0000 2021,1371516781622403076,Uber_Support,,Not Geo-tagged,"b""@Chrislee1107198 Thanks for reaching out. We've sent you a DM. Please check. In order to protect your privacy, we don't encourage users to provide their account information through social media, please delete your post containing this info.""","$MENTION$ Thanks for reaching out. We've sent you a DM. Please check. In order to protect your privacy, we don't encourage users to provide their account information through social media, please delete your post containing this info.","Thanks for reaching out. We've sent you a DM. Please check. In order to protect your privacy, we do not encourage users to provide their account information through social media, please delete your post containing this info.",thanks reaching we sent dm please check in order protect privacy encourage users provide account information social media please delete post containing info,thank reach send dm please check in order protect privacy encourage user provide account information social medium please delete post contain info,[],{},{},0,0,[],,['Chris lee'],0.8019
144,2021-03-15,Mon Mar 15 17:32:41 +0000 2021,1371514701822181380,wavesntrees,,Not Geo-tagged,"b'@DE2344 @NikkiTorresTV @PPSConnect @OregonGovBrown @KATUNews How do you explain all of the private schools being open all year without your prediction happening? And the other 46+ states? If you believe the stuff you\xe2\x80\x99re posting, feel free to stay home until you are comfortable again, but don\xe2\x80\x99t try to push false info on others.'","$MENTION$ $MENTION$ $MENTION$ $MENTION$ $MENTION$ How do you explain all of the private schools being open all year without your prediction happening? And the other $NUMBER$+ states? If you believe the stuff youre posting, feel free to stay home until you are comfortable again, but dont try to push false info on others.","How do you explain all of the private schools being open all year without your prediction happening? And the other + states? If you believe the stuff you re posting, feel free to stay home until you are comfortable again, but don t try to push false info on others.",how explain private schools open year without prediction happening and states if believe stuff posting feel free stay home comfortable try push false info others,how explain private school open year without prediction happen and state if believe stuff post feel free stay home comfortable try push false info other,[],{},{},0,0,[],,"['DE234', 'Nikki Torres', 'Portland Public Schools', 'Governor Kate Brown', 'KATU News']",0.5661
