s_no,date,created_at,id_str,screen_name,user_location,geo-tagged_place,tweet_text,tweet_tokenized,tweet_cleaned,tweet_filtered,tweet_lemmatized,tweet_mentioned_organizations,tweet_tags_classified,tweet_orgs_classified,retweet_count,fav_count,hashtags,urls,mentions,vader_polarity
243,2021-01-30,Sat Jan 30 07:25:59 +0000 2021,1355416956069797889,min_sugacube,She/her,Not Geo-tagged,b'@enphoria07 Fs all run in the same circles. They have GCs where some of them buy private info from sasaengs and then they circulate the schedule info among their fan site friends. That\xe2\x80\x99s how they show up. They are not invited or welcome. Belift fan etiquette is against this behavior',$MENTION$ Fs all run in the same circles. They have GCs where some of them buy private info from sasaengs and then they circulate the schedule info among their fan site friends. Thats how they show up. They are not invited or welcome. Belift fan etiquette is against this behavior,Fs all run in the same circles. They have GCs where some of them buy private info from sasaengs and then they circulate the schedule info among their fan site friends. That s how they show up. They are not invited or welcome. Belift fan etiquette is against this behavior,fs run circles they gcs buy private info sasaengs circulate schedule info among fan site friends that show they invited welcome belift fan etiquette behavior,fs run circle gcs buy private info sasaeng circulate schedule info among fan site friend that show invite welcome belift fan etiquette behavior,[],{},{},1,5,[],,['rj☄️ || ramyeon duo🍜'],0.6393
255,2021-01-30,Sat Jan 30 06:04:02 +0000 2021,1355396333574750208,V5labendeo,地獄,Not Geo-tagged,b'even worse when you know it\xe2\x80\x99s easy to disprove but risk getting private info out by correcting them so you just gotta sit there and accept it https://t.co/FASPAyBCM8',even worse when you know its easy to disprove but risk getting private info out by correcting them so you just gotta sit there and accept it $URL$,even worse when you know it s easy to disprove but risk getting private info out by correcting them so you just gotta sit there and accept it,even worse know easy disprove risk getting private info correcting got ta sit accept,even bad know easy disprove risk get private info correct get ta sit accept,[],{},{},0,1,[],,[],0.1655
237,2021-01-30,Sat Jan 30 08:00:25 +0000 2021,1355425620927401987,JoyleenKour1,"Jammu, Jammu And Kashmir",Not Geo-tagged,b'@BamanDiBari and also there is no problem with removal of apmc if the government can save the farmers from private enterprices which the govt has not done anyway . what has the govt done to safeguard farmers  and wa info bro I have read the farm laws and they are flawed go and read them',$MENTION$ and also there is no problem with removal of apmc if the government can save the farmers from private enterprices which the govt has not done anyway . what has the govt done to safeguard farmers and wa info bro I have read the farm laws and they are flawed go and read them,and also there is no problem with removal of apmc if the government can save the farmers from private enterprices which the govt has not done anyway . what has the govt done to safeguard farmers and wa info bro I have read the farm laws and they are flawed go and read them,also problem removal apmc government save farmers private enterprices govt done anyway govt done safeguard farmers info bro read farm laws flawed read,also problem removal apmc government save farmer private enterprice govt do anyway govt do safeguard farmers info bro read farm law flaw read,[],{},{},0,0,[],,['BOY_HAS_NO_NAME'],0.607
251,2021-01-30,Sat Jan 30 06:29:41 +0000 2021,1355402787463413764,MiskawaanVillas,Koh Samui Thailand,"Bang Phong Phang, Thailand, TH","b""Have you experienced Villa Wayu yet? Featuring 7 bedrooms, a kids dorm and a private gym, it's an ideal set up for large groups\n\nEmail us : reservations@miskawaan.com \nWhatsapp us : +66 (0) 833902992 \nFor more info: https://t.co/teh5qs8Vrr\n\n#Miskawaan #BeachLuxe #hotels https://t.co/acZtZVYAJh""","Have you experienced Villa Wayu yet? Featuring $NUMBER$ bedrooms, a kids dorm and a private gym, it's an ideal set up for large groups Email us : reservations$MENTION$.com Whatsapp us : +66 (0) $NUMBER$ For more info: $URL$ $HASHTAG$ $HASHTAG$ $HASHTAG$ $URL$","Have you experienced Villa Wayu yet? Featuring bedrooms, a kids dorm and a private gym, it's an ideal set up for large groups Email us reservations.com Whatsapp us +66 (0) For more info",have experienced villa wayu yet featuring bedrooms kids dorm private gym ideal set large groups email reservations com whatsapp for info,have experience villa wayu yet feature bedroom kid dorm private gym ideal set large group email reservation com whatsapp for info,[],{},{},1,2,"['Miskawaan', 'BeachLuxe', 'hotels']",https://bit.ly/Miskawaan-Brochure,[],0.5267
256,2021-01-30,Sat Jan 30 05:49:57 +0000 2021,1355392790209806336,IndoPornStar5,"DKI Jakarta, Indonesia",Not Geo-tagged,b'\xe2\x8a\xb0\xe1\xaf\xbd\xe2\x8a\xb1\xe2\x94\x88\xe2\x95\x8c \xf0\x9d\x91\xad\xf0\x9d\x92\x90\xf0\x9d\x92\x8d\xf0\x9d\x92\x8d\xf0\x9d\x92\x90\xf0\x9d\x92\x98 \xf0\x9d\x92\x80\xf0\x9d\x92\x96\xf0\x9d\x92\x8c \xe2\x95\x8c\xe2\x94\x88\xe2\x8a\xb0\xe1\xaf\xbd\xe2\x8a\xb1\n\n\xe2\x9c\x94\xef\xb8\x8e Hot Angel\n\xe2\x98\x9e\xef\xb8\x8e\xef\xb8\x8e\xef\xb8\x8e @Dyah41082076\n\nBase || Salatiga\n\n\xf0\x9f\x94\xb8Open BO &amp; Massage ++\n\n- Include || Exclude || Expo\n- St || Lt || Private\n\nMore Info By WA \xf0\x9f\x93\xb2 :\n\xe2\x98\x8f\xef\xb8\x8e081259940869\n\n\xe0\xbc\xba\xe2\x94\x80\xe2\x80\xa2\xe2\x8a\xb1 \xf0\x9d\x91\xb9\xf0\x9d\x92\x86\xf0\x9d\x92\x84\xf0\x9d\x92\x90\xf0\x9d\x92\x8e\xf0\x9d\x92\x86\xf0\x9d\x92\x8f\xf0\x9d\x92\x85\xf0\x9d\x92\x86\xf0\x9d\x92\x85 &amp; \xf0\x9d\x91\xbb\xf0\x9d\x92\x93\xf0\x9d\x92\x96\xf0\x9d\x92\x94\xf0\x9d\x92\x95\xf0\x9d\x92\x86\xf0\x9d\x92\x85 \xe2\x8a\xb0\xe2\x80\xa2\xe2\x94\x80\xe0\xbc\xbb https://t.co/TprguwYmPb',$EMOJI$ Hot Angel $EMOJI$ $MENTION$ Base || Salatiga $EMOJI$Open BO &amp; Massage ++ - Include || Exclude || Expo - St || Lt || Private More Info By WA $EMOJI$ : $EMOJI$081259940869 &amp; $URL$,Hot Angel Base || Salatiga Open BO &amp; Massage ++ - Include || Exclude || Expo - St || Lt || Private More Info By WA 081259940869 &amp;,hot angel base salatiga open bo massage include exclude expo st lt private more info by wa,hot angel base salatiga open bo massage include exclude expo st lt private more info by wa,[],{},{},1,2,[],,['availsalatiga@Dyah'],-0.2263
177,2021-01-30,Sat Jan 30 13:15:25 +0000 2021,1355504892203442177,TIDIA_Info,,Not Geo-tagged,"b'@namibiansun For the All Namibian Tax Payers Benefit, Stop Wasting BILLIONS, The Education, Schools, Hospitals etc NEED This Money!!\nLufthansa, Eurowings, Condor are MUCH Better for FRA to WDH Flights.\nNamibia Private Sector FlyWestAir can take over Domestic Flights &amp; Staff. https://t.co/gHLV0O1RbP'","$MENTION$ For the All Namibian Tax Payers Benefit, Stop Wasting BILLIONS, The Education, Schools, Hospitals etc NEED This Money!! Lufthansa, Eurowings, Condor are MUCH Better for FRA to WDH Flights. Namibia Private Sector FlyWestAir can take over Domestic Flights &amp; Staff. $URL$","For the All Namibian Tax Payers Benefit, Stop Wasting BILLIONS, The Education, Schools, Hospitals etc NEED This Money!! Lufthansa, Eurowings, Condor are MUCH Better for FRA to WDH Flights. Namibia Private Sector FlyWestAir can take over Domestic Flights &amp; Staff.",for all namibian tax payers benefit stop wasting billions the education schools hospitals etc need this money lufthansa eurowings condor much better fra wdh flights namibia private sector flywestair take domestic flights staff,for all namibian tax payer benefit stop waste billion the education school hospital etc need this money lufthansa eurowing condor much well fra wdh flight namibia private sector flywestair take domestic flight staff,[],{},{},0,0,[],https://twitter.com/namibiansun/status/1355232584637296643,['Namibian Sun'],0.3786
258,2021-01-30,Sat Jan 30 05:47:27 +0000 2021,1355392160711892994,IndoPornStar1,,Not Geo-tagged,b'\xe2\x8a\xb0\xe1\xaf\xbd\xe2\x8a\xb1\xe2\x94\x88\xe2\x95\x8c \xf0\x9d\x91\xad\xf0\x9d\x92\x90\xf0\x9d\x92\x8d\xf0\x9d\x92\x8d\xf0\x9d\x92\x90\xf0\x9d\x92\x98 \xf0\x9d\x92\x80\xf0\x9d\x92\x96\xf0\x9d\x92\x8c \xe2\x95\x8c\xe2\x94\x88\xe2\x8a\xb0\xe1\xaf\xbd\xe2\x8a\xb1\n\n\xe2\x9c\x94\xef\xb8\x8e Hot Angel\n\xe2\x98\x9e\xef\xb8\x8e\xef\xb8\x8e\xef\xb8\x8e @Dyah41082076\n\nBase || Salatiga\n\n\xf0\x9f\x94\xb8Open BO &amp; Massage ++\n\n- Include || Exclude || Expo\n- St || Lt || Private\n\nMore Info By WA \xf0\x9f\x93\xb2 :\n\xe2\x98\x8f\xef\xb8\x8e081259940869\n\n\xe0\xbc\xba\xe2\x94\x80\xe2\x80\xa2\xe2\x8a\xb1 \xf0\x9d\x91\xb9\xf0\x9d\x92\x86\xf0\x9d\x92\x84\xf0\x9d\x92\x90\xf0\x9d\x92\x8e\xf0\x9d\x92\x86\xf0\x9d\x92\x8f\xf0\x9d\x92\x85\xf0\x9d\x92\x86\xf0\x9d\x92\x85 &amp; \xf0\x9d\x91\xbb\xf0\x9d\x92\x93\xf0\x9d\x92\x96\xf0\x9d\x92\x94\xf0\x9d\x92\x95\xf0\x9d\x92\x86\xf0\x9d\x92\x85 \xe2\x8a\xb0\xe2\x80\xa2\xe2\x94\x80\xe0\xbc\xbb https://t.co/cHC530ZJbc',$EMOJI$ Hot Angel $EMOJI$ $MENTION$ Base || Salatiga $EMOJI$Open BO &amp; Massage ++ - Include || Exclude || Expo - St || Lt || Private More Info By WA $EMOJI$ : $EMOJI$081259940869 &amp; $URL$,Hot Angel Base || Salatiga Open BO &amp; Massage ++ - Include || Exclude || Expo - St || Lt || Private More Info By WA 081259940869 &amp;,hot angel base salatiga open bo massage include exclude expo st lt private more info by wa,hot angel base salatiga open bo massage include exclude expo st lt private more info by wa,[],{},{},2,3,[],,['availsalatiga@Dyah'],-0.2263
259,2021-01-30,Sat Jan 30 05:39:37 +0000 2021,1355390189858824198,IndoPornStar5,"DKI Jakarta, Indonesia",Not Geo-tagged,b'\xe2\x8a\xb0\xe1\xaf\xbd\xe2\x8a\xb1\xe2\x94\x88\xe2\x95\x8c \xf0\x9d\x91\xad\xf0\x9d\x92\x90\xf0\x9d\x92\x8d\xf0\x9d\x92\x8d\xf0\x9d\x92\x90\xf0\x9d\x92\x98 \xf0\x9d\x92\x80\xf0\x9d\x92\x96\xf0\x9d\x92\x8c \xe2\x95\x8c\xe2\x94\x88\xe2\x8a\xb0\xe1\xaf\xbd\xe2\x8a\xb1\n\n\xe2\x9c\x94\xef\xb8\x8e BBW Hot\n\n\xe2\x98\x9e\xef\xb8\x8e\xef\xb8\x8e\xef\xb8\x8e @Ayyarosinta_7\n\n\xf0\x9f\x94\xb8Open BO\n\n- Include || Exclude || Expo\n- St || Lt || Private\n- Wajib DP \xf0\x9f\x92\xb0\n- COD juga bisa \xf0\x9f\xa4\x97\n\nMore Info By DM :  \xf0\x9f\x93\xa9\n@Ayyarosinta_7\n\n\xe0\xbc\xba\xe2\x94\x80\xe2\x80\xa2\xe2\x8a\xb1 \xf0\x9d\x91\xb9\xf0\x9d\x92\x86\xf0\x9d\x92\x84\xf0\x9d\x92\x90\xf0\x9d\x92\x8e\xf0\x9d\x92\x86\xf0\x9d\x92\x8f\xf0\x9d\x92\x85\xf0\x9d\x92\x86\xf0\x9d\x92\x85 &amp; \xf0\x9d\x91\xbb\xf0\x9d\x92\x93\xf0\x9d\x92\x96\xf0\x9d\x92\x94\xf0\x9d\x92\x95\xf0\x9d\x92\x86\xf0\x9d\x92\x85 \xe2\x8a\xb0\xe2\x80\xa2\xe2\x94\x80\xe0\xbc\xbb https://t.co/8mZrKTzCh3',$EMOJI$ BBW Hot $EMOJI$ $MENTION$ $EMOJI$Open BO - Include || Exclude || Expo - St || Lt || Private - Wajib DP $EMOJI$ - COD juga bisa More Info By DM : $EMOJI$ $MENTION$ &amp; $URL$,BBW Hot Open BO - Include || Exclude || Expo - St || Lt || Private - Wajib DP - COD juga bisa More Info By DM &amp;,bbw hot open bo include exclude expo st lt private wajib dp cod juga bisa more info by dm,bbw hot open bo include exclude expo st lt private wajib dp cod juga bisa more info by dm,[],{},{},0,0,[],https://twitter.com/Ayyarosinta_7/status/1355330328559190017,"['BBW JAKARTA //082315218295', 'BBW JAKARTA //082315218295']",-0.2263
182,2021-01-30,Sat Jan 30 12:55:14 +0000 2021,1355499813412995074,DjLDot,Cyberspace,Not Geo-tagged,"b""People your messages are still private in WhatsApp\nThey are only sharing your info with Facebook\nIf you have Facebook they do that already and Instagram does it anyway which everyone has so I don't understand what everyone is seeing that hasn't been stated from WhatsApp \xf0\x9f\xa4\xb7\xf0\x9f\x8f\xbb\xe2\x80\x8d\xe2\x99\x82\xef\xb8\x8f""",People your messages are still private in WhatsApp They are only sharing your info with Facebook If you have Facebook they do that already and Instagram does it anyway which everyone has so I don't understand what everyone is seeing that hasn't been stated from WhatsApp $EMOJI$$EMOJI$,People your messages are still private in WhatsApp They are only sharing your info with Facebook If you have Facebook they do that already and Instagram does it anyway which everyone has so I do not understand what everyone is seeing that has not been stated from WhatsApp,people messages still private whatsapp they sharing info facebook if facebook already instagram anyway everyone understand everyone seeing stated whatsapp,people message still private whatsapp share info facebook if facebook already instagram anyway everyone understand everyone see state whatsapp,['facebook'],"{'Social media': ['facebook'], 'Advertising': ['facebook']}","{'facebook': ['Social media', 'Advertising']}",0,0,[],,[],0.4215
257,2021-01-30,Sat Jan 30 05:49:11 +0000 2021,1355392596944670724,IndoPornStar4,,Not Geo-tagged,b'\xe2\x8a\xb0\xe1\xaf\xbd\xe2\x8a\xb1\xe2\x94\x88\xe2\x95\x8c \xf0\x9d\x91\xad\xf0\x9d\x92\x90\xf0\x9d\x92\x8d\xf0\x9d\x92\x8d\xf0\x9d\x92\x90\xf0\x9d\x92\x98 \xf0\x9d\x92\x80\xf0\x9d\x92\x96\xf0\x9d\x92\x8c \xe2\x95\x8c\xe2\x94\x88\xe2\x8a\xb0\xe1\xaf\xbd\xe2\x8a\xb1\n\n\xe2\x9c\x94\xef\xb8\x8e Hot Angel\n\xe2\x98\x9e\xef\xb8\x8e\xef\xb8\x8e\xef\xb8\x8e @Dyah41082076\n\nBase || Salatiga\n\n\xf0\x9f\x94\xb8Open BO &amp; Massage ++\n\n- Include || Exclude || Expo\n- St || Lt || Private\n\nMore Info By WA \xf0\x9f\x93\xb2 :\n\xe2\x98\x8f\xef\xb8\x8e081259940869\n\n\xe0\xbc\xba\xe2\x94\x80\xe2\x80\xa2\xe2\x8a\xb1 \xf0\x9d\x91\xb9\xf0\x9d\x92\x86\xf0\x9d\x92\x84\xf0\x9d\x92\x90\xf0\x9d\x92\x8e\xf0\x9d\x92\x86\xf0\x9d\x92\x8f\xf0\x9d\x92\x85\xf0\x9d\x92\x86\xf0\x9d\x92\x85 &amp; \xf0\x9d\x91\xbb\xf0\x9d\x92\x93\xf0\x9d\x92\x96\xf0\x9d\x92\x94\xf0\x9d\x92\x95\xf0\x9d\x92\x86\xf0\x9d\x92\x85 \xe2\x8a\xb0\xe2\x80\xa2\xe2\x94\x80\xe0\xbc\xbb https://t.co/sbqLNzKYFl',$EMOJI$ Hot Angel $EMOJI$ $MENTION$ Base || Salatiga $EMOJI$Open BO &amp; Massage ++ - Include || Exclude || Expo - St || Lt || Private More Info By WA $EMOJI$ : $EMOJI$081259940869 &amp; $URL$,Hot Angel Base || Salatiga Open BO &amp; Massage ++ - Include || Exclude || Expo - St || Lt || Private More Info By WA 081259940869 &amp;,hot angel base salatiga open bo massage include exclude expo st lt private more info by wa,hot angel base salatiga open bo massage include exclude expo st lt private more info by wa,[],{},{},1,1,[],,['availsalatiga@Dyah'],-0.2263
262,2021-01-30,Sat Jan 30 05:38:07 +0000 2021,1355389811197022212,Availbooking5,"Bogor, Jawa Barat",Not Geo-tagged,"b'ReadyBogor Booking &amp; vcs nya say, Open Private, Include &amp; Exclude Room, Info Price &amp; Rules DM/WA\xf0\x9f\x92\x8c\n\nhttps://t.co/8rAkVDla3i \n\n#openbobogor #AngelBogor #expobogor #availbogor #bogorBO #vcs #vcscolmek #vcscroot #vcsjilbab #bobogor #Bogornakal #Bogorbirahi #bispakbogor #bisyarbogor https://t.co/xHlww4gyIY'","ReadyBogor Booking &amp; vcs nya say, Open Private, Include &amp; Exclude Room, Info Price &amp; Rules DM/WA$EMOJI$ $URL$ $HASHTAG$ $HASHTAG$ $HASHTAG$ $HASHTAG$ $HASHTAG$ $HASHTAG$ $HASHTAG$ $HASHTAG$ $HASHTAG$ $HASHTAG$ $HASHTAG$ $HASHTAG$ $HASHTAG$ $HASHTAG$ $URL$","ReadyBogor Booking &amp; vcs nya say, Open Private, Include &amp; Exclude Room, Info Price &amp; Rules DM/WA",readybogor booking vcs nya say open private include exclude room info price rules dm wa,readybogor booking vcs nya say open private include exclude room info price rule dm wa,[],{},{},1,1,"['openbobogor', 'AngelBogor', 'expobogor', 'availbogor', 'bogorBO', 'vcs', 'vcscolmek', 'vcscroot', 'vcsjilbab', 'bobogor', 'Bogornakal', 'Bogorbirahi', 'bispakbogor', 'bisyarbogor']",https://wa.me/62895340487802,[],-0.2263
261,2021-01-30,Sat Jan 30 05:38:12 +0000 2021,1355389832009109507,IndoPornStar1,,Not Geo-tagged,b'\xe2\x8a\xb0\xe1\xaf\xbd\xe2\x8a\xb1\xe2\x94\x88\xe2\x95\x8c \xf0\x9d\x91\xad\xf0\x9d\x92\x90\xf0\x9d\x92\x8d\xf0\x9d\x92\x8d\xf0\x9d\x92\x90\xf0\x9d\x92\x98 \xf0\x9d\x92\x80\xf0\x9d\x92\x96\xf0\x9d\x92\x8c \xe2\x95\x8c\xe2\x94\x88\xe2\x8a\xb0\xe1\xaf\xbd\xe2\x8a\xb1\n\n\xe2\x9c\x94\xef\xb8\x8e BBW Hot\n\n\xe2\x98\x9e\xef\xb8\x8e\xef\xb8\x8e\xef\xb8\x8e @Ayyarosinta_7\n\n\xf0\x9f\x94\xb8Open BO\n\n- Include || Exclude || Expo\n- St || Lt || Private\n- Wajib DP \xf0\x9f\x92\xb0\n- COD juga bisa \xf0\x9f\xa4\x97\n\nMore Info By DM :  \xf0\x9f\x93\xa9\n@Ayyarosinta_7\n\n\xe0\xbc\xba\xe2\x94\x80\xe2\x80\xa2\xe2\x8a\xb1 \xf0\x9d\x91\xb9\xf0\x9d\x92\x86\xf0\x9d\x92\x84\xf0\x9d\x92\x90\xf0\x9d\x92\x8e\xf0\x9d\x92\x86\xf0\x9d\x92\x8f\xf0\x9d\x92\x85\xf0\x9d\x92\x86\xf0\x9d\x92\x85 &amp; \xf0\x9d\x91\xbb\xf0\x9d\x92\x93\xf0\x9d\x92\x96\xf0\x9d\x92\x94\xf0\x9d\x92\x95\xf0\x9d\x92\x86\xf0\x9d\x92\x85 \xe2\x8a\xb0\xe2\x80\xa2\xe2\x94\x80\xe0\xbc\xbb https://t.co/PozvE4omVs',$EMOJI$ BBW Hot $EMOJI$ $MENTION$ $EMOJI$Open BO - Include || Exclude || Expo - St || Lt || Private - Wajib DP $EMOJI$ - COD juga bisa More Info By DM : $EMOJI$ $MENTION$ &amp; $URL$,BBW Hot Open BO - Include || Exclude || Expo - St || Lt || Private - Wajib DP - COD juga bisa More Info By DM &amp;,bbw hot open bo include exclude expo st lt private wajib dp cod juga bisa more info by dm,bbw hot open bo include exclude expo st lt private wajib dp cod juga bisa more info by dm,[],{},{},0,0,[],https://twitter.com/Ayyarosinta_7/status/1355330328559190017,"['BBW JAKARTA //082315218295', 'BBW JAKARTA //082315218295']",-0.2263
266,2021-01-30,Sat Jan 30 05:18:48 +0000 2021,1355384951189827585,yourtxtbot,투바투.,Not Geo-tagged,b'@sbjnz i don\xe2\x80\x99t know them off the top of my head but a lot of them are invading their privacy or some might release private info about the boys.',$MENTION$ i dont know them off the top of my head but a lot of them are invading their privacy or some might release private info about the boys.,i don t know them off the top of my head but a lot of them are invading their privacy or some might release private info about the boys.,know top head lot invading privacy might release private info boys,know top head lot invade privacy may release private info boy,[],{},{},0,0,[],,['arda'],0.1027
260,2021-01-30,Sat Jan 30 05:39:07 +0000 2021,1355390063903825929,IndoPornStar4,,Not Geo-tagged,b'\xe2\x8a\xb0\xe1\xaf\xbd\xe2\x8a\xb1\xe2\x94\x88\xe2\x95\x8c \xf0\x9d\x91\xad\xf0\x9d\x92\x90\xf0\x9d\x92\x8d\xf0\x9d\x92\x8d\xf0\x9d\x92\x90\xf0\x9d\x92\x98 \xf0\x9d\x92\x80\xf0\x9d\x92\x96\xf0\x9d\x92\x8c \xe2\x95\x8c\xe2\x94\x88\xe2\x8a\xb0\xe1\xaf\xbd\xe2\x8a\xb1\n\n\xe2\x9c\x94\xef\xb8\x8e BBW Hot\n\n\xe2\x98\x9e\xef\xb8\x8e\xef\xb8\x8e\xef\xb8\x8e @Ayyarosinta_7\n\n\xf0\x9f\x94\xb8Open BO\n\n- Include || Exclude || Expo\n- St || Lt || Private\n- Wajib DP \xf0\x9f\x92\xb0\n- COD juga bisa \xf0\x9f\xa4\x97\n\nMore Info By DM :  \xf0\x9f\x93\xa9\n@Ayyarosinta_7\n\n\xe0\xbc\xba\xe2\x94\x80\xe2\x80\xa2\xe2\x8a\xb1 \xf0\x9d\x91\xb9\xf0\x9d\x92\x86\xf0\x9d\x92\x84\xf0\x9d\x92\x90\xf0\x9d\x92\x8e\xf0\x9d\x92\x86\xf0\x9d\x92\x8f\xf0\x9d\x92\x85\xf0\x9d\x92\x86\xf0\x9d\x92\x85 &amp; \xf0\x9d\x91\xbb\xf0\x9d\x92\x93\xf0\x9d\x92\x96\xf0\x9d\x92\x94\xf0\x9d\x92\x95\xf0\x9d\x92\x86\xf0\x9d\x92\x85 \xe2\x8a\xb0\xe2\x80\xa2\xe2\x94\x80\xe0\xbc\xbb https://t.co/ccP8WnHBt6',$EMOJI$ BBW Hot $EMOJI$ $MENTION$ $EMOJI$Open BO - Include || Exclude || Expo - St || Lt || Private - Wajib DP $EMOJI$ - COD juga bisa More Info By DM : $EMOJI$ $MENTION$ &amp; $URL$,BBW Hot Open BO - Include || Exclude || Expo - St || Lt || Private - Wajib DP - COD juga bisa More Info By DM &amp;,bbw hot open bo include exclude expo st lt private wajib dp cod juga bisa more info by dm,bbw hot open bo include exclude expo st lt private wajib dp cod juga bisa more info by dm,[],{},{},0,0,[],https://twitter.com/Ayyarosinta_7/status/1355330328559190017,"['BBW JAKARTA //082315218295', 'BBW JAKARTA //082315218295']",-0.2263
254,2021-01-30,Sat Jan 30 06:15:08 +0000 2021,1355399125567561729,sky_beaver,"Beaver Creek, Colorado, USA",Not Geo-tagged,"b""Just give us a call at (970) 376-7849, and we'll make sure a car is reserved for you in no time. Please visit our website at https://t.co/wsS6oWnqLz  for more info on private Denver to Beaver Creek Private Car Service or Eagle Vail Airport Private Car Service. https://t.co/9iCQWUSBx6""","Just give us a call at (970) $NUMBER$-7849, and we'll make sure a car is reserved for you in no time. Please visit our website at $URL$ for more info on private Denver to Beaver Creek Private Car Service or Eagle Vail Airport Private Car Service. $URL$","Just give us a call at (970) -7849, and we'll make sure a car is reserved for you in no time. Please visit our website at for more info on private Denver to Beaver Creek Private Car Service or Eagle Vail Airport Private Car Service.",just give call make sure car reserved time please visit website info private denver beaver creek private car service eagle vail airport private car service,just give call make sure car reserved time please visit website info private denver beaver creek private car service eagle vail airport private car service,[],{},{},0,2,[],https://blueskylimovail.com/denver-to-beaver-creek/,[],-0.2173
274,2021-01-30,Sat Jan 30 04:49:27 +0000 2021,1355377563271528448,7__RhyThM,Builds 👉,Not Geo-tagged,b'@Cubrrr @machinesok I didn\xe2\x80\x99t wanna leak your private info',$MENTION$ $MENTION$ I didnt wanna leak your private info,I didn t wanna leak your private info,wan na leak private info,wan na leak private info,[],{},{},0,0,[],,"['Cuber', 'Sora ChaN']",-0.34
271,2021-01-30,Sat Jan 30 05:00:07 +0000 2021,1355380246212714496,SofiaVoloWine,"Baltimore, MD",Not Geo-tagged,b'Host a Private #Wine Tasting in your home. We make it easy! Click for More Info: https://t.co/R7PZdjWB15 #Baltimore #MDwine',Host a Private $HASHTAG$ Tasting in your home. We make it easy! Click for More Info: $URL$ $HASHTAG$ $HASHTAG$,Host a Private Tasting in your home. We make it easy! Click for More Info,host private tasting home we make easy click more info,host private tasting home make easy click more info,[],{},{},0,0,"['Wine', 'Baltimore', 'MDwine']",http://goo.gl/fRWhQz,[],0.4926
268,2021-01-30,Sat Jan 30 05:15:26 +0000 2021,1355384101650497537,LizWFab,,Not Geo-tagged,"b'YIKES! Revealing private info about anon account owners is not okay. You don\xe2\x80\x99t have to be friends with everyone on #AcademicTwitter, but don\xe2\x80\x99t be vindictive, just block and report like the rest of us. https://t.co/mKjKCG6evT'","YIKES! Revealing private info about anon account owners is not okay. You dont have to be friends with everyone on $HASHTAG$, but dont be vindictive, just block and report like the rest of us. $URL$","YIKES! Revealing private info about anon account owners is not okay. You don t have to be friends with everyone on , but don t be vindictive, just block and report like the rest of us.",yikes revealing private info anon account owners okay you friends everyone vindictive block report like rest us,yikes reveal private info anon account owner okay friend everyone vindictive block report like rest,[],{},{},0,6,['AcademicTwitter'],https://twitter.com/drsomedaymaybe/status/1355212445661491203,[],0.105
273,2021-01-30,Sat Jan 30 04:53:43 +0000 2021,1355378638749900804,TessaGroupllc,"Las Vegas, NV, San Diego, CA",Not Geo-tagged,b'Homes for rent by private owner no credit check&amp;#160;available now. Free Registration https://t.co/KoNfnP0yJ3 Text 702-996-6434 for more info',Homes for rent by private owner no credit check&amp;$HASHTAG$;available now. Free Registration $URL$ Text $NUMBER$-996-6434 for more info,Homes for rent by private owner no credit check&amp;;available now. Free Registration Text -996-6434 for more info,homes rent private owner credit check available free registration text info,home rent private owner credit check available free registration text info,[],{},{},0,0,[],http://bit.ly/NationwideRTOHouses,[],0.2769
283,2021-01-30,Sat Jan 30 04:19:13 +0000 2021,1355369956276244482,eonbinnie,hb•yj•sj•sh,Not Geo-tagged,b'@allkpop please respect his and their privacy stop digging and sharing such a private info  https://t.co/Jibj5YD2bo',$MENTION$ please respect his and their privacy stop digging and sharing such a private info $URL$,please respect his and their privacy stop digging and sharing such a private info,please respect privacy stop digging sharing private info,please respect privacy stop dig share private info,[],{},{},5,79,[],,['allkpop'],0.7184
279,2021-01-30,Sat Jan 30 04:31:09 +0000 2021,1355372959557447680,thebipolarbooks,"Houston, TX",Not Geo-tagged,"b'@shannonrwatts @iamjaderyes May be these ""extremist groups"" are actually part time private security providers.  who the hell knows.\n\nWe are sick and tired of this kind of info, even if its true'","$MENTION$ $MENTION$ May be these ""extremist groups"" are actually part time private security providers. who the hell knows. We are sick and tired of this kind of info, even if its true","May be these ""extremist groups"" are actually part time private security providers. who the hell knows. We are sick and tired of this kind of info, even if its true",may extremist groups actually part time private security providers hell knows we sick tired kind info even true,may extremist group actually part time private security provider hell know sick tired kind info even true,[],{},{},0,0,[],,"['Shannon Watts', 'Jade Ryes']",-0.765
