s_no,date,created_at,id_str,screen_name,user_location,geo-tagged_place,tweet_text,tweet_tokenized,tweet_cleaned,tweet_filtered,tweet_lemmatized,tweet_mentioned_organizations,tweet_tags_classified,tweet_orgs_classified,retweet_count,fav_count,hashtags,urls,mentions,vader_polarity
268,2021-01-14,Thu Jan 14 13:02:00 +0000 2021,1349703311356813318,Point_of_info,,Not Geo-tagged,"b'With \xc2\xa325k/ year private members clubs offering early access to the #vaccine, @br1dawg believes this could actually ""prolong the #pandemic and take more lives"".\n\nFind out why this could result in HUGE #inequality \xf0\x9f\x91\x87\nhttps://t.co/UM2dvgPfLO'","With $NUMBER$k/ year private members clubs offering early access to the $HASHTAG$, $MENTION$ believes this could actually ""prolong the $HASHTAG$ and take more lives"". Find out why this could result in HUGE $HASHTAG$ $EMOJI$ $URL$","With 25k/ year private members clubs offering early access to the , believes this could actually ""prolong the and take more lives"". Find out why this could result in HUGE",with year private members clubs offering early access believes could actually prolong take lives find could result huge,with year private member club offer early access believe could actually prolong take life find could result huge,[],{},{},0,3,"['vaccine', 'pandemic', 'inequality']",https://pointofinformation.co.uk/2020/12/11/should-covid-19-vaccines-be-for-sale-labour-article/,['Brian'],0.4648
260,2021-01-14,Thu Jan 14 13:23:36 +0000 2021,1349708747564847106,SuzieTullett,Ireland,Not Geo-tagged,b'Son tried to catch a flight today re a work trip. Having tested negative for #CovidUK was turned away. Told airlines won\xe2\x80\x99t accept NHS results because they don\xe2\x80\x99t include a doctor\xe2\x80\x99s name or lab info. Now has to travel to London &amp; pay for a private test which will include these x',Son tried to catch a flight today re a work trip. Having tested negative for $HASHTAG$ was turned away. Told airlines wont accept NHS results because they dont include a doctors name or lab info. Now has to travel to London &amp; pay for a private test which will include these x,Son tried to catch a flight today re a work trip. Having tested negative for was turned away. Told airlines won t accept NHS results because they don t include a doctor s name or lab info. Now has to travel to London &amp; pay for a private test which will include these x,son tried catch flight today work trip having tested negative turned away told airlines accept nhs results include doctor name lab info now travel london pay private test include,son try catch flight today work trip have test negative turn away tell airline accept nhs result include doctor name lab info now travel london pay private test include,[],{},{},0,1,['CovidUK'],,[],0.296
274,2021-01-14,Thu Jan 14 12:49:37 +0000 2021,1349700197304176640,AndrewW1960,London,Not Geo-tagged,"b'@iainmartin1 On our neighbourhood website, a local resident appealed for info about private clinics where Covid immunisation could be bought. ""Money no object."" Sickening.'","$MENTION$ On our neighbourhood website, a local resident appealed for info about private clinics where Covid immunisation could be bought. ""Money no object."" Sickening.","On our neighbourhood website, a local resident appealed for info about private clinics where Covid immunisation could be bought. ""Money no object."" Sickening.",on neighbourhood website local resident appealed info private clinics covid immunisation could bought money object sickening,on neighbourhood website local resident appeal info private clinic covid immunisation could buy money object sickening,[],{},{},0,0,[],,['Iain Martin'],0.1471
278,2021-01-14,Thu Jan 14 12:35:05 +0000 2021,1349696539816411142,VantellectuaI,KTH1🔜,Not Geo-tagged,"b""@moonyvivi It's not safe though. There was a whole expose thread on how they steal private info""",$MENTION$ It's not safe though. There was a whole expose thread on how they steal private info,It's not safe though. There was a whole expose thread on how they steal private info,it safe though there whole expose thread steal private info,safe though there whole expose thread steal private info,[],{},{},0,2,[],,['ia'],-0.7356
240,2021-01-14,Thu Jan 14 14:28:41 +0000 2021,1349725125390852097,ATT,"Dallas, TX",Not Geo-tagged,"b""@amybo Hi Amy, we'd like to look into this for you. Please send us a private message with your account number and contact info so we can get to the bottom of this. Thank you! https://t.co/7m6RT3Hk4n""","$MENTION$ Hi Amy, we'd like to look into this for you. Please send us a private message with your account number and contact info so we can get to the bottom of this. Thank you! $URL$","Hi Amy, we'd like to look into this for you. Please send us a private message with your account number and contact info so we can get to the bottom of this. Thank you!",hi amy like look please send private message account number contact info get bottom thank,hi amy like look please send private message account number contact info get bottom thank,[],{},{},0,0,[],https://twitter.com/messages/compose?recipient_id=14620190,['Amy Bohutinsky'],0.8056
5,2021-01-14,Thu Jan 14 23:41:38 +0000 2021,1349864282205286401,vegasjoecirca,,Not Geo-tagged,"b'\xf0\x9f\x8f\x80\xf0\x9f\x94\xa5\xf0\x9f\x94\xa522-2 \xf0\x9f\x8f\x80NBA RUN TWITTER VIDEO PLAYS\xf0\x9f\x94\xa5\xf0\x9f\x94\xa5\xf0\x9f\x94\xa5\xf0\x9f\x8f\x80Let\xe2\x80\x99s CASH this PLAY\xe2\x9c\x85WE are on an incredible \xf0\x9f\x8f\x80NBA RUN so let\xe2\x80\x99s keep it going \xf0\x9f\x91\x8d4 Official Plays in the Private GROUP @VegasJoeWins ,so let\xe2\x80\x99s get this SWEEP\xf0\x9f\xa7\xb9\xf0\x9f\xa7\xb9Follow me here on Twitter and DM for Private GROUP @VegasJoeWins INFO https://t.co/ocnB0udU1Q'","$EMOJI$$EMOJI$$EMOJI$22-2 $EMOJI$NBA RUN TWITTER VIDEO PLAYS$EMOJI$$EMOJI$$EMOJI$$EMOJI$Lets CASH this PLAY$EMOJI$WE are on an incredible $EMOJI$NBA RUN so lets keep it going $EMOJI$4 Official Plays in the Private GROUP $MENTION$ ,so lets get this SWEEPFollow me here on Twitter and DM for Private GROUP $MENTION$ INFO $URL$","22-2 NBA RUN TWITTER VIDEO PLAYS Let s CASH this PLAY WE are on an incredible NBA RUN so let s keep it going 4 Official Plays in the Private GROUP ,so let s get this SWEEP Follow me here on Twitter and DM for Private GROUP INFO",nba run twitter video plays let cash play we incredible nba run let keep going official plays private group let get sweep follow twitter dm private group info,nba run twitt video play let cash play incredible nba run let keep go official play private group let get sweep follow twitter dm private group info,[],{},{},49,190,[],,"['VEGASJoeWins', 'VEGASJoeWins']",0.8126
138,2021-01-14,Thu Jan 14 18:33:26 +0000 2021,1349786718506004490,TransferWise,Global,Not Geo-tagged,"b""@CoreyConnects Corey, we got to your private message yesterday with more info about your account and case. Kindly refer back to it  in case you haven't seen it yet. Thanks!""","$MENTION$ Corey, we got to your private message yesterday with more info about your account and case. Kindly refer back to it in case you haven't seen it yet. Thanks!","Corey, we got to your private message yesterday with more info about your account and case. Kindly refer back to it in case you have not seen it yet. Thanks!",corey got private message yesterday info account case kindly refer back case seen yet thanks,corey get private message yesterday info account case kindly refer back case see yet thank,[],{},{},0,0,[],,['Corey Connects'],0.75
276,2021-01-14,Thu Jan 14 12:42:55 +0000 2021,1349698509369470976,NJGuy4Biden,New Jersey,Not Geo-tagged,b'@laurenboebert Twitter is a private company. And you SHOULD be banned. You were an inside info source for those thugs.',$MENTION$ Twitter is a private company. And you SHOULD be banned. You were an inside info source for those thugs.,Twitter is a private company. And you SHOULD be banned. You were an inside info source for those thugs.,twitter private company and should banned you inside info source thugs,twitter private company and should ban inside info source thug,[],{},{},0,2,[],,['Lauren Boebert'],-0.4588
63,2021-01-14,Thu Jan 14 21:07:08 +0000 2021,1349825398129922049,resilientbee,"Sacramento, CA",Not Geo-tagged,"b""@BethandCats That is why I opted for using things like 23&amp;m* and anc*stry etc to try to get family info/health profiles/names bc every time I've tried to get info I'm shut down.\n\nThe agency my parents used was a private Christian one bc ofc it was &amp; it closed ages ago.""",$MENTION$ That is why I opted for using things like $NUMBER$&amp;m* and anc*stry etc to try to get family info/health profiles/names bc every time I've tried to get info I'm shut down. The agency my parents used was a private Christian one bc ofc it was &amp; it closed ages ago.,That is why I opted for using things like &amp;m* and anc*stry etc to try to get family info/health profiles/names bc every time I've tried to get info I'm shut down. The agency my parents used was a private Christian one bc ofc it was &amp; it closed ages ago.,that opted using things like anc stry etc try get family info health profiles names every time tried get info shut the agency parents used private christian one ofc closed ages ago,that opt use thing like anc stry etc try get family info health profile name every time try get info shut the agency parent use private christian one ofc close age ago,[],{},{},0,3,[],,"['Beth, the neighborhood hearth witch']",0.3612
272,2021-01-14,Thu Jan 14 12:50:53 +0000 2021,1349700513567301634,kpblm_info,Ukraine,Not Geo-tagged,"b""Zacharovany Karpaty, Slavske\nhttps://t.co/avEicqqYCt\nSichovykh Strltsiv Street 11A, Slavske, 82660, Ukraine\nSet in Slavske in the Lviv region, Zacharovany Karpaty offers accommodation with free WiFi and free private parking. The lodge offers a children's playgro... https://t.co/UuNeRmY5D1""","Zacharovany Karpaty, Slavske $URL$ Sichovykh Strltsiv Street $NUMBER$A, Slavske, $NUMBER$, Ukraine Set in Slavske in the Lviv region, Zacharovany Karpaty offers accommodation with free WiFi and free private parking. The lodge offers a children's playgro... $URL$","Zacharovany Karpaty, Slavske Sichovykh Strltsiv Street A, Slavske, , Ukraine Set in Slavske in the Lviv region, Zacharovany Karpaty offers accommodation with free WiFi and free private parking. The lodge offers a children's playgro..",zacharovany karpaty slavske sichovykh strltsiv street slavske ukraine set slavske lviv region zacharovany karpaty offers accommodation free wifi free private parking the lodge offers children playgro,zacharovany karpaty slavske sichovykh strltsiv street slavske ukraine set slavske lviv region zacharovany karpaty offer accommodation free wifi free private parking the lodge offer child playgro,[],{},{},0,0,[],https://zacharovany-karpaty.kpblm.info/en,[],0.765
228,2021-01-14,Thu Jan 14 15:07:12 +0000 2021,1349734818796322817,Anupam_work,Workex,Not Geo-tagged,b'@uni_con1 I suggest everyone to read this book \xf0\x9f\x93\x96 - Chaos Monkey by Antonio Martinez and we will come to know what this privacy bruahaha is all about. \n\nWe have moved from static info to real-time info on people. Private Info was always available to be sold from time immemorial :)',$MENTION$ I suggest everyone to read this book $EMOJI$ - Chaos Monkey by Antonio Martinez and we will come to know what this privacy bruahaha is all about. We have moved from static info to real-time info on people. Private Info was always available to be sold from time immemorial :),I suggest everyone to read this book - Chaos Monkey by Antonio Martinez and we will come to know what this privacy bruahaha is all about. We have moved from static info to real-time info on people. Private Info was always available to be sold from time immemorial ),suggest everyone read book chaos monkey antonio martinez come know privacy bruahaha we moved static info real time info people private info always available sold time immemorial,suggest everyone read book chaos monkey antonio martinez come know privacy bruahaha move static info real time info people private info always available sell time immemorial,[],{},{},0,1,[],,['Unicon Baba'],-0.5719
273,2021-01-14,Thu Jan 14 12:50:35 +0000 2021,1349700439130820610,RimaAngel18,Indonesia,Not Geo-tagged,b'\xf0\x9f\x94\x9eAVAIL MALANG\xf0\x9f\x94\x9e\n\n\xe2\x9c\x85OPEN BO &amp; VCS\n\xe2\x9c\x85COD NO DP\n\xe2\x9c\x85Info RR by DM\n\xe2\x9c\x85 Include &amp; Exclude\n\xe2\x9c\x85Boking Private\n\n#availmalang\n#bomalangcod \n#RealAccount \n#RealAngels \n#RealAngel \n#RealBO \n#TrustedBO\n#CODNODP \n#RecomendedBO\n#vcsreal \n#vcsbugil\n#vcscolmek\n#vcscroot\n#vcsberbayar\n#vcsmalang https://t.co/6EteJndtpa',$EMOJI$AVAIL MALANG$EMOJI$ $EMOJI$OPEN BO &amp; VCS $EMOJI$COD NO DP $EMOJI$Info RR by DM $EMOJI$ Include &amp; Exclude $EMOJI$Boking Private $HASHTAG$ $HASHTAG$ $HASHTAG$ $HASHTAG$ $HASHTAG$ $HASHTAG$ $HASHTAG$ $HASHTAG$ $HASHTAG$ $HASHTAG$ $HASHTAG$ $HASHTAG$ $HASHTAG$ $HASHTAG$ $HASHTAG$ $URL$,AVAIL MALANG OPEN BO &amp; VCS COD NO DP Info RR by DM Include &amp; Exclude Boking Private,avail malang open bo vcs cod no dp info rr dm include exclude boking private,avail malang open bo vcs cod no dp info rr dm include exclude boke private,[],{},{},0,0,"['availmalang', 'bomalangcod', 'RealAccount', 'RealAngels', 'RealAngel', 'RealBO', 'TrustedBO', 'CODNODP', 'RecomendedBO', 'vcsreal', 'vcsbugil', 'vcscolmek', 'vcscroot', 'vcsberbayar', 'vcsmalang']",,[],-0.5904
124,2021-01-14,Thu Jan 14 18:55:32 +0000 2021,1349792281587458048,needmyservice,Info@needmyservice.com,Not Geo-tagged,b'2018 Private SAAS Company Survey- Part 2For Entrepreneurs\n\nWe recently\xc2\xa0released\xc2\xa0Part 1\xc2\xa0results\xc2\xa0of our\xc2\xa0private SaaS company survey in partnership with\xc2\xa0KBCM Technology Group\xc2\xa0(formerly Pacific Cres... More Info - https://t.co/XudkrWYXAT\n#needmyservice https://t.co/QRvvvj8vMc',$NUMBER$ Private SAAS Company Survey- Part $NUMBER$For Entrepreneurs We recentlyreleasedPart $NUMBER$resultsof ourprivate SaaS company survey in partnership withKBCM Technology Group(formerly Pacific Cres... More Info - $URL$ $HASHTAG$ $URL$,Private SAAS Company Survey- Part For Entrepreneurs We recently released Part results of our private SaaS company survey in partnership with KBCM Technology Group (formerly Pacific Cres.. More Info -,private saas company survey part for entrepreneurs we recently released part results private saas company survey partnership kbcm technology group formerly pacific cres more info,private saas company survey part for entrepreneur recently release part result private saas company survey partnership kbcm technology group formerly pacific cre more info,[],{},{},0,1,['needmyservice'],https://needmyservice.com/2018-private-saas-company-survey-part-2for-entrepreneurs/,[],0.0
284,2021-01-14,Thu Jan 14 12:16:31 +0000 2021,1349691867651338241,AdrionNeorion,Republic of Slovenia,Not Geo-tagged,b'Are you a private #investor and would like to invest in a #startup incorporated in Slovenia? The Slovene Enterprise Fund can double your investment \xf0\x9f\x91\x8f\xf0\x9f\x91\x8d\nMore info here: https://t.co/swy7pS7fgR https://t.co/KCILxSq6cU',Are you a private $HASHTAG$ and would like to invest in a $HASHTAG$ incorporated in Slovenia? The Slovene Enterprise Fund can double your investment $EMOJI$$EMOJI$ More info here: $URL$ $URL$,Are you a private and would like to invest in a incorporated in Slovenia? The Slovene Enterprise Fund can double your investment More info here,are private would like invest incorporated slovenia the slovene enterprise fund double investment more info,be private would like invest incorporate slovenia the slovene enterprise fund double investment more info,[],{},{},0,1,"['investor', 'startup']",https://bit.ly/3nJuLbs,[],0.3612
282,2021-01-14,Thu Jan 14 12:19:59 +0000 2021,1349692739412082689,jenniferjune79,"Indiana, USA",Not Geo-tagged,"b'The most anticipated project @TheDaoMaker will have final private round on @gate_io after oversubscribed community and strategic rounds. More interesting, These tokens are also refundable per the #DYCO terms.\n\nhttps://t.co/0cdGmFLXHU\n\nFull info at: https://t.co/mhhftcVKWA'","The most anticipated project $MENTION$ will have final private round on $MENTION$ after oversubscribed community and strategic rounds. More interesting, These tokens are also refundable per the $HASHTAG$ terms. $URL$ Full info at: $URL$","The most anticipated project will have final private round on after oversubscribed community and strategic rounds. More interesting, These tokens are also refundable per the terms. Full info at",the anticipated project final private round oversubscribed community strategic rounds more interesting these tokens also refundable per terms full info,the anticipated project final private round oversubscribed community strategic round more interesting these token also refundable per term full info,[],{},{},0,0,['DYCO'],https://www.gate.io/en/article/18953,"['DAO Maker', 'Gate.io Exchange']",0.4576
277,2021-01-14,Thu Jan 14 12:38:45 +0000 2021,1349697462605381634,bjr80626,,Not Geo-tagged,b'Our local news stations and our local health departments only release covid info on FB. this is fucking ridiculous. This is PUBLIC INFORMATION. a private company has no business interfering. Our leaders should demand the information be made public.',Our local news stations and our local health departments only release covid info on FB. this is fucking ridiculous. This is PUBLIC INFORMATION. a private company has no business interfering. Our leaders should demand the information be made public.,Our local news stations and our local health departments only release covid info on FB. this is fucking ridiculous. This is PUBLIC INFORMATION. a private company has no business interfering. Our leaders should demand the information be made public.,our local news stations local health departments release covid info fb fucking ridiculous this public information private company business interfering our leaders demand information made public,local news station local health department release covid info fb fuck ridiculous this public information private company business interfere leader demand information make public,[],{},{},0,1,[],,[],-0.6697
106,2021-01-14,Thu Jan 14 19:39:04 +0000 2021,1349803238900588544,Tesco,United Kingdom,Not Geo-tagged,"b""@Duncan_Riches Hi Duncan, Sorry to see the state of the peppers you got! Not sure why they were being sold if they were visibly moldy. If you could send us a direct/private message with your purchase and packaging info, we'll do our best to help. TY - Ian""","$MENTION$ Hi Duncan, Sorry to see the state of the peppers you got! Not sure why they were being sold if they were visibly moldy. If you could send us a direct/private message with your purchase and packaging info, we'll do our best to help. TY - Ian","Hi Duncan, Sorry to see the state of the peppers you got! Not sure why they were being sold if they were visibly moldy. If you could send us a direct/private message with your purchase and packaging info, we'll do our best to help. TY - Ian",hi duncan sorry see state peppers got not sure sold visibly moldy if could send direct private message purchase packaging info best help ty ian,hi duncan sorry see state pepper get not sure sell visibly moldy if could send direct private message purchase packaging info good help ty ian,['duncan'],{},{'duncan': []},0,1,[],,['Duncan Riches'],0.8505
293,2021-01-14,Thu Jan 14 12:02:05 +0000 2021,1349688232175259650,ActiveSpeaking,Tasikmalaya,Not Geo-tagged,b'Private English Course for Elementary and Junior High School || Info : 083826757704 || Speaking and Pronunciation',Private English Course for Elementary and Junior High School || Info : $NUMBER$ || Speaking and Pronunciation,Private English Course for Elementary and Junior High School || Info || Speaking and Pronunciation,private english course elementary junior high school info speaking pronunciation,private english course elementary junior high school info speak pronunciation,[],{},{},0,0,[],,[],0.0
280,2021-01-14,Thu Jan 14 12:31:29 +0000 2021,1349695631774932992,DaRealZizzyHere,I'm infected bruh,Not Geo-tagged,"b""By the way @Doggy35637016 , I still have the screenshot of when you confessed you liked me lol. And the video including your voice. I'm not really the type to leak private info, but you've made me pretty mad. You can still see my tweets. So unblock me and give me a reason not to. https://t.co/vu4I39omtO""","By the way $MENTION$ , I still have the screenshot of when you confessed you liked me lol. And the video including your voice. I'm not really the type to leak private info, but you've made me pretty mad. You can still see my tweets. So unblock me and give me a reason not to. $URL$","By the way , I still have the screenshot of when you confessed you liked me lol. And the video including your voice. I'm not really the type to leak private info, but you've made me pretty mad. You can still see my tweets. So unblock me and give me a reason not to.",by way still screenshot confessed liked lol and video including voice really type leak private info made pretty mad you still see tweets so unblock give reason,by way still screenshot confessed like lol and video include voice really type leak private info make pretty mad still see tweet so unblock give reason,[],{},{},0,2,[],,['Doggy And Foxy'],0.2732
283,2021-01-14,Thu Jan 14 12:18:37 +0000 2021,1349692395470860296,RickLangel,,Not Geo-tagged,b'@MattTimmer1 @LauraRBelin @IAGovernor @KimReynoldsIA Ask yourself why you believed what you did in the first place. Wherever you got the info you did isn\xe2\x80\x99t telling you the truth. \n\nSchool choice allows parents to take the money that would have been allocated for their child and use it to pay for the private school.\n\nNo harm.',$MENTION$ $MENTION$ $MENTION$ $MENTION$ Ask yourself why you believed what you did in the first place. Wherever you got the info you did isnt telling you the truth. School choice allows parents to take the money that would have been allocated for their child and use it to pay for the private school. No harm.,Ask yourself why you believed what you did in the first place. Wherever you got the info you did isn t telling you the truth. School choice allows parents to take the money that would have been allocated for their child and use it to pay for the private school. No harm.,ask believed first place wherever got info telling truth school choice allows parents take money would allocated child use pay private school no harm,ask believe first place wherever get info tell truth school choice allow parent take money would allocate child use pay private school no harm,[],{},{},0,0,[],,"['Timmer', 'Bleeding Heartland', 'Gov. Kim Reynolds', 'Kim Reynolds']",0.5789
291,2021-01-14,Thu Jan 14 12:02:16 +0000 2021,1349688277595418628,Aaashiq_Aawara,"Karachi, Pakistan",Not Geo-tagged,b'shocked at how whatsapp is stealing private info like man if you wanted to know all these things you could\xe2\x80\x99ve just ASKED. My oversharing ass would tell u everything if you asked me once',shocked at how whatsapp is stealing private info like man if you wanted to know all these things you couldve just ASKED. My oversharing ass would tell u everything if you asked me once,shocked at how whatsapp is stealing private info like man if you wanted to know all these things you could ve just ASKED. My oversharing ass would tell u everything if you asked me once,shocked whatsapp stealing private info like man wanted know things could asked my oversharing ass would tell everything asked,shocked whatsapp steal private info like man want know thing could ask overshare ass would tell everything ask,[],{},{},0,0,[],,[],-0.7906
295,2021-01-14,Thu Jan 14 11:58:08 +0000 2021,1349687237454262272,Uxziu,Scotland,Not Geo-tagged,b'@Rxbornv @bannedosk @Vphxzshitter @JxyR6 no no no ur just lose. a public ip includes public information. not private. private info is Financial information or addresses',$MENTION$ $MENTION$ $MENTION$ $MENTION$ no no no ur just lose. a public ip includes public information. not private. private info is Financial information or addresses,no no no ur just lose. a public ip includes public information. not private. private info is Financial information or addresses,ur lose public includes public information private private info financial information addresses,ur lose public include public information private private info financial information address,[],{},{},0,1,[],,"['Dan', 'hammed burger :(', 'jxdqs', '.']",0.0196
294,2021-01-14,Thu Jan 14 12:00:09 +0000 2021,1349687747259232257,ESET_EA,"Nairobi, Kenya",Not Geo-tagged,"b'Router swarms will make your home Wi-Fi work better, sometimes a lot better, and that\xe2\x80\x99s how they\xe2\x80\x99re sold. But so much for privacy in private spaces. And what about security?\nMore info here \xf0\x9f\x91\x89\xf0\x9f\x8f\xbe  https://t.co/ezo9JjNVo1 https://t.co/26PbeSU9zr'","Router swarms will make your home Wi-Fi work better, sometimes a lot better, and thats how theyre sold. But so much for privacy in private spaces. And what about security? More info here $EMOJI$$EMOJI$ $URL$ $URL$","Router swarms will make your home Wi-Fi work better, sometimes a lot better, and that s how they re sold. But so much for privacy in private spaces. And what about security? More info here",router swarms make home wi fi work better sometimes lot better sold but much privacy private spaces and security more info,router swarm make home wi fi work well sometimes lot well sell but much privacy private space and security more info,[],{},{},0,1,[],https://zcu.io/qFy4,[],0.7184
