s_no,date,created_at,id_str,screen_name,user_location,geo-tagged_place,tweet_text,tweet_tokenized,tweet_cleaned,tweet_filtered,tweet_lemmatized,tweet_mentioned_organizations,tweet_tags_classified,tweet_orgs_classified,retweet_count,fav_count,hashtags,urls,mentions,vader_polarity
408,2021-01-14,Thu Jan 14 05:10:06 +0000 2021,1349584553300529153,IndoPornStar1,,Not Geo-tagged,b'\xe2\x8a\xb0\xe1\xaf\xbd\xe2\x8a\xb1\xe2\x94\x88\xe2\x95\x8c \xf0\x9d\x91\xad\xf0\x9d\x92\x90\xf0\x9d\x92\x8d\xf0\x9d\x92\x8d\xf0\x9d\x92\x90\xf0\x9d\x92\x98 \xf0\x9d\x92\x80\xf0\x9d\x92\x96\xf0\x9d\x92\x8c \xe2\x95\x8c\xe2\x94\x88\xe2\x8a\xb0\xe1\xaf\xbd\xe2\x8a\xb1\n\n\xe2\x9c\x94\xef\xb8\x8e Hot Angel\n\n\xe2\x98\x9e\xef\xb8\x8e\xef\xb8\x8e\xef\xb8\x8e @IsyanaBO8\n\xe2\x98\x9e\xef\xb8\x8e\xef\xb8\x8e\xef\xb8\x8e @angel_isyanaa\n\n\xf0\x9f\x94\xb8Open BO &amp; VCS \n\n- Include || Exclude || Expo\n- St || Lt || Private\n- Wajib DP\n\nMore Info By WA \xf0\x9f\x93\xb2 : \n\xe2\x98\x8f\xef\xb8\x8e 0813952709954\n\n\xe0\xbc\xba\xe2\x94\x80\xe2\x80\xa2\xe2\x8a\xb1 \xf0\x9d\x91\xb9\xf0\x9d\x92\x86\xf0\x9d\x92\x84\xf0\x9d\x92\x90\xf0\x9d\x92\x8e\xf0\x9d\x92\x86\xf0\x9d\x92\x8f\xf0\x9d\x92\x85\xf0\x9d\x92\x86\xf0\x9d\x92\x85 &amp; \xf0\x9d\x91\xbb\xf0\x9d\x92\x93\xf0\x9d\x92\x96\xf0\x9d\x92\x94\xf0\x9d\x92\x95\xf0\x9d\x92\x86\xf0\x9d\x92\x85 \xe2\x8a\xb0\xe2\x80\xa2\xe2\x94\x80\xe0\xbc\xbb https://t.co/SD2XrYaY5C',$EMOJI$ Hot Angel $EMOJI$ $MENTION$ $EMOJI$ $MENTION$ $EMOJI$Open BO &amp; VCS - Include || Exclude || Expo - St || Lt || Private - Wajib DP More Info By WA $EMOJI$ : $EMOJI$ $NUMBER$ &amp; $URL$,Hot Angel Open BO &amp; VCS - Include || Exclude || Expo - St || Lt || Private - Wajib DP More Info By WA &amp;,hot angel open bo vcs include exclude expo st lt private wajib dp more info by wa,hot angel open bo vcs include exclude expo st lt private wajib dp more info by wa,[],{},{},0,0,[],https://twitter.com/angel_isyanaa/status/1349361980075696128,"['EXPO JAKPUS (MENTENG) / AVAIL VCS 🦋', 'ISYANA #OPENBOJAKPUS (MENTENG) / AVAIL VCS 🎗']",-0.2263
412,2021-01-14,Thu Jan 14 05:06:30 +0000 2021,1349583648383647745,IndoPornStar1,,Not Geo-tagged,b'\xe1\xaf\xbd\xe2\x8a\xb1\xe2\x94\x88\xe2\x95\x8c \xf0\x9d\x91\xad\xf0\x9d\x92\x90\xf0\x9d\x92\x8d\xf0\x9d\x92\x8d\xf0\x9d\x92\x90\xf0\x9d\x92\x98 \xf0\x9d\x92\x80\xf0\x9d\x92\x96\xf0\x9d\x92\x8c \xe2\x95\x8c\xe2\x94\x88\xe2\x8a\xb0\xe1\xaf\xbd\xe2\x8a\xb1\n\n\xe2\x9c\x94\xef\xb8\x8e Hot Angel\n\n\xe2\x98\x9e\xef\xb8\x8e\xef\xb8\x8e\xef\xb8\x8e @Liawati07925914\n\nBase : Palembang\n\nNow : Jakarta\n\n\xf0\x9f\x94\xb8Open BO \n\n- Include || Exclude\n- St || Lt || Private\n- COD ( Bayar di Tempat )\n\nMore Info By DM : \xf0\x9f\x93\xa9 \n\n\xe0\xbc\xba\xe2\x94\x80\xe2\x80\xa2\xe2\x8a\xb1 \xf0\x9d\x91\xb9\xf0\x9d\x92\x86\xf0\x9d\x92\x84\xf0\x9d\x92\x90\xf0\x9d\x92\x8e\xf0\x9d\x92\x86\xf0\x9d\x92\x8f\xf0\x9d\x92\x85\xf0\x9d\x92\x86\xf0\x9d\x92\x85 &amp; \xf0\x9d\x91\xbb\xf0\x9d\x92\x93\xf0\x9d\x92\x96\xf0\x9d\x92\x94\xf0\x9d\x92\x95\xf0\x9d\x92\x86\xf0\x9d\x92\x85 \xe2\x8a\xb0\xe2\x80\xa2\xe2\x94\x80\xe0\xbc\xbb https://t.co/s9V5DGEQwF',$EMOJI$ Hot Angel $EMOJI$ $MENTION$ Base : Palembang Now : Jakarta $EMOJI$Open BO - Include || Exclude - St || Lt || Private - COD ( Bayar di Tempat ) More Info By DM : $EMOJI$ &amp; $URL$,Hot Angel Base Palembang Now Jakarta Open BO - Include || Exclude - St || Lt || Private - COD ( Bayar di Tempat ) More Info By DM &amp;,hot angel base palembang now jakarta open bo include exclude st lt private cod bayar tempat more info by dm,hot angel base palembang now jakarta open bo include exclude st lt private cod bayar tempat more info by dm,[],{},{},0,0,[],https://twitter.com/Liawati07925914/status/1349528384691269632,['#avail jakarta ST COD. LT wajib DP no vcs'],-0.2263
409,2021-01-14,Thu Jan 14 05:07:26 +0000 2021,1349583883017224192,IndoPornStar5,"DKI Jakarta, Indonesia",Not Geo-tagged,b'\xe1\xaf\xbd\xe2\x8a\xb1\xe2\x94\x88\xe2\x95\x8c \xf0\x9d\x91\xad\xf0\x9d\x92\x90\xf0\x9d\x92\x8d\xf0\x9d\x92\x8d\xf0\x9d\x92\x90\xf0\x9d\x92\x98 \xf0\x9d\x92\x80\xf0\x9d\x92\x96\xf0\x9d\x92\x8c \xe2\x95\x8c\xe2\x94\x88\xe2\x8a\xb0\xe1\xaf\xbd\xe2\x8a\xb1\n\n\xe2\x9c\x94\xef\xb8\x8e Hot Angel\n\n\xe2\x98\x9e\xef\xb8\x8e\xef\xb8\x8e\xef\xb8\x8e @Liawati07925914\n\nBase : Palembang\n\nNow : Jakarta\n\n\xf0\x9f\x94\xb8Open BO \n\n- Include || Exclude\n- St || Lt || Private\n- COD ( Bayar di Tempat )\n\nMore Info By DM : \xf0\x9f\x93\xa9 \n\n\xe0\xbc\xba\xe2\x94\x80\xe2\x80\xa2\xe2\x8a\xb1 \xf0\x9d\x91\xb9\xf0\x9d\x92\x86\xf0\x9d\x92\x84\xf0\x9d\x92\x90\xf0\x9d\x92\x8e\xf0\x9d\x92\x86\xf0\x9d\x92\x8f\xf0\x9d\x92\x85\xf0\x9d\x92\x86\xf0\x9d\x92\x85 &amp; \xf0\x9d\x91\xbb\xf0\x9d\x92\x93\xf0\x9d\x92\x96\xf0\x9d\x92\x94\xf0\x9d\x92\x95\xf0\x9d\x92\x86\xf0\x9d\x92\x85 \xe2\x8a\xb0\xe2\x80\xa2\xe2\x94\x80\xe0\xbc\xbb https://t.co/xLrCzHIC0E',$EMOJI$ Hot Angel $EMOJI$ $MENTION$ Base : Palembang Now : Jakarta $EMOJI$Open BO - Include || Exclude - St || Lt || Private - COD ( Bayar di Tempat ) More Info By DM : $EMOJI$ &amp; $URL$,Hot Angel Base Palembang Now Jakarta Open BO - Include || Exclude - St || Lt || Private - COD ( Bayar di Tempat ) More Info By DM &amp;,hot angel base palembang now jakarta open bo include exclude st lt private cod bayar tempat more info by dm,hot angel base palembang now jakarta open bo include exclude st lt private cod bayar tempat more info by dm,[],{},{},0,0,[],https://twitter.com/Liawati07925914/status/1349528384691269632,['#avail jakarta ST COD. LT wajib DP no vcs'],-0.2263
421,2021-01-14,Thu Jan 14 05:00:30 +0000 2021,1349582140145610755,SofiaVoloWine,"Baltimore, MD",Not Geo-tagged,b'Host a Private #Wine Tasting in your home. We make it easy! Click for More Info: https://t.co/R7PZdjWB15 #Baltimore #MDwine',Host a Private $HASHTAG$ Tasting in your home. We make it easy! Click for More Info: $URL$ $HASHTAG$ $HASHTAG$,Host a Private Tasting in your home. We make it easy! Click for More Info,host private tasting home we make easy click more info,host private tasting home make easy click more info,[],{},{},0,0,"['Wine', 'Baltimore', 'MDwine']",http://goo.gl/fRWhQz,[],0.4926
410,2021-01-14,Thu Jan 14 05:07:13 +0000 2021,1349583827644030977,IndoPornStar4,,Not Geo-tagged,b'\xe1\xaf\xbd\xe2\x8a\xb1\xe2\x94\x88\xe2\x95\x8c \xf0\x9d\x91\xad\xf0\x9d\x92\x90\xf0\x9d\x92\x8d\xf0\x9d\x92\x8d\xf0\x9d\x92\x90\xf0\x9d\x92\x98 \xf0\x9d\x92\x80\xf0\x9d\x92\x96\xf0\x9d\x92\x8c \xe2\x95\x8c\xe2\x94\x88\xe2\x8a\xb0\xe1\xaf\xbd\xe2\x8a\xb1\n\n\xe2\x9c\x94\xef\xb8\x8e Hot Angel\n\n\xe2\x98\x9e\xef\xb8\x8e\xef\xb8\x8e\xef\xb8\x8e @Liawati07925914\n\nBase : Palembang\n\nNow : Jakarta\n\n\xf0\x9f\x94\xb8Open BO \n\n- Include || Exclude\n- St || Lt || Private\n- COD ( Bayar di Tempat )\n\nMore Info By DM : \xf0\x9f\x93\xa9 \n\n\xe0\xbc\xba\xe2\x94\x80\xe2\x80\xa2\xe2\x8a\xb1 \xf0\x9d\x91\xb9\xf0\x9d\x92\x86\xf0\x9d\x92\x84\xf0\x9d\x92\x90\xf0\x9d\x92\x8e\xf0\x9d\x92\x86\xf0\x9d\x92\x8f\xf0\x9d\x92\x85\xf0\x9d\x92\x86\xf0\x9d\x92\x85 &amp; \xf0\x9d\x91\xbb\xf0\x9d\x92\x93\xf0\x9d\x92\x96\xf0\x9d\x92\x94\xf0\x9d\x92\x95\xf0\x9d\x92\x86\xf0\x9d\x92\x85 \xe2\x8a\xb0\xe2\x80\xa2\xe2\x94\x80\xe0\xbc\xbb https://t.co/2Gt7vmkJFa',$EMOJI$ Hot Angel $EMOJI$ $MENTION$ Base : Palembang Now : Jakarta $EMOJI$Open BO - Include || Exclude - St || Lt || Private - COD ( Bayar di Tempat ) More Info By DM : $EMOJI$ &amp; $URL$,Hot Angel Base Palembang Now Jakarta Open BO - Include || Exclude - St || Lt || Private - COD ( Bayar di Tempat ) More Info By DM &amp;,hot angel base palembang now jakarta open bo include exclude st lt private cod bayar tempat more info by dm,hot angel base palembang now jakarta open bo include exclude st lt private cod bayar tempat more info by dm,[],{},{},0,0,[],https://twitter.com/Liawati07925914/status/1349528384691269632,['#avail jakarta ST COD. LT wajib DP no vcs'],-0.2263
411,2021-01-14,Thu Jan 14 05:06:45 +0000 2021,1349583709679230979,IndoPornStar2,,Not Geo-tagged,b'\xe1\xaf\xbd\xe2\x8a\xb1\xe2\x94\x88\xe2\x95\x8c \xf0\x9d\x91\xad\xf0\x9d\x92\x90\xf0\x9d\x92\x8d\xf0\x9d\x92\x8d\xf0\x9d\x92\x90\xf0\x9d\x92\x98 \xf0\x9d\x92\x80\xf0\x9d\x92\x96\xf0\x9d\x92\x8c \xe2\x95\x8c\xe2\x94\x88\xe2\x8a\xb0\xe1\xaf\xbd\xe2\x8a\xb1\n\n\xe2\x9c\x94\xef\xb8\x8e Hot Angel\n\n\xe2\x98\x9e\xef\xb8\x8e\xef\xb8\x8e\xef\xb8\x8e @Liawati07925914\n\nBase : Palembang\n\nNow : Jakarta\n\n\xf0\x9f\x94\xb8Open BO \n\n- Include || Exclude\n- St || Lt || Private\n- COD ( Bayar di Tempat )\n\nMore Info By DM : \xf0\x9f\x93\xa9 \n\n\xe0\xbc\xba\xe2\x94\x80\xe2\x80\xa2\xe2\x8a\xb1 \xf0\x9d\x91\xb9\xf0\x9d\x92\x86\xf0\x9d\x92\x84\xf0\x9d\x92\x90\xf0\x9d\x92\x8e\xf0\x9d\x92\x86\xf0\x9d\x92\x8f\xf0\x9d\x92\x85\xf0\x9d\x92\x86\xf0\x9d\x92\x85 &amp; \xf0\x9d\x91\xbb\xf0\x9d\x92\x93\xf0\x9d\x92\x96\xf0\x9d\x92\x94\xf0\x9d\x92\x95\xf0\x9d\x92\x86\xf0\x9d\x92\x85 \xe2\x8a\xb0\xe2\x80\xa2\xe2\x94\x80\xe0\xbc\xbb https://t.co/F4T4fkaUEJ',$EMOJI$ Hot Angel $EMOJI$ $MENTION$ Base : Palembang Now : Jakarta $EMOJI$Open BO - Include || Exclude - St || Lt || Private - COD ( Bayar di Tempat ) More Info By DM : $EMOJI$ &amp; $URL$,Hot Angel Base Palembang Now Jakarta Open BO - Include || Exclude - St || Lt || Private - COD ( Bayar di Tempat ) More Info By DM &amp;,hot angel base palembang now jakarta open bo include exclude st lt private cod bayar tempat more info by dm,hot angel base palembang now jakarta open bo include exclude st lt private cod bayar tempat more info by dm,[],{},{},0,0,[],https://twitter.com/Liawati07925914/status/1349528384691269632,['#avail jakarta ST COD. LT wajib DP no vcs'],-0.2263
419,2021-01-14,Thu Jan 14 05:01:15 +0000 2021,1349582326192226304,IndoPornStar4,,Not Geo-tagged,b'\xe2\x8a\xb0\xe1\xaf\xbd\xe2\x8a\xb1\xe2\x94\x88\xe2\x95\x8c \xf0\x9d\x91\xad\xf0\x9d\x92\x90\xf0\x9d\x92\x8d\xf0\x9d\x92\x8d\xf0\x9d\x92\x90\xf0\x9d\x92\x98 \xf0\x9d\x92\x80\xf0\x9d\x92\x96\xf0\x9d\x92\x8c \xe2\x95\x8c\xe2\x94\x88\xe2\x8a\xb0\xe1\xaf\xbd\xe2\x8a\xb1\n\n\xe2\x9c\x94\xef\xb8\x8e Hot Angel\n\xe2\x98\x9e\xef\xb8\x8e\xef\xb8\x8e\xef\xb8\x8e @Dyah41082076\n\nBase || Salatiga\n\n\xf0\x9f\x94\xb8Open BO &amp; Massage ++\n\n- Include || Exclude || Expo\n- St || Lt || Private\n\nMore Info By WA \xf0\x9f\x93\xb2 :\n\xe2\x98\x8f\xef\xb8\x8e081259940869\n\n\xe0\xbc\xba\xe2\x94\x80\xe2\x80\xa2\xe2\x8a\xb1 \xf0\x9d\x91\xb9\xf0\x9d\x92\x86\xf0\x9d\x92\x84\xf0\x9d\x92\x90\xf0\x9d\x92\x8e\xf0\x9d\x92\x86\xf0\x9d\x92\x8f\xf0\x9d\x92\x85\xf0\x9d\x92\x86\xf0\x9d\x92\x85 &amp; \xf0\x9d\x91\xbb\xf0\x9d\x92\x93\xf0\x9d\x92\x96\xf0\x9d\x92\x94\xf0\x9d\x92\x95\xf0\x9d\x92\x86\xf0\x9d\x92\x85 \xe2\x8a\xb0\xe2\x80\xa2\xe2\x94\x80\xe0\xbc\xbb https://t.co/WQ7dxVSI18',$EMOJI$ Hot Angel $EMOJI$ $MENTION$ Base || Salatiga $EMOJI$Open BO &amp; Massage ++ - Include || Exclude || Expo - St || Lt || Private More Info By WA $EMOJI$ : $EMOJI$081259940869 &amp; $URL$,Hot Angel Base || Salatiga Open BO &amp; Massage ++ - Include || Exclude || Expo - St || Lt || Private More Info By WA 081259940869 &amp;,hot angel base salatiga open bo massage include exclude expo st lt private more info by wa,hot angel base salatiga open bo massage include exclude expo st lt private more info by wa,[],{},{},1,1,[],https://twitter.com/Dyah41082076/status/1281783441910935552,['availsalatiga@Dyah'],-0.2263
420,2021-01-14,Thu Jan 14 05:00:52 +0000 2021,1349582230780198913,IndoPornStar2,,Not Geo-tagged,b'\xe2\x8a\xb0\xe1\xaf\xbd\xe2\x8a\xb1\xe2\x94\x88\xe2\x95\x8c \xf0\x9d\x91\xad\xf0\x9d\x92\x90\xf0\x9d\x92\x8d\xf0\x9d\x92\x8d\xf0\x9d\x92\x90\xf0\x9d\x92\x98 \xf0\x9d\x92\x80\xf0\x9d\x92\x96\xf0\x9d\x92\x8c \xe2\x95\x8c\xe2\x94\x88\xe2\x8a\xb0\xe1\xaf\xbd\xe2\x8a\xb1\n\n\xe2\x9c\x94\xef\xb8\x8e Hot Angel\n\xe2\x98\x9e\xef\xb8\x8e\xef\xb8\x8e\xef\xb8\x8e @Dyah41082076\n\nBase || Salatiga\n\n\xf0\x9f\x94\xb8Open BO &amp; Massage ++\n\n- Include || Exclude || Expo\n- St || Lt || Private\n\nMore Info By WA \xf0\x9f\x93\xb2 :\n\xe2\x98\x8f\xef\xb8\x8e081259940869\n\n\xe0\xbc\xba\xe2\x94\x80\xe2\x80\xa2\xe2\x8a\xb1 \xf0\x9d\x91\xb9\xf0\x9d\x92\x86\xf0\x9d\x92\x84\xf0\x9d\x92\x90\xf0\x9d\x92\x8e\xf0\x9d\x92\x86\xf0\x9d\x92\x8f\xf0\x9d\x92\x85\xf0\x9d\x92\x86\xf0\x9d\x92\x85 &amp; \xf0\x9d\x91\xbb\xf0\x9d\x92\x93\xf0\x9d\x92\x96\xf0\x9d\x92\x94\xf0\x9d\x92\x95\xf0\x9d\x92\x86\xf0\x9d\x92\x85 \xe2\x8a\xb0\xe2\x80\xa2\xe2\x94\x80\xe0\xbc\xbb https://t.co/40zdwjPwCj',$EMOJI$ Hot Angel $EMOJI$ $MENTION$ Base || Salatiga $EMOJI$Open BO &amp; Massage ++ - Include || Exclude || Expo - St || Lt || Private More Info By WA $EMOJI$ : $EMOJI$081259940869 &amp; $URL$,Hot Angel Base || Salatiga Open BO &amp; Massage ++ - Include || Exclude || Expo - St || Lt || Private More Info By WA 081259940869 &amp;,hot angel base salatiga open bo massage include exclude expo st lt private more info by wa,hot angel base salatiga open bo massage include exclude expo st lt private more info by wa,[],{},{},1,1,[],https://twitter.com/Dyah41082076/status/1281783441910935552,['availsalatiga@Dyah'],-0.2263
417,2021-01-14,Thu Jan 14 05:03:04 +0000 2021,1349582783182585856,alt_centrist420,,Not Geo-tagged,"b'@EgaoChan1 @NuanceBro Not really. It was an exploit in their third-party phone verification system. It gave them access to ""deleted"" posts, some of which can have sensitive Metadata, but it doesn\'t give access to the site\'s servers or private user info. Still a bad look though.'","$MENTION$ $MENTION$ Not really. It was an exploit in their third-party phone verification system. It gave them access to ""deleted"" posts, some of which can have sensitive Metadata, but it doesn't give access to the site's servers or private user info. Still a bad look though.","Not really. It was an exploit in their third-party phone verification system. It gave them access to ""deleted"" posts, some of which can have sensitive Metadata, but it does not give access to the site's servers or private user info. Still a bad look though.",not really it exploit third party phone verification system it gave access deleted posts sensitive metadata give access site servers private user info still bad look though,not really exploit third party phone verification system give access delete post sensitive metadata give access site server private user info still bad look though,[],{},{},0,1,[],,"['BibiChan', 'Nuance Bro']",-0.714
422,2021-01-14,Thu Jan 14 05:00:04 +0000 2021,1349582031169048577,IndoPornStar1,,Not Geo-tagged,b'\xe2\x8a\xb0\xe1\xaf\xbd\xe2\x8a\xb1\xe2\x94\x88\xe2\x95\x8c \xf0\x9d\x91\xad\xf0\x9d\x92\x90\xf0\x9d\x92\x8d\xf0\x9d\x92\x8d\xf0\x9d\x92\x90\xf0\x9d\x92\x98 \xf0\x9d\x92\x80\xf0\x9d\x92\x96\xf0\x9d\x92\x8c \xe2\x95\x8c\xe2\x94\x88\xe2\x8a\xb0\xe1\xaf\xbd\xe2\x8a\xb1\n\n\xe2\x9c\x94\xef\xb8\x8e Hot Angel\n\xe2\x98\x9e\xef\xb8\x8e\xef\xb8\x8e\xef\xb8\x8e @Dyah41082076\n\nBase || Salatiga\n\n\xf0\x9f\x94\xb8Open BO &amp; Massage ++\n\n- Include || Exclude || Expo\n- St || Lt || Private\n\nMore Info By WA \xf0\x9f\x93\xb2 :\n\xe2\x98\x8f\xef\xb8\x8e081259940869\n\n\xe0\xbc\xba\xe2\x94\x80\xe2\x80\xa2\xe2\x8a\xb1 \xf0\x9d\x91\xb9\xf0\x9d\x92\x86\xf0\x9d\x92\x84\xf0\x9d\x92\x90\xf0\x9d\x92\x8e\xf0\x9d\x92\x86\xf0\x9d\x92\x8f\xf0\x9d\x92\x85\xf0\x9d\x92\x86\xf0\x9d\x92\x85 &amp; \xf0\x9d\x91\xbb\xf0\x9d\x92\x93\xf0\x9d\x92\x96\xf0\x9d\x92\x94\xf0\x9d\x92\x95\xf0\x9d\x92\x86\xf0\x9d\x92\x85 \xe2\x8a\xb0\xe2\x80\xa2\xe2\x94\x80\xe0\xbc\xbb https://t.co/tNeav4wdg2',$EMOJI$ Hot Angel $EMOJI$ $MENTION$ Base || Salatiga $EMOJI$Open BO &amp; Massage ++ - Include || Exclude || Expo - St || Lt || Private More Info By WA $EMOJI$ : $EMOJI$081259940869 &amp; $URL$,Hot Angel Base || Salatiga Open BO &amp; Massage ++ - Include || Exclude || Expo - St || Lt || Private More Info By WA 081259940869 &amp;,hot angel base salatiga open bo massage include exclude expo st lt private more info by wa,hot angel base salatiga open bo massage include exclude expo st lt private more info by wa,[],{},{},1,2,[],https://twitter.com/Dyah41082076/status/1281783441910935552,['availsalatiga@Dyah'],-0.2263
424,2021-01-14,Thu Jan 14 04:54:33 +0000 2021,1349580640887463938,TessaGroupllc,"Las Vegas, NV, San Diego, CA",Not Geo-tagged,b'Homes for rent by private owner no credit check&amp;#160;available now. Free Registration https://t.co/KoNfnP0yJ3 Text 702-996-6434 for more info',Homes for rent by private owner no credit check&amp;$HASHTAG$;available now. Free Registration $URL$ Text $NUMBER$-996-6434 for more info,Homes for rent by private owner no credit check&amp;;available now. Free Registration Text -996-6434 for more info,homes rent private owner credit check available free registration text info,home rent private owner credit check available free registration text info,[],{},{},0,0,[],http://bit.ly/NationwideRTOHouses,[],0.2769
434,2021-01-14,Thu Jan 14 04:19:58 +0000 2021,1349571939363389441,RockyJuniorJon4,,Not Geo-tagged,b'@ruther_pamela @washingtonpost Having classified info on a private server is a slam dunk crime.  End of story.',$MENTION$ $MENTION$ Having classified info on a private server is a slam dunk crime. End of story.,Having classified info on a private server is a slam dunk crime. End of story.,having classified info private server slam dunk crime end story,have classify info private server slam dunk crime end story,[],{},{},0,0,[],,"['Pamela Ruther', 'The Washington Post']",-0.7269
425,2021-01-14,Thu Jan 14 04:53:39 +0000 2021,1349580416093601793,leftypett461,SF CA,Not Geo-tagged,b'@MattHaneySF Thank you for this. I tried today to find out where to get a vaccine and there is no way to register or find locations. I am 69 and my private provider has no vaccines or info on how to get one. There was no info anywhere.',$MENTION$ Thank you for this. I tried today to find out where to get a vaccine and there is no way to register or find locations. I am $NUMBER$ and my private provider has no vaccines or info on how to get one. There was no info anywhere.,Thank you for this. I tried today to find out where to get a vaccine and there is no way to register or find locations. I am and my private provider has no vaccines or info on how to get one. There was no info anywhere.,thank tried today find get vaccine way register find locations private provider vaccines info get one there info anywhere,thank try today find get vaccine way register find location private provider vaccine info get one there info anywhere,[],{},{},0,1,[],,['Matt Haney'],-0.4767
423,2021-01-14,Thu Jan 14 04:57:12 +0000 2021,1349581306468904961,deniz_yaz,"Vienna, Austria",Not Geo-tagged,"b'But also, private decisions on censorship shld be consistent, transparent &amp; accountable - esp when only a small number of big tech hold so much power over internet ecosystem - and shape our info space online. This is an uphill battle that continues...'","But also, private decisions on censorship shld be consistent, transparent &amp; accountable - esp when only a small number of big tech hold so much power over internet ecosystem - and shape our info space online. This is an uphill battle that continues...","But also, private decisions on censorship shld be consistent, transparent &amp; accountable - esp when only a small number of big tech hold so much power over internet ecosystem - and shape our info space online. This is an uphill battle that continues..",but also private decisions censorship shld consistent transparent accountable esp small number big tech hold much power internet ecosystem shape info space online this uphill battle continues,but also private decision censorship shld consistent transparent accountable esp small number big tech hold much power internet ecosystem shape info space online this uphill battle continue,[],{},{},0,0,[],,[],-0.4497
427,2021-01-14,Thu Jan 14 04:42:43 +0000 2021,1349577663426424833,chillfeline,"San Francisco, CA",Not Geo-tagged,"b""I literally can't believe what little empathy and humanity people can have for others. I literally have no money for food and im trying to convince one or my roommates to help apply to cal fresh and they said they'd rather keep their info private than let me have free food??""",I literally can't believe what little empathy and humanity people can have for others. I literally have no money for food and im trying to convince one or my roommates to help apply to cal fresh and they said they'd rather keep their info private than let me have free food??,I literally ca not believe what little empathy and humanity people can have for others. I literally have no money for food and im trying to convince one or my roommates to help apply to cal fresh and they said they'd rather keep their info private than let me have free food??,literally believe little empathy humanity people others literally money food trying convince one roommates help apply cal fresh said rather keep info private let free food,literally believe little empathy humanity people other literally money food try convince one roommate help apply cal fresh say rather keep info private let free food,[],{},{},0,0,[],,[],0.8156
438,2021-01-14,Thu Jan 14 03:56:47 +0000 2021,1349566105237524480,GHA5T_TEAR,"29, 59, -52",Not Geo-tagged,"b""@joobileekind yeah, i'm pretty private in general, so i get what you're saying, thanks for the info :D""","$MENTION$ yeah, i'm pretty private in general, so i get what you're saying, thanks for the info :D","yeah, i'm pretty private in general, so i get what you're saying, thanks for the info D",yeah pretty private general get saying thanks info ,yeah pretty private general get say thank info,[],{},{},0,1,[],,['jubi but sad era'],0.8074
441,2021-01-14,Thu Jan 14 03:30:00 +0000 2021,1349559362180800515,News18Tech,,Not Geo-tagged,"b'#Facebook has revamped its #privacy transparency tool, Access Your Information amid #WhatsAppPrivacy row. All details in the link below:\n\nhttps://t.co/5W1Hqoprpd'","$HASHTAG$ has revamped its $HASHTAG$ transparency tool, Access Your Information amid $HASHTAG$ row. All details in the link below: $URL$","has revamped its transparency tool, Access Your Information amid row. All details in the link below",revamped transparency tool access your information amid row all details link,revamp transparency tool access information amid row all detail link,[],{},{},0,0,"['Facebook', 'privacy', 'WhatsAppPrivacy']",https://www.news18.com/news/tech/amid-whatsapp-privacy-row-and-ios-14-security-prompt-facebook-revamps-access-your-info-tool-3284555.html,[],0.0
428,2021-01-14,Thu Jan 14 04:41:30 +0000 2021,1349577356495757312,TylerGellasch,,Not Geo-tagged,"b'@AdviserCounsel @SEC_News Can we have a discussion about the concept of the accredited investor and what the word \xe2\x80\x9cprivate\xe2\x80\x9d means?  \n\nI don\xe2\x80\x99t care what your income or wealth or sophistication is, if you don\xe2\x80\x99t have essential info and rights, you are gambling. Scaling that through public ads is bad.'","$MENTION$ $MENTION$ Can we have a discussion about the concept of the accredited investor and what the word private means? I dont care what your income or wealth or sophistication is, if you dont have essential info and rights, you are gambling. Scaling that through public ads is bad.","Can we have a discussion about the concept of the accredited investor and what the word private means? I don t care what your income or wealth or sophistication is, if you don t have essential info and rights, you are gambling. Scaling that through public ads is bad.",can discussion concept accredited investor word private means care income wealth sophistication essential info rights gambling scaling public ads bad,can discussion concept accredit investor word private mean care income wealth sophistication essential info right gambling scale public ad bad,[],{},{},0,2,[],,"['Max Schatzow', 'SEC_News']",0.4404
440,2021-01-14,Thu Jan 14 03:34:28 +0000 2021,1349560487252422658,RealSteelLeaks,Zero Point,Not Geo-tagged,"b'Epic Games Requested to All Private Servers (Neonite++, Rift, Aurora, EZFN) to Remove Cosmetics from Locker\n\nInfo by @TweaBR'","Epic Games Requested to All Private Servers (Neonite++, Rift, Aurora, EZFN) to Remove Cosmetics from Locker Info by $MENTION$","Epic Games Requested to All Private Servers (Neonite++, Rift, Aurora, EZFN) to Remove Cosmetics from Locker Info by",epic games requested all private servers neonite rift aurora ezfn remove cosmetics locker info,epic games request all private server neonite rift aurora ezfn remove cosmetics locker info,[],{},{},0,4,[],,['Twea - Fortnite Dataminer'],0.0
433,2021-01-14,Thu Jan 14 04:30:48 +0000 2021,1349574662951325696,ImAtulAneja,,Not Geo-tagged,"b'@ChageJhote @pbhushan1 Please don\xe2\x80\x99t mind but none of this is new. We have seen corruption in public sector as well as private banks much before Adani or Ambani, Analysts and writers will share their views on the basis of some info but it doesn\xe2\x80\x99t mean they are correct.'","$MENTION$ $MENTION$ Please dont mind but none of this is new. We have seen corruption in public sector as well as private banks much before Adani or Ambani, Analysts and writers will share their views on the basis of some info but it doesnt mean they are correct.","Please don t mind but none of this is new. We have seen corruption in public sector as well as private banks much before Adani or Ambani, Analysts and writers will share their views on the basis of some info but it doesn t mean they are correct.",please mind none new we seen corruption public sector well private banks much adani ambani analysts writers share views basis info mean correct,please mind none new see corruption public sector well private bank much adani ambani analyst writer share view basis info mean correct,[],{},{},0,0,[],,"['Jhote ChaGe', 'Prashant Bhushan']",0.7269
