s_no,date,created_at,id_str,screen_name,user_location,geo-tagged_place,tweet_text,tweet_tokenized,tweet_cleaned,tweet_filtered,tweet_lemmatized,tweet_mentioned_organizations,tweet_tags_classified,tweet_orgs_classified,retweet_count,fav_count,hashtags,urls,mentions,vader_polarity
236,2021-01-18,Mon Jan 18 10:21:42 +0000 2021,1351112524066910208,marionfellows,Wishaw,Not Geo-tagged,"b'ScotGov has trebled support for taxi drivers from \xc2\xa319m to \xc2\xa357m. From today, local authorities will start contacting taxi drivers directly using license data to pay them a \xc2\xa31,500 grant without the need for a burdensome application form.\n\nMore info here \xf0\x9f\x91\x87\n\nhttps://t.co/RJ1BgOVz2G'","ScotGov has trebled support for taxi drivers from $NUMBER$m to $NUMBER$m. From today, local authorities will start contacting taxi drivers directly using license data to pay them a $NUMBER$ grant without the need for a burdensome application form. More info here $EMOJI$ $URL$","ScotGov has trebled support for taxi drivers from 19m to 57m. From today, local authorities will start contacting taxi drivers directly using license data to pay them a 1,500 grant without the need for a burdensome application form. More info here",scotgov trebled support taxi drivers from today local authorities start contacting taxi drivers directly using license data pay grant without need burdensome application form more info,scotgov treble support taxi driver from today local authority start contact taxi driver directly use license datum pay grant without need burdensome application form more info,[],{},{},2,6,[],https://www.gov.scot/publications/coronavirus-covid-19-taxi-and-private-hire-driver-support-fund/pages/how-to-apply/,[],0.25
235,2021-01-18,Mon Jan 18 10:23:30 +0000 2021,1351112975281750020,CrustedDollar,,Not Geo-tagged,"b'Imagine for a moment.... you have someone\'s business info. Their name. Their work email. The name of their business. And your first thought is, ""Haha! I got private info! Imma use it to extort this individual!"" And violate every TOS they possible can to extort someone.....'","Imagine for a moment.... you have someone's business info. Their name. Their work email. The name of their business. And your first thought is, ""Haha! I got private info! Imma use it to extort this individual!"" And violate every TOS they possible can to extort someone.....","Imagine for a moment.. you have someone's business info. Their name. Their work email. The name of their business. And your first thought is, ""Haha! I got private info! Imma use it to extort this individual!"" And violate every TOS they possible can to extort someone..",imagine moment someone business info their name their work email the name business and first thought haha got private info imma use extort individual and violate every tos possible extort someone,imagine moment someone business info name work email the name business and first thought haha get private info imma use extort individual and violate every tos possible extort someone,[],{},{},0,0,[],,[],-0.2677
238,2021-01-18,Mon Jan 18 10:17:44 +0000 2021,1351111522655883265,olivegrove_info,Wrexham,Not Geo-tagged,"b'** NEW - FOR SALE **\nHAWARDEN ROAD, CAERGWRLE\n3 Bed Detached Bungalow,2 reception rooms,ample off road parking,single detached garage &amp; private rear garden with a spectacular view.\nPRICE \xc2\xa3250,000\nCall to view 01978 750234\n#Wrexham #sales #forsale #bungalow #3bed #estateagents https://t.co/R0wayQN5I4'","** NEW - FOR SALE ** HAWARDEN ROAD, CAERGWRLE $NUMBER$ Bed Detached Bungalow,2 reception rooms,ample off road parking,single detached garage &amp; private rear garden with a spectacular view. PRICE $NUMBER$ Call to view $NUMBER$ $NUMBER$ $HASHTAG$ $HASHTAG$ $HASHTAG$ $HASHTAG$ $HASHTAG$ $HASHTAG$ $URL$","** NEW - FOR SALE ** HAWARDEN ROAD, CAERGWRLE Bed Detached Bungalow,2 reception rooms,ample off road parking,single detached garage &amp; private rear garden with a spectacular view. PRICE 250,00 Call to view",new for sale hawarden road caergwrle bed detached bungalow reception rooms ample road parking single detached garage private rear garden spectacular view price call view,new for sale hawarden road caergwrle bed detach bungalow reception room ample road parking single detached garage private rear garden spectacular view price call view,[],{},{},0,0,"['Wrexham', 'sales', 'forsale', 'bungalow', '3bed', 'estateagents']",,[],-0.25
241,2021-01-18,Mon Jan 18 10:09:01 +0000 2021,1351109331710783491,WorkNormanOK,"Norman, OK",Not Geo-tagged,b'Yukon OK USA - Master Teacher - Primrose School of Yukon is an accredited private preschool that pro: Primrose School of Yukon is an accredited private preschool that provides a premier educational child care experience. W https://t.co/ljTtWLqCPA',Yukon OK USA - Master Teacher - Primrose School of Yukon is an accredited private preschool that pro: Primrose School of Yukon is an accredited private preschool that provides a premier educational child care experience. W $URL$,Yukon OK USA - Master Teacher - Primrose School of Yukon is an accredited private preschool that pro Primrose School of Yukon is an accredited private preschool that provides a premier educational child care experience. W,yukon ok usa master teacher primrose school yukon accredited private preschool pro primrose school yukon accredited private preschool provides premier educational child care experience ,yukon ok usa master teacher primrose school yukon accredit private preschool pro primrose school yukon accredit private preschool provide premier educational child care experience,[],{},{},0,0,[],http://dld.bz/jq5eW,[],0.7297
255,2021-01-18,Mon Jan 18 09:09:18 +0000 2021,1351094304127774720,neothewrld,she / they,Not Geo-tagged,"b""there isn't any way that those ssngs could've been at the [ private ] schedule unless someone in label v disclosed that info to them...""",there isn't any way that those ssngs could've been at the [ private ] schedule unless someone in label v disclosed that info to them...,there is not any way that those ssngs could've been at the [ private ] schedule unless someone in label v disclosed that info to them..,way ssngs could private schedule unless someone label disclosed info,way ssng could private schedule unless someone label disclose info,[],{},{},2,11,[],,[],0.0
251,2021-01-18,Mon Jan 18 09:14:08 +0000 2021,1351095517451870209,ntuitiventusg,Singapore,Not Geo-tagged,b'The @bankofSG x #NTUitive Open Innovation Challenge 2021 is a unique opportunity for you to work with Asia\xe2\x80\x99s global private bank on an exciting project! Sign up for the info session here: https://t.co/zCKC33fic2\n\n@NTUsg #NTUsg #NTUES #BankOfSingapore #innovationchallenge #banking https://t.co/tGyrGSpUpK',The $MENTION$ x $HASHTAG$ Open Innovation Challenge $NUMBER$ is a unique opportunity for you to work with Asias global private bank on an exciting project! Sign up for the info session here: $URL$ $MENTION$ $HASHTAG$ $HASHTAG$ $HASHTAG$ $HASHTAG$ $HASHTAG$ $URL$,The x Open Innovation Challenge is a unique opportunity for you to work with Asia s global private bank on an exciting project! Sign up for the info session here,the open innovation challenge unique opportunity work asia global private bank exciting project sign info session,the open innovation challenge unique opportunity work asia global private bank exciting project sign info session,[],{},{},0,0,"['NTUitive', 'NTUsg', 'NTUES', 'BankOfSingapore', 'innovationchallenge', 'banking']",https://tiny.cc/bosxntubrief,"['Bank of Singapore', 'NTU Singapore']",0.8478
248,2021-01-18,Mon Jan 18 09:30:16 +0000 2021,1351099580306354180,ClareAdamsonSNP,"Motherwell, Scotland",Not Geo-tagged,"b'Coronavirus (Covid-19): Taxi and Private Hire Driver Support Fund\n\nNew info on eligibility \n\xf0\x9f\x91\x89 https://t.co/tUwigBseXK\n\nYou do not need to apply \xe2\x80\x93 your local authority will get in touch with you by letter, email or other communication method from week commencing 18 January. https://t.co/LKNXjCabbD'","Coronavirus (Covid-19): Taxi and Private Hire Driver Support Fund New info on eligibility $EMOJI$ $URL$ You do not need to apply your local authority will get in touch with you by letter, email or other communication method from week commencing $NUMBER$ January. $URL$","Coronavirus (Covid-19) Taxi and Private Hire Driver Support Fund New info on eligibility You do not need to apply your local authority will get in touch with you by letter, email or other communication method from week commencing January.",coronavirus covid taxi private hire driver support fund new info eligibility you need apply local authority get touch letter email communication method week commencing january,coronavirus covid taxi private hire driver support fund new info eligibility need apply local authority get touch letter email communication method week commence january,[],{},{},3,0,[],https://bit.ly/3o2D9Db,[],0.4588
244,2021-01-18,Mon Jan 18 09:59:38 +0000 2021,1351106968946171905,EOXON_INFO,"Kerala, India",Not Geo-tagged,"b'React Native Developers\nSaasvaap Techies Private Limited\n\nClosing on:\n20/01/2021\n\nContact email:\ncareers@saasvaap.com\n\nAt least 5+ years of experience developing in React Native and React-Native CLI\n\nTechnopark,Phase-1, Thiruvananthapuram https://t.co/brQK5QYflD'","React Native Developers Saasvaap Techies Private Limited Closing on: $NUMBER$/01/2021 Contact email: careers$MENTION$.com At least $NUMBER$+ years of experience developing in React Native and React-Native CLI Technopark,Phase-1, Thiruvananthapuram $URL$","React Native Developers Saasvaap Techies Private Limited Closing on /01/2021 Contact email careers.com At least + years of experience developing in React Native and React-Native CLI Technopark,Phase-1, Thiruvananthapuram",react native developers saasvaap techies private limited closing contact email careers com at least years experience developing react native react native cli technopark phase thiruvananthapuram,react native developer saasvaap techie private limited closing contact email career com at least year experience develop react native react native cli technopark phase thiruvananthapuram,[],{},{},0,0,[],,[],-0.2263
97,2021-01-18,Mon Jan 18 17:50:23 +0000 2021,1351225438601965573,iamsourav1985,Chandannagar,Not Geo-tagged,b'@Ei_Samay Odvut\xf0\x9f\x98\x9f..kono private company r against e kono ovijog thakle court bolbe na posale onno company r kache jan!!!!!!!!!aree sadharon manuser info private rakhar jonno to law ache. Ekhnae whatsapp manuser  private info Facebook ke diye dicche ar court safe game khelche????',$MENTION$ Odvut$EMOJI$..kono private company r against e kono ovijog thakle court bolbe na posale onno company r kache jan!!!!!!!!!aree sadharon manuser info private rakhar jonno to law ache. Ekhnae whatsapp manuser private info Facebook ke diye dicche ar court safe game khelche????,Odvut ..kono private company r against e kono ovijog thakle court bolbe na posale onno company r kache jan!!aree sadharon manuser info private rakhar jonno to law ache. Ekhnae whatsapp manuser private info Facebook ke diye dicche ar court safe game khelche??,odvut kono private company kono ovijog thakle court bolbe posale onno company kache jan aree sadharon manuser info private rakhar jonno law ache ekhnae whatsapp manuser private info facebook diye dicche court safe game khelche,odvut kono private company kono ovijog thakle court bolbe posale onno company kache jan aree sadharon manuser info private rakhar jonno law ache ekhnae whatsapp manuser private info facebook diye dicche court safe game khelche,[],{},{},0,0,[],,['Ei Samay'],0.3058
245,2021-01-18,Mon Jan 18 09:57:37 +0000 2021,1351106460697178116,EOXON_INFO,"Kerala, India",Not Geo-tagged,"b'Odoo Lead Developers\nSaasvaap Techies Private Limited\n\nClosing on:\n20/01/2021\n\nContact email:\nshobhi.cm@saasvaap.com\n\nMinimum 5 years of experience in Odoo.\nCapable of handling multiple projects and team.\nPreferred skills - Odoo\nTechnopark,Phase-1, Thiruvananthapuram https://t.co/x32qenunfy'","Odoo Lead Developers Saasvaap Techies Private Limited Closing on: $NUMBER$/01/2021 Contact email: shobhi.cm$MENTION$.com Minimum $NUMBER$ years of experience in Odoo. Capable of handling multiple projects and team. Preferred skills - Odoo Technopark,Phase-1, Thiruvananthapuram $URL$","Odoo Lead Developers Saasvaap Techies Private Limited Closing on /01/2021 Contact email shobhi.cm.com Minimum years of experience in Odoo. Capable of handling multiple projects and team. Preferred skills - Odoo Technopark,Phase-1, Thiruvananthapuram",odoo lead developers saasvaap techies private limited closing contact email shobhi com minimum years experience odoo capable handling multiple projects team preferred skills odoo technopark phase thiruvananthapuram,odoo lead developer saasvaap techie private limited closing contact email shobhi com minimum year experience odoo capable handle multiple project team prefer skill odoo technopark phase thiruvananthapuram,[],{},{},0,0,[],,[],0.1779
252,2021-01-18,Mon Jan 18 09:13:13 +0000 2021,1351095289189457928,Football_Tips_,,Not Geo-tagged,b'\xf0\x9f\x92\xa5 VIP SPECIAL SIGN UP OFFER \xf0\x9f\x92\xa5\n\nPRIVATE MESSAGE us now for a SPECIAL SIGN UP offer!\n\nWe\xe2\x80\x99ve just posted a MAXBET over at @Football_TipVIP \n\nWe\xe2\x80\x99ve got a big day ahead!\n\nPRIVATE MESSAGE us for info \xf0\x9f\x93\xa9',$EMOJI$ VIP SPECIAL SIGN UP OFFER $EMOJI$ PRIVATE MESSAGE us now for a SPECIAL SIGN UP offer! Weve just posted a MAXBET over at $MENTION$ Weve got a big day ahead! PRIVATE MESSAGE us for info $EMOJI$,VIP SPECIAL SIGN UP OFFER PRIVATE MESSAGE us now for a SPECIAL SIGN UP offer! We ve just posted a MAXBET over at We ve got a big day ahead! PRIVATE MESSAGE us for info,vip special sign up offer private message special sign up offer we posted maxbet we got big day ahead private message info,vip special sign up offer private message special sign up offer post maxbet get big day ahead private message info,[],{},{},1,3,[],,['Football_Tipster_King_VIP'],0.9097
261,2021-01-18,Mon Jan 18 08:46:54 +0000 2021,1351088664026226694,2starsun,,Not Geo-tagged,"b'she stalks idols, she sells private info'","she stalks idols, she sells private info","she stalks idols, she sells private info",stalks idols sells private info,stalk idols sell private info,[],{},{},0,0,[],,[],0.0
276,2021-01-18,Mon Jan 18 08:19:45 +0000 2021,1351081834067746821,iWebzConnect,,Not Geo-tagged,b'10 Minute Install of #SandstormApps (Private Web Apps) on #Ubuntu in #AmazonEC2 https://t.co/bgX4pHLsk9 https://t.co/cQqnnSMipO',$NUMBER$ Minute Install of $HASHTAG$ (Private Web Apps) on $HASHTAG$ in $HASHTAG$ $URL$ $URL$,Minute Install of (Private Web Apps) on in,minute install private web apps,minute install private web app,[],{},{},0,0,"['SandstormApps', 'Ubuntu', 'AmazonEC2']",https://buff.ly/36fbHev,[],0.0
259,2021-01-18,Mon Jan 18 08:56:02 +0000 2021,1351090962064416769,windery4ever,she/her,Not Geo-tagged,b'INVESTIGATE!!! THAT\xe2\x80\x99S A BREACH OF CONTRACT SM!!!! SUE THEM EMPLOYEES WHO SELL PRIVATE INFO SO CALLED \xe2\x80\x9cSUE ME ENTERTAINMENT\xe2\x80\x9d #ProtectWayV @SMTOWNGLOBAL',INVESTIGATE!!! THATS A BREACH OF CONTRACT SM!!!! SUE THEM EMPLOYEES WHO SELL PRIVATE INFO SO CALLED SUE ME ENTERTAINMENT $HASHTAG$ $MENTION$,INVESTIGATE!! THAT S A BREACH OF CONTRACT SM!! SUE THEM EMPLOYEES WHO SELL PRIVATE INFO SO CALLED SUE ME ENTERTAINMENT,investigate that a breach of contract sm sue them employees who sell private info so called sue me entertainment,investigate that a breach of contract sm sue employee who sell private info so call sue entertainment,[],{},{},0,0,['ProtectWayV'],,['SMTOWN'],0.6083
250,2021-01-18,Mon Jan 18 09:15:05 +0000 2021,1351095757865152518,GMAgregsays,London UK,Not Geo-tagged,"b'In a change to WhatsApp\xe2\x80\x99s privacy policy from next month, users outside of Europe will have to agree to share their personal information with WhatsApp\xe2\x80\x99s owner Facebook or leave the app.\n#technews #privacy #data\nhttps://t.co/oo5w9lWM0c https://t.co/ZMXoUOO9BF'","In a change to WhatsApps privacy policy from next month, users outside of Europe will have to agree to share their personal information with WhatsApps owner Facebook or leave the app. $HASHTAG$ $HASHTAG$ $HASHTAG$ $URL$ $URL$","In a change to WhatsApp s privacy policy from next month, users outside of Europe will have to agree to share their personal information with WhatsApp s owner Facebook or leave the app.",in change whatsapp privacy policy next month users outside europe agree share personal information whatsapp owner facebook leave app,in change whatsapp privacy policy next month user outside europe agree share personal information whatsapp owner facebook leave app,[],{},{},0,0,"['technews', 'privacy', 'data']",http://ow.ly/8ASb50D8jJp,[],0.5423
254,2021-01-18,Mon Jan 18 09:11:23 +0000 2021,1351094827564326913,sweetjezi,"Centurion, South Africa",Not Geo-tagged,"b'@Lesufi @educationgp I just received a call from a private school in JHB offering space for my grade 8 child. They claim to have gotten my number from GDE, what other confidential info is in their hands?  please investigate, they called from this number +27870581357'","$MENTION$ $MENTION$ I just received a call from a private school in JHB offering space for my grade $NUMBER$ child. They claim to have gotten my number from GDE, what other confidential info is in their hands? please investigate, they called from this number +27870581357","I just received a call from a private school in JHB offering space for my grade child. They claim to have gotten my number from GDE, what other confidential info is in their hands? please investigate, they called from this number +27870581357",received call private school jhb offering space grade child they claim gotten number gde confidential info hands please investigate called number,receive call private school jhb offer space grade child claim get number gde confidential info hand please investigate call number,[],{},{},0,0,[],,"['Panyaza Lesufi', 'Gauteng Department of Education (GDE)']",0.4543
249,2021-01-18,Mon Jan 18 09:27:01 +0000 2021,1351098759850110976,AIL0VEYUTA,,Not Geo-tagged,"b'Please help to mass email sm &amp; label v about this, it\'s more helpful. Templates are below\xf0\x9f\x91\x87\xf0\x9f\x8f\xbb also report the acc as ""abusive &amp; hateful &gt; posting private info"" &amp; block the ssg, dont interact please #protectWayV https://t.co/aS1etiqZpZ'","Please help to mass email sm &amp; label v about this, it's more helpful. Templates are below$EMOJI$$EMOJI$ also report the acc as ""abusive &amp; hateful &gt; posting private info"" &amp; block the ssg, dont interact please $HASHTAG$ $URL$","Please help to mass email sm &amp; label v about this, it's more helpful. Templates are below also report the acc as ""abusive &amp; hateful &gt; posting private info"" &amp; block the ssg, dont interact please",please help mass email label helpful templates also report acc abusive hateful posting private info block ssg dont interact please,please help mass email label helpful template also report acc abusive hateful post private info block ssg do not interact please,[],{},{},7,6,['protectWayV'],https://twitter.com/riri2302/status/1351079720029458433,[],-0.6333
257,2021-01-18,Mon Jan 18 08:59:50 +0000 2021,1351091920932626434,spamkun_,,Not Geo-tagged,b'Good afternoon. My name is Yaela writing you. Just to give you some info about my life: I work as a health assistant at private clinic. I apologize for disturbing you.',Good afternoon. My name is Yaela writing you. Just to give you some info about my life: I work as a health assistant at private clinic. I apologize for disturbing you.,Good afternoon. My name is Yaela writing you. Just to give you some info about my life I work as a health assistant at private clinic. I apologize for disturbing you.,good afternoon my name yaela writing just give info life work health assistant private clinic apologize disturbing,good afternoon name yaela write just give info life work health assistant private clinic apologize disturb,[],{},{},0,0,[],,[],0.0
253,2021-01-18,Mon Jan 18 09:12:44 +0000 2021,1351095168561274881,jisungnom,🇳🇬🏴󠁧󠁢󠁥󠁮󠁧󠁿,Not Geo-tagged,b'if these sasaengs get sued they are vv likely to turn into haters and spread private info about wayv. pls dont retweet any unofficial info unless u are 100% sure its safe and do not engage with accs spreading info on twt just report and block.',if these sasaengs get sued they are vv likely to turn into haters and spread private info about wayv. pls dont retweet any unofficial info unless u are $NUMBER$% sure its safe and do not engage with accs spreading info on twt just report and block.,if these sasaengs get sued they are vv likely to turn into haters and spread private info about wayv. pls dont retweet any unofficial info unless u are % sure its safe and do not engage with accs spreading info on twt just report and block.,sasaengs get sued likely turn haters spread private info wayv pls dont retweet unofficial info unless sure safe engage accs spreading info twt report block,sasaeng get sue likely turn hater spread private info wayv pls do not retweet unofficial info unless sure safe engage accs spread info twt report block,[],{},{},0,0,[],,[],-0.3891
265,2021-01-18,Mon Jan 18 08:36:03 +0000 2021,1351085936478720001,BriciaXXX,"Kota Surabaya, Jawa Timur",Not Geo-tagged,"b'Ready include exclude\nSt, Lt, Private\n\nInfo rr by dm ya syg\n\n#bosurabaya \n#wpsurabaya \n#includesurabaya \n#bookingansurabaya \n#availsby \n#ExpoSurabaya \n#OpenBO \n#surabayapusat \n#surabayalendir \n#surabayabirahi \n#surabayabo \n#surabayainclude \n#RealAngels \n#RealAngel \n#RealAccount https://t.co/PxzX0PKrIf'","Ready include exclude St, Lt, Private Info rr by dm ya syg $HASHTAG$ $HASHTAG$ $HASHTAG$ $HASHTAG$ $HASHTAG$ $HASHTAG$ $HASHTAG$ $HASHTAG$ $HASHTAG$ $HASHTAG$ $HASHTAG$ $HASHTAG$ $HASHTAG$ $HASHTAG$ $HASHTAG$ $URL$","Ready include exclude St, Lt, Private Info rr by dm ya syg",ready include exclude st lt private info ya syg,ready include exclude st lt private info ya syg,[],{},{},1,4,"['bosurabaya', 'wpsurabaya', 'includesurabaya', 'bookingansurabaya', 'availsby', 'ExpoSurabaya', 'OpenBO', 'surabayapusat', 'surabayalendir', 'surabayabirahi', 'surabayabo', 'surabayainclude', 'RealAngels', 'RealAngel', 'RealAccount']",,[],0.1531
286,2021-01-18,Mon Jan 18 07:56:54 +0000 2021,1351076081126748166,cupidkhj,carrd under pinned,Not Geo-tagged,"b'@mrkdrifts either do it as \'h4cked\' or do it as ""abusive and hateful/posting private photos or info""'","$MENTION$ either do it as 'h4cked' or do it as ""abusive and hateful/posting private photos or info""","either do it as 'h4cked' or do it as ""abusive and hateful/posting private photos or info""",either cked abusive hateful posting private photos info,either cke abusive hateful post private photo info,[],{},{},0,0,[],,['chlo'],-0.6369
278,2021-01-18,Mon Jan 18 08:15:40 +0000 2021,1351080806463242244,Ashutos01339123,,Not Geo-tagged,b'@JioCare i have sent personal info as private message and the reply is still not here',$MENTION$ i have sent personal info as private message and the reply is still not here,i have sent personal info as private message and the reply is still not here,sent personal info private message reply still,send personal info private message reply still,[],{},{},0,0,[],,['JioCare'],0.0
280,2021-01-18,Mon Jan 18 08:13:44 +0000 2021,1351080317642285058,ChaoticExotic,"Michigan, USA","Michigan, USA, US",b'@RLittle2019 @ClassyClaire3 That works. I would just rather self this info through a private message rather than comments',$MENTION$ $MENTION$ That works. I would just rather self this info through a private message rather than comments,That works. I would just rather self this info through a private message rather than comments,that works would rather self info private message rather comments,that work would rather self info private message rather comment,[],{},{},0,0,[],,"['RichardLittle2019', 'ClassyClaire']",0.0
260,2021-01-18,Mon Jan 18 08:48:01 +0000 2021,1351088947535994880,oneironut,Italia,Not Geo-tagged,"b""We saw it multiple times in the fandom, in dozen of different situazione. Most of the people here don't give a fuck about the idols, but they want to know the gossips, the insider info, and all this kind of stuff that should be remain private.""","We saw it multiple times in the fandom, in dozen of different situazione. Most of the people here don't give a fuck about the idols, but they want to know the gossips, the insider info, and all this kind of stuff that should be remain private.","We saw it multiple times in the fandom, in dozen of different situazione. Most of the people here do not give a fuck about the idols, but they want to know the gossips, the insider info, and all this kind of stuff that should be remain private.",we saw multiple times fandom dozen different situazione most people give fuck idols want know gossips insider info kind stuff remain private,see multiple time fandom dozen different situazione most people give fuck idol want know gossip insider info kind stuff remain private,[],{},{},0,1,[],,[],-0.1469
