s_no,date,created_at,id_str,screen_name,user_location,geo-tagged_place,tweet_text,tweet_tokenized,tweet_cleaned,tweet_filtered,tweet_lemmatized,tweet_mentioned_organizations,tweet_tags_classified,tweet_orgs_classified,retweet_count,fav_count,hashtags,urls,mentions,vader_polarity
9,2021-01-18,Mon Jan 18 23:15:26 +0000 2021,1351307237864722435,hsndnnne,,Not Geo-tagged,b'@rey_wrld I reported that it is private info',$MENTION$ I reported that it is private info,I reported that it is private info,reported private info,report private info,[],{},{},0,0,[],,['999 rey'],0.0
12,2021-01-18,Mon Jan 18 22:48:45 +0000 2021,1351300525589983235,SAPNAPKlTTENS,"they/she, 17, feraltwt, bootwt",Not Geo-tagged,"b""@karlcomehome delete this wtf that's private info \xf0\x9f\x98\x90\xf0\x9f\x98\x90\xf0\x9f\x98\x90""",$MENTION$ delete this wtf that's private info $EMOJI$$EMOJI$$EMOJI$,delete this wtf that's private info,delete wtf private info,delete wtf private info,[],{},{},0,1,[],,['k!'],-0.5859
11,2021-01-18,Mon Jan 18 22:52:38 +0000 2021,1351301502527283203,ICONMinneapolis,"Minneapolis, MN",Not Geo-tagged,b'Join us for your very own private #movie screening at ShowPlace ICON #Minneapolis! More info &amp; ticketing: https://t.co/CRAt844yPp #MakeItICONIC \n\n(\xf0\x9f\x93\xb8: msmulrmpls via Instagram) https://t.co/Sp4SlLcfPh',Join us for your very own private $HASHTAG$ screening at ShowPlace ICON $HASHTAG$! More info &amp; ticketing: $URL$ $HASHTAG$ ($EMOJI$: msmulrmpls via Instagram) $URL$,Join us for your very own private screening at ShowPlace ICON ! More info &amp; ticketing ( msmulrmpls via Instagram),join private screening showplace icon more info ticketing msmulrmpls via instagram,join private screening showplace icon more info ticket msmulrmpls via instagram,[],{},{},0,0,"['movie', 'Minneapolis', 'MakeItICONIC']",https://bit.ly/2Hm5Hbh,[],0.3595
13,2021-01-18,Mon Jan 18 22:42:10 +0000 2021,1351298865992003589,RockstarSupport,"New York, NY",Not Geo-tagged,b'@jgraham4488 We can look into this further for you if you submit your account info in a private request here: https://t.co/iLlf5byDom *TB',$MENTION$ We can look into this further for you if you submit your account info in a private request here: $URL$ *TB,We can look into this further for you if you submit your account info in a private request here *TB,we look submit account info private request tb,look submit account info private request tb,[],{},{},0,0,[],http://rsg.ms/support,['Steve Bruce is a clown'],0.0
1,2021-01-18,Mon Jan 18 23:56:04 +0000 2021,1351317464148283392,love123official,Lunar Land 💜🌙✨,Not Geo-tagged,b'@uwu_anna2 What the actual heck \xf0\x9f\x98\xad\n\nARE THEY DUMB?? WHY WOULD THEY SHARE THIS INFO OUT ITS PRIVATE AND PERSONAL INFO I\xe2\x80\x94',$MENTION$ What the actual heck $EMOJI$ ARE THEY DUMB?? WHY WOULD THEY SHARE THIS INFO OUT ITS PRIVATE AND PERSONAL INFO I,What the actual heck ARE THEY DUMB?? WHY WOULD THEY SHARE THIS INFO OUT ITS PRIVATE AND PERSONAL INFO I,what actual heck are they dumb why would they share this info out its private and personal info,what actual heck be dumb why would share this info out private and personal info,[],{},{},0,4,[],,['uwuanna▼😝💅'],-0.3527
32,2021-01-18,Mon Jan 18 21:57:21 +0000 2021,1351287586636001280,Unpurgeable18,,Not Geo-tagged,b'@Quin4Trump @ISafeyet @Una_Alta_Volta @Hurrica18475798 @Franchise2Mr @itsaboutdamnti1 @Larryputt @LaughTrackItsT1 @nuny2017 @ICanPlainlySee @EubanksKris @thedude77 @MemeMercenary @TecSurfer @Raiden3pt0 @ernestleenot @Ryanvanguard1 @davidf4444 @kcinor @adagioforstring @ken_kinkel @acts_17_11 @1AmTheTornado @77MARKALLENSOVA @DarrinMM @realTrumpSquad @Epona08 @RaeAnon @GOPWarLord @OxmanMartin @RalphS24381648 @1Terry @BettyAnnCanizio @KayKay01361294 @williamtsulliv1 @EntheosShines @plozr10 @FLMrs4TRUMP @Andrews2069 @VLovesAnimals @shellyt561 @boomersoonertwt @DebraDouglass11 @NightShiftNews @TheUnitedSpot22 @MarilynLavala @tnolwene @TwitterSafety @TwitterSupport Where everyone else gets private info from\n\nData Collector \xf0\x9f\x98\x82 https://t.co/HrocYtTYb4',$MENTION$ $MENTION$ $MENTION$ $MENTION$ $MENTION$ $MENTION$ $MENTION$ $MENTION$ $MENTION$ $MENTION$ $MENTION$ $MENTION$ $MENTION$ $MENTION$ $MENTION$ $MENTION$ $MENTION$ $MENTION$ $MENTION$ $MENTION$ $MENTION$ $MENTION$ $MENTION$ $MENTION$ $MENTION$ $MENTION$ $MENTION$ $MENTION$ $MENTION$ $MENTION$ $MENTION$ $MENTION$ $MENTION$ $MENTION$ $MENTION$ $MENTION$ $MENTION$ $MENTION$ $MENTION$ $MENTION$ $MENTION$ $MENTION$ $MENTION$ $MENTION$ $MENTION$ $MENTION$ $MENTION$ $MENTION$ $MENTION$ Where everyone else gets private info from Data Collector $EMOJI$ $URL$,Where everyone else gets private info from Data Collector,where everyone else gets private info data collector,where everyone else get private info datum collector,[],{},{},1,3,[],,"['The Future is Red (not blue) 👍🇺🇸👍🇺🇸👍🇺🇸👍', 'IsIt SafeYet-BrightLightOfTruthRemoveIgnoranceAMEN', 'Marie@nevergiveup', 'Hurricane', '1s1k -THE- John L (MAGA)', 'its about time', 'Larry G Putnam', ""Laugh Track ...That's True!"", 'nuny2017', 'Henry Kringle 🆓🎁✨', 'Kris Eubanks', 'Dr. Kent - I will not comply 🇺🇸', 'President Elect - MemeMercenary', 'President Elect TecSurfer', '❌Raiden❌ ⭐⭐⭐ (K)', 'Ernest Leenot', '🇺🇸TheConservative🇺🇸', 'Nonsense Interceptor ⭐⭐⭐', 'Keith', '🎼AdagioForStrings🎻', 'Kinkel', 'Warning: SNP have a scorched earth policy 🇬🇧', 'The Red Cracker 👩🏼\u200d🦰', '💫`MARK´❤`ALLEN´💋`SOVA´💫 ⚘ 💮 Enjoy Each Day 💮', 'PRESIDENT ELECT of THE WORLD!', 'President Elect TrumpSquad 🇺🇸😎', 'Julia Hovey⭐️⭐️⭐️', 'Queen DaNile💎☀️Patriot✨💎Anon🌟💎', 'BULLWORTH', 'Martin H Oxman', 'El Presidente North America loyalty your word hand', '1Terry Time to get kracken!', 'Betty Ann Canizio MAGA, KAG 🇱🇷🇬🇶', 'Kay Kay', 'William Sullivan', 'Enthéos', 'Guy Peck', 'DLP', 'Is it time yet?', 'Animal Advocate MAGA', 'You’re Not Fooling Shelly Thomas', 'Kash', 'Debra Douglass', 'NightShiftNews!®🌟🌟🌟', 'The United Spot 2', '❌🇺🇸Marilyn Lavala🇺🇸✊❌ #CCOT☦🙏🛐✡🌷🕊💜⚘', 'Nolwene', 'Twitter Safety', 'Twitter Support']",0.0
4,2021-01-18,Mon Jan 18 23:49:06 +0000 2021,1351315711977783299,cocomoco1234567,United States,Not Geo-tagged,b'$TPTW..TPT Global Tech Inc. (TPTW): PaperPass reveals personal info that QR-codes\ndon&amp;rsquo;t...QR-code/digital-records more-private https://t.co/POUR2XGmTs',$TPTW..TPT Global Tech Inc. (TPTW): PaperPass reveals personal info that QR-codes don&amp;rsquo;t...QR-code/digital-records more-private $URL$,$TPTW..TPT Global Tech Inc. (TPTW) PaperPass reveals personal info that QR-codes don&amp;rsquo;t..QR-code/digital-records more-private,tptw tpt global tech inc tptw paperpass reveals personal info qr codes rsquo qr code digital records private,tptw tpt global tech inc tptw paperpass reveal personal info qr codes rsquo qr code digital record private,[],{},{},0,5,[],https://investorshub.advfn.com/boards/read_msg.aspx?message_id=161001883,[],0.0
22,2021-01-18,Mon Jan 18 22:19:25 +0000 2021,1351293141106761734,ProfessorJulieD,"Birmingham, AL","Alabama, USA, US",b'@_st8z @YouTube @Facebook @Twitter @Google @Twitch This still collects my data. I\xe2\x80\x99ve had enough of that. Not many options unless I give up my private info. Sigh.',$MENTION$ $MENTION$ $MENTION$ $MENTION$ $MENTION$ $MENTION$ This still collects my data. Ive had enough of that. Not many options unless I give up my private info. Sigh.,This still collects my data. I ve had enough of that. Not many options unless I give up my private info. Sigh.,this still collects data enough not many options unless give private info sigh,this still collect datum enough not many option unless give private info sigh,[],{},{},0,0,[],,"['st8z', 'YouTube', 'Facebook', 'Twitter', 'Google', 'Twitch']",0.0258
38,2021-01-18,Mon Jan 18 21:26:03 +0000 2021,1351279711008256000,gardenstategrl,,Not Geo-tagged,b'@TinaTerFa98 Then you shouldn\xe2\x80\x99t haven\xe2\x80\x99t outed my private info buckster https://t.co/QRK4NNnIVd',$MENTION$ Then you shouldnt havent outed my private info buckster $URL$,Then you shouldn t haven t outed my private info buckster,then outed private info buckster,then out private info buckster,[],{},{},0,2,[],,['Mitchele 🐮💩🤡🙏🏻'],0.0
8,2021-01-18,Mon Jan 18 23:25:03 +0000 2021,1351309659509026820,apermanenthug,The Dark Side Of The Moon,Not Geo-tagged,"b'Here goes Grog, mr ""no im not gonna reveal sarahs private info to the world"" and saying to hell with that ive been found out as a predatory paedo https://t.co/CJBztL0tw8'","Here goes Grog, mr ""no im not gonna reveal sarahs private info to the world"" and saying to hell with that ive been found out as a predatory paedo $URL$","Here goes Grog, mr ""no im not gonna reveal sarahs private info to the world"" and saying to hell with that ive been found out as a predatory paedo",here goes grog im gon na reveal sarahs private info world saying hell ive found predatory paedo,here go grog be gon na reveal sarah private info world say hell have find predatory paedo,[],{},{},0,1,[],https://twitter.com/Onision/status/1351303928508370945,[],-0.6808
5,2021-01-18,Mon Jan 18 23:47:26 +0000 2021,1351315292773904387,KathyGagnon678,,Not Geo-tagged,"b'@AlexisFigir @javiera72 I didn\'t ask for personal info. I asked if Javiera could message me so that I could ask a private question, whenever she had a chance. \nQuestion isn\'t about ""hook up"" or ""favorite this or that"".  If Javiera doesn\'t want to, that\'s fine.'","$MENTION$ $MENTION$ I didn't ask for personal info. I asked if Javiera could message me so that I could ask a private question, whenever she had a chance. Question isn't about ""hook up"" or ""favorite this or that"". If Javiera doesn't want to, that's fine.","I did not ask for personal info. I asked if Javiera could message me so that I could ask a private question, whenever she had a chance. Question is not about ""hook up"" or ""favorite this or that"". If Javiera does not want to, that's fine.",ask personal info asked javiera could message could ask private question whenever chance question hook favorite if javiera want fine,ask personal info ask javiera could message could ask private question whenever chance question hook favorite if javiera want fine,[],{},{},0,0,[],,"['Alex Figir', 'Javiera Balmaceda']",0.6786
17,2021-01-18,Mon Jan 18 22:34:40 +0000 2021,1351296981398917120,Matt_Daniel_,ACE of Clubs&Jack Follows Suit,Not Geo-tagged,"b""@JOttoPohl1 I didn't know you could send private messages on Patreon.\n\nI'm no writer so it's wordy &amp; full of non- relevant info but I did my best with the short time I had.\nHope you like it. Cheers!""",$MENTION$ I didn't know you could send private messages on Patreon. I'm no writer so it's wordy &amp; full of non- relevant info but I did my best with the short time I had. Hope you like it. Cheers!,I did not know you could send private messages on Patreon. I'm no writer so it's wordy &amp; full of non- relevant info but I did my best with the short time I had. Hope you like it. Cheers!,know could send private messages patreon writer wordy full non relevant info best short time hope like cheers,know could send private message patreon writer wordy full non relevant info well short time hope like cheer,[],{},{},0,1,[],,['J. Otto Pohl'],0.9568
2,2021-01-18,Mon Jan 18 23:50:40 +0000 2021,1351316106699530241,RazorDak,Fish Market,Not Geo-tagged,"b'Check out some SOCOM Confrontation gameplay! My first match on in the Private BetaFireFireFire\n\nFor info on how you may be able to play, read the video description\n\n@SOCOMCommunity\n \n@SOCOMHQ @ConfrontationPS\n #SOCOMConfrontation #SOCOM #SOCOMPS3\n\nhttps://t.co/rRvY3wT7nK'","Check out some SOCOM Confrontation gameplay! My first match on in the Private BetaFireFireFire For info on how you may be able to play, read the video description $MENTION$ $MENTION$ $MENTION$ $HASHTAG$ $HASHTAG$ $HASHTAG$ $URL$","Check out some SOCOM Confrontation gameplay! My first match on in the Private BetaFireFireFire For info on how you may be able to play, read the video description",check socom confrontation gameplay my first match private betafirefirefire for info may able play read video description,check socom confrontation gameplay first match private betafirefirefire for info may able play read video description,[],{},{},1,1,"['SOCOMConfrontation', 'SOCOM', 'SOCOMPS3']",https://youtu.be/NZzDQe0ZOf8,"['SOCOM Community', 'SHQ', 'Save Confrontation']",0.1007
27,2021-01-18,Mon Jan 18 22:07:42 +0000 2021,1351290192989184000,82ladybugs,"Findlay, OH",Not Geo-tagged,"b""@donwinslow Nooo, that's not odd in the slightest \xf0\x9f\x99\x84\xf0\x9f\x99\x84\xf0\x9f\x99\x84. The only fun part is hoping their private info is used to great personal detriment""","$MENTION$ Nooo, that's not odd in the slightest $EMOJI$$EMOJI$$EMOJI$. The only fun part is hoping their private info is used to great personal detriment","Noo, that's not odd in the slightest . The only fun part is hoping their private info is used to great personal detriment",noo odd slightest the fun part hoping private info used great personal detriment,noo odd slight the fun part hope private info use great personal detriment,[],{},{},0,0,[],,['Don Winslow'],0.9034
28,2021-01-18,Mon Jan 18 22:05:04 +0000 2021,1351289529630552064,ActiveSpeaking,Tasikmalaya,Not Geo-tagged,b'Private English Course for Elementary and Junior High School || Info : 083826757704 || Speaking and Pronunciation',Private English Course for Elementary and Junior High School || Info : $NUMBER$ || Speaking and Pronunciation,Private English Course for Elementary and Junior High School || Info || Speaking and Pronunciation,private english course elementary junior high school info speaking pronunciation,private english course elementary junior high school info speak pronunciation,[],{},{},0,0,[],,[],0.0
10,2021-01-18,Mon Jan 18 23:06:03 +0000 2021,1351304875611725824,HumaneTampaBay,"3607 N. Armenia Ave, Tampa, FL",Not Geo-tagged,"b'What do you get with an HSTB Birthday Party Package? A decorated, private room, photo ops, animal-themed cake, shelter tours, visits from furry friends, and kid-friendly activities \xf0\x9f\x90\xb6\xf0\x9f\x8e\x89\xf0\x9f\x90\xb1 Info: https://t.co/G9IpDNrUrL\n\n#birthdayparty #WeAreHSTB #AdoptDontShop #EveryLifeCounts https://t.co/iLuATcucsq'","What do you get with an HSTB Birthday Party Package? A decorated, private room, photo ops, animal-themed cake, shelter tours, visits from furry friends, and kid-friendly activities $EMOJI$$EMOJI$$EMOJI$ Info: $URL$ $HASHTAG$ $HASHTAG$ $HASHTAG$ $HASHTAG$ $URL$","What do you get with an HSTB Birthday Party Package? A decorated, private room, photo ops, animal-themed cake, shelter tours, visits from furry friends, and kid-friendly activities Info",what get hstb birthday party package decorated private room photo ops animal themed cake shelter tours visits furry friends kid friendly activities info,what get hstb birthday party package decorate private room photo op animal themed cake shelter tour visit furry friend kid friendly activity info,[],{},{},1,0,"['birthdayparty', 'WeAreHSTB', 'AdoptDontShop', 'EveryLifeCounts']",https://buff.ly/3mZGxib,[],0.7003
41,2021-01-18,Mon Jan 18 21:10:06 +0000 2021,1351275698770616326,GlassiAlonso,"Chicago via Cincy, Louisville ",Not Geo-tagged,b'@PhamilyDoc I have a private club set up on PokerStars. If you\xe2\x80\x99re interested send me a DM and I\xe2\x80\x99ll give you more info',$MENTION$ I have a private club set up on PokerStars. If youre interested send me a DM and Ill give you more info,I have a private club set up on PokerStars. If you re interested send me a DM and I ll give you more info,private club set pokerstars if interested send dm give info,private club set pokerstar if interested send dm give info,[],{},{},0,0,[],,['Adam'],0.4019
24,2021-01-18,Mon Jan 18 22:11:29 +0000 2021,1351291143590465538,marky_b_tweets,,Not Geo-tagged,"b'When we talk about censorship and misinformation, we\xe2\x80\x99re talking about an info landscape functionally dominated by private corporations that are incentivized to encourage the inflammatory misinformation to people conditioned to treat it either as rumination or entertainment: 1/4'","When we talk about censorship and misinformation, were talking about an info landscape functionally dominated by private corporations that are incentivized to encourage the inflammatory misinformation to people conditioned to treat it either as rumination or entertainment: $NUMBER$/4","When we talk about censorship and misinformation, we re talking about an info landscape functionally dominated by private corporations that are incentivized to encourage the inflammatory misinformation to people conditioned to treat it either as rumination or entertainment /4",when talk censorship misinformation talking info landscape functionally dominated private corporations incentivized encourage inflammatory misinformation people conditioned treat either rumination entertainment,when talk censorship misinformation talk info landscape functionally dominate private corporation incentivize encourage inflammatory misinformation people condition treat either rumination entertainment,[],{},{},0,15,[],,[],0.6369
55,2021-01-18,Mon Jan 18 20:24:01 +0000 2021,1351264102245691398,ShowPlaceICON,"Chicago, IL Minneapolis, MN Boston, MA Mountain View, CA",Not Geo-tagged,b'Join us for your very own private #movie screening! More info &amp; ticketing: https://t.co/BOrdNsct5a #MakeItICONIC \n\n(\xf0\x9f\x93\xb8: msmulrmpls via Instagram)\n#movietheaters #popcorn #onsalenow #nowplaying #cinemasafe https://t.co/x5pIyPp1JW',Join us for your very own private $HASHTAG$ screening! More info &amp; ticketing: $URL$ $HASHTAG$ ($EMOJI$: msmulrmpls via Instagram) $HASHTAG$ $HASHTAG$ $HASHTAG$ $HASHTAG$ $HASHTAG$ $URL$,Join us for your very own private screening! More info &amp; ticketing ( msmulrmpls via Instagram),join private screening more info ticketing msmulrmpls via instagram,join private screening more info ticket msmulrmpls via instagram,[],{},{},0,0,"['movie', 'MakeItICONIC', 'movietheaters', 'popcorn', 'onsalenow', 'nowplaying', 'cinemasafe']",https://bit.ly/2Hm5Hbh,[],0.3595
21,2021-01-18,Mon Jan 18 22:20:06 +0000 2021,1351293315841486849,DaphneDamour,New England or FMTY ✈️,Not Geo-tagged,"b""@aronstung1 Because no matter how big of an ASS someone is, I'm far too professional to publicly list someone's info, I do however give it via private DM to other ladies upon request.""","$MENTION$ Because no matter how big of an ASS someone is, I'm far too professional to publicly list someone's info, I do however give it via private DM to other ladies upon request.","Because no matter how big of an ASS someone is, I'm far too professional to publicly list someone's info, I do however give it via private DM to other ladies upon request.",because matter big ass someone far professional publicly list someone info however give via private dm ladies upon request,because matter big ass someone far professional publicly list someone info however give via private dm lady upon request,[],{},{},0,1,[],,['aronstung1@gmail.com'],-0.6494
31,2021-01-18,Mon Jan 18 21:59:00 +0000 2021,1351288002694139904,SPARTAEX,"London, England",Not Geo-tagged,b'Need help? Contact SPARTAEX Support. *Do not post any private info publicly. For full support: https://t.co/V7XOmdMp34 @SPARTAEX #Bitcoin #Litecoin #cryptotrading',Need help? Contact SPARTAEX Support. *Do not post any private info publicly. For full support: $URL$ $MENTION$ $HASHTAG$ $HASHTAG$ $HASHTAG$,Need help? Contact SPARTAEX Support. *Do not post any private info publicly. For full support,need help contact spartaex support do post private info publicly for full support,need help contact spartaex support do post private info publicly for full support,[],{},{},0,1,"['Bitcoin', 'Litecoin', 'cryptotrading']",https://www.spartaex.com/Support/,['SPARTAEX'],0.7964
34,2021-01-18,Mon Jan 18 21:52:51 +0000 2021,1351286455012913153,harperscool,"Pennsylvania, USA",Not Geo-tagged,"b'@DavidBegnaud There is so much private identifying info in this affidavit, I would seriously edit this to block that info out...'","$MENTION$ There is so much private identifying info in this affidavit, I would seriously edit this to block that info out...","There is so much private identifying info in this affidavit, I would seriously edit this to block that info out..",there much private identifying info affidavit would seriously edit block info,there much private identify info affidavit would seriously edit block info,[],{},{},0,2,[],,['David Begnaud'],-0.5574
25,2021-01-18,Mon Jan 18 22:11:07 +0000 2021,1351291051273822209,applesopinion,,Not Geo-tagged,"b'That aside: how do you get mad at your audience for asking questions about your children, when they are in ALL THE CONTENT you provide and YOU are the one sharing private info in the first place'","That aside: how do you get mad at your audience for asking questions about your children, when they are in ALL THE CONTENT you provide and YOU are the one sharing private info in the first place","That aside how do you get mad at your audience for asking questions about your children, when they are in ALL THE CONTENT you provide and YOU are the one sharing private info in the first place",that aside get mad audience asking questions children all the content provide you one sharing private info first place,that aside get mad audience ask question child all the content provide one share private info first place,[],{},{},0,1,[],,[],-0.1027
46,2021-01-18,Mon Jan 18 20:57:41 +0000 2021,1351272574026612736,PiecesofMargo,"The Western Provinces, USA",Not Geo-tagged,"b""I thought the Collector was getting info about me from a private eye (which might still be the case) but now I have a sneaking suspicion it's from my own mother, whom he emotionally seduced and she wants us to get back together!""","I thought the Collector was getting info about me from a private eye (which might still be the case) but now I have a sneaking suspicion it's from my own mother, whom he emotionally seduced and she wants us to get back together!","I thought the Collector was getting info about me from a private eye (which might still be the case) but now I have a sneaking suspicion it's from my own mother, whom he emotionally seduced and she wants us to get back together!",thought collector getting info private eye might still case sneaking suspicion mother emotionally seduced wants get back together,thought collector get info private eye may still case sneak suspicion mother emotionally seduce want get back together,[],{},{},0,1,[],,[],-0.7871
42,2021-01-18,Mon Jan 18 21:09:53 +0000 2021,1351275643661504512,purge_khalifa,,Not Geo-tagged,"b'@MSNBC It seems like they should just keep it to themselves if they don\xe2\x80\x99t want the vaccine. That\xe2\x80\x99s private medical info, and sharing their misinformed opinion only discourages others from making the choice for themselves. The discussion should be between the patient and doctor only.'","$MENTION$ It seems like they should just keep it to themselves if they dont want the vaccine. Thats private medical info, and sharing their misinformed opinion only discourages others from making the choice for themselves. The discussion should be between the patient and doctor only.","It seems like they should just keep it to themselves if they don t want the vaccine. That s private medical info, and sharing their misinformed opinion only discourages others from making the choice for themselves. The discussion should be between the patient and doctor only.",it seems like keep want vaccine that private medical info sharing misinformed opinion discourages others making choice the discussion patient doctor,seem like keep want vaccine that private medical info sharing misinform opinion discourage other make choice the discussion patient doctor,[],{},{},0,0,[],,['MSNBC'],0.0258
39,2021-01-18,Mon Jan 18 21:17:44 +0000 2021,1351277617912098819,RockstarSupport,"New York, NY",Not Geo-tagged,b'@BURT_2003 We can look into this further for you if you submit your account info in a private request here: https://t.co/iLlf5byDom *MM',$MENTION$ We can look into this further for you if you submit your account info in a private request here: $URL$ *MM,We can look into this further for you if you submit your account info in a private request here *MM,we look submit account info private request mm,look submit account info private request mm,[],{},{},0,0,[],http://rsg.ms/support,['Burt'],0.0
