s_no,date,created_at,id_str,screen_name,user_location,geo-tagged_place,tweet_text,tweet_tokenized,tweet_cleaned,tweet_filtered,tweet_lemmatized,tweet_mentioned_organizations,tweet_tags_classified,tweet_orgs_classified,retweet_count,fav_count,hashtags,urls,mentions,vader_polarity
253,2021-03-10,Wed Mar 10 13:15:35 +0000 2021,1369638063861866498,dyinginfl,"Florida, USA",Not Geo-tagged,"b'@bobertmax @nappyisCRACKED You made a false statement though. There is nothing to say private health info can\xe2\x80\x99t be in a mobile app. Now if a medical provider puts it there, unsecured it may be an issue. Don\xe2\x80\x99t spew false info.'","$MENTION$ $MENTION$ You made a false statement though. There is nothing to say private health info cant be in a mobile app. Now if a medical provider puts it there, unsecured it may be an issue. Dont spew false info.","You made a false statement though. There is nothing to say private health info can t be in a mobile app. Now if a medical provider puts it there, unsecured it may be an issue. Don t spew false info.",you made false statement though there nothing say private health info mobile app now medical provider puts unsecured may issue don spew false info,make false statement though there nothing say private health info mobile app now medical provider put unsecured may issue don spew false info,[],{},{},0,0,[],,"['Bobert Max', 'the internet is voluntary 💕👨🏽\u200d']",-0.3818
231,2021-03-10,Wed Mar 10 14:00:45 +0000 2021,1369649431348449283,Premier_RE,550 25th Ave North - St. Cloud,Not Geo-tagged,"b'\xf0\x9f\x8e\x89 Just Listed! \n\xf0\x9f\x9b\x8f\xef\xb8\x8f 2 Bed \n\xf0\x9f\x9a\xbd 2 Bath\n\xf0\x9f\x8f\xa0 1,530 Sqft\n\xe2\x9c\x85 55+\n\xe2\x9c\x85 Master Bedroom with Private Bath\n\xe2\x9c\x85 Walk-in Closets\n\xf0\x9f\x93\x8d 2594 Stearns Way, Saint Cloud \n\xf0\x9f\x92\xb0 List price: $139,900\nMore info: https://t.co/PJCoa6MlcO https://t.co/EdHwtXptWf'","$EMOJI$ Just Listed! $EMOJI$ $NUMBER$ Bed $EMOJI$ $NUMBER$ Bath $EMOJI$ $NUMBER$ Sqft $EMOJI$ $NUMBER$+ $EMOJI$ Master Bedroom with Private Bath $EMOJI$ Walk-in Closets $EMOJI$ $NUMBER$ Stearns Way, Saint Cloud $EMOJI$ List price: $139,900 More info: $URL$ $URL$","Just Listed! Bed Bath Sqft + Master Bedroom with Private Bath Walk-in Closets Stearns Way, Saint Cloud List price $139,900 More info",just listed bed bath sqft master bedroom private bath walk closets stearns way saint cloud list price more info,just list bed bath sqft master bedroom private bath walk closets stearns way saint cloud list price more info,['bed bath'],{'Retail': ['bed bath']},{'bed bath': ['Retail']},0,0,[],https://buff.ly/3vbD3xu,[],0.0
271,2021-03-10,Wed Mar 10 12:32:00 +0000 2021,1369627093395513349,HRCarriages,London/NY,Not Geo-tagged,"b'In the future, will you be needing a private helicopter to get you from one city to another? Then we can take care of all your chartered aviation demands with no stress. We regularly work with aviation firms that offer a range of aviation services. For more info, give us a call! https://t.co/dfuWWVRRT5'","In the future, will you be needing a private helicopter to get you from one city to another? Then we can take care of all your chartered aviation demands with no stress. We regularly work with aviation firms that offer a range of aviation services. For more info, give us a call! $URL$","In the future, will you be needing a private helicopter to get you from one city to another? Then we can take care of all your chartered aviation demands with no stress. We regularly work with aviation firms that offer a range of aviation services. For more info, give us a call!",in future needing private helicopter get one city another then take care chartered aviation demands stress we regularly work aviation firms offer range aviation services for info give call,in future need private helicopter get one city another then take care chartered aviation demand stress regularly work aviation firm offer range aviation service for info give call,[],{},{},0,1,[],,[],0.7026
273,2021-03-10,Wed Mar 10 12:23:10 +0000 2021,1369624872297578501,bobertmax,,Not Geo-tagged,b'@nappyisCRACKED If it\xe2\x80\x99s important make it a card like a drivers license or a passport. Opening the door to putting medical info on the cloud and your phone is bad.\n\nBlockchain would help this a tiny bit but it still makes public what should always be private.',$MENTION$ If its important make it a card like a drivers license or a passport. Opening the door to putting medical info on the cloud and your phone is bad. Blockchain would help this a tiny bit but it still makes public what should always be private.,If it s important make it a card like a drivers license or a passport. Opening the door to putting medical info on the cloud and your phone is bad. Blockchain would help this a tiny bit but it still makes public what should always be private.,if important make card like drivers license passport opening door putting medical info cloud phone bad blockchain would help tiny bit still makes public always private,if important make card like driver license passport opening door put medical info cloud phone bad blockchain would help tiny bit still make public always private,[],{},{},0,1,[],,['the internet is voluntary 💕👨🏽\u200d'],0.1901
291,2021-03-10,Wed Mar 10 10:07:43 +0000 2021,1369590785742618625,GoyunInfo,,Not Geo-tagged,b'Blockchain Firm Concordium Raises $15 Million in Private Sale https://t.co/jusTf6RnlD',Blockchain Firm Concordium Raises $15 Million in Private Sale $URL$,Blockchain Firm Concordium Raises $15 Million in Private Sale,blockchain firm concordium raises million private sale,blockchain firm concordium raise million private sale,[],{},{},0,0,[],https://ift.tt/3epiFmJ,[],0.0
280,2021-03-10,Wed Mar 10 11:46:09 +0000 2021,1369615557918621699,TeamYouTube,"San Bruno, CA",Not Geo-tagged,b'@AlisBlogger Only valid public watch hours from the last 12 months count towards the monetization threshold and not views from private/unlisted videos. More info here: https://t.co/wNS4c1H0Zs. Hope this helps clarify.',$MENTION$ Only valid public watch hours from the last $NUMBER$ months count towards the monetization threshold and not views from private/unlisted videos. More info here: $URL$. Hope this helps clarify.,Only valid public watch hours from the last months count towards the monetization threshold and not views from private/unlisted videos. More info here . Hope this helps clarify.,only valid public watch hours last months count towards monetization threshold views private unlisted videos more info hope helps clarify,only valid public watch hour last month count towards monetization threshold view private unlisted video more info hope help clarify,[],{},{},0,1,[],https://yt.be/help/ECX1,['Alis Blogger'],0.7096
298,2021-03-10,Wed Mar 10 09:42:08 +0000 2021,1369584345418186754,urfriendlee,they/them / 19yo ,Not Geo-tagged,b'@alnaphylaxis i kept your info private but if you wanna out yourself okkkkkk then',$MENTION$ i kept your info private but if you wanna out yourself okkkkkk then,i kept your info private but if you wanna out yourself okk then,kept info private wan na okk,keep info private wan na okk,[],{},{},0,0,[],,['sleeping'],0.0
289,2021-03-10,Wed Mar 10 10:24:27 +0000 2021,1369594994282041344,palembang_real,"Kota Palembang, Sumatera Selatan",Not Geo-tagged,b'Ready slot \n-Booking private\n-vcs\n-massage\nInfo lebih lanjut Dm\xf0\x9f\x92\x8c/ https://t.co/t5W3elUnNi\n\n#Bispakpalembang\n#openbopalembang #availpalembang #bopalembang\n#lendirpalembang #bisyarpalembang #vcsbugil\n#sangeberat #RealAccount #vcscolmek #vcsberbayar #vcscroot #vcsyuk \n#vcs https://t.co/HExm2Tp1m3',Ready slot -Booking private -vcs -massage Info lebih lanjut Dm$EMOJI$/ $URL$ $HASHTAG$ $HASHTAG$ $HASHTAG$ $HASHTAG$ $HASHTAG$ $HASHTAG$ $HASHTAG$ $HASHTAG$ $HASHTAG$ $HASHTAG$ $HASHTAG$ $HASHTAG$ $HASHTAG$ $HASHTAG$ $URL$,Ready slot -Booking private -vcs -massage Info lebih lanjut Dm /,ready slot booking private vcs massage info lebih lanjut dm,ready slot book private vcs massage info lebih lanjut dm,[],{},{},1,1,"['Bispakpalembang', 'openbopalembang', 'availpalembang', 'bopalembang', 'lendirpalembang', 'bisyarpalembang', 'vcsbugil', 'sangeberat', 'RealAccount', 'vcscolmek', 'vcsberbayar', 'vcscroot', 'vcsyuk', 'vcs']",http://wa.me/+62814145715,[],0.3612
187,2021-03-10,Wed Mar 10 15:42:31 +0000 2021,1369675038568382470,AppuruGumi,she/her,Not Geo-tagged,"b""I've started to have more people acting akward on my DMs m, did i reach that point where my follower count makes people feel i'm unapproachable?\n\nFor the record, i'm open to chitchatting, just don't ask me weird stuff or for private info.""","I've started to have more people acting akward on my DMs m, did i reach that point where my follower count makes people feel i'm unapproachable? For the record, i'm open to chitchatting, just don't ask me weird stuff or for private info.","I've started to have more people acting akward on my DMs m, did i reach that point where my follower count makes people feel i'm unapproachable? For the record, i'm open to chitchatting, just do not ask me weird stuff or for private info.",started people acting akward dms reach point follower count makes people feel unapproachable for record open chitchatting ask weird stuff private info,start people act akward dms reach point follower count make people feel unapproachable for record open chitchat ask weird stuff private info,[],{},{},0,2,[],,[],0.1576
293,2021-03-10,Wed Mar 10 10:00:14 +0000 2021,1369588900600111105,GooglePayIndia,India,Not Geo-tagged,"b""@MasanamPavani Sorry to hear that, Pavani. Without revealing any private info, could you share more details about your query? We'll do our best to help.""","$MENTION$ Sorry to hear that, Pavani. Without revealing any private info, could you share more details about your query? We'll do our best to help.","Sorry to hear that, Pavani. Without revealing any private info, could you share more details about your query? We'll do our best to help.",sorry hear pavani without revealing private info could share details query we best help,sorry hear pavani without reveal private info could share detail query well help,[],{},{},0,0,[],,['Pavani Masanam'],0.8316
286,2021-03-10,Wed Mar 10 10:55:14 +0000 2021,1369602741660643332,LynMer24,,Not Geo-tagged,"b'@Definews_Info @clover_finance @MantaNetwork This partnership will work together to meet the demands of the users about price stability and privacy protection.  Also,  it aims to enable private  transaction and swapping.'","$MENTION$ $MENTION$ $MENTION$ This partnership will work together to meet the demands of the users about price stability and privacy protection. Also, it aims to enable private transaction and swapping.","This partnership will work together to meet the demands of the users about price stability and privacy protection. Also, it aims to enable private transaction and swapping.",this partnership work together meet demands users price stability privacy protection also aims enable private transaction swapping,this partnership work together meet demand user price stability privacy protection also aim enable private transaction swap,[],{},{},0,0,[],,"['🌐 DeFi News 🌐', 'Clover', 'Manta Network']",0.0
222,2021-03-10,Wed Mar 10 14:16:32 +0000 2021,1369653403228463110,mohamedanis,London,Not Geo-tagged,"b'Infosys has been named as a Leader in the ISG Provider Lens\xe2\x84\xa2 Quadrant Report 2020 for Next-Gen Private/Hybrid Cloud - Data Center Services &amp; Solutions. To get more info on this, click here https://t.co/PKt2QEbiG6 #InfosysCobalt https://t.co/3SwDFJkLOV'","Infosys has been named as a Leader in the ISG Provider Lens Quadrant Report $NUMBER$ for Next-Gen Private/Hybrid Cloud - Data Center Services &amp; Solutions. To get more info on this, click here $URL$ $HASHTAG$ $URL$","Infosys has been named as a Leader in the ISG Provider Lens Quadrant Report for Next-Gen Private/Hybrid Cloud - Data Center Services &amp; Solutions. To get more info on this, click here",infosys named leader isg provider lens quadrant report next gen private hybrid cloud data center services solutions to get info click,infosys name leader isg provider lens quadrant report next gen private hybrid cloud data center service solution to get info click,['infosys'],"{'IT service management|IT services': ['infosys'], 'Information technology consulting|IT consulting': ['infosys']}","{'infosys': ['IT service management|IT services', 'Information technology consulting|IT consulting']}",0,0,['InfosysCobalt'],https://infy.com/3byWkBy,[],0.1779
281,2021-03-10,Wed Mar 10 11:28:36 +0000 2021,1369611140473446404,JimHaake1,,Not Geo-tagged,"b'A great place to make change! Collinsville, Illinois.\n\nOver the past few months you\xe2\x80\x99ve heard quite a bit about the Extreme Networks partner Step CG and their vision and commitment to becoming THE leader in private LTE and wire-line\xe2\x80\xa6https://t.co/Xr82EJKtAX https://t.co/mMG0zCGeYw'","A great place to make change! Collinsville, Illinois. Over the past few months youve heard quite a bit about the Extreme Networks partner Step CG and their vision and commitment to becoming THE leader in private LTE and wire-line$URL$ $URL$","A great place to make change! Collinsville, Illinois. Over the past few months you ve heard quite a bit about the Extreme Networks partner Step CG and their vision and commitment to becoming THE leader in private LTE and wire-line", great place make change collinsville illinois over past months heard quite bit extreme networks partner step cg vision commitment becoming the leader private lte wire line,  great place make change collinsville illinois over past month hear quite bit extreme network partner step cg vision commitment become the leader private lte wire line,[],{},{},0,0,[],"https://lnkd.in/ewbD68S, https://lnkd.in/e4FX3Em",[],0.8398
295,2021-03-10,Wed Mar 10 09:57:30 +0000 2021,1369588214181335041,marioncoumel,"University of Warwick, UK",Not Geo-tagged,"b""@bellamysystem @_katelightfoot Hi, thank you for offering to help! I've tried to sent you more info by private message but did not manage :( can you email me at m.coumel[at]https://t.co/sM2tVDeSg7?""","$MENTION$ $MENTION$ Hi, thank you for offering to help! I've tried to sent you more info by private message but did not manage :( can you email me at m.coumel[at]$URL$?","Hi, thank you for offering to help! I've tried to sent you more info by private message but did not manage ( can you email me at m.coumel[at]?",hi thank offering help tried sent info private message manage email coumel,hi thank offer help try send info private message manage email coumel,[],{},{},0,0,[],http://warwick.ac.uk,"['Kate Bellamy', 'Kate Lightfoot']",0.4389
312,2021-03-10,Wed Mar 10 08:52:08 +0000 2021,1369571764531908608,lianmeyke27,"Bali, Indonesia",Not Geo-tagged,b'#onlyvipmember #OpenBO #openbooking #openparty #private #coorporateparty #coorporatemember #privateparty #weekend #balihot #Bali #8hotvipclub #openbobali #OPENBOBandung #openbojakarta more info chat whatsapp  https://t.co/UDmpuP1LIU or https://t.co/JTjh7K7pti https://t.co/f7KuvOELOT',$HASHTAG$ $HASHTAG$ $HASHTAG$ $HASHTAG$ $HASHTAG$ $HASHTAG$ $HASHTAG$ $HASHTAG$ $HASHTAG$ $HASHTAG$ $HASHTAG$ $HASHTAG$ $HASHTAG$ $HASHTAG$ $HASHTAG$ more info chat whatsapp $URL$ or $URL$ $URL$,more info chat whatsapp or,info chat whatsapp,info chat whatsapp,[],{},{},0,0,"['onlyvipmember', 'OpenBO', 'openbooking', 'openparty', 'private', 'coorporateparty', 'coorporatemember', 'privateparty', 'weekend', 'balihot', 'Bali', '8hotvipclub', 'openbobali', 'OPENBOBandung', 'openbojakarta']","http://wa.me/6282148288199, http://bit.ly/8HotVIpCLub",[],0.0
283,2021-03-10,Wed Mar 10 11:13:56 +0000 2021,1369607447124602880,midgov,"Midlothian, Scotland",Not Geo-tagged,"b""#FOSTER ##MIDLOTHIAN ONLINE DROP-IN EVENT\nJoin the Family Placement Team on Thurs 25 March to find out about the joys &amp; rewards of fostering. Stay for as little or long as you want &amp; there's \xe2\x80\x98break-out\xe2\x80\x99 rooms if you\xe2\x80\x99d like a private chat. More info &amp; book: https://t.co/GnbDswDmGU https://t.co/XoIbpOp8wS""",$HASHTAG$ $HASHTAG$$HASHTAG$ ONLINE DROP-IN EVENT Join the Family Placement Team on Thurs $NUMBER$ March to find out about the joys &amp; rewards of fostering. Stay for as little or long as you want &amp; there's break-out rooms if youd like a private chat. More info &amp; book: $URL$ $URL$,ONLINE DROP-IN EVENT Join the Family Placement Team on Thurs March to find out about the joys &amp; rewards of fostering. Stay for as little or long as you want &amp; there's break-out rooms if you d like a private chat. More info &amp; book,online drop in event join family placement team thurs march find joys rewards fostering stay little long want break rooms like private chat more info book,online drop in event join family placement team thur march find joys rewards foster stay little long want break room like private chat more info book,[],{},{},6,3,"['FOSTER', 'MIDLOTHIAN']",https://bit.ly/30rXsR1,[],0.8834
285,2021-03-10,Wed Mar 10 10:55:41 +0000 2021,1369602856857255942,GardenCityHomes,Wythenshawe,Not Geo-tagged,b'PROPERTY OF THE WEEK- PLOT 25\n.\n\xe2\x9e\x95 First floor 2 bed apartment\n\xe2\x9e\x95 Separate entrance\n\xe2\x9e\x95 Private Drive\n\xe2\x9e\x95 Available through Rent to Buy\n\xe2\x9e\x95 Immediate move in\n.\nContact for more info\n\xf0\x9f\x93\x9e 0300 777 7177\n\xf0\x9f\x93\xa7 enquiries@gardencityhomes.org.uk https://t.co/KZwYFmUtgc',PROPERTY OF THE WEEK- PLOT $NUMBER$ . $EMOJI$ First floor $NUMBER$ bed apartment $EMOJI$ Separate entrance $EMOJI$ Private Drive $EMOJI$ Available through Rent to Buy $EMOJI$ Immediate move in . Contact for more info $EMOJI$ $NUMBER$ $NUMBER$ $NUMBER$ $EMOJI$ enquiries$MENTION$.org.uk $URL$,PROPERTY OF THE WEEK- PLOT . First floor bed apartment Separate entrance Private Drive Available through Rent to Buy Immediate move in . Contact for more info enquiries.org.uk,property of the week plot first floor bed apartment separate entrance private drive available rent buy immediate move contact info enquiries org,property of the week plot first floor bed apartment separate entrance private drive available rent buy immediate move contact info enquiry org,[],{},{},1,1,[],,[],0.0
288,2021-03-10,Wed Mar 10 10:42:15 +0000 2021,1369599476491563009,ImadeIyamu,"Lagos, Nigeria",Not Geo-tagged,b'@__co__pico @Dolarpo Agreed but valuations of a publicly listed company (with millions of retail and institutional investors) are going to be different from private markets with few investors &amp; limited info. That\xe2\x80\x99s just a global thing.',$MENTION$ $MENTION$ Agreed but valuations of a publicly listed company (with millions of retail and institutional investors) are going to be different from private markets with few investors &amp; limited info. Thats just a global thing.,Agreed but valuations of a publicly listed company (with millions of retail and institutional investors) are going to be different from private markets with few investors &amp; limited info. That s just a global thing.,agreed valuations publicly listed company millions retail institutional investors going different private markets investors limited info that global thing,agree valuation publicly list company million retail institutional investor go different private market investor limited info that global thing,[],{},{},1,5,[],,"['pico', 'Professor Doni (Retired Nigerian)']",-0.2023
234,2021-03-10,Wed Mar 10 14:00:17 +0000 2021,1369649313257820163,Infosys,"Global (HQ: Bangalore, India)",Not Geo-tagged,"b'Infosys has been named as a Leader in the ISG Provider Lens\xe2\x84\xa2 Quadrant Report 2020 for Next-Gen Private/Hybrid Cloud - Data Center Services &amp; Solutions. To get more info on this, click here https://t.co/IlNXoSoihh #InfosysCobalt https://t.co/Ebg0CLj2Td'","Infosys has been named as a Leader in the ISG Provider Lens Quadrant Report $NUMBER$ for Next-Gen Private/Hybrid Cloud - Data Center Services &amp; Solutions. To get more info on this, click here $URL$ $HASHTAG$ $URL$","Infosys has been named as a Leader in the ISG Provider Lens Quadrant Report for Next-Gen Private/Hybrid Cloud - Data Center Services &amp; Solutions. To get more info on this, click here",infosys named leader isg provider lens quadrant report next gen private hybrid cloud data center services solutions to get info click,infosys name leader isg provider lens quadrant report next gen private hybrid cloud data center service solution to get info click,['infosys'],"{'IT service management|IT services': ['infosys'], 'Information technology consulting|IT consulting': ['infosys']}","{'infosys': ['IT service management|IT services', 'Information technology consulting|IT consulting']}",4,12,['InfosysCobalt'],https://infy.com/3byWkBy,[],0.1779
282,2021-03-10,Wed Mar 10 11:21:48 +0000 2021,1369609429058994182,Reclvse,On a high horse. Can't ride...,Not Geo-tagged,"b'Funny how Nigerian banks suffer data breaches and they just \xe2\x80\x9cunlook\xe2\x80\x9d. No email informing customers that their private info is on the dark web, no compensation or data protection services offered. Just smile and invent more frivolous charges\xe2\x80\xa6'","Funny how Nigerian banks suffer data breaches and they just unlook. No email informing customers that their private info is on the dark web, no compensation or data protection services offered. Just smile and invent more frivolous charges","Funny how Nigerian banks suffer data breaches and they just unlook . No email informing customers that their private info is on the dark web, no compensation or data protection services offered. Just smile and invent more frivolous charges",funny nigerian banks suffer data breaches unlook no email informing customers private info dark web compensation data protection services offered just smile invent frivolous charges,funny nigerian bank suffer data breach unlook no email inform customer private info dark web compensation datum protection service offer just smile invent frivolous charge,[],{},{},6,3,[],,[],-0.5965
274,2021-03-10,Wed Mar 10 12:17:07 +0000 2021,1369623348188229634,brexitblog_info,,Not Geo-tagged,b'Incredible if true.  It means that Meghan is allowed to spray around inflammatory allegations and criticisms about the Royal Family &amp; publicise private conversations - all on prime time TV.  But no one is allowed to question \xe2\x80\x9cher truth\xe2\x80\x9d.  She\xe2\x80\x99s a monster. https://t.co/MZUPQWJgn7',Incredible if true. It means that Meghan is allowed to spray around inflammatory allegations and criticisms about the Royal Family &amp; publicise private conversations - all on prime time TV. But no one is allowed to question her truth. Shes a monster. $URL$,Incredible if true. It means that Meghan is allowed to spray around inflammatory allegations and criticisms about the Royal Family &amp; publicise private conversations - all on prime time TV. But no one is allowed to question her truth . She s a monster.,incredible true it means meghan allowed spray around inflammatory allegations criticisms royal family publicise private conversations prime time tv but one allowed question truth she monster,incredible true mean meghan allow spray around inflammatory allegation criticism royal family publicise private conversation prime time tv but one allow question truth monster,[],{},{},289,781,[],https://www.thesun.co.uk/news/14292850/piers-morgan-quit-gmb-meghan-markle-complained-itv/,[],0.1875
292,2021-03-10,Wed Mar 10 10:07:04 +0000 2021,1369590620218683393,GooglePayIndia,India,Not Geo-tagged,"b""@1887001e16794cd Sorry about that, Sandeep. Without revealing any private info, could you let us know if you're seeing any error message while making the transaction? You may also check out useful tips here: https://t.co/GQUtn6froM. Keep us posted.""","$MENTION$ Sorry about that, Sandeep. Without revealing any private info, could you let us know if you're seeing any error message while making the transaction? You may also check out useful tips here: $URL$. Keep us posted.","Sorry about that, Sandeep. Without revealing any private info, could you let us know if you're seeing any error message while making the transaction? You may also check out useful tips here . Keep us posted.",sorry sandeep without revealing private info could let know seeing error message making transaction you may also check useful tips keep posted,sorry sandeep without reveal private info could let know see error message make transaction may also check useful tip keep post,[],{},{},0,0,[],https://goo.gle/2EwevX6,['Sandeep Shetty'],-0.0258
