s_no,date,created_at,id_str,screen_name,user_location,geo-tagged_place,tweet_text,tweet_tokenized,tweet_cleaned,tweet_filtered,tweet_lemmatized,tweet_mentioned_organizations,tweet_tags_classified,tweet_orgs_classified,retweet_count,fav_count,hashtags,urls,mentions,vader_polarity
140,2021-01-18,Mon Jan 18 15:41:32 +0000 2021,1351193012290936832,TeamYouTube,"San Bruno, CA",Not Geo-tagged,"b""@TahirAmini You can try checking your browser's history for the link. We'll need so that we can take a closer look. Also, please delete your tweet as you've shared private info.""","$MENTION$ You can try checking your browser's history for the link. We'll need so that we can take a closer look. Also, please delete your tweet as you've shared private info.","You can try checking your browser's history for the link. We'll need so that we can take a closer look. Also, please delete your tweet as you've shared private info.",you try checking browser history link we need take closer look also please delete tweet shared private info,try check browser history link need take close look also please delete tweet share private info,[],{},{},0,0,[],,['Tahir Amini'],0.5719
145,2021-01-18,Mon Jan 18 15:36:29 +0000 2021,1351191740942856192,AG2000000,"Fresh Meadows/Flushing, NY",Not Geo-tagged,b'@PatrickSanford1 Delete those...it is spam at best at worst it isna way for you to click on linkmtonget private info....',$MENTION$ Delete those...it is spam at best at worst it isna way for you to click on linkmtonget private info....,Delete those..it is spam at best at worst it isna way for you to click on linkmtonget private info..,delete spam best worst isna way click linkmtonget private info,delete spam well bad isna way click linkmtonget private info,[],{},{},0,0,[],,['PatrickSanford'],-0.34
143,2021-01-18,Mon Jan 18 15:37:45 +0000 2021,1351192059877744646,OECDdev,"Paris, France",Not Geo-tagged,b'\xf0\x9f\x93\x8c Save the date\n\n\xf0\x9d\x98\xbd\xf0\x9d\x99\x87\xf0\x9d\x99\x80\xf0\x9d\x99\x89\xf0\x9d\x98\xbf\xf0\x9d\x99\x80\xf0\x9d\x98\xbf \xf0\x9d\x99\x81\xf0\x9d\x99\x84\xf0\x9d\x99\x89\xf0\x9d\x98\xbc\xf0\x9d\x99\x89\xf0\x9d\x98\xbe\xf0\x9d\x99\x80 &amp; \xf0\x9d\x99\x84\xf0\x9d\x99\x88\xf0\x9d\x99\x8b\xf0\x9d\x98\xbc\xf0\x9d\x98\xbe\xf0\x9d\x99\x8f \xf0\x9d\x99\x92\xf0\x9d\x99\x80\xf0\x9d\x99\x80\xf0\x9d\x99\x86\n\n\xf0\x9f\x97\x93\xef\xb8\x8f 1-4 February 2021\n\n\xf0\x9f\x92\xbb Join four days of virtual discussions on private finance for sustainable development! \n\nMore info &amp; register \xf0\x9f\x91\x89 https://t.co/gh8sh2guYU\n\n#PF4SD | @IPEnews | @ConvergenceBF | @devex https://t.co/f93e5yQQQs',$EMOJI$ Save the date &amp; $EMOJI$ $NUMBER$-4 February $NUMBER$ $EMOJI$ Join four days of virtual discussions on private finance for sustainable development! More info &amp; register $EMOJI$ $URL$ $HASHTAG$ | $MENTION$ | $MENTION$ | $MENTION$ $URL$,Save the date &amp; -4 February Join four days of virtual discussions on private finance for sustainable development! More info &amp; register | | |,save date february join four days virtual discussions private finance sustainable development more info register,save date february join four day virtual discussion private finance sustainable development more info register,[],{},{},9,13,['PF4SD'],http://bit.ly/BFIweek,"['IPE.com News', 'Convergence Blended Finance', 'Devex']",0.69
126,2021-01-18,Mon Jan 18 16:23:21 +0000 2021,1351203534176464899,dmarti,"Leipzig, Deutschland",Not Geo-tagged,"b""State privacy laws are popular, so politicians want to take credit, but getting enforcement budget is hard.\n\nPossible solution: CCPA-like law plus private right of action, and attorneys have to report cases to the state so they show up on a site with politicians' info #winWin""","State privacy laws are popular, so politicians want to take credit, but getting enforcement budget is hard. Possible solution: CCPA-like law plus private right of action, and attorneys have to report cases to the state so they show up on a site with politicians' info $HASHTAG$","State privacy laws are popular, so politicians want to take credit, but getting enforcement budget is hard. Possible solution CCPA-like law plus private right of action, and attorneys have to report cases to the state so they show up on a site with politicians' info",state privacy laws popular politicians want take credit getting enforcement budget hard possible solution ccpa like law plus private right action attorneys report cases state show site politicians info,state privacy law popular politician want take credit get enforcement budget hard possible solution ccpa like law plus private right action attorney report case state show site politician info,[],{},{},0,1,['winWin'],,[],0.653
130,2021-01-18,Mon Jan 18 16:11:28 +0000 2021,1351200543839051778,Macys,,Not Geo-tagged,"b""@Robbikinz We're sorry to hear about this.  Our Customer Service team is unavailable until tomorrow, but please send a private message in the meantime with more info including your email, and they will get back to you as soon as they can. Thanks! https://t.co/9HJq8Cszhv""","$MENTION$ We're sorry to hear about this. Our Customer Service team is unavailable until tomorrow, but please send a private message in the meantime with more info including your email, and they will get back to you as soon as they can. Thanks! $URL$","We're sorry to hear about this. Our Customer Service team is unavailable until tomorrow, but please send a private message in the meantime with more info including your email, and they will get back to you as soon as they can. Thanks!",we sorry hear our customer service team unavailable tomorrow please send private message meantime info including email get back soon thanks,sorry hear customer service team unavailable tomorrow please send private message meantime info include email get back soon thank,[],{},{},0,0,[],https://twitter.com/messages/compose?recipient_id=50687788,['ロブ🏄🏻\u200d♀️'],0.7871
135,2021-01-18,Mon Jan 18 15:56:53 +0000 2021,1351196873219072006,Macys,,Not Geo-tagged,"b""@sheila0789 We'd like to look into this for you \xe2\x80\x94 our Customer Service team is unavailable until 1/19, but please send a private message in the meantime with your sales check number and contact info, and they will get back to you as soon as they can. Thanks! https://t.co/9HJq8Cszhv""","$MENTION$ We'd like to look into this for you our Customer Service team is unavailable until $NUMBER$/19, but please send a private message in the meantime with your sales check number and contact info, and they will get back to you as soon as they can. Thanks! $URL$","We'd like to look into this for you our Customer Service team is unavailable until /19, but please send a private message in the meantime with your sales check number and contact info, and they will get back to you as soon as they can. Thanks!",we like look customer service team unavailable please send private message meantime sales check number contact info get back soon thanks,like look customer service team unavailable please send private message meantime sale check number contact info get back soon thank,[],{},{},0,0,[],https://twitter.com/messages/compose?recipient_id=50687788,['Sheila Hall'],0.8516
101,2021-01-18,Mon Jan 18 17:21:14 +0000 2021,1351218099975041026,UrbanAirPark,USA,Not Geo-tagged,"b""@LOVEALWAYS_JAS_ Hi, Chanel. We want you to know that we take your feedback seriously and we'd like to help. So we can learn more, please send us a private message with the park location and your contact info. We look forward to further assisting you.""","$MENTION$ Hi, Chanel. We want you to know that we take your feedback seriously and we'd like to help. So we can learn more, please send us a private message with the park location and your contact info. We look forward to further assisting you.","Hi, Chanel. We want you to know that we take your feedback seriously and we'd like to help. So we can learn more, please send us a private message with the park location and your contact info. We look forward to further assisting you.",hi chanel we want know take feedback seriously like help so learn please send private message park location contact info we look forward assisting,hi chanel want know take feedback seriously like help so learn please send private message park location contact info look forward assist,['chanel'],{'Fashion industry|Fashion': ['chanel']},{'chanel': ['Fashion industry|Fashion']},0,0,[],,['Chanel Mademoiselle'],0.7501
138,2021-01-18,Mon Jan 18 15:55:13 +0000 2021,1351196454656872454,VodafoneIreland,Ireland,Not Geo-tagged,"b""@skimanuk Hi,\n\nIf you can send us a private message with the below info, we can look into this for you?\n\nAccount number or mobile number:\nSecurity PIN (or, if you don't have this, your address and date of birth):\nA brief of the query:\n\nThanks,\nReham""","$MENTION$ Hi, If you can send us a private message with the below info, we can look into this for you? Account number or mobile number: Security PIN (or, if you don't have this, your address and date of birth): A brief of the query: Thanks, Reham","Hi, If you can send us a private message with the below info, we can look into this for you? Account number or mobile number Security PIN (or, if you do not have this, your address and date of birth) A brief of the query Thanks, Reham",hi if send private message info look account number mobile number security pin address date birth brief query thanks reham,hi if send private message info look account number mobile number security pin address date birth brief query thank reham,[],{},{},0,0,[],,['Skimanuk'],0.7096
136,2021-01-18,Mon Jan 18 15:56:01 +0000 2021,1351196657329844234,LetResearch,,Not Geo-tagged,"b'@OtherSideReflec So he claims to work for a private security firm with a job to protect media equipment.\n\nHis wife/father confirm that he is a security guard, too.\n\nUltimately, while we have to be cautious, we also have to be careful about sensationalizing without all the info.'","$MENTION$ So he claims to work for a private security firm with a job to protect media equipment. His wife/father confirm that he is a security guard, too. Ultimately, while we have to be cautious, we also have to be careful about sensationalizing without all the info.","So he claims to work for a private security firm with a job to protect media equipment. His wife/father confirm that he is a security guard, too. Ultimately, while we have to be cautious, we also have to be careful about sensationalizing without all the info.",so claims work private security firm job protect media equipment his wife father confirm security guard ultimately cautious also careful sensationalizing without info,so claim work private security firm job protect medium equipment wife father confirm security guard ultimately cautious also careful sensationalizing without info,[],{},{},0,0,[],,['Tim'],0.765
144,2021-01-18,Mon Jan 18 15:36:52 +0000 2021,1351191835880861699,MatthewFine0,"London, England",Not Geo-tagged,"b'Coming to the market very soon a delightful 1 bed flat with a private roof terrace in #marylebone leasehold \xc2\xa3500,000. #forsale \xe2\x81\xa6@KubieGoldAssoc\xe2\x81\xa9 for more info https://t.co/iZRToUngbE'",Coming to the market very soon a delightful $NUMBER$ bed flat with a private roof terrace in $HASHTAG$ leasehold $NUMBER$. $HASHTAG$ $MENTION$ for more info $URL$,"Coming to the market very soon a delightful bed flat with a private roof terrace in leasehold 500,00. for more info",coming market soon delightful bed flat private roof terrace leasehold info,come market soon delightful bed flat private roof terrace leasehold info,[],{},{},0,0,"['marylebone', 'forsale']",,['Kubie Gold'],0.6204
153,2021-01-18,Mon Jan 18 15:01:35 +0000 2021,1351182959362125824,srsinger40,Somewhere in America,Not Geo-tagged,"b'@kylegriffin1 He didn\xe2\x80\x99t listen when he was president why should he get them as a private citizen. You know someone in his family, or him, will sell that info. for $$'","$MENTION$ He didnt listen when he was president why should he get them as a private citizen. You know someone in his family, or him, will sell that info. for $$","He didn t listen when he was president why should he get them as a private citizen. You know someone in his family, or him, will sell that info. for $$",he listen president get private citizen you know someone family sell info,listen president get private citizen know someone family sell info,[],{},{},0,1,[],,['Kyle Griffin'],0.0
152,2021-01-18,Mon Jan 18 15:10:11 +0000 2021,1351185121286758406,KevinC_ScottS,"New York, NY",Not Geo-tagged,b'@realearthman @_El_Profesorr @DoctorSpac @alexcutler247 @SpacGuru I worked in Private Avaition for 7 years. I might be able to check something. Will report back if I have any info!',$MENTION$ $MENTION$ $MENTION$ $MENTION$ $MENTION$ I worked in Private Avaition for $NUMBER$ years. I might be able to check something. Will report back if I have any info!,I worked in Private Avaition for years. I might be able to check something. Will report back if I have any info!,worked private avaition years might able check something will report back info,work private avaition year may able check something will report back info,[],{},{},0,45,[],,"['realearthman', 'El Profesor', 'Dr. SPAC', 'Alex Cutler', 'Spac Guru']",0.0
147,2021-01-18,Mon Jan 18 15:27:01 +0000 2021,1351189356552331271,sleepyadyyy,she her  minor  bi,Not Geo-tagged,b'@graywasfound you have pretty eyes!! also can i ask why someone needs to have tagged eyes? if thats disrespectful or private info thats okqy and im sorry for asking !/gen',$MENTION$ you have pretty eyes!! also can i ask why someone needs to have tagged eyes? if thats disrespectful or private info thats okqy and im sorry for asking !/gen,you have pretty eyes!! also can i ask why someone needs to have tagged eyes? if thats disrespectful or private info thats okqy and im sorry for asking !/gen,pretty eyes also ask someone needs tagged eyes thats disrespectful private info thats okqy sorry asking gen,pretty eye also ask someone need tag eye that s disrespectful private info that s okqy sorry asking gen,[],{},{},0,2,[],,['gray📌MCYTTWT PROJECT'],0.5826
148,2021-01-18,Mon Jan 18 15:20:38 +0000 2021,1351187751513837575,L0USCALAM1TY,she/her - 14 -,Not Geo-tagged,b'i\xe2\x80\x99ve just realised that over the like 12 months i\xe2\x80\x99ve been on twitter i have probably shared all my private info. but it\xe2\x80\x99s fine cause i trust u guys. like you probs could find my national insurance number on here somewhere',ive just realised that over the like $NUMBER$ months ive been on twitter i have probably shared all my private info. but its fine cause i trust u guys. like you probs could find my national insurance number on here somewhere,i ve just realised that over the like months i ve been on twitter i have probably shared all my private info. but it s fine cause i trust u guys. like you probs could find my national insurance number on here somewhere,realised like months twitter probably shared private info fine cause trust guys like probs could find national insurance number somewhere,realise like month twitter probably share private info fine cause trust guy like probs could find national insurance number somewhere,[],{},{},1,4,[],,[],0.9153
141,2021-01-18,Mon Jan 18 15:39:01 +0000 2021,1351192379928285188,CrustedDollar,,Not Geo-tagged,"b'I do not honestly see a person who literally cannot discern between public info and private info. Could just be like 3500 Deer Creek Road, Palo Alto, CA 94304 United States and someone will think ""a Haha! Got your info!""'","I do not honestly see a person who literally cannot discern between public info and private info. Could just be like $NUMBER$ Deer Creek Road, Palo Alto, CA $NUMBER$ United States and someone will think ""a Haha! Got your info!""","I do not honestly see a person who literally cannot discern between public info and private info. Could just be like Deer Creek Road, Palo Alto, CA United States and someone will think ""a Haha! Got your info!""",honestly see person literally discern public info private info could like deer creek road palo alto ca united states someone think haha got info,honestly see person literally discern public info private info could like deer creek road palo alto ca united states someone think haha get info,[],{},{},0,0,[],,[],0.7509
134,2021-01-18,Mon Jan 18 16:01:05 +0000 2021,1351197931374833665,2disrealtome,18,Not Geo-tagged,"b'Report&gt;it displays a sensitive photo or video&gt;an unauthorized photo or video&gt;it includes unauthorized, intimate content of me or someone else&gt;someone else.\n\nReport&gt;it displays a sensitive photo or video&gt;an unauthorized photo or video&gt;it includes private info&gt;other&gt;someone else. https://t.co/ycv6kTNUBU'","Report&gt;it displays a sensitive photo or video&gt;an unauthorized photo or video&gt;it includes unauthorized, intimate content of me or someone else&gt;someone else. Report&gt;it displays a sensitive photo or video&gt;an unauthorized photo or video&gt;it includes private info&gt;other&gt;someone else. $URL$","Report&gt;it displays a sensitive photo or video&gt;an unauthorized photo or video&gt;it includes unauthorized, intimate content of me or someone else&gt;someone else. Report&gt;it displays a sensitive photo or video&gt;an unauthorized photo or video&gt;it includes private info&gt;other&gt;someone else.",report displays sensitive photo video unauthorized photo video includes unauthorized intimate content someone else someone else report displays sensitive photo video unauthorized photo video includes private info someone else,report displays sensitive photo video unauthorized photo video include unauthorized intimate content someone else someone else report display sensitive photo video unauthorized photo video include private info someone else,[],{},{},2,10,[],https://twitter.com/2disrealtome/status/1351192980196110345,[],0.0
131,2021-01-18,Mon Jan 18 16:09:07 +0000 2021,1351199950835740673,martkingichigo,"Rotterdam, The Netherlands",Not Geo-tagged,"b""@CharizardZord @VioTCZ leaking others private things and giving partner stats in favor of explicit things ISNT a thing that can help that bish's ass a 2nd chance. idk where you were when it all went down, but i DEF recommend rechecking your info and then come again with that statement. imo - never""","$MENTION$ $MENTION$ leaking others private things and giving partner stats in favor of explicit things ISNT a thing that can help that bish's ass a $NUMBER$nd chance. idk where you were when it all went down, but i DEF recommend rechecking your info and then come again with that statement. imo - never","leaking others private things and giving partner stats in favor of explicit things ISNT a thing that can help that bish's ass a nd chance. idk where you were when it all went down, but i DEF recommend rechecking your info and then come again with that statement. imo - never",leaking others private things giving partner stats favor explicit things isnt thing help bish ass chance idk went def recommend rechecking info come statement imo never,leak other private thing give partner stat favor explicit thing be not thing help bish ass chance idk go def recommend rechecke info come statement imo never,[],{},{},0,0,[],,"['Just Another Brad', 'Vio 🇨🇦🐧']",0.6908
160,2021-01-18,Mon Jan 18 14:51:30 +0000 2021,1351180419811696641,ZinxMotionYT,Misty Meadows ,Not Geo-tagged,"b'@werqzyy @heytsch_ @nzgget there many forms of doxing, doxing is the form of when you leak any private info to the victim, such as address ip phone number etc...'","$MENTION$ $MENTION$ $MENTION$ there many forms of doxing, doxing is the form of when you leak any private info to the victim, such as address ip phone number etc...","there many forms of doxing, doxing is the form of when you leak any private info to the victim, such as address ip phone number etc..",many forms doxing doxing form leak private info victim address phone number etc,many form doxe doxe form leak private info victim address phone number etc,[],{},{},0,3,[],,"['werqzy🌋', 'h don’t care', '»']",-0.4939
150,2021-01-18,Mon Jan 18 15:14:01 +0000 2021,1351186085100068871,zesiput,"Jakarta Selatan, DKI Jakarta",Not Geo-tagged,b'\xf0\x9f\x94\xb1OPEN BO &amp; VCs\xf0\x9f\x94\xb1\n\n\xe2\x9c\xa8OPEN 3\xe2\x83\xa3SLOT\xe2\x9c\xa8\n\n\xe2\x9a\xabInclude\n\xe2\x9a\xabExclude\n\xe2\x9a\xabPrivate BO\n\n\xe2\x96\xb6 COD / DP\n\xe2\x96\xb6 CAPS\n\xe2\x96\xb6 NO ANAL\n\xe2\x96\xb6 CIM / CIF\nMORE INFO :DM \xf0\x9f\x92\x8c &amp; 083839554992\n\n#openjaksel  #openbojakarta #cewekbispak #bokalcit\n#kalibaya #realfilesbooking #OpenBooking #Openbojkt #bojaksel #RealAccount https://t.co/ZNmrc31DYa',$EMOJI$OPEN BO &amp; VCs$EMOJI$ $EMOJI$OPEN $NUMBER$SLOT$EMOJI$ $EMOJI$Include $EMOJI$Exclude $EMOJI$Private BO COD / DP CAPS NO ANAL CIM / CIF MORE INFO :DM $EMOJI$ &amp; $NUMBER$ $HASHTAG$ $HASHTAG$ $HASHTAG$ $HASHTAG$ $HASHTAG$ $HASHTAG$ $HASHTAG$ $HASHTAG$ $HASHTAG$ $HASHTAG$ $URL$,OPEN BO &amp; VCs OPEN SLOT Include Exclude Private BO COD / DP CAPS NO ANAL CIM / CIF MORE INFO DM &amp;,open bo vcs open slot include exclude private bo cod dp caps no anal cim cif more info dm,open bo vcs open slot include exclude private bo cod dp cap no anal cim cif more info dm,[],{},{},1,1,"['openjaksel', 'openbojakarta', 'cewekbispak', 'bokalcit', 'kalibaya', 'realfilesbooking', 'OpenBooking', 'Openbojkt', 'bojaksel', 'RealAccount']",,[],-0.5904
151,2021-01-18,Mon Jan 18 15:12:31 +0000 2021,1351185710074781699,DstnyRichardsTV,"Spokane, WA","Spokane, WA, US",b'The club can also move on the path forward in the Healthy WA reopening plan. \n\nSmall private shows are allowed under Phase 1 as long as it\xe2\x80\x99s with people in your household.\n\nMore info \xe2\xac\x87\xef\xb8\x8f @kxly4news \n https://t.co/mC7Zk3voxt',The club can also move on the path forward in the Healthy WA reopening plan. Small private shows are allowed under Phase $NUMBER$ as long as its with people in your household. More info $MENTION$ $URL$,The club can also move on the path forward in the Healthy WA reopening plan. Small private shows are allowed under Phase as long as it s with people in your household. More info,the club also move path forward healthy wa reopening plan small private shows allowed phase long people household more info,the club also move path forward healthy wa reopen plan small private show allow phase long people household more info,[],{},{},1,1,[],https://www.kxly.com/spokane-comedy-club-operating-three-restaurants-allowing-private-comedy-shows-under-phase-1/,['4 News Now'],0.4019
162,2021-01-18,Mon Jan 18 14:45:58 +0000 2021,1351179029102137349,hitng_info,Nigeria,Not Geo-tagged,b'58 Year Old Woman Arrested For Inserting Pepper Into Daughters Private Parts\xc2\xa0(Photos) https://t.co/01C4Db4MJk',$NUMBER$ Year Old Woman Arrested For Inserting Pepper Into Daughters Private Parts(Photos) $URL$,Year Old Woman Arrested For Inserting Pepper Into Daughters Private Parts (Photos),year old woman arrested for inserting pepper into daughters private parts photos,year old woman arrest for insert pepper into daughter private part photo,[],{},{},0,0,[],https://www.hitng.info/58-year-old-woman-arrested-for-inserting-pepper-into-daughters-private-parts-photos/,[],-0.4767
155,2021-01-18,Mon Jan 18 15:00:34 +0000 2021,1351182700212850699,Kalorik,,Not Geo-tagged,"b""@kbratz Hi Katheryn. We're sorry to hear about your product experience and want to help! Please send me your contact info via private message so I can assist you further. Thank you!""",$MENTION$ Hi Katheryn. We're sorry to hear about your product experience and want to help! Please send me your contact info via private message so I can assist you further. Thank you!,Hi Katheryn. We're sorry to hear about your product experience and want to help! Please send me your contact info via private message so I can assist you further. Thank you!,hi katheryn we sorry hear product experience want help please send contact info via private message assist thank,hi katheryn sorry hear product experience want help please send contact info via private message assist thank,[],{},{},0,0,[],,['Katheryn Bratz'],0.7955
98,2021-01-18,Mon Jan 18 17:46:43 +0000 2021,1351224513489477635,fabfashionista8,,Not Geo-tagged,"b""@apadillafilm6 @NLGnews @PeoplesLawChi 3/ U can set ur Twitter security settings so I can't know who ur followers are. But u are not keeping this info private or from the gov't in a secure way. see,\n\nre: the\xc2\xa0FBI\xe2\x80\x99s lawsuit attempting to force Apple to unlock an iPhone. - (the gov't doesn't sue TW to find ur followers.)""","$MENTION$ $MENTION$ $MENTION$ $NUMBER$/ U can set ur Twitter security settings so I can't know who ur followers are. But u are not keeping this info private or from the gov't in a secure way. see, re: theFBIs lawsuit attempting to force Apple to unlock an iPhone. - (the gov't doesn't sue TW to find ur followers.)","/ U can set ur Twitter security settings so I ca not know who ur followers are. But u are not keeping this info private or from the gov't in a secure way. see, re the FBI s lawsuit attempting to force Apple to unlock an iPhone. - (the gov't does not sue TW to find ur followers.)", set twitter security settings know followers but keeping info private gov secure way see fbi lawsuit attempting force apple unlock iphone gov sue tw find followers,  set twitt security setting know follower but keep info private gov secure way see fbi lawsuit attempt force apple unlock iphone gov sue tw find follower,[],{},{},0,0,[],,"['Andrew J. Padilla 🇵🇷', 'National Lawyers Guild', 'Peoples Law Office']",0.3506
