s_no,date,created_at,id_str,screen_name,user_location,geo-tagged_place,tweet_text,tweet_tokenized,tweet_cleaned,tweet_filtered,tweet_lemmatized,tweet_mentioned_organizations,tweet_tags_classified,tweet_orgs_classified,retweet_count,fav_count,hashtags,urls,mentions,vader_polarity
205,2021-03-23,Tue Mar 23 14:41:25 +0000 2021,1374370707119935490,CrackerBarrel,,Not Geo-tagged,"b""@unchelled We're truly sorry we didn't get it right this time around. Please private message us with the restaurant location and your contact info (email address and phone number) so we can look into the issue.""",$MENTION$ We're truly sorry we didn't get it right this time around. Please private message us with the restaurant location and your contact info (email address and phone number) so we can look into the issue.,We're truly sorry we did not get it right this time around. Please private message us with the restaurant location and your contact info (email address and phone number) so we can look into the issue.,we truly sorry get right time around please private message restaurant location contact info email address phone number look issue,truly sorry get right time around please private message restaurant location contact info email address phone number look issue,[],{},{},0,0,[],,['MicHelle'],0.6369
218,2021-03-23,Tue Mar 23 14:06:20 +0000 2021,1374361875119538178,IT_securitynews,Worldwide,Not Geo-tagged,b'Debt-chasing UK councils potentially expose private resident\xc2\xa0data https://t.co/v7aGtLzxe7',Debt-chasing UK councils potentially expose private residentdata $URL$,Debt-chasing UK councils potentially expose private resident data,debt chasing uk councils potentially expose private resident data,debt chase uk council potentially expose private resident datum,[],{},{},0,1,[],https://www.itsecuritynews.info/debt-chasing-uk-councils-potentially-expose-private-resident-data/,[],-0.1531
197,2021-03-23,Tue Mar 23 14:54:08 +0000 2021,1374373906937565189,NiHaolain,,Not Geo-tagged,"b'@butwhyso2 @DeeGilhawley @LouisWu1992 A communication advising that there has been a case in the school doesn\xe2\x80\x99t give any private medical info though, it just informs people of facts. And if anything it may spur parents on to be more cautious going forward, that can only be a good thing!'","$MENTION$ $MENTION$ $MENTION$ A communication advising that there has been a case in the school doesnt give any private medical info though, it just informs people of facts. And if anything it may spur parents on to be more cautious going forward, that can only be a good thing!","A communication advising that there has been a case in the school doesn t give any private medical info though, it just informs people of facts. And if anything it may spur parents on to be more cautious going forward, that can only be a good thing!", communication advising case school give private medical info though informs people facts and anything may spur parents cautious going forward good thing,  communication advising case school give private medical info though inform people fact and anything may spur parent cautious go forward good thing,[],{},{},0,2,[],,"['but why so?', 'Deirdre Gilhawley', 'Louis Wu']",0.3609
194,2021-03-23,Tue Mar 23 15:00:04 +0000 2021,1374375399392571399,varnishsoftware,"Stockholm, Sweden",Not Geo-tagged,"b'Hurry \xe2\x80\xbc\xef\xb8\x8f Join our webinar \xe2\x80\x9cFrom Clusters to CDNs: Multi-tenancy Deployments Made Easy with #Varnish\xe2\x80\x9d on March 25th, where we\xe2\x80\x99ll use our user-friendly admin console to deploy a customized private #CDN in no time at all.\n\nSelect your timezone and register \xf0\x9f\x91\x87 https://t.co/duwzqNAE4m'","Hurry Join our webinar From Clusters to CDNs: Multi-tenancy Deployments Made Easy with $HASHTAG$ on March $NUMBER$th, where well use our user-friendly admin console to deploy a customized private $HASHTAG$ in no time at all. Select your timezone and register $EMOJI$ $URL$","Hurry Join our webinar From Clusters to CDNs Multi-tenancy Deployments Made Easy with on March th, where we ll use our user-friendly admin console to deploy a customized private in no time at all. Select your timezone and register",hurry join webinar from clusters cdns multi tenancy deployments made easy march use user friendly admin console deploy customized private time select timezone register,hurry join webinar from clusters cdns multi tenancy deployment make easy march use user friendly admin console deploy customize private time select timezone register,[],{},{},0,0,"['Varnish', 'CDN']",https://hubs.ly/H0JLrTF0,[],0.4404
198,2021-03-23,Tue Mar 23 14:53:25 +0000 2021,1374373727287177224,Citizen2076,,Not Geo-tagged,b'@JennaEllisEsq Don\xe2\x80\x99t forget social media geniuses:\n\nIf Trump starts his own social media platform and you sign up for it:\n\nTrump will have access to your personal info &amp; GPS locations\n\nIf Trump don\xe2\x80\x99t like what you say - he has your private info to wreak vengeance \n\n#WorstPresidentInHistory https://t.co/9kth9vckkS',$MENTION$ Dont forget social media geniuses: If Trump starts his own social media platform and you sign up for it: Trump will have access to your personal info &amp; GPS locations If Trump dont like what you say - he has your private info to wreak vengeance $HASHTAG$ $URL$,Don t forget social media geniuses If Trump starts his own social media platform and you sign up for it Trump will have access to your personal info &amp; GPS locations If Trump don t like what you say - he has your private info to wreak vengeance,don forget social media geniuses if trump starts social media platform sign trump access personal info gps locations if trump like say private info wreak vengeance,don forget social medium genius if trump start social medium platform sign trump access personal info gp location if trump like say private info wreak vengeance,[],{},{},0,0,['WorstPresidentInHistory'],,['Jenna Ellis'],0.1531
203,2021-03-23,Tue Mar 23 14:45:19 +0000 2021,1374371687576203277,libreture,"West Cumbria, UK",Not Geo-tagged,"b'@realBingeBooks Enjoy!\n\nAaaand... since readers upload their ebooks to their personal Libreture libraries, and have their own private OPDS feed, it means they could, in theory, use that to feed book info into third-party applications... such as other reading services.\n\nJust sayin \xf0\x9f\x98\x89'","$MENTION$ Enjoy! Aaaand... since readers upload their ebooks to their personal Libreture libraries, and have their own private OPDS feed, it means they could, in theory, use that to feed book info into third-party applications... such as other reading services. Just sayin $EMOJI$","Enjoy! Aaand.. since readers upload their ebooks to their personal Libreture libraries, and have their own private OPDS feed, it means they could, in theory, use that to feed book info into third-party applications.. such as other reading services. Just sayin",enjoy aaand since readers upload ebooks personal libreture libraries private opds feed means could theory use feed book info third party applications reading services just sayin,enjoy aaand since reader upload ebook personal libreture library private opds feed mean could theory use feed book info third party application read service just sayin,[],{},{},0,0,[],,['BingeBooks'],0.5411
174,2021-03-23,Tue Mar 23 15:50:06 +0000 2021,1374387992647794702,SequorLaw,"Miami, FL",Not Geo-tagged,b'Did you know the US Supreme Court is taking on the issue of whether Section 1782 may be used to obtain discovery for use in private commercial arbitrations? Click link for more info:\nhttps://t.co/TtFdXBAF9X\n \n#1782 #Discovery #PrivateCommercialArbitration #didyouknow #inthenews https://t.co/WjXbcffoBe',Did you know the US Supreme Court is taking on the issue of whether Section $NUMBER$ may be used to obtain discovery for use in private commercial arbitrations? Click link for more info: $URL$ $HASHTAG$ $HASHTAG$ $HASHTAG$ $HASHTAG$ $HASHTAG$ $URL$,Did you know the US Supreme Court is taking on the issue of whether Section may be used to obtain discovery for use in private commercial arbitrations? Click link for more info,did know us supreme court taking issue whether section may used obtain discovery use private commercial arbitrations click link info,do know supreme court take issue whether section may use obtain discovery use private commercial arbitration click link info,[],{},{},2,3,"['Discovery', 'PrivateCommercialArbitration', 'didyouknow', 'inthenews']",https://www.law360.com/articles/1362295/high-court-will-take-up-arbitration-discovery-question,[],0.5574
219,2021-03-23,Tue Mar 23 14:05:03 +0000 2021,1374361555454685192,novita_diiah,"Bogor, Jawa Barat",Not Geo-tagged,b'avail\nopen private bo\ninclude /exclude\xf0\x9f\x8f\xa2 special service\ninfo DM or Wa 083166844202 \xf0\x9f\x93\xb2\n\n#angelsurabaya\n#opensurabaya\n#includesurabaya\n#excludesurabaya\n#bisyarsurabaya\n#bispaksurabaya\n#TrustedBooking\n#TrustedAngels\n#Recomended4BO\n#vcs\n#vcsreal\n#vcscolmek\n\nhttps://t.co/QQoK1lMMMi',avail open private bo include /exclude$EMOJI$ special service info DM or Wa $NUMBER$ $EMOJI$ $HASHTAG$ $HASHTAG$ $HASHTAG$ $HASHTAG$ $HASHTAG$ $HASHTAG$ $HASHTAG$ $HASHTAG$ $HASHTAG$ $HASHTAG$ $HASHTAG$ $HASHTAG$ $URL$,avail open private bo include /exclude special service info DM or Wa,avail open private include exclude special service info dm wa,avail open private include exclude special service info dm wa,[],{},{},0,0,"['angelsurabaya', 'opensurabaya', 'includesurabaya', 'excludesurabaya', 'bisyarsurabaya', 'bispaksurabaya', 'TrustedBooking', 'TrustedAngels', 'Recomended4BO', 'vcs', 'vcsreal', 'vcscolmek']",,[],0.2023
206,2021-03-23,Tue Mar 23 14:39:38 +0000 2021,1374370258958516228,LendersBagel,,Not Geo-tagged,"b'@HappyHour Pamela, we need all the info to get this reported and fixed. Please send us a private message with the UPC, best by date, and numbers near the date from your last purchase. Thank you!'","$MENTION$ Pamela, we need all the info to get this reported and fixed. Please send us a private message with the UPC, best by date, and numbers near the date from your last purchase. Thank you!","Pamela, we need all the info to get this reported and fixed. Please send us a private message with the UPC, best by date, and numbers near the date from your last purchase. Thank you!",pamela need info get reported fixed please send private message upc best date numbers near date last purchase thank,pamela need info get report fixed please send private message upc good date number near date last purchase thank,[],{},{},0,0,[],,['Pamela A @ Happy Hour'],0.8516
201,2021-03-23,Tue Mar 23 14:47:43 +0000 2021,1374372290041933824,Jody71558440,Georgia,Not Geo-tagged,"b'@amlivemon @JohnnyQuest22 Universities aren\xe2\x80\x99t all public, and private schools can request vaccine records too. \n\nIt\xe2\x80\x99s even easier if they\xe2\x80\x99re not storing it. The info on your drivers license is covered by the Privacy Act, but businesses can still ask to see ID. Same here.'","$MENTION$ $MENTION$ Universities arent all public, and private schools can request vaccine records too. Its even easier if theyre not storing it. The info on your drivers license is covered by the Privacy Act, but businesses can still ask to see ID. Same here.","Universities aren t all public, and private schools can request vaccine records too. It s even easier if they re not storing it. The info on your drivers license is covered by the Privacy Act, but businesses can still ask to see ID. Same here.",universities public private schools request vaccine records it even easier storing the info drivers license covered privacy act businesses still ask see id same,universitie public private school request vaccine record even easier store the info driver license cover privacy act business still ask see d same,[],{},{},0,0,[],,"['Live Monitor', 'Jonny Quest']",0.2263
215,2021-03-23,Tue Mar 23 14:18:42 +0000 2021,1374364989687963650,dgp1,United States,Not Geo-tagged,"b""#othena is the f*cking worst. Apparently this is a REQUIRED FIELD for everyone including adults. Incompetence or just want to collect more private info that you don't need? Go fuck yourself Othena. https://t.co/dWv3dvMkbo""",$HASHTAG$ is the f*cking worst. Apparently this is a REQUIRED FIELD for everyone including adults. Incompetence or just want to collect more private info that you don't need? Go fuck yourself Othena. $URL$,is the f*cking worst. Apparently this is a REQUIRED FIELD for everyone including adults. Incompetence or just want to collect more private info that you do not need? Go fuck yourself Othena.,cking worst apparently required field everyone including adults incompetence want collect private info need go fuck othena,cke bad apparently require field everyone include adult incompetence want collect private info need go fuck othena,[],{},{},0,0,['othena'],,[],-0.6428
211,2021-03-23,Tue Mar 23 14:29:08 +0000 2021,1374367612813991945,grshrddy5,"Hyderabad,India",Not Geo-tagged,"b""@abhiandniyu 1000's of workers work in this factory. The govt is handling this to private companies only because that there has been no profits from the last few years. This is mainly due to the failure of previous state goverments. You can check out the pic attached for more info. https://t.co/4i2HbrqWv1""",$MENTION$ $NUMBER$'s of workers work in this factory. The govt is handling this to private companies only because that there has been no profits from the last few years. This is mainly due to the failure of previous state goverments. You can check out the pic attached for more info. $URL$,'s of workers work in this factory. The govt is handling this to private companies only because that there has been no profits from the last few years. This is mainly due to the failure of previous state goverments. You can check out the pic attached for more info.,workers work factory the govt handling private companies profits last years this mainly due failure previous state goverments you check pic attached info,worker work factory the govt handle private company profit last year this mainly due failure previous state goverment check pic attach info,[],{},{},0,0,[],,['Abhi and Niyu'],-0.6914
204,2021-03-23,Tue Mar 23 14:43:06 +0000 2021,1374371131348512769,scoin800,,Not Geo-tagged,"b'@lanceXXRD POS is a private blockchain.. Connect thu peer to peer connection..\nYou can download our wallet, or use a staking pool..\nInfo is on website or discord.. \nHope to see you there..\xf0\x9f\x99\x82'","$MENTION$ POS is a private blockchain.. Connect thu peer to peer connection.. You can download our wallet, or use a staking pool.. Info is on website or discord.. Hope to see you there..$EMOJI$","POS is a private blockchain.. Connect thu peer to peer connection.. You can download our wallet, or use a staking pool.. Info is on website or discord.. Hope to see you there..",pos private blockchain connect thu peer peer connection you download wallet use staking pool info website discord hope see,pos private blockchain connect thu peer peer connection download wallet use stake pool info website discord hope see,[],{},{},0,0,[],,['LanceXXRD'],0.0516
180,2021-03-23,Tue Mar 23 15:37:52 +0000 2021,1374384910396395536,SNVworld,"The Hague, the Netherlands",Not Geo-tagged,"b'Join the Investment Climate Reform Facility event on mobilising #finance to catalyse private sector engagement for #climatechange adaptation in African, Caribbean and Pacific (#ACP) countries \xe2\xac\x87\xef\xb8\x8f\n\n\xe2\x9c\x8d\xef\xb8\x8fRegister: https://t.co/QT2GKUCloY\n\xe2\x84\xb9\xef\xb8\x8f More info: https://t.co/AdpsXPNw0h https://t.co/lSef7OaZAr'","Join the Investment Climate Reform Facility event on mobilising $HASHTAG$ to catalyse private sector engagement for $HASHTAG$ adaptation in African, Caribbean and Pacific ($HASHTAG$) countries $EMOJI$Register: $URL$ More info: $URL$ $URL$","Join the Investment Climate Reform Facility event on mobilising to catalyse private sector engagement for adaptation in African, Caribbean and Pacific () countries Register More info",join investment climate reform facility event mobilising catalyse private sector engagement adaptation african caribbean pacific countries register more info,join investment climate reform facility event mobilise catalyse private sector engagement adaptation african caribbean pacific country register more info,[],{},{},7,12,"['finance', 'climatechange', 'ACP']","http://on.snv.org/3reSLoC, http://on.snv.org/3ccWEGg",[],0.6369
224,2021-03-23,Tue Mar 23 13:56:54 +0000 2021,1374359504704450561,MoCap786,,Not Geo-tagged,"b""@trizzer3 @toriabanks @OwenJones84 I know it sounds absurd but surely if a weird man on the Internet starts getting your private info and sharing it online that's a concern?""",$MENTION$ $MENTION$ $MENTION$ I know it sounds absurd but surely if a weird man on the Internet starts getting your private info and sharing it online that's a concern?,I know it sounds absurd but surely if a weird man on the Internet starts getting your private info and sharing it online that's a concern?,know sounds absurd surely weird man internet starts getting private info sharing online concern,know sound absurd surely weird man internet start get private info sharing online concern,[],{},{},0,0,[],,"['@trizzer 🐏', 'Toria Banks', 'Owen Jones 🌹']",0.7579
222,2021-03-23,Tue Mar 23 14:00:29 +0000 2021,1374360406249107470,SafSecur,"Pittsburgh, PA",Not Geo-tagged,"b'#techtuesday  Always use two-factor authentication. Although it can seem like a pain at times, it will keep your private info from being stolen. https://t.co/sXnkNVqJAh'","$HASHTAG$ Always use two-factor authentication. Although it can seem like a pain at times, it will keep your private info from being stolen. $URL$","Always use two-factor authentication. Although it can seem like a pain at times, it will keep your private info from being stolen.",always use two factor authentication although seem like pain times keep private info stolen,always use two factor authentication although seem like pain time keep private info steal,[],{},{},0,0,['techtuesday'],,[],-0.6124
228,2021-03-23,Tue Mar 23 13:44:03 +0000 2021,1374356270879272967,Allstate,,Not Geo-tagged,"b'@vickiejent1 We are sorry to hear this. Please private message us a bit more info, so we can look into this. ^AG https://t.co/vYIVrwsUyL'","$MENTION$ We are sorry to hear this. Please private message us a bit more info, so we can look into this. ^AG $URL$","We are sorry to hear this. Please private message us a bit more info, so we can look into this. ^AG",we sorry hear please private message bit info look ag,sorry hear please private message bit info look ag,[],{},{},0,0,[],https://twitter.com/messages/compose?recipient_id=14275290,['vickiejent1@gmail.com'],0.3237
210,2021-03-23,Tue Mar 23 14:30:51 +0000 2021,1374368046593236996,sigsense,NYC,Not Geo-tagged,"b'Can we not call student plagiarism ""stealing""?  The goal of academic writing is to share out knowledge and research, not to assert property rights.  So if you don\'t share your source, you\'re not ""stealing"" from a private ""owner"".  You\'re hoarding info that belongs to everybody'","Can we not call student plagiarism ""stealing""? The goal of academic writing is to share out knowledge and research, not to assert property rights. So if you don't share your source, you're not ""stealing"" from a private ""owner"". You're hoarding info that belongs to everybody","Can we not call student plagiarism ""stealing""? The goal of academic writing is to share out knowledge and research, not to assert property rights. So if you do not share your source, you're not ""stealing"" from a private ""owner"". You're hoarding info that belongs to everybody",can call student plagiarism stealing the goal academic writing share knowledge research assert property rights so share source stealing private owner you hoarding info belongs everybody,can call student plagiarism steal the goal academic writing share knowledge research assert property right so share source steal private owner hoard info belong everybody,[],{},{},0,0,[],,[],-0.1002
223,2021-03-23,Tue Mar 23 13:59:12 +0000 2021,1374360082167832581,bostonsci,"Boston, MA",Not Geo-tagged,"b""@USAMRIID We're sorry to hear this. If you feel comfortable providing your contact info via private message, we will connect you with our Patient Services team.""","$MENTION$ We're sorry to hear this. If you feel comfortable providing your contact info via private message, we will connect you with our Patient Services team.","We're sorry to hear this. If you feel comfortable providing your contact info via private message, we will connect you with our Patient Services team.",we sorry hear if feel comfortable providing contact info via private message connect patient services team,sorry hear if feel comfortable provide contact info via private message connect patient service team,[],{},{},0,0,[],,['USAMRIID'],0.4588
214,2021-03-23,Tue Mar 23 14:22:00 +0000 2021,1374365820785192961,Zakoutib,she/her,Not Geo-tagged,"b'And about having info about ur stan\'s private life, u look stupid denying it now lolz that\'s how ppl know u bc u said Addison has talked about her feelings and what\'s going on with u literally said ""I have some unknown info"" and we all saw it lmfao it\'s something to deny.'","And about having info about ur stan's private life, u look stupid denying it now lolz that's how ppl know u bc u said Addison has talked about her feelings and what's going on with u literally said ""I have some unknown info"" and we all saw it lmfao it's something to deny.","And about having info about ur stan's private life, u look stupid denying it now lolz that's how ppl know u bc u said Addison has talked about her feelings and what's going on with u literally said ""I have some unknown info"" and we all saw it lmfao it's something to deny.",and info stan private life look stupid denying lolz ppl know said addison talked feelings going literally said unknown info saw lmfao something deny,and info stan private life look stupid denying lolz ppl know say addison talk feeling go literally say unknown info see lmfao something deny,[],{},{},0,12,[],,[],0.0
217,2021-03-23,Tue Mar 23 14:10:20 +0000 2021,1374362884365504516,rossgarber,New Orleans/DC/CT,Not Geo-tagged,b'12/ Committee members emphasize confidentiality. One just advocated using private emails to communicate. In many states Freedom of Information issues arise in trying to conduct confidential investigations. (public right to access to meetings and info)',$NUMBER$/ Committee members emphasize confidentiality. One just advocated using private emails to communicate. In many states Freedom of Information issues arise in trying to conduct confidential investigations. (public right to access to meetings and info),/ Committee members emphasize confidentiality. One just advocated using private emails to communicate. In many states Freedom of Information issues arise in trying to conduct confidential investigations. (public right to access to meetings and info),committee members emphasize confidentiality one advocated using private emails communicate in many states freedom information issues arise trying conduct confidential investigations public right access meetings info,committee member emphasize confidentiality one advocate use private email communicate in many state freedom information issue arise try conduct confidential investigation public right access meeting info,[],{},{},0,6,[],,[],0.6369
233,2021-03-23,Tue Mar 23 13:28:32 +0000 2021,1374352362807103494,IPCinfoprivacy,"Ontario, Canada",Not Geo-tagged,"b'Similarly, they may not be as aware of their right to access information or their right when it comes to privacy protection. Find out more on Info Matters: https://t.co/Bmq4m5NUPZ'","Similarly, they may not be as aware of their right to access information or their right when it comes to privacy protection. Find out more on Info Matters: $URL$","Similarly, they may not be as aware of their right to access information or their right when it comes to privacy protection. Find out more on Info Matters",similarly may aware right access information right comes privacy protection find info matters,similarly may aware right access information right come privacy protection find info matter,[],{},{},0,0,[],https://infomatters.simplecast.com/episodes/reaching-out-to-franco-ontarians,[],0.0935
225,2021-03-23,Tue Mar 23 13:53:02 +0000 2021,1374358528652054531,Lokhandwala_Bom,"Andheri West, Mumbai",Not Geo-tagged,b'Taking note of 2nd wave in #COVID19 cases in #Mumbai\nBMC has banned any #Holi celebrations in Private ( Within premises of Housing societies ) &amp; public places\n@mulund_info\n@MaladWelfare\n@WeAllConnectwAc\n@MumbadeviPraja\n@WorliResidents\n@SPMgrp\n@vlpresidents\n@jkd18\n@kar_mumbai https://t.co/qScVyAw2MH',Taking note of $NUMBER$nd wave in $HASHTAG$ cases in $HASHTAG$ BMC has banned any $HASHTAG$ celebrations in Private ( Within premises of Housing societies ) &amp; public places $MENTION$ $MENTION$ $MENTION$ $MENTION$ $MENTION$ $MENTION$ $MENTION$ $MENTION$ $MENTION$ $URL$,Taking note of nd wave in cases in BMC has banned any celebrations in Private ( Within premises of Housing societies ) &amp; public places,taking note nd wave cases bmc banned celebrations private within premises housing societies public places,take note nd wave case bmc ban celebration private within premise housing society public place,[],{},{},13,20,"['COVID19', 'Mumbai', 'Holi']",,"['𝔐𝔲𝔩𝔲𝔫𝔡 𝔦𝔫𝔣𝔬', 'Malad-Goregaon Welfare Association', 'We All Connect - wAc', 'Mumbadevi Praja Forum (ALM South Mumbai)', 'Worli Residents, Mumbai 🗨️ वरळी रहिवासी, मुंबई🗨️', 'SurakshitParleMvmnt', 'Vile Parle Residents', 'Jyoti Kapur Das', 'Citizen of Charkop']",-0.4588
