s_no,date,created_at,id_str,screen_name,user_location,geo-tagged_place,tweet_text,tweet_tokenized,tweet_cleaned,tweet_filtered,tweet_lemmatized,tweet_mentioned_organizations,tweet_tags_classified,tweet_orgs_classified,retweet_count,fav_count,hashtags,urls,mentions,vader_polarity
110,2021-03-22,Mon Mar 22 18:18:12 +0000 2021,1374062871857000448,sickpub,glasgow 🏴󠁧󠁢󠁳󠁣󠁴󠁿,Not Geo-tagged,"b'@KerfuffleFur @CatsCavern @COMBVRO facebook is known for being quite happy with alt right an extremist content being handled on its website, even helping private companies peddle this info to easily swayed people. twitter is similar, so why can\xe2\x80\x99t we have this new site :))'","$MENTION$ $MENTION$ $MENTION$ facebook is known for being quite happy with alt right an extremist content being handled on its website, even helping private companies peddle this info to easily swayed people. twitter is similar, so why cant we have this new site :))","facebook is known for being quite happy with alt right an extremist content being handled on its website, even helping private companies peddle this info to easily swayed people. twitter is similar, so why can t we have this new site ))",facebook known quite happy alt right extremist content handled website even helping private companies peddle info easily swayed people twitter similar new site,facebook know quite happy alt right extremist content handle website even help private company peddle info easily sway people twitter similar new site,['facebook'],"{'Social media': ['facebook'], 'Advertising': ['facebook']}","{'facebook': ['Social media', 'Advertising']}",0,1,[],,"['🏳️\u200d⚧️Kerfuffle🏳️\u200d🌈', 'Páiste an Pangur Bán 🌍🌹🇮🇪', 'catboy joe pesci']",0.8221
321,2021-03-22,Mon Mar 22 07:52:44 +0000 2021,1373905469014691841,asrcet,,Not Geo-tagged,b'@SimonCalder Is there any further info on Test to release scheme for international passenger from non-red list countries? Trying to find out if it\xe2\x80\x99s all via post or if there is any other option. And how to find the nearest options.\n\nhttps://t.co/S79lsnj7Hn',$MENTION$ Is there any further info on Test to release scheme for international passenger from non-red list countries? Trying to find out if its all via post or if there is any other option. And how to find the nearest options. $URL$,Is there any further info on Test to release scheme for international passenger from non-red list countries? Trying to find out if it s all via post or if there is any other option. And how to find the nearest options.,is info test release scheme international passenger non red list countries trying find via post option and find nearest options,be info test release scheme international passenger non red list country try find via post option and find near option,[],{},{},0,0,[],https://assets.publishing.service.gov.uk/government/uploads/system/uploads/attachment_data/file/971248/covid-private-testing-providers-general-testing-190321.csv/preview,['Simon Calder'],0.0
317,2021-03-22,Mon Mar 22 08:09:43 +0000 2021,1373909744646115328,GregoryMcKelvey,"Portland, OR",Not Geo-tagged,"b'Today I messed up and replied to a tweet publicly with private info that was wrong. I broke my only Twitter rule of not talking about leftists. And it was risky, reckless, unnecessary, dangerous, and wrong. I am sorry to that person and my community. I messed up.'","Today I messed up and replied to a tweet publicly with private info that was wrong. I broke my only Twitter rule of not talking about leftists. And it was risky, reckless, unnecessary, dangerous, and wrong. I am sorry to that person and my community. I messed up.","Today I messed up and replied to a tweet publicly with private info that was wrong. I broke my only Twitter rule of not talking about leftists. And it was risky, reckless, unnecessary, dangerous, and wrong. I am sorry to that person and my community. I messed up.",today messed replied tweet publicly private info wrong broke twitter rule talking leftists and risky reckless unnecessary dangerous wrong sorry person community messed,today mess reply tweet publicly private info wrong break twitt rule talk leftist and risky reckless unnecessary dangerous wrong sorry person community mess,[],{},{},3,77,[],,[],-0.9623
294,2021-03-22,Mon Mar 22 10:00:01 +0000 2021,1373937502374010880,CJ_SouthWest,,Not Geo-tagged,"b'\xf0\x9f\x90\xb4Equestrian Feature Week\xf0\x9f\x90\xb4\n\xe2\xad\x90\xef\xb8\x8fHammonds Farm, Stroud, Gloucestershire \xe2\xad\x90\xef\xb8\x8f\n\nLaunched to the market last week, a private residential farm currently offering luxury Bed &amp; Breakfast accommodation &amp; numerous other leisure, equestrian or farming opportunities. Call 01823 428590 for info! https://t.co/lIadJF4KSu'","$EMOJI$Equestrian Feature Week$EMOJI$ Hammonds Farm, Stroud, Gloucestershire Launched to the market last week, a private residential farm currently offering luxury Bed &amp; Breakfast accommodation &amp; numerous other leisure, equestrian or farming opportunities. Call $NUMBER$ $NUMBER$ for info! $URL$","Equestrian Feature Week Hammonds Farm, Stroud, Gloucestershire Launched to the market last week, a private residential farm currently offering luxury Bed &amp; Breakfast accommodation &amp; numerous other leisure, equestrian or farming opportunities. Call for info!",equestrian feature week hammonds farm stroud gloucestershire launched market last week private residential farm currently offering luxury bed breakfast accommodation numerous leisure equestrian farming opportunities call info,equestrian feature week hammond farm stroud gloucestershire launch market last week private residential farm currently offer luxury bed breakfast accommodation numerous leisure equestrian farming opportunity call info,[],{},{},0,0,[],,[],0.5255
272,2021-03-22,Mon Mar 22 11:38:27 +0000 2021,1373962272125591558,yanacomel99,"Tasikmalaya, Jawa Barat",Not Geo-tagged,b'\xf0\x9f\x8c\xac\xef\xb8\x8fReady Y Say Malam in Khusus BO/VCS Daerah #Tasikmalaya DM Via WA MOVE\nINFO:/Incloud or Excloud.PRIVATE\xe2\xac\x87\xef\xb8\x8f\nhttps://t.co/RXezFjwmjZ\n#tasikmalaya\n#BOTasikmalaya\n#bispakTasikmalaya\n#bisyarTasikmalaya\n#availTasikmalaya\n#cewekpanggilan\n#cewekTasikmalaya\n#openboTasikmalaya\n@yanacomel99 https://t.co/eGMQBTG7pW',$EMOJI$Ready Y Say Malam in Khusus BO/VCS Daerah $HASHTAG$ DM Via WA MOVE INFO:/Incloud or Excloud.PRIVATE $URL$ $HASHTAG$ $HASHTAG$ $HASHTAG$ $HASHTAG$ $HASHTAG$ $HASHTAG$ $HASHTAG$ $HASHTAG$ $MENTION$ $URL$,Ready Y Say Malam in Khusus BO/VCS Daerah DM Via WA MOVE INFO /Incloud or Excloud.PRIVATE,ready say malam khusus bo vcs daerah dm via wa move info incloud excloud private,ready say malam khusus bo vcs daerah dm via wa move info incloud excloud private,[],{},{},0,0,"['Tasikmalaya', 'tasikmalaya', 'BOTasikmalaya', 'bispakTasikmalaya', 'bisyarTasikmalaya', 'availTasikmalaya', 'cewekpanggilan', 'cewekTasikmalaya', 'openboTasikmalaya']",http://wa.me/6289617208010,['🌠YANA REAL ACCAOUT💯'],0.3612
309,2021-03-22,Mon Mar 22 08:55:57 +0000 2021,1373921379725246467,TheSeven2021,The Spire,Not Geo-tagged,b'It got to the point where he decides to doxx people nonstop even though that he said he would no longer do that with multiple twitter reports by people who got their private info leaked. He also sent some people bomb threats with their actual living address. If you happen to have',It got to the point where he decides to doxx people nonstop even though that he said he would no longer do that with multiple twitter reports by people who got their private info leaked. He also sent some people bomb threats with their actual living address. If you happen to have,It got to the point where he decides to doxx people nonstop even though that he said he would no longer do that with multiple twitter reports by people who got their private info leaked. He also sent some people bomb threats with their actual living address. If you happen to have,it got point decides doxx people nonstop even though said would longer multiple twitter reports people got private info leaked he also sent people bomb threats actual living address if happen,get point decide doxx people nonstop even though say would long multiple twitter report people get private info leak also send people bomb threat actual live address if happen,[],{},{},0,0,[],,[],-0.8591
320,2021-03-22,Mon Mar 22 07:59:50 +0000 2021,1373907256597692417,celticwitch1995,"Motherwell, tha an latha a nis",Not Geo-tagged,"b""Jesus, has anybody read this article this morning? Census farmed out to private company who can supply the info to American security agencies/government with whom they are obliged to share the information with.   I wouldn't trust it at all.  https://t.co/kDpDVua4Ee""","Jesus, has anybody read this article this morning? Census farmed out to private company who can supply the info to American security agencies/government with whom they are obliged to share the information with. I wouldn't trust it at all. $URL$","Jesus, has anybody read this article this morning? Census farmed out to private company who can supply the info to American security agencies/government with whom they are obliged to share the information with. I would not trust it at all.",jesus anybody read article morning census farmed private company supply info american security agencies government obliged share information would trust,jesus anybody read article morning census farm private company supply info american security agency government oblige share information would trust,[],{},{},10,15,[],https://www.thenational.scot/news/19176965.george-kerevan-secure-census-data-handed-private-interests/,[],0.2259
315,2021-03-22,Mon Mar 22 08:23:18 +0000 2021,1373913162542637057,yxwaiex,,Not Geo-tagged,"b'@vic_boop @ser_remy @ashlynanarchy The doctor in question had said that ""SARS had returned"" in a private group chat where the screenshot went viral, which was factually incorrect and could potentially cause panic, so they made him publicly apologize for false info, but he was still honored for his sacrifice'","$MENTION$ $MENTION$ $MENTION$ The doctor in question had said that ""SARS had returned"" in a private group chat where the screenshot went viral, which was factually incorrect and could potentially cause panic, so they made him publicly apologize for false info, but he was still honored for his sacrifice","The doctor in question had said that ""SARS had returned"" in a private group chat where the screenshot went viral, which was factually incorrect and could potentially cause panic, so they made him publicly apologize for false info, but he was still honored for his sacrifice",the doctor question said sars returned private group chat screenshot went viral factually incorrect could potentially cause panic made publicly apologize false info still honored sacrifice,the doctor question say sars return private group chat screenshot go viral factually incorrect could potentially cause panic make publicly apologize false info still honor sacrifice,[],{},{},0,3,[],,"['Mom Boucher 🗿', 'Ser Remy', 'Ashlyn the Anarchist Barbie™️🏴🚩🦔']",0.6428
338,2021-03-22,Mon Mar 22 05:49:16 +0000 2021,1373874400114671620,Susan27095135,#Minnesota,Not Geo-tagged,"b""@PookiakPozniak @ReparSandra @davenewworld_2 Isn't HIPPA about keeping one's health info private. \nAnother COOCOO CLOCK""",$MENTION$ $MENTION$ $MENTION$ Isn't HIPPA about keeping one's health info private. Another COOCOO CLOCK,Is not HIPPA about keeping one's health info private. Another COOCOO CLOCK,is hippa keeping one health info private another coocoo clock,be hippa keep one health info private another coocoo clock,[],{},{},1,3,[],,"['Sharon Pozniak 🇺🇸🌊🌘🐿', 'Sandra Repar BLM', 'Fifty Shades of Whey']",0.0
339,2021-03-22,Mon Mar 22 05:47:14 +0000 2021,1373873885825933312,evolvan,Ludhiana,Not Geo-tagged,b'Our #heartiest #welcome goes to Satnam Singh. #Congratulations on being #part of our #growing and #dynamic #team here! We\xe2\x80\x99re #honored to have you with Evolvan Info Solutions Private Limited!\n\n#onboarding #newjoinee #newmember #reactdeveloper #phpdeveloper #javascriptdeveloper https://t.co/I4K5lsE5Bn',Our $HASHTAG$ $HASHTAG$ goes to Satnam Singh. $HASHTAG$ on being $HASHTAG$ of our $HASHTAG$ and $HASHTAG$ $HASHTAG$ here! Were $HASHTAG$ to have you with Evolvan Info Solutions Private Limited! $HASHTAG$ $HASHTAG$ $HASHTAG$ $HASHTAG$ $HASHTAG$ $HASHTAG$ $URL$,Our goes to Satnam Singh. on being of our and here! We re to have you with Evolvan Info Solutions Private Limited!,our goes satnam singh we evolvan info solutions private limited,go satnam singh evolvan info solution private limited,[],{},{},0,1,"['heartiest', 'welcome', 'Congratulations', 'part', 'growing', 'dynamic', 'team', 'honored', 'onboarding', 'newjoinee', 'newmember', 'reactdeveloper', 'phpdeveloper', 'javascriptdeveloper']",,[],-0.1984
330,2021-03-22,Mon Mar 22 06:39:41 +0000 2021,1373887085610893317,chlgroup,"Australia,Timor,Chile,PNG,Peru, Rwanda",Not Geo-tagged,"b'Are you looking to #rent out your property  in the #Hastings, #Kempsey or #Taree areas? As part of a NSW Government initiative, CHL are looking to #lease a limited number of #properties from the private sector.\nPlease contact Ian Welsh on 02 6583 6717 for more info. https://t.co/8cQDD2nWRA'","Are you looking to $HASHTAG$ out your property in the $HASHTAG$, $HASHTAG$ or $HASHTAG$ areas? As part of a NSW Government initiative, CHL are looking to $HASHTAG$ a limited number of $HASHTAG$ from the private sector. Please contact Ian Welsh on $NUMBER$ $NUMBER$ $NUMBER$ for more info. $URL$","Are you looking to out your property in the , or areas? As part of a NSW Government initiative, CHL are looking to a limited number of from the private sector. Please contact Ian Welsh on for more info.",are looking property areas as part nsw government initiative chl looking limited number private sector please contact ian welsh info,be look property area as part nsw government initiative chl look limited number private sector please contact ian welsh info,[],{},{},1,1,"['rent', 'Hastings', 'Kempsey', 'Taree', 'lease', 'properties']",,[],0.1779
304,2021-03-22,Mon Mar 22 09:28:32 +0000 2021,1373929578062868487,ACB46235111,,Not Geo-tagged,"b'@TheaCanada @CBCPolitics Is the entire government working for the US?  Trudeau obviously is, then there is also the CBA that is just too happy to do as the US orders them to, and now CRA is sending private info of Canadians to the US, which is also treason.'","$MENTION$ $MENTION$ Is the entire government working for the US? Trudeau obviously is, then there is also the CBA that is just too happy to do as the US orders them to, and now CRA is sending private info of Canadians to the US, which is also treason.","Is the entire government working for the US? Trudeau obviously is, then there is also the CBA that is just too happy to do as the US orders them to, and now CRA is sending private info of Canadians to the US, which is also treason.",is entire government working us trudeau obviously also cba happy us orders cra sending private info canadians us also treason,be entire government work trudeau obviously also cba happy us order cra send private info canadian also treason,[],{},{},0,0,[],,"['Tea 🇨🇦', 'CBC Politics']",0.2023
322,2021-03-22,Mon Mar 22 07:50:33 +0000 2021,1373904920328335360,yangliuxh,Beijing,Not Geo-tagged,"b""Awareness for protecting private info against commercial exploitation significantly rose since last year, the Chinese gov't has pledged to take measures to curb unnecessary personal information gathering. Aside from the regulation, a related legislation is in the pipeline. End""","Awareness for protecting private info against commercial exploitation significantly rose since last year, the Chinese gov't has pledged to take measures to curb unnecessary personal information gathering. Aside from the regulation, a related legislation is in the pipeline. End","Awareness for protecting private info against commercial exploitation significantly rose since last year, the Chinese gov't has pledged to take measures to curb unnecessary personal information gathering. Aside from the regulation, a related legislation is in the pipeline. End",awareness protecting private info commercial exploitation significantly rose since last year chinese gov pledged take measures curb unnecessary personal information gathering aside regulation related legislation pipeline end,awareness protect private info commercial exploitation significantly rise since last year chinese gov pledge take measure curb unnecessary personal information gather aside regulation related legislation pipeline end,[],{},{},0,0,[],,[],0.0
316,2021-03-22,Mon Mar 22 08:14:33 +0000 2021,1373910958649708546,rachan_pyon,WinKun’s Hand Veins,Not Geo-tagged,b'@dongsichengpogi They\xe2\x80\x99re throwing the ssng word so easily to everyone lol the only proven ssng is winter wh!te since she\xe2\x80\x99s the only one who follows him even on private schedules others are all work related schedules but not announced to public but of course those info are easily obtained \xf0\x9f\xa4\xb7\xf0\x9f\x8f\xbb\xe2\x80\x8d\xe2\x99\x80\xef\xb8\x8f',$MENTION$ Theyre throwing the ssng word so easily to everyone lol the only proven ssng is winter wh!te since shes the only one who follows him even on private schedules others are all work related schedules but not announced to public but of course those info are easily obtained $EMOJI$$EMOJI$,They re throwing the ssng word so easily to everyone lol the only proven ssng is winter wh!te since she s the only one who follows him even on private schedules others are all work related schedules but not announced to public but of course those info are easily obtained,they throwing ssng word easily everyone lol proven ssng winter te since one follows even private schedules others work related schedules announced public course info easily obtained,throw ssng word easily everyone lol prove ssng winter te since one follow even private schedule other work related schedule announce public course info easily obtain,[],{},{},0,1,[],,['ًhana priv.'],0.7469
306,2021-03-22,Mon Mar 22 09:16:30 +0000 2021,1373926548114436101,bassemh1,,Not Geo-tagged,b'@firassabiad There are rumors circulating about how the imported Sputnik V to Leb will be distributed. Do you know if Sputnik vaccination will be handled by MOPH or directly by the importing company/private clinics? Apparently people are being asked to register to take it. Any info? Thanks!',$MENTION$ There are rumors circulating about how the imported Sputnik V to Leb will be distributed. Do you know if Sputnik vaccination will be handled by MOPH or directly by the importing company/private clinics? Apparently people are being asked to register to take it. Any info? Thanks!,There are rumors circulating about how the imported Sputnik V to Leb will be distributed. Do you know if Sputnik vaccination will be handled by MOPH or directly by the importing company/private clinics? Apparently people are being asked to register to take it. Any info? Thanks!,there rumors circulating imported sputnik leb distributed do know sputnik vaccination handled moph directly importing company private clinics apparently people asked register take any info thanks,there rumor circulate import sputnik leb distribute do know sputnik vaccination handle moph directly import company private clinic apparently people ask register take any info thank,[],{},{},0,0,[],,['Firass Abiad'],0.5502
334,2021-03-22,Mon Mar 22 06:22:45 +0000 2021,1373882822595915776,GooglePayIndia,India,Not Geo-tagged,"b""@gupta_vikash Sorry to hear that, Vikash. Unfortunately, We don't have an option to arrange a callback right now. Without revealing any private info, could you share more details about your query? We'll do our best to help.""","$MENTION$ Sorry to hear that, Vikash. Unfortunately, We don't have an option to arrange a callback right now. Without revealing any private info, could you share more details about your query? We'll do our best to help.","Sorry to hear that, Vikash. Unfortunately, We do not have an option to arrange a callback right now. Without revealing any private info, could you share more details about your query? We'll do our best to help.",sorry hear vikash unfortunately we option arrange callback right without revealing private info could share details query we best help,sorry hear vikash unfortunately option arrange callback right without reveal private info could share detail query well help,[],{},{},0,0,[],,['VIKASH GUPTA'],0.7506
327,2021-03-22,Mon Mar 22 07:42:03 +0000 2021,1373902782722412547,favtr5,South Africa,Not Geo-tagged,"b'@macmonate @2001_019108_08 @Manikipi @vngalwana My mistake, how did a private company shareholder order a whole police force? It seems inconceivable that an ordinary citizen can have such powers, but then again the country is run by the Ruperts and Oppenheimers. Thanks for bringing that info to my knowledge l had overlooked it'","$MENTION$ $MENTION$ $MENTION$ $MENTION$ My mistake, how did a private company shareholder order a whole police force? It seems inconceivable that an ordinary citizen can have such powers, but then again the country is run by the Ruperts and Oppenheimers. Thanks for bringing that info to my knowledge l had overlooked it","My mistake, how did a private company shareholder order a whole police force? It seems inconceivable that an ordinary citizen can have such powers, but then again the country is run by the Ruperts and Oppenheimers. Thanks for bringing that info to my knowledge l had overlooked it",my mistake private company shareholder order whole police force it seems inconceivable ordinary citizen powers country run ruperts oppenheimers thanks bringing info knowledge overlooked,mistake private company shareholder order whole police force seem inconceivable ordinary citizen power country run rupert oppenheimer thank bring info knowledge overlook,[],{},{},0,0,[],,"['Mduduzi Hadebe 🇿🇦™', 'The Apartheid Museum = GRCCasino& Jewish/ANC Fraud', 'Manikivana', 'Simply Vido']",0.7906
314,2021-03-22,Mon Mar 22 08:30:18 +0000 2021,1373914924561367047,ProPropertyG,"Leederville, Perth (WA)",Not Geo-tagged,"b""\xf0\x9f\x94\xa5JUST LISTED\n16 Meredith Way, DIANELLA\n\nGOLDEN TRIANGLE MASTERPIECE!\n\nThis home is luxurious &amp; versatile with 5 brm, 3 bath, office &amp; theatre room. It's a once in a lifetime opportunity to secure your own private oasis\n\nMore Info: https://t.co/pOkqHoYCpe https://t.co/8fxop5beRt""","$EMOJI$JUST LISTED $NUMBER$ Meredith Way, DIANELLA GOLDEN TRIANGLE MASTERPIECE! This home is luxurious &amp; versatile with $NUMBER$ brm, $NUMBER$ bath, office &amp; theatre room. It's a once in a lifetime opportunity to secure your own private oasis More Info: $URL$ $URL$","JUST LISTED Meredith Way, DIANELLA GOLDEN TRIANGLE MASTERPIECE! This home is luxurious &amp; versatile with brm, bath, office &amp; theatre room. It's a once in a lifetime opportunity to secure your own private oasis More Info",just listed meredith way dianella golden triangle masterpiece this home luxurious versatile brm bath office theatre room it lifetime opportunity secure private oasis more info,just list meredith way dianella golden triangle masterpiece this home luxurious versatile brm bath office theatre room lifetime opportunity secure private oasis more info,[],{},{},0,0,[],http://ow.ly/eoWD50E4Fux,[],0.884
345,2021-03-22,Mon Mar 22 05:03:09 +0000 2021,1373862791057186816,RegenNightOwl,,Not Geo-tagged,"b""Just realized I can't set up a PayPal and keep my personal info private at the same time... not sure what to do about that :/""",Just realized I can't set up a PayPal and keep my personal info private at the same time... not sure what to do about that :/,Just realized I ca not set up a PayPal and keep my personal info private at the same time.. not sure what to do about that /,just realized set paypal keep personal info private time sure,just realize set paypal keep personal info private time sure,[],{},{},0,0,[],,[],-0.2411
326,2021-03-22,Mon Mar 22 07:42:45 +0000 2021,1373902956232372226,NiBuL,"Qatar/ Thrissur, India",Not Geo-tagged,b'@DohaBankQatar Just noticed an important safety vulnerability in your webpage and access portal. Anyone with an internet connection can easily access customers private info including accoutn details via your website easily. DM for details.\nHad to tweet cos  Customer service was\xf0\x9f\x98\x91',$MENTION$ Just noticed an important safety vulnerability in your webpage and access portal. Anyone with an internet connection can easily access customers private info including accoutn details via your website easily. DM for details. Had to tweet cos Customer service was$EMOJI$,Just noticed an important safety vulnerability in your webpage and access portal. Anyone with an internet connection can easily access customers private info including accoutn details via your website easily. DM for details. Had to tweet cos Customer service was,just noticed important safety vulnerability webpage access portal anyone internet connection easily access customers private info including accoutn details via website easily dm details had tweet cos customer service,just notice important safety vulnerability webpage access portal anyone internet connection easily access customer private info include accoutn detail via website easily dm detail have tweet cos customer service,[],{},{},0,0,[],,['Doha Bank'],0.7579
