s_no,date,created_at,id_str,screen_name,user_location,geo-tagged_place,tweet_text,tweet_tokenized,tweet_cleaned,tweet_filtered,tweet_lemmatized,tweet_mentioned_organizations,tweet_tags_classified,tweet_orgs_classified,retweet_count,fav_count,hashtags,urls,mentions,vader_polarity
311,2021-03-23,Tue Mar 23 07:14:35 +0000 2021,1374258254642040836,AnimeLover2805,South Texas ,Not Geo-tagged,b'@CuteDiaper_ OK so I just read the tweet from the 2nd party and yours and from what I understand there as a mix up between orders and another customers order information was sent to the wrong customer unintentionally causing a problem with private and personal info being shared',$MENTION$ OK so I just read the tweet from the $NUMBER$nd party and yours and from what I understand there as a mix up between orders and another customers order information was sent to the wrong customer unintentionally causing a problem with private and personal info being shared,OK so I just read the tweet from the nd party and yours and from what I understand there as a mix up between orders and another customers order information was sent to the wrong customer unintentionally causing a problem with private and personal info being shared,ok read tweet party understand mix orders another customers order information sent wrong customer unintentionally causing problem private personal info shared,ok read tweet party understand mix order another customer order information send wrong customer unintentionally cause problem private personal info share,[],{},{},0,0,[],,['Cute Diaper'],0.3034
299,2021-03-23,Tue Mar 23 08:09:18 +0000 2021,1374272025833787392,psabadi15,Jalan. Kemanggisan Ilir No.15 ,Not Geo-tagged,"b'""Great things in business are never done by one person. They\'re done by a team of people""\n.\nIf you NEED Sports Instructor for private / group class at Home, Office &amp; etc, PSA can provide!\n.\nFor more info about Sports Instructor:\nPlease DM or whatsapp to +62-813-1109-2957\n. https://t.co/eGaaOMGoK9'","""Great things in business are never done by one person. They're done by a team of people"" . If you NEED Sports Instructor for private / group class at Home, Office &amp; etc, PSA can provide! . For more info about Sports Instructor: Please DM or whatsapp to +62-813-1109-2957 . $URL$","""Great things in business are never done by one person. They're done by a team of people"" . If you NEED Sports Instructor for private / group class at Home, Office &amp; etc, PSA can provide! . For more info about Sports Instructor Please DM or whatsapp to +62-813-1109-2957 .",great things business never done one person they done team people if need sports instructor private group class home office etc psa provide for info sports instructor please dm whatsapp,great thing business never do one person do team people if need sport instructor private group class home office etc psa provide for info sport instructor please dm whatsapp,[],{},{},0,0,[],,[],0.7712
327,2021-03-23,Tue Mar 23 06:34:45 +0000 2021,1374248230683340806,tomathay,Karls Heart,Not Geo-tagged,"b'@kaceytron Well they doxxed, took your private info for a reason Kaceytron, wonder what that reason is...'","$MENTION$ Well they doxxed, took your private info for a reason Kaceytron, wonder what that reason is...","Well they doxxed, took your private info for a reason Kaceytron, wonder what that reason is..",well doxxed took private info reason kaceytron wonder reason,well doxxed take private info reason kaceytron wonder reason,[],{},{},0,3,[],,['kaceytron'],0.2732
322,2021-03-23,Tue Mar 23 06:51:50 +0000 2021,1374252532604805125,LordOfTheYiffs,"{ country_code: ""HU"" }",Not Geo-tagged,"b""@Furry_Patriot He was actually jailed for talking about the court case in public. I've even found medical documents online that includes private info, such as his son's deadname.""","$MENTION$ He was actually jailed for talking about the court case in public. I've even found medical documents online that includes private info, such as his son's deadname.","He was actually jailed for talking about the court case in public. I've even found medical documents online that includes private info, such as his son's deadname.",he actually jailed talking court case public even found medical documents online includes private info son deadname,actually jail talk court case public even find medical document online include private info son deadname,[],{},{},0,50,[],,['Furry Patriot'],-0.4939
344,2021-03-23,Tue Mar 23 04:57:55 +0000 2021,1374223862171373570,REDCHENGQING,Caiyi. ,Not Geo-tagged,b'Private info again. \xf0\x9f\xa4\xad\n\nhttps://t.co/LewJtrFKcB',Private info again. $URL$,Private info again.,private info,private info,[],{},{},0,0,[],https://twitter.com/J4NGIE/status/1372281001590853633?s=19,[],0.0
315,2021-03-23,Tue Mar 23 07:08:06 +0000 2021,1374256622973816834,loveleewoozi,Singapore,Not Geo-tagged,"b'Oh I just found out that she shares our private conversation with a group of people. Most probably incomplete info. No wonder I am getting attacked by her ""friends"". Sure. And if I share the entire google drive of every conversation we had, she wouldn\'t mind will she?'","Oh I just found out that she shares our private conversation with a group of people. Most probably incomplete info. No wonder I am getting attacked by her ""friends"". Sure. And if I share the entire google drive of every conversation we had, she wouldn't mind will she?","Oh I just found out that she shares our private conversation with a group of people. Most probably incomplete info. No wonder I am getting attacked by her ""friends"". Sure. And if I share the entire google drive of every conversation we had, she would not mind will she?",oh found shares private conversation group people most probably incomplete info no wonder getting attacked friends sure and share entire google drive every conversation would mind,oh find share private conversation group people most probably incomplete info no wonder get attack friend sure and share entire google drive every conversation would mind,[],{},{},0,65,[],,[],0.5574
314,2021-03-23,Tue Mar 23 07:11:00 +0000 2021,1374257355714625538,webberwentzel,Johannesburg | Cape Town,Not Geo-tagged,"b'No extension to #POPI Act grace period, says info regulator. According to Advocate Tlakula, the Information Regulator is in the process of making final preparations for SA\xe2\x80\x99s data privacy law that is set to kick in on 1 July. #POPIA #PrivacyLaw @ITWeb\n\nhttps://t.co/n0f0zUJEgP'","No extension to $HASHTAG$ Act grace period, says info regulator. According to Advocate Tlakula, the Information Regulator is in the process of making final preparations for SAs data privacy law that is set to kick in on $NUMBER$ July. $HASHTAG$ $HASHTAG$ $MENTION$ $URL$","No extension to Act grace period, says info regulator. According to Advocate Tlakula, the Information Regulator is in the process of making final preparations for SA s data privacy law that is set to kick in on July.",no extension act grace period says info regulator according advocate tlakula information regulator process making final preparations sa data privacy law set kick july,no extension act grace period say info regulator accord advocate tlakula information regulator process make final preparation sa datum privacy law set kick july,[],{},{},1,0,"['POPI', 'POPIA', 'PrivacyLaw']",https://bit.ly/3cJ572P,['ITWeb News Publication'],0.1531
321,2021-03-23,Tue Mar 23 06:55:32 +0000 2021,1374253461869457408,PriyankaPulla,Bangalore,Not Geo-tagged,"b""While I am worried about what information AZ has hidden regarding the vaccine's efficacy, I am also impressed NIAID made this info public instead of quietly telling AZ in a private conversation.""","While I am worried about what information AZ has hidden regarding the vaccine's efficacy, I am also impressed NIAID made this info public instead of quietly telling AZ in a private conversation.","While I am worried about what information AZ has hidden regarding the vaccine's efficacy, I am also impressed NIAID made this info public instead of quietly telling AZ in a private conversation.",while worried information az hidden regarding vaccine efficacy also impressed niaid made info public instead quietly telling az private conversation,while worried information az hide regard vaccine efficacy also impress niaid make info public instead quietly tell az private conversation,[],{},{},4,15,[],,[],0.2263
326,2021-03-23,Tue Mar 23 06:39:29 +0000 2021,1374249423035891713,nyuberrysales,"Florida, USA",Not Geo-tagged,b'hi! will you be posting the masterlist of who was able to secure the japan lucky draw? \xe2\x80\x94 yes we will be! I am currently working on making a version that doesn\xe2\x80\x99t reveal people\xe2\x80\x99s private info i hope to have it up by the morning! -\xf0\x9f\x8d\x93 https://t.co/6h2AclucVn',hi! will you be posting the masterlist of who was able to secure the japan lucky draw? yes we will be! I am currently working on making a version that doesnt reveal peoples private info i hope to have it up by the morning! -$EMOJI$ $URL$,hi! will you be posting the masterlist of who was able to secure the japan lucky draw? yes we will be! I am currently working on making a version that doesn t reveal people s private info i hope to have it up by the morning! -,posting masterlist able secure japan lucky draw yes currently working making version reveal people private info hope morning,post masterlist able secure japan lucky draw yes currently work make version reveal people private info hope morning,[],{},{},0,5,[],https://curiouscat.qa/nyuberrysales/post/1193265468,[],0.8928
320,2021-03-23,Tue Mar 23 06:58:05 +0000 2021,1374254104533368835,Born2beARMY,13430,Not Geo-tagged,"b'Today is reminding me of the time Will Smith said ""I was stupid but in private!Unlike the young ones of today."" \xf0\x9f\x98\x85\nYou have the power of getting info right at ur fingertips,unlike us who had to depend on mainstream media(we know HOW truthful they are!!) yet you choose to be dumb!'","Today is reminding me of the time Will Smith said ""I was stupid but in private!Unlike the young ones of today."" $EMOJI$ You have the power of getting info right at ur fingertips,unlike us who had to depend on mainstream media(we know HOW truthful they are!!) yet you choose to be dumb!","Today is reminding me of the time Will Smith said ""I was stupid but in private!Unlike the young ones of today."" You have the power of getting info right at ur fingertips,unlike us who had to depend on mainstream media(we know HOW truthful they are!!) yet you choose to be dumb!",today reminding time will smith said stupid private unlike young ones today you power getting info right ur fingertips unlike depend mainstream media know how truthful yet choose dumb,today reminding time will smith say stupid private unlike young one today power get info right ur fingertip unlike depend mainstream medium know how truthful yet choose dumb,[],{},{},0,0,[],,[],-0.5883
349,2021-03-23,Tue Mar 23 04:43:33 +0000 2021,1374220248321294336,REDCHENGQING,Caiyi. ,Not Geo-tagged,"b""That's private info hehe \xf0\x9f\xa4\xad\n\nhttps://t.co/rULSmP5eT4""",That's private info hehe $URL$,That's private info hehe,that private info hehe,that private info hehe,[],{},{},0,0,[],https://twitter.com/J4NGIE/status/1372279027872976899?s=19,[],0.0
335,2021-03-23,Tue Mar 23 05:50:09 +0000 2021,1374237009422606337,ChromeJk,,Not Geo-tagged,b'Comtech Info Solution Private Limited Hiring for Job Posts https://t.co/KZSrC8llCI',Comtech Info Solution Private Limited Hiring for Job Posts $URL$,Comtech Info Solution Private Limited Hiring for Job Posts,comtech info solution private limited hiring job posts,comtech info solution private limited hiring job post,[],{},{},0,0,[],https://www.jkchrome.com/comtech-info-solution-private-limited-hiring-for-job-posts/,[],0.1027
333,2021-03-23,Tue Mar 23 05:56:37 +0000 2021,1374238634455490561,TeamYouTube,"San Bruno, CA",Not Geo-tagged,b'@janeesy Thanks for the update \xe2\x80\x93 are you getting any error messages? Mind sending us a screenshot (without capturing your private info) so we can take a look? Keep us posted',$MENTION$ Thanks for the update are you getting any error messages? Mind sending us a screenshot (without capturing your private info) so we can take a look? Keep us posted,Thanks for the update are you getting any error messages? Mind sending us a screenshot (without capturing your private info) so we can take a look? Keep us posted,thanks update getting error messages mind sending screenshot without capturing private info take look keep posted,thanks update get error message mind send screenshot without capture private info take look keep post,[],{},{},0,0,[],,['Jane'],0.1431
319,2021-03-23,Tue Mar 23 06:58:37 +0000 2021,1374254236612108288,ChrisBTCbull,Private telegram channel ✌️,Not Geo-tagged,b'\xf0\x9f\x91\x80INFO\xf0\x9f\x91\x80\n\xf0\x9f\x9f\xa2 I invite everyone who does not want to lose money to my private telegram channel.\n\n\xf0\x9f\x9f\xa2Details on my public trial channel \xf0\x9f\x91\x89 https://t.co/cQWfjCZwaa\n- how to understand my forecasts correctly;\n- how to connect to a private channel;\n- What coins do I make forecasts for?',$EMOJI$INFO$EMOJI$ I invite everyone who does not want to lose money to my private telegram channel. Details on my public trial channel $EMOJI$ $URL$ - how to understand my forecasts correctly; - how to connect to a private channel; - What coins do I make forecasts for?,INFO I invite everyone who does not want to lose money to my private telegram channel. Details on my public trial channel - how to understand my forecasts correctly; - how to connect to a private channel; - What coins do I make forecasts for?,info invite everyone want lose money private telegram channel details public trial channel understand forecasts correctly connect private channel what coins make forecasts,info invite everyone want lose money private telegram channel detail public trial channel understand forecast correctly connect private channel what coin make forecast,[],{},{},1,17,[],https://t.me/forecastchris,[],0.3891
350,2021-03-23,Tue Mar 23 04:35:17 +0000 2021,1374218166470115330,cumpoggers,,Not Geo-tagged,b'@BigSheddieGLad @sarin_sage @ShapedInternet how the fuck is someones pronouns private info',$MENTION$ $MENTION$ $MENTION$ how the fuck is someones pronouns private info,how the fuck is someones pronouns private info,fuck someones pronouns private info,fuck someone pronoun private info,[],{},{},0,1,[],,"['Shedd', 'spooky spooks', 'Things That Changed the Internet']",-0.5423
340,2021-03-23,Tue Mar 23 05:29:29 +0000 2021,1374231805428068352,HijabBidadari,"Yogyakarta, Indonesia",Not Geo-tagged,b'open private bo vcs\nincl /exc\xf0\x9f\x8f\xa2 slot terbatas say\ninfo DM or Wa082289702951\xf0\x9f\x93\xb2\n#vcssangek\n#vcsyuk #vcshot #angelsemarang\n#opensemarang\n#includejaksel\n#excludekediri\n#bisyarsemarang\n#bispaksemarang\n#TrustedBooking\n#TrustedAngels\n#Recomended4BO\n#vcs\n#vcsreal\n#vcscolmek \n#semarangbo https://t.co/aVzgc1Z4NA',open private bo vcs incl /exc$EMOJI$ slot terbatas say info DM or Wa082289702951$EMOJI$ $HASHTAG$ $HASHTAG$ $HASHTAG$ $HASHTAG$ $HASHTAG$ $HASHTAG$ $HASHTAG$ $HASHTAG$ $HASHTAG$ $HASHTAG$ $HASHTAG$ $HASHTAG$ $HASHTAG$ $HASHTAG$ $HASHTAG$ $HASHTAG$ $URL$,open private bo vcs incl /exc slot terbatas say info DM or Wa082289702951,open private vcs incl exc slot terbatas say info dm wa,open private vcs incl exc slot terbata say info dm wa,[],{},{},1,1,"['vcssangek', 'vcsyuk', 'vcshot', 'angelsemarang', 'opensemarang', 'includejaksel', 'excludekediri', 'bisyarsemarang', 'bispaksemarang', 'TrustedBooking', 'TrustedAngels', 'Recomended4BO', 'vcs', 'vcsreal', 'vcscolmek', 'semarangbo']",,[],0.0
330,2021-03-23,Tue Mar 23 06:19:08 +0000 2021,1374244302411329537,whoknowsmarz,BAY AREA,Not Geo-tagged,"b'@TakeAKnee87 @NourishedByNat Courtesy to you?  \n\nPrivate health info is absolutely no ones business.  If said person decides to disclose that info, their choice.'","$MENTION$ $MENTION$ Courtesy to you? Private health info is absolutely no ones business. If said person decides to disclose that info, their choice.","Courtesy to you? Private health info is absolutely no ones business. If said person decides to disclose that info, their choice.",courtesy private health info absolutely ones business if said person decides disclose info choice,courtesy private health info absolutely one business if say person decide disclose info choice,[],{},{},0,0,[],,"['Ryan', 'Nat’s Alter Ego 🇯🇲']",0.0018
338,2021-03-23,Tue Mar 23 05:37:11 +0000 2021,1374233744463237121,GooglePayIndia,India,Not Geo-tagged,"b""@AMAN7PREETSINGH Regret the inconvenience, Aman. Without revealing any private info, could you let us know if you're seeing any error message? Keep us posted.""","$MENTION$ Regret the inconvenience, Aman. Without revealing any private info, could you let us know if you're seeing any error message? Keep us posted.","Regret the inconvenience, Aman. Without revealing any private info, could you let us know if you're seeing any error message? Keep us posted.",regret inconvenience aman without revealing private info could let know seeing error message keep posted,regret inconvenience aman without reveal private info could let know see error message keep post,[],{},{},0,0,[],,['AMAN'],-0.7906
339,2021-03-23,Tue Mar 23 05:32:20 +0000 2021,1374232526118588416,lazismyname7,“SOMEWHERE OVER THE RAINBOW”,Not Geo-tagged,b'@JohnMic93707886 Something is not functioning properly look \xf0\x9f\x91\x80 do a restart on your phone if you remember your private info or just reset phone which is better',$MENTION$ Something is not functioning properly look $EMOJI$ do a restart on your phone if you remember your private info or just reset phone which is better,Something is not functioning properly look do a restart on your phone if you remember your private info or just reset phone which is better,something functioning properly look restart phone remember private info reset phone better,something function properly look restart phone remember private info reset phone well,[],{},{},0,2,[],,['Michael.🌸❤️🌸❤️❤️🌸❤️🌸❤️'],0.4404
323,2021-03-23,Tue Mar 23 06:44:14 +0000 2021,1374250620249542663,AusHCIndia,"New Delhi, India",Not Geo-tagged,b'The India to Australia group will run private charter \xe2\x9c\x88\xef\xb8\x8f from Bengaluru to Perth &amp; Sydney on 8 April. We are not in a position to endorse this offer but will help facilitate the\xe2\x9c\x88\xef\xb8\x8fthrough the various approval processes. More info \xf0\x9f\x91\x89 https://t.co/yUhUUPLFwh (1/2) https://t.co/mTkHXoaM8X',The India to Australia group will run private charter $EMOJI$ from Bengaluru to Perth &amp; Sydney on $NUMBER$ April. We are not in a position to endorse this offer but will help facilitate the$EMOJI$through the various approval processes. More info $EMOJI$ $URL$ (1/2) $URL$,The India to Australia group will run private charter from Bengaluru to Perth &amp; Sydney on April. We are not in a position to endorse this offer but will help facilitate the through the various approval processes. More info (1/2),the india australia group run private charter bengaluru perth sydney april we position endorse offer help facilitate various approval processes more info,the india australia group run private charter bengaluru perth sydney april position endorse offer help facilitate various approval process more info,[],{},{},7,24,[],https://www.indiatoaustraliagroup.com/,[],0.8537
334,2021-03-23,Tue Mar 23 05:55:35 +0000 2021,1374238374450585600,Odrinhereboy,,Not Geo-tagged,"b""@danianfocus @EckhartsLadder If you're referring to the Quartering referencing one of the podcaster's first names, that's not what is being referred to here. Some other random person apparently doxxed them of all their private info.""","$MENTION$ $MENTION$ If you're referring to the Quartering referencing one of the podcaster's first names, that's not what is being referred to here. Some other random person apparently doxxed them of all their private info.","If you're referring to the Quartering referencing one of the podcaster's first names, that's not what is being referred to here. Some other random person apparently doxxed them of all their private info.",if referring quartering referencing one podcaster first names referred some random person apparently doxxed private info,if refer quarter reference one podcaster first name refer some random person apparently doxxe private info,[],{},{},0,0,[],,"['Daniel 🇬🇷⬛\U0001f7e7☣️', 'EckhartsLadder']",0.0
332,2021-03-23,Tue Mar 23 05:59:47 +0000 2021,1374239431553658880,braintumourlady,"Penzance, UK",Not Geo-tagged,"b'The @BrainTumourSupp forum is for anyone affected by a brain tumour. Also there are forums for more local groups. The groups are private, moderated and confidential so members can feel safe. For info go to https://t.co/sdzU2VSvvv #BTAM21 #BrainTumourAwarenessMonth #Support'","The $MENTION$ forum is for anyone affected by a brain tumour. Also there are forums for more local groups. The groups are private, moderated and confidential so members can feel safe. For info go to $URL$ $HASHTAG$ $HASHTAG$ $HASHTAG$","The forum is for anyone affected by a brain tumour. Also there are forums for more local groups. The groups are private, moderated and confidential so members can feel safe. For info go to",the forum anyone affected brain tumour also forums local groups the groups private moderated confidential members feel safe for info,the forum anyone affect brain tumour also forum local group the group private moderate confidential member feel safe for info,[],{},{},2,3,"['BTAM21', 'BrainTumourAwarenessMonth', 'Support']",http://braintumoursupport.co.uk/online-support,['Brain Tumour Support 💙'],0.3182
318,2021-03-23,Tue Mar 23 06:59:52 +0000 2021,1374254554993156102,er26584832,"Tangerang, Indonesia",Not Geo-tagged,"b""promo bo Hotel #santika\nAvail (ledis\xf0\x9f\x99\x8ehotel)\nWajib Via\xf0\x9f\x8f\xa7TF\n\xe2\xac\x86Open private #BO\n\xf0\x9f\x8f\xa8include/exclude\n\xf0\x9f\x8c\x8fArea free hotel's\n\xe2\x9b\x94Expo free\xe2\x9c\x8c\n\xf0\x9f\x93\xa9info RR 2.5jt 10jam LT\n\xf0\x9f\x93\xa9info RR1jt 1jm ST\n\xf0\x9f\x86\x99TOP service\n#availbo #ladiesbo #bispaktangerang #wptanggerang #botanggerang #TrustedBooking #TANGERANG""",promo bo Hotel $HASHTAG$ Avail (ledis$EMOJI$hotel) Wajib Via$EMOJI$TF Open private $HASHTAG$ $EMOJI$include/exclude $EMOJI$Area free hotel's $EMOJI$Expo free$EMOJI$ $EMOJI$info RR $NUMBER$jt $NUMBER$jam LT $EMOJI$info RR1jt $NUMBER$jm ST TOP service $HASHTAG$ $HASHTAG$ $HASHTAG$ $HASHTAG$ $HASHTAG$ $HASHTAG$ $HASHTAG$,promo bo Hotel Avail (ledis hotel) Wajib Via TF Open private include/exclude Area free hotel's Expo free info RR jt jam LT info RR1jt jm ST TOP service,promo hotel avail ledis hotel wajib via tf open private include exclude area free hotel expo free info rr jam lt info rr jm st top service,promo hotel avail ledis hotel wajib via tf open private include exclude area free hotel expo free info rr jam lt info rr jm st top service,[],{},{},1,1,"['santika', 'BO', 'availbo', 'ladiesbo', 'bispaktangerang', 'wptanggerang', 'botanggerang', 'TrustedBooking', 'TANGERANG']",,[],0.876
337,2021-03-23,Tue Mar 23 05:40:05 +0000 2021,1374234474033131524,Uber_Support,,Not Geo-tagged,"b""@josephs10167816 Thanks for reaching out. In order to protect your privacy, we don't encourage users to provide their account information through social media, please delete your post containing this info.""","$MENTION$ Thanks for reaching out. In order to protect your privacy, we don't encourage users to provide their account information through social media, please delete your post containing this info.","Thanks for reaching out. In order to protect your privacy, we do not encourage users to provide their account information through social media, please delete your post containing this info.",thanks reaching in order protect privacy encourage users provide account information social media please delete post containing info,thank reach in order protect privacy encourage user provide account information social medium please delete post contain info,[],{},{},0,0,[],,['joseph sharpe'],0.7094
357,2021-03-23,Tue Mar 23 04:13:35 +0000 2021,1374212704722817026,fitri_marl,,Not Geo-tagged,b'ready private BO say\ninfo by DM \n#availjawatengah \n#availjepara\n#openBOjepara\n#BOjepara\n#bisyarjepara\n#wpjepara\n#lendirjepara\n#realBOjepara\n#excludejepara\n#includejepara\n#ceweBOjepara\n#jeparabirahi\n#bispakjepara\n#realbojepara\n\nhttps://t.co/Hjty7mElSV',ready private BO say info by DM $HASHTAG$ $HASHTAG$ $HASHTAG$ $HASHTAG$ $HASHTAG$ $HASHTAG$ $HASHTAG$ $HASHTAG$ $HASHTAG$ $HASHTAG$ $HASHTAG$ $HASHTAG$ $HASHTAG$ $HASHTAG$ $URL$,ready private BO say info by DM,ready private bo say info dm,ready private bo say info dm,[],{},{},0,0,"['availjawatengah', 'availjepara', 'openBOjepara', 'BOjepara', 'bisyarjepara', 'wpjepara', 'lendirjepara', 'realBOjepara', 'excludejepara', 'includejepara', 'ceweBOjepara', 'jeparabirahi', 'bispakjepara', 'realbojepara']",,[],0.3612
355,2021-03-23,Tue Mar 23 04:16:05 +0000 2021,1374213334292123649,PlatlessIsHot,hell,Not Geo-tagged,"b'going private for tonight, can\xe2\x80\x99t handle it if someone decides to reply with my info.'","going private for tonight, cant handle it if someone decides to reply with my info.","going private for tonight, can t handle it if someone decides to reply with my info.",going private tonight handle someone decides reply info,go private tonight handle someone decide reply info,[],{},{},0,4,[],,[],0.0
