s_no,date,created_at,id_str,screen_name,user_location,geo-tagged_place,tweet_text,tweet_tokenized,tweet_cleaned,tweet_filtered,tweet_lemmatized,tweet_mentioned_organizations,tweet_tags_classified,tweet_orgs_classified,retweet_count,fav_count,hashtags,urls,mentions,vader_polarity
125,2021-02-07,Sun Feb 07 16:05:44 +0000 2021,1358446857459019780,JohnAla12122466,,Not Geo-tagged,b'SUPER BOWL SUNDAY SPECIAL.  150% Dep BONUS  ONLY 5x Rollover  INSANE PROPS. LIVE WAGERING OPTIONS. PARLAY ANY SPORT\xe2\x9a\xbd\xef\xb8\x8f\xf0\x9f\x8e\xbe\xf0\x9f\x8f\x80\xf0\x9f\x8f\x90\xf0\x9f\x8f\x93\xf0\x9f\x8f\x88\xf0\x9f\x8f\x89\xe2\x9a\xbe\xef\xb8\x8f\xf0\x9f\x8f\x92\xf0\x9f\xa5\x8a\xf0\x9f\xa5\x8b.  Full Casino n Racebook. 31+yrs in business. Private contact info available  ZELLE   FACEBOOK PAY   GOOGLE PAY   BITCOIN   CASHAPP  APPLE PAY',SUPER BOWL SUNDAY SPECIAL. $NUMBER$% Dep BONUS ONLY $NUMBER$x Rollover INSANE PROPS. LIVE WAGERING OPTIONS. PARLAY ANY SPORT$EMOJI$$EMOJI$$EMOJI$$EMOJI$$EMOJI$$EMOJI$$EMOJI$$EMOJI$$EMOJI$. Full Casino n Racebook. $NUMBER$+yrs in business. Private contact info available ZELLE FACEBOOK PAY GOOGLE PAY BITCOIN CASHAPP APPLE PAY,SUPER BOWL SUNDAY SPECIAL. % Dep BONUS ONLY x Rollover INSANE PROPS. LIVE WAGERING OPTIONS. PARLAY ANY SPORT . Full Casino n Racebook. +yrs in business. Private contact info available ZELLE FACEBOOK PAY GOOGLE PAY BITCOIN CASHAPP APPLE PAY,super bowl sunday special dep bonus only rollover insane props live wagering options parlay any sport full casino racebook yrs business private contact info available zelle facebook pay google pay bitcoin cashapp apple pay,super bowl sunday special dep bonus only rollover insane prop live wagering option parlay any sport full casino racebook yrs business private contact info available zelle facebook pay google pay bitcoin cashapp apple pay,[],{},{},0,0,[],,[],0.667
163,2021-02-07,Sun Feb 07 13:23:01 +0000 2021,1358405908510965760,BBBCentralIN,"Indianapolis, Indiana",Not Geo-tagged,b'@WTHRcom and @BobSegallWTHR share the stories of #identitytheft victims and the awful impact these scams have: https://t.co/0ByXqwmpU4. Do your best to protect your private info and if you have been a victim report it to https://t.co/3QHmi9Hq8E.  \n#StartWithTrust #Scamtracker https://t.co/HGT2nvEfMP',$MENTION$ and $MENTION$ share the stories of $HASHTAG$ victims and the awful impact these scams have: $URL$. Do your best to protect your private info and if you have been a victim report it to $URL$. $HASHTAG$ $HASHTAG$ $URL$,and share the stories of victims and the awful impact these scams have . Do your best to protect your private info and if you have been a victim report it to .,share stories victims awful impact scams do best protect private info victim report,share story victim awful impact scam do well protect private info victim report,[],{},{},2,2,"['identitytheft', 'StartWithTrust', 'Scamtracker']","https://bit.ly/3q5bSSp, http://Scamtracker.org","['WTHR.com', 'Bob Segall']",-0.296
119,2021-02-07,Sun Feb 07 16:22:18 +0000 2021,1358451029222694913,park_inn_seo,,Not Geo-tagged,"b""I read this info last year from a korean twitter-user. He/she twit this to explain that Winner isnt underrated in korea. I checked acc of this user but it's private now so I cant share the thread. Please feel free to add if u find other name of idol-rapper.""",I read this info last year from a korean twitter-user. He/she twit this to explain that Winner isnt underrated in korea. I checked acc of this user but it's private now so I cant share the thread. Please feel free to add if u find other name of idol-rapper.,I read this info last year from a korean twitter-user. He/she twit this to explain that Winner isnt underrated in korea. I checked acc of this user but it's private now so I cant share the thread. Please feel free to add if u find other name of idol-rapper.,read info last year korean twitter user he twit explain winner isnt underrated korea checked acc user private cant share thread please feel free add find name idol rapper,read info last year korean twitter user twit explain winner be not underrated korea check acc user private can not share thread please feel free add find name idol rapper,[],{},{},0,0,[],,[],0.7948
165,2021-02-07,Sun Feb 07 13:19:02 +0000 2021,1358404908505038849,pscwyers,she/her 17•✡︎•BLM•carrd byf,Not Geo-tagged,"b""and she's such a creep fting minors in the bath and telling them private info ab ur friend who ur freeloading of??? when lili drops her ugly ass https://t.co/SvIstAfTHh""",and she's such a creep fting minors in the bath and telling them private info ab ur friend who ur freeloading of??? when lili drops her ugly ass $URL$,and she's such a creep fting minors in the bath and telling them private info ab ur friend who ur freeloading of?? when lili drops her ugly ass,creep fting minors bath telling private info ur friend freeloading lili drops ugly ass,creep fte minor bath tell private info ur friend freeload lili drop ugly ass,[],{},{},0,10,[],https://twitter.com/pscwyers/status/1358404467272650762,[],-0.7399
159,2021-02-07,Sun Feb 07 13:44:10 +0000 2021,1358411232806658049,andyb69,"Scotland, United Kingdom",Not Geo-tagged,"b'@ShonaHay72 @CelticCelticCe1 @ZeynMo @albagubrath10 @ScottHastings13 No such thing as a private school in Scotland. They are Fee paying, and all those u have noted have a lot of pupils on some type of bursary scheme (they have to these days) Seems u have a bit of a chip on your shoulder. But again u got your info wrong \xf0\x9f\xa4\xa3'","$MENTION$ $MENTION$ $MENTION$ $MENTION$ $MENTION$ No such thing as a private school in Scotland. They are Fee paying, and all those u have noted have a lot of pupils on some type of bursary scheme (they have to these days) Seems u have a bit of a chip on your shoulder. But again u got your info wrong","No such thing as a private school in Scotland. They are Fee paying, and all those u have noted have a lot of pupils on some type of bursary scheme (they have to these days) Seems u have a bit of a chip on your shoulder. But again u got your info wrong",no thing private school scotland they fee paying noted lot pupils type bursary scheme days seems bit chip shoulder but got info wrong,no thing private school scotland fee pay note lot pupil type bursary scheme day seem bit chip shoulder but get info wrong,[],{},{},0,1,[],,"['Shona 🏴\U000e0067\U000e0062\U000e0073\U000e0063\U000e0074\U000e007f🇪🇺 #indyref2 #FBPE #Scottish', 'Celtic!Celtic!Celtic!', 'Zeyn', 'Dàibhidh MacAodh', 'Scott Hastings']",-0.6956
164,2021-02-07,Sun Feb 07 13:22:38 +0000 2021,1358405813488992263,thinkingdem,"Massachusetts, USA",Not Geo-tagged,b'@TODAYshow @KellyO Simple decision @WHCOS @POTUS \n\nEvaluate 45\xe2\x80\x99s eligibility to receive \n\nClassified info as if he was a \n\nPrivate citizen (which he is) \n\n\xe2\x80\x94\nHands down he fails that review \n\nAs do JAVANKA and many/most \n\nTrump admin officials \n\n@PressSec',$MENTION$ $MENTION$ Simple decision $MENTION$ $MENTION$ Evaluate $NUMBER$s eligibility to receive Classified info as if he was a Private citizen (which he is) Hands down he fails that review As do JAVANKA and many/most Trump admin officials $MENTION$,Simple decision Evaluate s eligibility to receive Classified info as if he was a Private citizen (which he is) Hands down he fails that review As do JAVANKA and many/most Trump admin officials,simple decision evaluate eligibility receive classified info private citizen hands fails review as javanka many trump admin officials,simple decision evaluate eligibility receive classified info private citizen hand fail review as javanka many trump admin official,[],{},{},0,7,[],,"['TODAY', ""Kelly O'Donnell"", 'Ronald Klain', 'President Biden', 'Jen Psaki']",-0.4215
155,2021-02-07,Sun Feb 07 13:55:57 +0000 2021,1358414199165235204,647_416,,Not Geo-tagged,"b""@narc_free @Karim_Adatia @VaesNico @ussuricat1 No idea but she doesn't seem to be the kind of person who would decline to record a short video herself about the situation. If she was such a private person, she wouldn't have agreed to have her shot broadcast and she wouldn't have disclosed personal info about her condition.""","$MENTION$ $MENTION$ $MENTION$ $MENTION$ No idea but she doesn't seem to be the kind of person who would decline to record a short video herself about the situation. If she was such a private person, she wouldn't have agreed to have her shot broadcast and she wouldn't have disclosed personal info about her condition.","No idea but she does not seem to be the kind of person who would decline to record a short video herself about the situation. If she was such a private person, she would not have agreed to have her shot broadcast and she would not have disclosed personal info about her condition.",no idea seem kind person would decline record short video situation if private person would agreed shot broadcast would disclosed personal info condition,no idea seem kind person would decline record short video situation if private person would agree shoot broadcast would disclosed personal info condition,[],{},{},0,0,[],,"['Narc Free Formula', 'Karim Adatia', 'Nico Vaes', 'ussuricat']",-0.4255
156,2021-02-07,Sun Feb 07 13:51:27 +0000 2021,1358413067248304130,Fil_Am_Expat,,Not Geo-tagged,"b'@Yousefer81 @CBSNews No private organization is obligated to collect info for contact tracing. Even if they chose to collect it, it can only be used specifically for the stated purpose. It\xe2\x80\x99s the same reason why schools are not obligated to share information about undocumented immigrant students.'","$MENTION$ $MENTION$ No private organization is obligated to collect info for contact tracing. Even if they chose to collect it, it can only be used specifically for the stated purpose. Its the same reason why schools are not obligated to share information about undocumented immigrant students.","No private organization is obligated to collect info for contact tracing. Even if they chose to collect it, it can only be used specifically for the stated purpose. It s the same reason why schools are not obligated to share information about undocumented immigrant students.",no private organization obligated collect info contact tracing even chose collect used specifically stated purpose it reason schools obligated share information undocumented immigrant students,no private organization obligate collect info contact trace even choose collect use specifically state purpose reason school obligate share information undocumente immigrant student,[],{},{},0,0,[],,"['kyle katarn', 'CBS News']",-0.4745
160,2021-02-07,Sun Feb 07 13:38:51 +0000 2021,1358409896366993411,iKunal_Shiva,India,Not Geo-tagged,"b'@ChinnaduraiS12 @bains_rajinder @BobBlackman Yes\n\n&amp; even in case of doubt they can ask any information by filing RTI, \n\nBut they will only believe these private sold out channels/You Tubers\n\nThey sell the narratives that these Govt. Institutions r sold out,\n\nNo genuine info. u can get there\nBut U will get here at my channel'","$MENTION$ $MENTION$ $MENTION$ Yes &amp; even in case of doubt they can ask any information by filing RTI, But they will only believe these private sold out channels/You Tubers They sell the narratives that these Govt. Institutions r sold out, No genuine info. u can get there But U will get here at my channel","Yes &amp; even in case of doubt they can ask any information by filing RTI, But they will only believe these private sold out channels/You Tubers They sell the narratives that these Govt. Institutions r sold out, No genuine info. u can get there But U will get here at my channel",yes even case doubt ask information filing rti but believe private sold channels you tubers they sell narratives govt institutions sold no genuine info get but get channel,yes even case doubt ask information filing rti but believe private sell channel tuber sell narrative govt institution sell no genuine info get but get channel,[],{},{},0,2,[],,"['Chinnadurai S', 'Rajinder Bains', 'Bob Blackman']",-0.4019
151,2021-02-07,Sun Feb 07 14:09:54 +0000 2021,1358417709504090114,RiotSupport,Available to Assist,Not Geo-tagged,"b""@Gerrit53694939 Hello there! Hmmm, this doens't looks ideal at all. :(\n\nPlease shoot us a Private DM with a bit more info and we will gladly take a look and see what can be done to assist! Also, which game are we talking about here and did this happen during the loading screen? \xf0\x9f\xa4\x94~ISodious""","$MENTION$ Hello there! Hmmm, this doens't looks ideal at all. :( Please shoot us a Private DM with a bit more info and we will gladly take a look and see what can be done to assist! Also, which game are we talking about here and did this happen during the loading screen? ~ISodious","Hello there! Hmm, this doens't looks ideal at all. ( Please shoot us a Private DM with a bit more info and we will gladly take a look and see what can be done to assist! Also, which game are we talking about here and did this happen during the loading screen? ~ISodious",hello hmm doens looks ideal please shoot private dm bit info gladly take look see done assist also game talking happen loading screen isodious,hello hmm doens look ideal please shoot private dm bit info gladly take look see do assist also game talk happen loading screen isodious,[],{},{},0,0,[],,['Gerrit'],0.7418
187,2021-02-07,Sun Feb 07 10:01:15 +0000 2021,1358355132858175489,SmartMoneyM,Usa,Not Geo-tagged,"b""Quinshaw Finance: What's happened to the bond it offered? - https://t.co/zTg8OxrSc1 #Investing #Fiat #Transfer #Privacy #Portfolio #Information #Qrcode #Government #Education #Bank https://t.co/1NPYHAVtnu""",Quinshaw Finance: What's happened to the bond it offered? - $URL$ $HASHTAG$ $HASHTAG$ $HASHTAG$ $HASHTAG$ $HASHTAG$ $HASHTAG$ $HASHTAG$ $HASHTAG$ $HASHTAG$ $HASHTAG$ $URL$,Quinshaw Finance What's happened to the bond it offered? -,quinshaw finance what happened bond offered,quinshaw finance what happen bond offer,[],{},{},1,1,"['Investing', 'Fiat', 'Transfer', 'Privacy', 'Portfolio', 'Information', 'Qrcode', 'Government', 'Education', 'Bank']",https://www.smartmoneymanagement.info/2021/02/quinshaw-finance-whats-happened-to-bond.html,[],0.0
139,2021-02-07,Sun Feb 07 14:49:57 +0000 2021,1358427787921678337,ZarosTheFurry,"Minnesota, USA",Not Geo-tagged,"b'@qutens_ Hey, I feel like I\xe2\x80\x99m gonna be buried under your notifications, but I was curious if you\xe2\x80\x99d like to join me for a small podcast on YouTube to talk about what\xe2\x80\x99s going on with DHC. c:\n\nBut! I understand if you want to keep your info/thoughts private. Let me know!'","$MENTION$ Hey, I feel like Im gonna be buried under your notifications, but I was curious if youd like to join me for a small podcast on YouTube to talk about whats going on with DHC. c: But! I understand if you want to keep your info/thoughts private. Let me know!","Hey, I feel like I m gonna be buried under your notifications, but I was curious if you d like to join me for a small podcast on YouTube to talk about what s going on with DHC. c But! I understand if you want to keep your info/thoughts private. Let me know!",hey feel like gon na buried notifications curious like join small podcast youtube talk going dhc but understand want keep info thoughts private let know,hey feel like gon na bury notification curious like join small podcast youtube talk go dhc but understand want keep info thought private let know,[],{},{},0,1,[],,['💕✨ qutens ✨💕'],0.8953
145,2021-02-07,Sun Feb 07 14:24:47 +0000 2021,1358421454929481732,SonicareUK,UK,Not Geo-tagged,"b'@pscartledge Hi there, Paul. Thank you kindly for sharing the info with us. Do you happen to have a proof of purchase? If so, could you share a screenshot with us (in a private message)? We should then be able to find the information we need. Awaiting your reply. :) https://t.co/hZenlaqztp'","$MENTION$ Hi there, Paul. Thank you kindly for sharing the info with us. Do you happen to have a proof of purchase? If so, could you share a screenshot with us (in a private message)? We should then be able to find the information we need. Awaiting your reply. :) $URL$","Hi there, Paul. Thank you kindly for sharing the info with us. Do you happen to have a proof of purchase? If so, could you share a screenshot with us (in a private message)? We should then be able to find the information we need. Awaiting your reply. )",hi paul thank kindly sharing info do happen proof purchase if could share screenshot private message we able find information need awaiting reply,hi paul thank kindly share info do happen proof purchase if could share screenshot private message able find information need await reply,[],{},{},0,0,[],https://twitter.com/messages/compose?recipient_id=534489059,['Paul Cartledge'],0.8767
162,2021-02-07,Sun Feb 07 13:26:59 +0000 2021,1358406909041254406,LateefJohar,"Toronto, Ontario","Toronto, Ontario, CA","b'It\xe2\x80\x99s been 47 days since #KarimaBaloch\xe2\x80\x99s body was found in Toronto but @JustinTrudeau\xe2\x80\x99s govt is still silent on her mysterious death, pretending nothing happened. Even the govt did nothing when @PakinCanada_ shared our private info online.\xf0\x9f\x98\xa2\n#JusticeForKarimaBaloch\n@cafreeland'","Its been $NUMBER$ days since $HASHTAG$ body was found in Toronto but $MENTION$ govt is still silent on her mysterious death, pretending nothing happened. Even the govt did nothing when $MENTION$ shared our private info online.$EMOJI$ $HASHTAG$ $MENTION$","It s been days since s body was found in Toronto but s govt is still silent on her mysterious death, pretending nothing happened. Even the govt did nothing when shared our private info online.",it days since body found toronto govt still silent mysterious death pretending nothing happened even govt nothing shared private info online,day since body find toronto govt still silent mysterious death pretend nothing happen even govt nothing share private info online,[],{},{},54,107,"['KarimaBaloch', 'JusticeForKarimaBaloch']",,"['Justin Trudeau', 'Pakistan High Commission Canada', 'Chrystia Freeland']",-0.8076
173,2021-02-07,Sun Feb 07 12:11:52 +0000 2021,1358388002687512580,BadACNHSJWs,,Not Geo-tagged,"b""Not to mention there's a burner that keeps releasing that same private info somewhere. \n\nThat AJ has ans accepted. \n\n\xf0\x9f\xa4\x94\xf0\x9f\xa4\x94\xf0\x9f\xa4\x94\n\nMakes you wonder if it's not the friend but AJ herself doing this. Speculation but fits the pattern.""",Not to mention there's a burner that keeps releasing that same private info somewhere. That AJ has ans accepted. Makes you wonder if it's not the friend but AJ herself doing this. Speculation but fits the pattern.,Not to mention there's a burner that keeps releasing that same private info somewhere. That AJ has ans accepted. Makes you wonder if it's not the friend but AJ herself doing this. Speculation but fits the pattern.,not mention burner keeps releasing private info somewhere that aj ans accepted makes wonder friend aj speculation fits pattern,not mention burner keep release private info somewhere that aj ans accepted make wonder friend aj speculation fit pattern,[],{},{},0,0,[],,[],-0.068
175,2021-02-07,Sun Feb 07 11:59:00 +0000 2021,1358384767629029383,curteboamusica,Republic of Mozambique,Not Geo-tagged,b'DJ Ace \xe2\x80\x93 210K Followers (Private School Piano Slow Jam Mix) https://t.co/Nl0OWZ6aof',DJ Ace $NUMBER$K Followers (Private School Piano Slow Jam Mix) $URL$,DJ Ace K Followers (Private School Piano Slow Jam Mix),dj ace followers private school piano slow jam mix,dj ace follower private school piano slow jam mix,[],{},{},0,0,[],https://curteboamusica.info/dj/dj-ace-210k-followers-private-school-piano-slow-jam-mix/,[],0.0
174,2021-02-07,Sun Feb 07 12:05:34 +0000 2021,1358386416867291138,JCRyle,,Not Geo-tagged,b'The Fruits of Your Public Worship\n\nThe best public worship is that which produces the best private Christianity. The best Church services for the congregation are those which make its individual members most holy at home and alone...\n\nhttps://t.co/HHqS4NActR',The Fruits of Your Public Worship The best public worship is that which produces the best private Christianity. The best Church services for the congregation are those which make its individual members most holy at home and alone... $URL$,The Fruits of Your Public Worship The best public worship is that which produces the best private Christianity. The best Church services for the congregation are those which make its individual members most holy at home and alone..,the fruits your public worship the best public worship produces best private christianity the best church services congregation make individual members holy home alone,the fruit public worship the good public worship produce good private christianity the good church service congregation make individual member holy home alone,[],{},{},5,25,[],https://www.jcryle.info/2021/02/the-fruits-of-your-public-worship.html,[],0.9432
169,2021-02-07,Sun Feb 07 12:47:05 +0000 2021,1358396867810361347,RRowanOlive,London ,Not Geo-tagged,"b'@Mianthrope I mean i guess if someone was currently incarcerated the logistics would probably be a challenge as I need to be able to get the participant info sheet to people and have them sign a consent form, and then they\xe2\x80\x99d need somewhere private to do the phone/online interview, but anyone'","$MENTION$ I mean i guess if someone was currently incarcerated the logistics would probably be a challenge as I need to be able to get the participant info sheet to people and have them sign a consent form, and then theyd need somewhere private to do the phone/online interview, but anyone","I mean i guess if someone was currently incarcerated the logistics would probably be a challenge as I need to be able to get the participant info sheet to people and have them sign a consent form, and then they d need somewhere private to do the phone/online interview, but anyone",mean guess someone currently incarcerated logistics would probably challenge need able get participant info sheet people sign consent form need somewhere private phone online interview anyone,mean guess someone currently incarcerate logistic would probably challenge need able get participant info sheet people sign consent form need somewhere private phone online interview anyone,[],{},{},0,1,[],,['Abdullah Mia'],0.1531
171,2021-02-07,Sun Feb 07 12:36:48 +0000 2021,1358394278834302977,samdownie,"Films, TV, Radio & Music",Not Geo-tagged,"b'@LouIseAKennedy @BristolLibDems @ICOnews @WHO And thank for this link, very useful to bring to the attention of NHS Digital as the info collected doesn\xe2\x80\x99t say who it\xe2\x80\x99s collected by ( nhs or private labs ). As I\xe2\x80\x99ve stated there\xe2\x80\x99s privacy policies in place too, so if the private labs aren\xe2\x80\x99t following them, then it\xe2\x80\x99s unlawful'","$MENTION$ $MENTION$ $MENTION$ $MENTION$ And thank for this link, very useful to bring to the attention of NHS Digital as the info collected doesnt say who its collected by ( nhs or private labs ). As Ive stated theres privacy policies in place too, so if the private labs arent following them, then its unlawful","And thank for this link, very useful to bring to the attention of NHS Digital as the info collected doesn t say who it s collected by ( nhs or private labs ). As I ve stated there s privacy policies in place too, so if the private labs aren t following them, then it s unlawful",and thank link useful bring attention nhs digital info collected say collected nhs private labs as stated privacy policies place private labs following unlawful,and thank link useful bring attention nhs digital info collect say collect nhs private lab as state privacy policy place private lab follow unlawful,[],{},{},0,0,[],,"['Dr Louise Kennedy 😷🔶', 'Bristol Lib Dems🔶', 'ICO - ico.org.uk/KeepDataFlowing', 'World Health Organization (WHO)']",0.6901
188,2021-02-07,Sun Feb 07 09:48:48 +0000 2021,1358351998731440130,MelisaOpen,"Lampung, Indonesia",Not Geo-tagged,b'\xf0\x9f\x92\xaf%real ready #morningsexlampung TB165 BB55 BRA36B include&amp;exclude private info DM wa.082112743584\n #availopenbolampung\n#expobolampung #openbolampung #wplampung\n#bokinglampung #expolampung #bolampung #Readyopenbolampung #availboanglelampung #rekomendedopenbolampung @masnalampung https://t.co/ycgWUguaL1',$EMOJI$%real ready $HASHTAG$ TB165 BB55 BRA36B include&amp;exclude private info DM wa.082112743584 $HASHTAG$ $HASHTAG$ $HASHTAG$ $HASHTAG$ $HASHTAG$ $HASHTAG$ $HASHTAG$ $HASHTAG$ $HASHTAG$ $HASHTAG$ $MENTION$ $URL$,%real ready TB165 BB55 BRA36B include&amp;exclude private info DM wa.082112743584,real ready tb bb bra include exclude private info dm,real ready tb bb bra include exclude private info dm,[],{},{},1,3,"['morningsexlampung', 'availopenbolampung', 'expobolampung', 'openbolampung', 'wplampung', 'bokinglampung', 'expolampung', 'bolampung', 'Readyopenbolampung', 'availboanglelampung', 'rekomendedopenbolampung']",,['Masna openbo Lampung'],0.3612
